Comments,Make
"I tried the approach of getting the girlfriend to lean stick, it did not go well. 

I wanted another R wagon so that’s part of the reason I made the jump. My 99’ R also has better seats than my C30 did (it was a base model). Just a few. 

I had many nights of being the gentlemen driver in her car too (an automatic civic lol).",Volvo
LETS GOOO,Volvo
"And my 2008 does this, too.",Volvo
"I use it on mountain roads with tight turns and hairpins. It is annoying to have the automating transmission keep the high gear until too late in the turn, you want to downshift earlier so that you have the right gear at the middle point of the turn.",Volvo
Idk 2024 exterior styling blows 2016 out of the water in my opinion!,Volvo
"My total miles left fluctuates depending on my driving. Once, coming down a mountain, I got up to like 900 miles remaining because I was coasting. If I drive in town, the miles remaining drops quickly. On the freeway, often I will accrue positive miles remaining because I am driving more efficiently.

If you want to understand what kind of per tank/per gallon mileage you get, I would set a trip meter when you get gas to see exactly how many miles you are getting between fill ups.",Volvo
Rock star. Thank you very much!,Volvo
Rear quarter panel.,Volvo
Oh dude that’s a sweet ride. Looks really aggressive,Volvo
I did own one at the time,Volvo
"so, about 21 mpg? 

My v70R is less but gets a lot of very short trips. 

On a long road trip, I once got 27.",Volvo
"Subaru’s are great. Handle well in snow and have good active safety. Also reliable. I’ve had an XC90, V60, and currently the XC60 and XC40. But the Subaru I drove back in Park City is always on my mind.",Volvo
"Hi there, yes I am! I got it through Etsy.  


https://www.etsy.com/uk/listing/1403716467/1x-volvo-yellow-moose-boot-badge-emblem?ga\_order=most\_relevant&ga\_search\_type=all&ga\_view\_type=gallery&ga\_search\_query=moose+badge+volvo&ref=sr\_gallery-1-1&cns=1&local\_signal\_search=1&content\_source=2a0cf187e7d5a56677c054cd0904c10a486a6b5e%253A1403716467&organic\_search\_click=1",Volvo
That’s a solid deal and the best part is it’s pretty close in spec to the 2024 model.,Volvo
"Yep, will look awesome, but i’ll change the car color also!
Nardo grey wrap will do the job nicely!",Volvo
That is really nice but not this one,Volvo
do they put different scorpions on the plus model? I am not near my car rn so cant tell,Volvo
Thanks so much for the help. You guys have been so responsive. The previous owner told me it helps boost fuel economy and reduces stress on the transmission when shifting up at high speeds. Am I to understand that the automatic does this efficiently on its own?,Volvo
"VIDA/DICE is what you want, it is the actual Volvo system for interfacing with the car's systems. It will give you all of the Volvo specific codes, allow you to adjust various parameters in the car, perform calibrations, etc.",Volvo
"I'm not entirely understanding what you mean by that but i'll relay this to my mechanic, maybe he'll know.",Volvo
"I mean technically this generation and lineup of Volvo’s haven’t really been with us for very long compared to older models. I’m thinking about the P2 S60 was 9 years, gen 3 V70 was 9 years as well, V60 gen 1 was 8 years. And so on. Current models are still pretty new.",Volvo
"Whats quicker, The spyder or the S60?",Volvo
"While the V90CC is very very capable in the snow, tires are probably the most important part of the equation.

I have a V90CC and a P2 V70R, they're both absolutely and insanely good in snow. But i have dedicated winter tires for both. 

If the tire has no traction, doesn't matter how good the car is.",Volvo
"Is this a low profile tyre ? My current xc90 has normal tyres and I get 40,000 miles. My previous was an r design xc90 and it had low profiles. I wouldn’t get those again",Volvo
"I have a 2020 V60, and the interior tech was 2 years behind Audi when it was new. If there haven’t been dramatic improvements since, Volvo is *really* behind.",Volvo
Classic design and sophisticated looking car - I vote keep it that way and original,Volvo
Great work!,Volvo
Yes it was actually,Volvo
I have two coworkers with the same blue wrx that always make a point to park next to each other at work. Similar but much cooler since they are Volvos. ,Volvo
Don't put your warm McDonalds fries there because your car will think that your sensor is broken and it will cost you around 175€ to replace it. Don't ask me how I know that ...,Volvo
And lose control into a crowd of people when leaving a car meet.,Volvo
940 NA redblock gets like 15-20l/100km LPG so it is like 12 euro for 100km,Volvo
What about if you get the battery jumped? Any standard process for that situation?,Volvo
If I’m not mistaken we will be the one of first brand to use lidar so that’s exciting. Looks wise we need something to change,Volvo
"It seems Volvo dealers are grossly over inventory currently, however, I'm not sure the V60 Recharge is significantly impacted.  Are there deals to be had on these?",Volvo
"For some reason I just don't like the back of it, I much prefer the V50.",Volvo
The gauge on my 740 works until 1/2 tank. Then it suddenly drops to 0 and the engine goes rough uphill. Thats my low fuel indicator.,Volvo
"The only fad I see with Volvo right now is that they are in a cost cutting mode where they get rid of a useful button here to move something else to the screen or a useful software options while in transition to Android Automotive.  That and I find vegan leather to be a fad as they wear much faster than real leather, thus negating any positive impact it could have on the environment.",Volvo
"I’m filling up like once every third month or so, i get around 30 MPG mixed driving, 2007 V70 Classic 2.4 N/A 170hp manual.",Volvo
"The Pano roof doesn't steal headroom in the new Volvos. The roof retracts over the top of the car, not into the roof like many other cars so.",Volvo
"These comments make me confident in my recent purchase af a 2009 XC60 T6 with 340.000km on it. It is in the shop at the moment, to have turbo changed, but i am looking forward to having it back. I only got the chance to drive it for 150km before the turbo broke, and i have been waiting almost 3 weeks now, but they have promised i will have it back next week.",Volvo
Ooo that sounds so nice man,Volvo
I have denim blue with blonde interior and yes darker jeans can leave some pigment on the seat but the dealer recommended Lexol cleaner and conditioner off Amazon. Honestly it works fantastic with little to no effort and I agree that I love how light and airy the cabin feels.,Volvo
Anyone able to help?,Volvo
"If you are on a mountain road and want to keep it in a lower gear going down a long hill, it will help you use the brakes less. Also if it is snowy or icy you can start in second to prevent wheelspin, though you might not need that.

Like others said, its the same as an automatic car with PRND21 or PRNDL",Volvo
"You’ve bought halogen, not xenon bulbs.

According to Philips your car should have D1S for the low beam / halvljus.

Edit: Amazon.se is usually the cheapest place to buy xenon bulbs. I’d go with Osram or Philips.",Volvo
2022 S60 B5 AWD. 27.6 MPG over ~15k miles. Fill up 7-9 gallons per week.,Volvo
"Because of how it’s non VVT, I would just repair it with another 850 motor or 94-98 motor. You can use s60 2.4 head if it’s the 2.4 or vice versa a 2.5 from a later s60. Only thing Is that you retain older style pumps and front intake and throttle cable etc. would be about 2-3k but better then a price of another car.",Volvo
"More common than the earlier 5 speed spaceballs, I’ve only ever seen one and pulled from it.",Volvo
"I would get the XC40 in Fjord Blue for my family if we don't already have a minivan. However, it's hard to go back to something with less space than a minivan once you are used to hauling home all the boxes from IKEA. Too bad the EM90 is not sold here in the US!",Volvo
Um my 2023 XC90 has a TPMS…,Volvo
That one is out of budget...,Volvo
Just put it in gear and roll it across the border I’ll put the money in a cannon and shoot it over to you.,Volvo
Xenons use high voltage so be 100% sure you have them turned off while working on them.,Volvo
"OK that makes sense. The main “hydraulic” portion aluminum alloy, maybe save a little weight, cast iron over the rotor, where it would be difficult to an Al alloy and get enough stiffness in a floating open jaw caliper.

Does seem like a fair bit of complication for a floating caliper, probably why all the ATE brakes on the later SPA Volvos, and most cars with floating calipers, are simple single piece of cast iron.",Volvo
I don't think it works on non-electri trunk.,Volvo
Lovely! Welcome. Hope you love it as much as we do.,Volvo
"Having gone through every model since a 240 I can say it doesn't say anything else than I like the design, the safety and the easy power they can make without ever drawing attention.",Volvo
Same in Black!,Volvo
Sure...,Volvo
*nice*,Volvo
"my 850 gets great mileage, just did a 1300km trip on 2 and a quarter tanks",Volvo
Details on that S60?,Volvo
"I think my 40k for my xc40 was about $700.

At least it’s just once a year?",Volvo
"Yet it’s going in for the second time for a headlight malfunction. Probably going to be replacing the headlight for $2200, but that warranty is totally a waste/s",Volvo
Have this on my XC60,Volvo
I definitely hear ya. Good luck on your search!,Volvo
My 23 V60 came with Perelli Zeros stock. Definitely NOT winter tires. I'm in Michigan and plan to replace them with Crossclimate 2s or CrossContact when they're done.,Volvo
"My 2015 S60 can do this with its 8 speed trans. It’s fun to occasionally pedal through the gears manual, but never really practical. Fun though.",Volvo
"Every company is downsizing but Mazda is going completely the other way, which I really like. Big engines will last a lot longer and are more fun to drive.",Volvo
"Ha I hear you but we hear that every year since 2021. And here we are! 

Wagon buyers are a great demographic - rich and loyal. They serve a good purpose for the brand.",Volvo
Pay sales tax at dmv when changing title lien holder in California.,Volvo
Would a 2012 have the aux battery?,Volvo
"I use it daily in commute in the city and on the highway. Roundabouts…. No. It is also unnerving a few times in curves as it will take the middle of the lane when a manual turn will cut the corner of the lane.

I do it in the winter as well but you still have to hold the wheel.

Best use is in the dark, fog, and when your focus needs to be on driving. Sounds kinda weird to say that but it allows me to notice things on the road that normally would have been omitted due to driving tunnel vision.

I can’t speak for how the google based works but both mine are the older sensus system. When the new lidar based ex90 comes out it will be even better.",Volvo
"I know in the US, rare, especially 05+. 
I only know the number for mine, that's 60 imported in 2007",Volvo
"Thanks, everyone!  Got it to snap in.  Just wasn't quite sure how it was oriented....",Volvo
Other way around. We don't have air suspension for example. For the xc90 we only get 2 trims and we can't modify,Volvo
"P3, SPA, and CMA cars NEED TO HAVE THE BMS RESET EVERY TIME A BATTERY IS INSTALLED. I’m saying it in all caps so EVERYONE can see it. They have an electronically controlled alternator that bases the charge level of the battery on how much power it will output to run the car & charge the battery. 

Failure to do so will put excess stress on the battery killing it early, excess stress on the alternator, and eventually burn out part of the ECU requiring it to be replaced or repaired.",Volvo
Just buy a Mustang,Volvo
This ^,Volvo
"Who makes brakes out of steel, it’s cast iron or aluminum alloy.",Volvo
"FCP has batteries, free shipping and the lifetime warranty. Maybe check there. I recently got an AGM battery from them, ruined it over the winter, purchased another from them and then successfully returned the one I ruined and received a full refund. I found my battery buddy.",Volvo
I just wanted to make sure as my car will charge my phone via usb but doesn’t play music that way,Volvo
"It’s good you have some doubts haha. If you read around, plenty of PHEV people don’t seem to second guess the number.",Volvo
"it was a 2018 wrangler rubicon, it had k02 tires on it.",Volvo
"I know this is a bit of a jump but... They make carplay modules for these cars...

Im not a fan of the built in nav",Volvo
"Danke. Ja ich finde es auch nicht so dramatisch, wollte nur sichergehen. Versiegeln lassen wär aufjedenfall sinnvoll, leichter Anflug von Rost ist auf den Fotos schon zu sehen. 

Der Preis ist wirklich in Ordnung.. Bereifung tausche ich ohnehin.",Volvo
Rip tyre 🙏,Volvo
"There is no adjuster behind the rotor, BUT there is an adjuster at the hand brake lever. Pop up the boot and you can see the 10mm end on it, loosen it a bit and the pads should retract further. Just make sure to adjust the parking brake once it is all back together.",Volvo
"can you elaborate on this statement =)  


I am glad you think this!",Volvo
Yeah. Snowy roads too when you want to maintain a lower gear to save having to use the brakes.,Volvo
The reason I love owning a Volvo is the same reason I would never own a Jeep. I never have to worry about a stranger trying to talk to me about my car.,Volvo
Lol.,Volvo
"Thanks, I brake hard sometimes before the curves when I have to out run the law.",Volvo
"You’re biggest issues is going to the dealer for service or parts, independent and online are the way to go friend",Volvo
New xc90. But I guess that change significantly depending on market,Volvo
"Love it, it is off but good thinking!!",Volvo
"What kind of Audi?  Unless it’s an RS or R8, you’re overpaying.",Volvo
"Originally Volvo represents some humble eternal Skandinavian values devoid of disposable extravagance and excessive consumerism.

Too bad it is a recipe for disaster in today's world. Most people need gimmicks to get dopamine fixes and flex.",Volvo
Average around 29. I would be higher if my mom wasn’t driving local all the time. Twice a month,Volvo
Ah so no change then,Volvo
I have done 1000 miles on a tank but it’s rare.,Volvo
“87% of Volvo drivers are college educated… the other 13% are just plain smart.”,Volvo
That was just a response to someone. Check my original comment... I explain it in detail and I provide a link to how to adjust the windows to fix it.,Volvo
"Nobody in America bought the S60P, which is still built for other markets. Volvo was selling 15 polestar wagons for every one sedan in the States. I’ve never even seen one in real life.",Volvo
"Sounds like it to me too, picked up a nail or screw and has a slow leak.",Volvo
But In these same cars there is a little button under the gas pedal that does the same thing.,Volvo
Share away! We get it!,Volvo
"I'd check euro ncap scores for safety measurement. Grand cherokee has 81% (adult occupant) for 2011-2022, and 84% for 2022 and later which are not that good in my opinion (you can compare with other models). Afaik, audis and genesis have decent scores.",Volvo
"I thought the steering was very light on my 2020 XC60, but every P2+ I’ve ever owned has been light. When I subscribed to orbit the first thing was enable the settle to change the steering force",Volvo
Who said anything about getting it off the island?,Volvo
"It’s been accurately answered. And no, it isn’t a vent for the infotainment system.",Volvo
"Yeah, Ill try just in case. But dont think it will work, since the c30 physical key has to ber emoved from the fob and its just a piece of metal.",Volvo
"They’re both great, the manual will have you feeling more connected to the car. The auto will be better for convenience, and for sharing if family if needed. 

I had a 2011 C30 T5 6 speed. It was a great car. Just make sure you get one with leather, the non-leather seats crack up really easy.",Volvo
I just want 4-500hp nothing too crazy,Volvo
"Are you from Boston, by chance?",Volvo
Long live the 240!,Volvo
Impatiently waiting for a hybrid to come along worth me giving up my optioned-out (with massage seats!) 2019 XC60. I don’t want to move up to a 90 but Volvo only offers the massage seats on the 60 anymore.,Volvo
"They're getting bald, more privileged and are white.  
That's my case, at least.",Volvo
I had this issue - it was a coin stuck in the runner under the seat,Volvo
Your opinion right?,Volvo
"Old typically equals wise, so you're not wrong.",Volvo
"I fill up every few months and average 65 mpg

Edit - mpg autocorrected to mph ",Volvo
"No. They need to clean the wheel better most likely, and/or apply bead sealer. The ""these are for Jaguar/land Rover"" comment probably is because those are tires that happen to be used as original equipment on them. That doesn't mean that they're only for them.",Volvo
Nothing.,Volvo
"I drive a lot, so I top up something every four days or so.

My Volvo XC-90 V8 averages a consistent 20 mpg. My Volvo V50  T-5 averages 27-28 mpg. My Honda Fit averages 37-40 mpg.

I top up the Honda most often because it has a tiny 10 gallon tank.",Volvo
"I thought so too, for map updates. Though those can be through USB.",Volvo
The D pillar,Volvo
I originally read this as “ I use it when getting my partner out of the back.”,Volvo
"On all of the cars I've had, the last half tank burns real fast. It's just not right",Volvo
"Yep, note that I said the Volvo was behind in 2020 vs a *2018* Audi (which I owned previously), which had just launched the Virtual Cockpit (which is miles better than what’s in my car). And while the rectangular screen was small and looked bolted on, it did its job spectacularly, and I happen to prefer the wheel to touch. I hate hidden, multi-step touch controls where stuff I need while driving is buried.",Volvo
Hoping it’s just that one bad tyre!,Volvo
Niiice dude a swedish bmw /srs,Volvo
Michigan winters are the reason I bought my first Volvo. Even without winter tires my wife’s wagon dominated UP roads during a blizzard the first year we had it.,Volvo
It is also a reason why some current volvo owners are changing brands. For reference a XC90 lease three years ago was around $600-$800 and today a ultimate is over $1000,Volvo
"So I simply don’t know if it is because it is my first manual car that I have owned. But I have driven every from 14:1 e85 srt8’s, to Tesla Model Y’s and will seriously say this is the number one car I have driven. The Confort/Sport/Advanced are actually different in the feelings and it is definitely not a gimmick. The S60r is the perfect balance of a weekend car and an everyday normal car. But it can be that way because of the 4c suspension. In my opinion, if you would get this car, get the m66. Puts a smile on my face every time a shift in that car",Volvo
Very nice! If only the v40 driver had come later than you..,Volvo
"If Volvo was still making the 242 Turbo, like for real, just kept the line going since say 1991 and only updating the stereo I would have never purchased a different model of car in the last 20 years. (Since I wouldn't have been able to afford one before 2004.)",Volvo
"I drove my mother's brand new Envision with Wireless AA ... And it was excellent. Connects fast. Seamless.   
But still not must have for me and my car.  
All this opinion would probably change if I had an AAOS car and the HUD worked with (in your case) ACP.",Volvo
"When is the transmission service suggested? I've had all the 10k mile services on my new to me purchase, wondering when volvo suggests transmission service",Volvo
"Surprised no one on here can chip in with experience as it’s such an infamous issue. Keep us
posted. I don’t have a pano but I know someone who has the issue with an XC40. He’s not managed to get it fixed but also worth noting that we share the same local Volvo franchise dealer and they are complete fuckwits. If it were me, I’d be making full use of whatever purchase / warranty protection you get based on your location.",Volvo
"Not sure why your comment got downvoted.  I have it on my XC90 B6 and this is exactly what I think of when I select this mode.  I also used to have a Mazda and felt that the function was very much the same.  Granted I do a lot of city driving, so perhaps that’s not the best use for it but you’d think it would be useful in all kinds of driving settings for what you’re paying.",Volvo
Thank you👏🏽🇸🇪,Volvo
We get around 10-20 a year with and additional 5 polestar v60’s sold. They are dying,Volvo
"I cant agree with you on that. The new system is far better than the last, yes it has its downs but the upside is far greater. It came out in 2021 and has improved a lot since its release.",Volvo
"From my understanding theres nothing to much thats different internal, maybe some trim pieces.
I think its just mainly the engine and awd that thats different but I could be wrong!",Volvo
Volvo obviously put the focus on the new EV line. Hopefully we will see them start to back port the tech and features to the current models. I drive a v60 CC and have an XC90 as a loaner right now and have no desire whatsoever to drive a car this big full time. It’s not fun to drive and is no more comfortable or more utilitarian than my wagon.,Volvo
"2021 S60 T5, I get 22-24 usually so about the same as you",Volvo
Lmao. Service isn’t covered under a warranty.,Volvo
"A dirt bike fits in the back of a Saab 99 Combi. Don’t tell my mum.

Edit: I killed my mum’s Saab. I put it onto it’s roof. We ended up rubber side down in a ditch. Oops!",Volvo
Because only fast cars need big brakes.,Volvo
Thanks for the answer! Ahh Orrefors gear shifter is s very cool touch! I have some Orrefors drinking glasses at home! But yeah older inscription packages was always amazing but i felt like newer versions lost some of this luxury touch but it seems i was wrong wich im happy about haha,Volvo
"I loved the 20” Pirelli Scorpions on my 2016 XC60 T6. They only lasted four summers though - about 50,000 km. I just went to order replacements and decided not to. They were too expensive.  Instead I ordered Continental Supercontact DWS06+ for about a hunski CAD per tire less and there is a rebate on right now.

That will give me 18” X-Ice for the winter and the DWS06+ for the summers.",Volvo
You know Volvo sells a lot of cool shit. This one is way cooler: https://www.volvocollection.com/volvoconsumers/Stoneware-Mug-Blue/p-CMG08955,Volvo
"Yeah, it's a rare bird nowadays ... dumb Americans and their SUVs.

Counterpoint, cars in general have become pretty reliable. As someone else pointed out for their V90, it was a ton of annoyances and nothing that kept the car from going from point A to point B. Sure, Volvo is closer to the bottom of popular reliability rankings, but that doesn't make the cars UNRELIABLE.",Volvo
Congrats! Good choice.,Volvo
Still the most comfortable ride though,Volvo
What does Eco do on these?,Volvo
"If the light is RED then you must turn off the engine immediately.

You need to be more clear about what kind of light or message you got.",Volvo
"‘20 V60 XC.  Mainly highway, but summer time 28.5+ winter 25ish mpg on 93",Volvo
Can you share specs?,Volvo
I can’t go with a Beamer since I prefer use my turn signals. GLC and E450 aren’t bad and just started looking at those,Volvo
"A) not true B) just rude

Like why hate on people for no reason?",Volvo
"Tire warranty itself is a good idea if you live in an area with potholes or high construction traffic (ask me how I know). However, special tires are a sales gimmick. These tires can be purchased anywhere, nothing is exclusive about them. Doesn’t mean that Volvo specification uses cheap tires though. The usual range for a ‘same branded’ Volvo tire is $150-$275 each. If you have Pirelli tires, definitely get some kind of tire replacement warranty.",Volvo
">I took it to the dealership thinking it would be covered under the warranty but they said we needed a maintenance contract.

Warranty never covers maintenance so that's nothing weird.

But that seems excessive. I'd take it to a different volvo mech for a second quote.",Volvo
"I book every Saturday of the season at a motel up there 

I usually plan it and book all the dates in June/July 😂",Volvo
The black just completely drowns out any visual of the wheels. I’m not a fan. The wheels it come with look great as is. No need to cheapen a nice car imo.,Volvo
This is poetic and beautiful.,Volvo
I agree.  The manual is a joke.  At least combine the 600 page into a single pdf so I can easily do a search.,Volvo
Nope it was standard.,Volvo
Pic o the day! Nice.,Volvo
c30 doesn’t scream luxury - c30 owner,Volvo
I recently checked my contract and found out it actually says in the event of an early buyout all your lease payments will be considered to be paid on the date they were due and there is no unearned rent charge refund :(,Volvo
"I am in a very similar situation 

XC90 is a dream car for me, and I’ve been wanting an up grade from my forester for a while now. 

But, my family is young and I don’t know that the kids are ready to respect a Volvo the way it deserves.  

I am leaning towards a CX90 as a compromise.  Relative space (3 rows), but lacks the luxury sheen that would come with a Volvo and contradict the constant muddy boots and endless snacks in the back seat.",Volvo
The fwd t5 is snappy. Close to a 6 second 0-60,Volvo
Higher HP? You mean horse power?,Volvo
You can however lease it for 3 months and get a good portion of that as a discount. A incentive loophole,Volvo
