Comments,Make
"Yes, plug the usb into your phone and it should be ready to go.",abarth
I am 6'3. I fit just fine in mine. I did not when I was fat years ago. I have the stock seats though not the buckets.,abarth
"Yeah, we aren't having this.",abarth
My first experience was playing Gran Turismo. I drove it so much in game that when I test drove a real one it was oddly familiar. I bought mine a few mos. later. Was already into Fiats and still have a '78 124 Spider.,abarth
180hp also have a better exhaust (Akrapovic or Record Monza) on top of better brakes (330mm Brembo) than the 160hp,abarth
11.5% apr for a 700-750 credit score according to the dealers website? Hell nah what are these dealers smoking,abarth
Yes any vacuum leak could cause a random misfire. Could be they left something disconnected or one of the lines is cracked. Mine was a small oil leak on the turbo drain line,abarth
"Mine was doing this, I found out the blue and me module is drawing more amps than it should be when the car is off causing it to drain fully in less than 12 hours. Disconnecting the red 10 amp fuse every night above the hood release seems to have fixed it for me. Not really a fix but yeah 👍",abarth
Looks mental hahahaha well done,abarth
If we ever need to remove it I think that would be a pain.   But for me I don’t really see a reason to.  I still have my OEM exhaust hanging in the garage to.  I definitely love the OEM tips and I might get curious and put it on one day.,abarth
It has what I would assume was dealership installed Katskins red leather,abarth
"The USDM ""Series 3"" car originally came with the analog gauges up until 2015. However, US cars have always had TPMS sensors integrated into the wheel valve core that communicate with the cluster in the settings menu.",abarth
"I like the cut of your jib, haha. That's exactly how I would have responded 🙂",abarth
"I refuse to believe it’s even it’s second, gotta be at least third",abarth
Yes thus is down to the blue me module in the rear seats or the display this can normally be checked by a reader and some patients,abarth
But the car is 6 years older than when I purchased it. It was a 5 year old car versus an 11 year old car. Not exactly apples to apples comparison to just look at inflation calculator.,abarth
Thanks hehe :),abarth
"Component set for up front (cheap but a good brand or expensive, but expensive speakers are usually more power hungry and need an amplifier as well). Component means door woofers + separate tweeters, sometimes with an crossover box. Coaxial is both in one speaker, good for rear speakers or cars without front tweeters, but the 500 has tweeters in the A-pillar. You don't want coaxials and then also the tweeters in the A-pillar at the same time, it creates interference and too much treble. Rear speakers are not important at all IMO.

Could also replace the broken speaker(s) for cheap from junkyard. 

Get an underseat subwoofer for bass, this is the first thing I like to do on cars.",abarth
That’s how it is when shops buy oem parts. I had my spider there for 2 months all for a thermostat and a coolant hose,abarth
Not coming to USA :(,abarth
"Generally people will hear the car before they see it and become far more curious about what this loud, turbo charged golf kart is rather than insulting it",abarth
"Maybe 165hp. But man, go for the garret or the td-04 turbine. Stronger and more reliable.

Also: intercooler. With more hp you always need to lower those temperatures",abarth
"There should be instructions for doing a proxi alignment on the multiecuscan forums.  I use a dealer diagnostic tool that I’m lucky enough to have access to, so the process is totally different.

Along that line, the cable I have breaks out each pair of pins in the OBD so I can connect to whatever I need.  I believe multiecuscan sells the appropriate cable though.",abarth
Had one of those as well. Moving up to 2022 Alfa Romeo Giulia Quadrafiglio.,abarth
"I have the dv+, a blow off plate, the ec v4.1 intake, the boost leak mod, rear seat delete, oft 93 oct stage 2.

It's also a turbo and not an abarth so I went from 135whp to 180ish.

Besides the intake, which I got just because it's the best intake besides maybe the fenderwell or holy cowl (both too loud imo), I went bang per buck and was not disappointed.

Edit: got the oft from maperformance.com",abarth
Does it have a dual mass flywheel? That could be a potential issue if the sound is coming from the clutch area.,abarth
absolutely love it,abarth
Owner is older person. He didn’t mention if it’s modified.,abarth
At some point I will own a abarth I drive a truck right now but when I can afford  a new car I will be buying a abartg,abarth
Well done that's amazing. Do you have a write up or some links we could see. ,abarth
Warranty did,abarth
Check out Canadian auto sales sites. Prepare to be shocked at the current selling prices.,abarth
"If mine sits for a week, I have to prime the multi-air actuator every single time. Which is just dumb but it works every time. These cars seem to be temperamental lil sh*ts.",abarth
9k aint too bad,abarth
"I have black rims on a yellow 595, annoyingly today I caught a curb down a narrow country lane :'( and now I look like a doughnut! 

Hmm, I wonder if I have a black Sharpie a home!",abarth
"Talk to tony, he’ll fix it",abarth
I dig the rims,abarth
it's my play car. It only comes out on nice days.,abarth
"Is it manual or automatic? If it's automatic by this mileage I would definitely have the transmission fluid changed now if it hasn't been done already. About 120k miles is where you're better off just leaving the original fluid alone. Just like the others said, timing belt should be done at this point.",abarth
"Yeah fair enough I’ve always paid a premium for the official garage to look at it so maybe that’s worth it to keep it running well. 

But I know what you mean after changing the door handle that broke and my attempt to replace the engine cover have been a pain. It’s odd though since it’s based on a mass production car that should be easier to repair",abarth
Looks pretty mean.,abarth
"Thank you for the correction! I kept seeing the two numbers - or I made it up in my head, either or XD

That's true, I do enjoy my WRX, and it's fun, but it was supposed to be a mom-mobile and it was just that. She never even got a name. The Abarth I've already been joking about naming it Raspberry (my Pop was Blackberry).",abarth
"I love it. My first one broke somehow, I messaged AAD immediately and they had a new one delivered in a day or so, and paid for the return label on the older one. I highly recommend this company and their products after the pleasant experience I had with them.",abarth
"[http://www.fiat500usa.com/2019/07/fiat-500-abarth-hard-shifting-repair.html](http://www.fiat500usa.com/2019/07/fiat-500-abarth-hard-shifting-repair.html)  


https://www.fiat500usaforum.com/forum/fiat-500-abarth-forums/fiat-500-abarth-general-discussion/35808-sloppy-shifting-in-13-abarth?39995-Sloppy-shifting-in-13-Abarth=&viewfull=1#post524700",abarth
"Ah yes the indicator stalk, I feel your pain on that one, I have the same issue, slightly annoying and feels like you're going to break something when you try and force it back on!

The screen wash jets however,  3 strong streams from each side, might be worth checking for a blockage.
(There is a little screw on the side of the jet to adjust the height if needed)",abarth
"Listen, I have absolutely no skin in this game, so it really doesn't affect me personally. I'm just sharing information. 

But I've been building and toying with forced induction cars for over a decade (my first build was an 800hp B5 Audi S4, an extremely finicky twin turbo motor), and more importantly, there's gobs of actual research that's much more sound than ""I've had conversations with 3 people"" or my personal experience. Like...the test I linked to uses thermal imaging to measure the impact on engine bay temps, and they measured IATs and HP. And that's one of many tests on the matter. [Here's a whole video with a bunch of measurements.](https://www.youtube.com/watch?v=FrFeaNGDnOk)

It's not a really a complicated subject and you might be holding onto the wrong conclusion too tightly in the face of opposing evidence. 

Turbo blankets keep heat in the hot side of the turbo, which is good, and that, by nature, also helps keep heat **out** of the cold side of the turbo, which is also good.

Anyway, good luck out there.",abarth
Razor clamming is so fun! Oh nice car too! :),abarth
"I have a 13.1 sticker on the side window of my 500C Abarth, someone at a drive-thru window asked if that's how long it takes to get to 60mph, I told him that was how clowns I could fit.",abarth
"But that would also not explain why the knock sound is gone when I press the clutch down, because it it was the engine the sound would be constantly there right?",abarth
Awhh! I’m sorry to hear that. What year did you have?,abarth
Uk based 595 owner here. That’s what I have. They look great IMO.,abarth
Just common sense. Insulate the hot thing. It gets hotter. Stuff inside gets hotter. Hot stuff goes in the engine. Since our cars are already prone to overheat. More hot stuff in the engine. Will make that happen sooner. If ya wanna remove heat. Then remove it with cooler air. Not insulation.,abarth
"Dang dude. I work for Honda and I can't imagine a clutch job being that expensive, lol. Their labor rate must be *insane*.",abarth
My 2015 with 90k-ish miles has to play with it a while to get the heat to switch over lol,abarth
Yea factory rims,abarth
Beautiful ride !,abarth
"Use a vacuum pump and check for leaks, I do not remember it should hold 15 psi (?). I changed mine already twice, \~10 dlls.",abarth
"They said they did and that the sound is gone, but after me driving like 5-8 kilometers the sound came back (maybe I didn’t notice it before and it was there the whole time)",abarth
"Changed! Thank you for the note, I had Pennzoil listed, forgot what the word for word name is.",abarth
Man I really wish I could get the 595/695’s here in the states,abarth
"Have to point out that the Orra Fenderwell intake does come with a new washer fluid reservoir as well. 

I wouldn't say that the ATM or Orra are better than the other as they are both going to offer the best performance compared to other intakes on the market.",abarth
I hope these pictures catch on.,abarth
Nobody I know of in NJ are specialty fiat tuners. But there are some good tuners out here. What exactly are you looking to do? These are deceptively easy to work on when adding performance parts.,abarth
"Thats a unicorn without knowing all the issues and history of the car, Im impressed still.",abarth
Sounds like a you problem.,abarth
"Ah no this is just for the installation of the aftermarket CAE shifter, it's not a recall issue.",abarth
"This is basically it, and android tablet with car grade components",abarth
Nice! You’ll get very quickly used to the seating position.,abarth
This is why I wish mine didn’t have the sunroof.,abarth
No worries. If this helps one person then it was worth it. I was getting so frustrated with my car and I can't believe it was this little issue.,abarth
I’d take it to a different garage for a second opinion.,abarth
"Nice, so i will put downpipe, blow off, forge filter kit and go for remap. I have the ihi turbo so how much horsepower will i reach? I currently run 135hp",abarth
"A car is just a machine. As long as you keep the rust away, everything else can be repaired/replaced. The question will eventually be how committed to it are you?",abarth
Probably should have the alternator tested.,abarth
"> i would get a amber engine light flash for a few seconds, then go away but the car would be fine and when i checked codes, nothing would be listed.

You need a better diagnostic tool / software. The error is there but if it's not a permanent one some tools won't display these.

It could be a lot of things so it's hard to even take a guess without more info..",abarth
Oh you drive a Fiata.   I wanna beat these people to death with their own shoes.,abarth
I’ve got 250k on original motor and trans 😎 not all that impressive tho coming from an 01 tacoma,abarth
So there are two types of this model available?,abarth
Maybe you could like the Lancia Delta Evo-E just a little bit? Looks every bit a modern take on the boxy 80s hatchback.,abarth
"From what if heard it isnt easy..either swap the whole gearbox. Or just an module in between with usually results in dropping de box. 

I am no expert but have been warned About it befoe i bought mine..which is a regular shifter",abarth
That rear bumper looks sick wtf,abarth
The funny thing is it's not even ghost parked... it's pretty far forward in the space lmao,abarth
You just pop them off. You should not need to dremel or cut anything.,abarth
"According to Wikipedia, 194,622 Fiat 500s were sold in the US between 2011 and 2021.  That includes all variations and models.",abarth
Fix it again Tony,abarth
"I mean it depends how handy you are, really. If you can diy most jobs and source your own parts + the car is generally in good condition then I don’t see why not. If you don’t have the know how or space to work though, I’d leave it be. You could be into that thing for more than it’s worth in one trip to the mechanic. Ask me how I know lol. OE sourced parts for these are getting tougher to come by and they were never all that cheap to begin with.",abarth
fair enough,abarth
"The 1.4L Multiair is an interference engine. As far as I'm aware, so is the T-Jet.",abarth
"Lots of cloth seats in Texas. I prefer leather because the cloth are like Brillo pads. They're awful to clean because they attract pilling on clothing, dust and dead skin from like your elbows or legs when wearing shorts. I'd give mine to you but I bought pretty expensive custom car seat covers for mine.",abarth
Different top ends? A multiair block can be converted to a t-jet? vice versa?,abarth
Vacuum leak. Check for wet spots as a mildly bad oil leak can cause it. Sounds like she is too new for this problem but they did just play with all the lines and such.,abarth
"Congrats, your abarth will explode at 160,001 miles.",abarth
"I don't know where you live but in Australia it's $1700 for the front bumper, mirrors and some of the bonnet for ppf....bonnet and roof could be close to that or more..who knows.",abarth
Is the battery still original? Our cars like to throw all kinds of codes when the batteries get old.,abarth
Oh right,abarth
It’s a really robust tranny,abarth
She's gonna blow sounds like big end bearings. I don't know why people but Fiat's they're junk.,abarth
You told OP they bought the wrong car.  Don't do this.,abarth
You can change it within the speedometer settings it’s super easy,abarth
"The OP still hasn't answered how they got the car to start the last time this happened. 

Battery might be toast because of deep discharge, or, if it was just replaced then it might be defective but I'd be looking for a parasitic draw. 
The OP's best bet is to have the battery tested and, if it passes, start looking for a parasitic draw. 

It's worth noting that modern starters can generally turn over an engine down to a voltage below that where the ECU won't be able to fire the engine. I'd guess a 1.4l with slightly lower compression for the turbo should be pretty easy. 

Also, since it's winter, the OP is aware that below a certain coolant temp the Multiair engine won't start and a block heater will be needed?",abarth
Well the car is never driven in the rain so there is that.,abarth
"Thing is, my car is originally red and the paint was in really bad condition, some body panels not being the right shade since the dealer I bought it from were idiots. So instead of a paint job (since that’s so expensive), I decided to wrap since it’ll last about 5 years, then I can wrap her again a different color and by the next 5 years after that I should hopefully be able to afford a proper paint job all around 😊",abarth
Lmao those were corner pieces of this foam pad tape I was cutting. I forgot I left those there ha,abarth
But it's true! lol https://m.youtube.com/watch?v=zDMcWT1zw2E,abarth
I didn’t knew there was a difference between US and EU cars… I thought there were just the older pre 2017 and facelift post 2017 version. Interesting …,abarth
"Hui… die scheinen ja wirklich langlebig zu sein die kleinen. Grundsätzlich steht bei mir die Wartung an aller erster Stelle, aber klar.. die Basis muss halt passen. Mal schauen was ich mache.. ich werde auf jeden Fall berichten :)",abarth
"Wrong, the valve, is always closed when sport mode is disabled. With sport mode enabled, it opens but closes as soon as one starts driving. When reaching 60km/h, the valve opens again. Optionally, one can disconnect a little plug in the engine compartment to have the valve open all the time. Sport mode or not, the valve is open.",abarth
"If you ever find out post an update please, I have a 2013 and this post spooks me lol",abarth
S-Tier vanity plate as well.,abarth
"I've got a Ragazzon Evo Line Resonated Center Pipe, Ragazzon Evo Line Straight Pipe Axleback, and a catless downpipe. I personally like resonators in my exhaust setups to reduce rasp and drone, while also not reducing the noise much.",abarth
Mine has been in the shop for 5 months,abarth
"I had Ohlins on my 99ae Miata but after I replaced it with an AFCO double adjustable compression and rebound coilovers, I changed my mind on Ohlins.",abarth
"I haven't experienced it on my 500 Abarth but I've read that the aluminum ones will oxidize and fuse to the valve stem. I give them a twist every so often because I think that might prevent it from happening.

They look so awesome though.",abarth
"They should both turn the same direction if it has, right.?! I’ll try to find that sticker somewhere on google and take a mirror with me. The owner does not know.. so I have to find it out somehow by myself. 

You were a huge help!! Thank you again!! :D",abarth
"Ah yes, very useful info",abarth
"Love it, reliable engine and if kept stock and cambelts & service stuff is done why not! I’d try and get it to 500k",abarth
"At this point just replace that unit.
You can find them for cheap. In fact a good chance to upgrade to the newer lcd speedometer.",abarth
"Sorry you are right, 330 is what I am putting on mine, but it's a custom extension from my prepper",abarth
"True but surprisingly close still...22 is the lowest I've every seen and that was beating it up a 3000ft climb in the rockies, but it never leaves sport mode and I never baby it or eco drive but I'm still low 30s average. Probably all the other slow drivers help there lol",abarth
"Series 1 (analogue gauge with small digital piece in the centre) did not have any tyre pressure monitor. The only thing from memory was on a s Esseesse kit equipped car you got locking dust caps that showed a white or red dot to indicate the pressure but they were really fiddly.


Series 3 onwards with full TFT screen have a built in system. No special monitor in the wheel, just uses the ABS system to monitor wheel rotations (flatter wheel = more rotation). Doesn't give accurate pressure, just an indication something may be wrong.",abarth
That's... *A lot* of stickers.,abarth
"yep..the ""most smiles per mile"" of any car.",abarth
"There is a significant amount of individual assessment and testing done that says you're wrong, but I'm all for learning new information so if you can link some articles I'd love to have a read.",abarth
Which motor? My NA gets 5w40.,abarth
"I Bought my 2012 with all the Mods! Piston ring 1st. Fixed it, Broke again! 2. Valves bent! 3rd time, Bent a Connection Rod! 4.5.6. The Abarth pistons melted😮! 3 different times! I put stock 1’s back in and “No more Problems!😮👍🏾🔥oh, the 1st rebuild I put the Stock 500 crank in🔥it’s 10 pounds Lighter😮😎👍🏾So much Work, So much Fun❤️",abarth
"Yep, nevermind my mistake!
Good luck with the buy!",abarth
"As you are talking about the Euro spec Abarths, I can't speak to the specific measurements (I'm in the US)...however, you should also keep in mind the roof of your 595. If there's a sunroof/moonroof, the ceiling will be lower than if it's a hard-top. I'm almost 6' 2"" and don't fit into the US Abarth with the sunroof...but fit fine in the cabrio and the hard top (which mine is). No matter your overall height, also, you have to take into account how much of your size is due to long legs or torso.  Also, I have size 13 US (12.5 UK) shoes and frequently find myself hitting the edge of the throttle pedal when I'm on the brakes.  As has been said...take a long test drive, getting into and out of the car several times to be sure how you're fitting.",abarth
Precious!,abarth
"That looks great, fits as well as my alpine head unit too",abarth
Did they damage the wing too,abarth
Bluetooth (blue and me) module is failing and flattening the battery with a constant draw.,abarth
Abarth 500,abarth
Does it start when you jump the battery?,abarth
"Yeah, I’ll see what the shop can get for pictures. Could’ve probably gotten more if I opted to let a local machine shop rebuild my head, but the mech said it would probably be a 2 week proposition to go that route, as well as the fact that the machinist couldn’t find guides easily right now if it needed them. I think I’m gonna look into what SpeedMotive can do for a tune to try to control this in the future, now",abarth
"Mine doesn't have any sort of speed beep I know of unless it's deep in the settings and off by default, or set somewhere above the low 100s mph wise.

The closeest I've seen is the convertibles are electronically limited to 88mph with the top down (I guess higher speeds can damage it) which made me worry it was broken the first time I hit it lmao. No beep/warning for that and i had to google to find out.",abarth
i got from from up yours 🤣 it's a good website check it out,abarth
"That's kind of the problem I'm having lol... like is nostalgia getting in the way? Is it gunna be worth it? Lmao fuck I hope so. I haven't decided to pull the trigger yet, we are actually going to talk to them in person and decide tomorrow.",abarth
It alright,abarth
"I'd go with a Pop or Retro, over an Abarth. Especially with the Abarth taking premium, it can add up quickly. And no joke on the turning radius. People laugh at me but don't realize the turning radius is literally that of a go-kart.",abarth
"Just the normal ones!  All stock still, minus a K&N drop in filter.",abarth
"Do you list all the part numbers for the products on your web site? Real question. 


Rule number one of a running a business. Never criticize your competitors publicly. It's a really turn off and makes me want to shop elsewhere.",abarth
I'll have to try that and see how it works,abarth
"Thank you, I will look into it",abarth
"""Damn, that's crazy.""
*drives away*

It's really not that hard to defuse those types.",abarth
"Definitely worth the trade, even if the motor blows you should be able to sell the rolling chassis and buy another 250 should that happen.",abarth
Sure thing! I’ll make another post to show off more of the vinyl wrap ;),abarth
Yes you would benefit from an LSD. No you dont need one for daily use cars. It would be a waste.,abarth
"Personally,  I'd look for a car that isn't modded. I'm on my 2nd 500 Abarth. Neither have been unreliable.",abarth
...not worth it.  gets old fast.,abarth
"Thanks for the answer! The car is completely stable during braking. I had to floor the brake a few days ago due to a semi truck deciding to turn left from the rightmost lane, and nothing strange happened. It stopped almost right away would not much noise.

The annoying part is when I press the brake pedal a few centimeters and it whistles. It's just when I brake lightly, but it's very loud. As soon as a press a few centimeters more it goes away.",abarth
"I did find a couple that were better priced - but they were like 2013 models with a bit higher mileage. It makes me a bit nervous and I don't know if it's a better deal or not for the age difference.

I did love my pop! I loved being able to park literally anywhere XD",abarth
Can you provide a list of parts and part numbers you used for the conversion,abarth
"Love the recessed wheel look...those Neu-Fs? They look a lot easier to clean than mine, too.",abarth
"Just one, usually. 😏",abarth
Now take great care of it and have a blast!,abarth
"Have had my Abarth since 2018. I would never think about putting a car seat in mine. Do yourself a favor and find a 4-door. The hell of pulling that red strap to get access to the back seat every time you need to strap your kid in will get tiresome very quickly. And then when that red strap breaks (both of mine are broke and nearly impossible to fix), you will need to use the INNER handles to have the seat slide up. I think buying this car at that price and with an infant is a big mistake.
Other Redditors, feel free to chime in.",abarth
"Sorry, I'm on IOS, but just find the top rated Apps on the Play Store and check their FAQ. For example I bought an OBD module and later found out it wasn't compatible with the AutoDoctor app.

Vgate seem to make cheap and decent Bluetooth modules.

PS The engine is similar to the Dodge Dart and Alfa Romeo Mito. My advice is to take it to a mechanic that works on Abarths or some of those cars for an inspection. 

I didn't do that and later found out the car had some unknown modifications (An after market diverter valve on the turbo to be exact).",abarth
"Easy when clean, not fun when done on wet trails. Such a mess!",abarth
