Comments,Make
"‘08 9-3 Aero Combi XWD in stick, ‘09 9-3 2.0T combi (wife’s), ‘90 SPG in black.",saab
"My car came without a solenoid (154bhp).

It does start with the original ECM, and the new ECM seems to have VSS enabled yes. But after furter research I wont do any furter work to get the new ECM to work, as BSR seems to have a bad reputation when it comes to Saabs.",saab
">. My E46 BMW was the worst car I've ever owned by a mile. The Saab is not only built more solid, but it actually works every day like a real car! BMWs since the 90s have been designed to fail out of warranty, and most manufacturers have since adopted this same design philosophy. I understand the NG 9³ is a bit of a dud in the lineup when it comes to reliability and a lot of people seem to make the mistake of judging the entire brand's reputation based on the NG 9³ (which is arguably the worst Saab ever made)

My e46 is far better than most of the Saabs I have owned,  I have broken more than 15 saabs but have not broken my 330ci yet.  

I would break transmissions on my older v4 saabs and my c900 saabs all the time, I even shattered a flywheel on a 9000 once",saab
"Probably, that system will check everything once you connect the battery and realize that whatever was in the seat isn't there.",saab
"The big steel ones have been on every turbo I have ever owned, which is like 50 of them. None have been automatics.",saab
"It's a manual with tons of miles and cosmetic issues. all three hurt your value. 

I say the bottom price for a running driving car with A/C is $2000, so I think you can probably get that much for it. list it for $3k, and hope somebody who really wants to drive a manual picks it up. List it on saab specific places like [saabnet.com](https://saabnet.com). 

Kbb says $1500-2500 private party. so right in that range. LOL, trade in is $150. sounds about right.",saab
"That is where my thinking is with it right now. Since it’s had issues before regenerating, it’s probably a lot worse off now.",saab
"I had a repeat left axle seal leak after replacing the axle.  Figuring my luck had run out with the used seal, i replaced it and that one leaked.  Then i replaced it again and still i leaked.  It turned out to be the axle.  Although the sealing surface looked fine and measured exactly the same as the old axle, replacing the axle again fixed the leak.",saab
"Have a search on this sub, as I'm pretty sure it's come up before. I think it's either the motor or the band slipping. The latter would be a cheap fix. Either way, something you can do yourself if you're handy with tools.",saab
"What check engine codes?

What brand, model, gap spark plugs?  What brand of coil pack?  Usually ""jerking"" as you call it is spark misfire.  I tune these cars and ALWAYS recommend NGK, 6282 plugs gapped tight at 0.7-0.8 mm.  Not inches.  mm.  [esaabparts.com](https://esaabparts.com) sells them for $2.38 each.  And make sure you have the correct oem Saab coil packs.  Not aftermarket.  Dont' lie, if you put anything aftermarket in they will misfire.",saab
I had to change both on mine!,saab
Great write. Anything about  Saab 9-3??,saab
I want mine to end up looking like this 🔥,saab
"Are you referring to the blinkers behind the front wheels? (Typically referred to as side markers). I assume not since they're already clear. If you're talking about the orange reflectors on the front bumper within the black trim, I would probably just take them out, paint them black, and put them back in. Technically not allowed but I don't think anyone would realize they're missing if they didn't know what it looked like before.",saab
"Makes sense , however my sunroof has no problems otherwise, it can open and close with out any worries minus the sun cover which sometimes gets stuck. Was hoping to avoid having to take the whole thing out",saab
"I have 300,000 km on my 9-3 2.0T. I've identified the problem. It definitely goes away ( full compression) once the car is warmed up. I've checked the compression cold and hot. And it's only at half when cold. 
I'm planning on doing the valve job someday, but have never had any cold start fails (just rough when cold).  I live in the warmer climate of vancouver, So not so annoying.
 I have read that the valve job is a pretty simple fix, something you can handle on your own if your mechanically inclined. The WIS will walk you through it.",saab
Wow! Nice! I have a couple from an ‘85 SPG and they are very technical yes,saab
"This thing has been a nightmare for real, turbo blew a week after I bought it. In november it almost threw the timing chain, I've had to retourqe the entire top and change about half the gaskets, change subframe bushings, 2 axels, airbag has been changed and it's chewed up 2 serpentine belts. All this within 2 years of owning it.",saab
"I love my 9-5 but it never really was reliable. There’s always a little something. And mines only done 148k miles. I’ve had It for six years and it broke down twice, once due to a faulty DICE (though it was my own fault for buying a cheap one) and once when I lent it to my parents and they went on vacation with it and on the last day the fuel pump died.",saab
Not painting anymore? Yay! Smokey sides are cool,saab
Agreed! Same engine…completely different vehicles,saab
How long have you been running this new pump?,saab
"I meant undercarriage, as in is it possible that water is coming from below?",saab
Soo many Architects..,saab
Haha,saab
r/woosh,saab
"If you are looking for the Saab standard luxury wise I would still suggest a Saab 9-5 Arc or up (Aero Preferred) with a Stick, about 100K or under, that is if you do not need 4WD, but a good set of tires solves any snow problem. It has a 6 second 0-60 and is a highway monster.",saab
"Vacuum leaks almost definitely, how high does it idle in park? I’d be careful driving it like that for your transmissions sake. if you’ve gotta drive it maybe throw it in neutral before braking or when stopped, you’ll chew up 1st gear pretty bad stopped/stopping in drive if it’s idling super high.",saab
"I think this is overly generalized a bit too far. If you compare a top spec Saab 9-3 Aero XWD from 2009 to a Mercedes C63 from the same year, the amount of electronics and things to go wrong in them isn't that far off one way or the other. But as far as I can tell the majority of Saabs you still see around were closer to base level trim and options. Some of this is just that not as many top trim 9-3s were made as the C63 afaik. 

The comparison really differs to by the year you choose to compare, and if you're comparing against Mercedes, BMW, or another manufacturer. For example BMW in 2008 was making _garbage_ in terms of reliability. The closest competitor to a Turbo X in 2008 would've been either the M3 or 335i from BMW, and with those two cars you have some of the worst BMW electronics ever and engines/turbos known for blowing up at random. But if you compare with model year 2000 to BMW, it looks a lot more comparable",saab
How can I tell which one I need? Want to make sure I order the correct one. Also I don’t have a lot of money to spend on the car and it sounds like a lot of work that has te be done to solve this issue. You would recommend the oil change first?,saab
"I’ve been there 😔. 

I was struggling to justify to keep my 9-5 aero running at the maintenance it took, and then it decided to help me by breaking down with a clutch repair i couldn’t afford on top of the other things. 

I hope you can sell it to someone here!",saab
Prob saabnet but give it a lil bit and if nutting bat.,saab
Why made so poorly. $$ they are not cheap.  I have a Volvo. I’d  be pissed if that happened to me,saab
I’d just detune the car and get your mileage back,saab
Neobrothers,saab
"This is the vacuum pump. Has a gasket when you attach to the engine. That weird gasket is single use, it means you only attach it once. If you remove the pump, you need new gasket.",saab
"Look up alu37 Saab wheels, they're OEM alloys that look quite nice",saab
Thanks for the input!,saab
"We have a Volvo V50 with a Peugeot 1.6 turbo diesel. Not the lost powerful but I really like it.

My dad has almost exclusively had diesels and I also like them. Don't have to rev them as much as a similar size petrol.",saab
It’s the top trim level of this model. A performance version! (Wish mine was one haha),saab
"You're using tech2win I presume? I think it's a bug/design flaw in tech2win. I have had the same experience. FWIW, tech2win also has a bug with CAN on 9440. It sort of feels like Saab+tech2win was never fully/properly implemented. I'm using a recent clone MDI FWIW. I have not tried it on my '08 9-5 but it doesn't work on any other ""OG"" Saabs I have tried. (It does work on my '99 Suburban, though...)",saab
No rust sounds like its primary selling point.  These days you can probably get $1500-$2000.  But it’s got enough issues that people are going to do their best to haggle you down.,saab
"Had you showed me the rims off the car I would say don't do it.   
I would have been wrong. Those look great on there!",saab
The most important thing when buying any car Saabs included is getting as much of a detailed service history as you can. And then going into it with the correct mentality of your buying a used car and it likely needs a stage 0 service. Whatever that entails.,saab
"Mhm, I think reliability is the best feature though. Diesel engines go and go compared to their petrol counterparts. You can run them hot with minimal coolant and they'll still cool themselves via oil, because the explosion is due to compaction not ignition. Sure they have Glow plugs but compared to spark plugs they rarely go bad. 

It's hard to kill a diesel engine. My main complaint with it is the diesel itself. It's probably the worst, most dirty fuel to consume, more expensive than petrol nowadays and since recent advances in gas engines, they are pretty much the same in fuel savings. By comparison petrol burns more cleanly and completely since both have EGR valves and other ways to filter exhaust now.

Still miss it though.",saab
"I'm not trying to convince anybody, I just needed to rant a bit. I've decided to get rid of it since it feels unnecessary to keep such a big and thirsty car, it takes up about 40% of my monthy salary with insurance and gas. 

If I buy a smaller car I can get that down to about 20% even with a loan, and that means I can start saving for a house with a garage and even for a project in the future 🤷",saab
"Check the the wiring harness. It's mounted on the right side of the chassis under the battery box there are 2 Grey connectors, they tend to have loose pins causing those codes. Clean and reconnect them.

Then try this:

recalibrate the throttle sensor.

1) car in off position no key in
2) press accelerator pedal to the floor 100%
3) depress clutch if manual
4) Start the car as normal leaving pedal at 100%
5) After check is complete on SID release pedal 0%

Lastly, if not fixed pull the TB and shake it. If it sounds like there is plastic rattling inside it is done for.

If none of that works come back and I'll do some more digging.
I've retired from Saab and moved on. All of my knowledge is here on this forum. Enjoy your Saabs!",saab
Sparkly Saab ✨,saab
Its giving me 34 more HP🤣,saab
Is there an ad for this car you can share?,saab
"No, but WOW is that thing beautiful.",saab
Bolts with a floating cone that adjust when you tighten them. [Like these](https://cdn.abicart.com/shop/13102/art2/h9067/178289067-origpic-9c58fa.png?max-width=1560&max-height=1560&quality=40),saab
Would a tire/wheel shop or just a garage be able to drill them from 100 to 108? Or would they require some specialized type shit,saab
Is that all? I thought the car is already heavy enough. Can I do alterations to the springs that gives me similar results? I'm not fancy to get lighter wheels or carry extra weight,saab
All I know is Maptun is the only one to ever make coilovers for the XWD.  I’ve had mine for 2 yrs on my 09 Aero V6 XWD and they’re fantastic.,saab
Yeah but i'm in the eu sorry,saab
3 9⁵ wagons...,saab
It’s so pretty,saab
"Could always wrap it, might be cheaper than paint. Then again, that is an awful choice with the sparkle finish so it might be best to paint it.",saab
"Nice! Great books!

The Bentley manual is an abbreviated version of these.",saab
i would acctually badly need one but i bet youre somewhere in america right?,saab
I got it 2 days ago and i think i am now the youngest turbo x owner at 16😂. I appreciate the welcome. I really do love the car and I love its features. We will see what this brings but at the moment it is sound other than the washer fluid reservoir is leaking,saab
"This.

Things to always have in your trunk with a car with a T7 engine:  
Crank shaft positioning sensor  
DI-Casette",saab
"Well, I guess widebody is your only choice now",saab
My (almost) 5 year old son is always asking if we can drive the Saab 9000 instead of the 2017 VW Passat 🥹,saab
"Good point, well made… but I’ve always liked the extra trim on these, similar to the all-road avants from Audi. I’ve seen a few of those around with a nice fitment and they look superb. Different strokes for different folks!",saab
Prezzo?,saab
"I have an ‘08 9-5 Aero Sportcombi as well! Best of both worlds, but yes I agree!",saab
oh god thank you!,saab
Took the throttle body off and didn't realize there was a seal on it... Ordered new one and will put that on when it gets here. Intake manifold looked pretty dirty but the throttle body seemed pretty okay. Is it safe to drive it without the seal on the throttle body?,saab
"Nice! Good buy. I bought that diesel with 7months inspection/valid MOT 900€.
My second daily driver 2005 ng9-3 B207E, bought 1.5years ago 300€ and had 5months MOT/inspection time. I spend around 150€ new brakes and coils and got new 1 year mot/inspection driving time. Now it due to got mot/inspection to do, but i will probably sell it as parts/scrap because rear frame and axle beam have been rusted through and will fail mot inspection.

That diesel have been most expensive saab that i have bought. I have been bought them on 225-700€ with mot still valid.",saab
Username is crazy 💀,saab
"I feel for you!!
I was in a similar situation when I lost my license a few years ago. 

Every day up to doomsday, all I could think about was what I would do with my pride and joy! I was determined not to get rid of it, not to sell it. It would’ve been easier, but I was determined to keep it. 

I ate, slept and dreamt about what I could do. Then, out of the blue, on the last day I could legally drive, an old friend outside of London heard about my predicament and offered me a place to store it. 

So, my last day of driving was up to my friend's farm, where she is now living the country life in the barn. She’s living her best life, even more than me🤣

What I’m saying is it's obvious how much you love your car, and people around you know this! Ask around for a home for her; have selling be your last resort!

Manifest the hell out of it!! I'm pretty certain that what I did🤔

Good luck. DON’T SELL..!!",saab
"a trick that i learnt since i didnt have a leaf blower for the roof is don't scoop all the snow off the roof by hand.

only scoop off the top level snow by hand but then use something like a large soft bristle paint brush [(i use one like this)](https://www.diy.com/departments/2pcs-fence-paint-brushes-block-brush-set-decking-paint-brush-shed-and-fence-brush-masonry-paint-brush/5056175945023_BQ.prd) it does wonders in softly removing all the snow from the fabric roof without pushing the snow into the fibers",saab
"Stop driving it! Send it on a flatbed and have a Saab specialist diagnose it and then fix it. 

If it’s the Haldex AWD you could do irreparable damage to the car",saab
"97 900s, 2001 95, 2000 viggen, 2006 93, 2008 95.",saab
"Yes, for sure! All bolts and mounts are important!",saab
If you live in a cold climate check that the diesel heater works,saab
Nice one.,saab
Oh it helps a lot. A more budget and practical update is to just get the OEM springs for a viggen. Still stiffer but only 20mm lower than stock.,saab
I think the bypass does not solve this problem. You need the amp there.,saab
"I have two ECU's the original one and a tuned one, I need Tech2 for the tuned one to work in my car. I need to marry the ECU to the car.",saab
Haha. Im looking at an '11 9-3 rn and the forums saabcentral etc got me dead scared. Car has 93k miles and im in a relatively pretty cold climate (winters go to -20 celcius). Would you say I should steer clear of it even though the car is very solid? I did some research and couldn't find any ppl with a 2011 9-3 that had this issue (or spoke of it on forums at least),saab
"It’s not super bad, the foam isn’t coming out or anything, it’s just torn on the side where you swing in/out of the car. I’m leaning toward just keeping the car thiugh",saab
tsg-tsg is 100% correct.  Prove it to yourself.  Raise car.  Spin wheel.  Press brakes a few times.  See how different the brake drag is on the wheel.  You can also crack the bleeder and see if the pressure relieves itself and the wheel spins freely.,saab
okay thank you! i’ve heard blowers not working is quite common on these models,saab
Because he’s 2 and a half years old and didn’t want to take off his pajamas 😂,saab
"I wish! One of my previous Aero wagon’s were, not this one though. It’s for DD and functionality, and the Viggen for fun. Even though the wagon is stage 3 and also fun 😅",saab
are you capable of fixing it?,saab
What are those,saab
Time to get a 1.9 TiD,saab
"Stick with the OEM Saab one, they’re $61 on eSaabparts.com. Even the OEM one will fail again eventually but I’ll typically get 80-120k miles out of one before it starts exhibiting issues. Dropping the tank isn’t super difficult, just run the tank to as close to empty as you can first. 
The free and easy fix is to use your tripmeter as your gas gauge, I do this on my beater 9-3s. Fill the tank to the top and reset the tripmeter, refill before 300 miles.",saab
Maybe it's the hydraulic valve lifter?,saab
"07 9-3 60th anniversary SportCombi 6MT, 09 9-3 sport sedan",saab
06 2.0T all plastic.,saab
"9-3's can have micro leaks possibly anywhere. Worth a check to disassemble small turbo hoses and check the air intake hose to maf sensor for small cracks, maf sensors are prone for malfunctions, clean it also. Do88 sells high quality replacements for hoses if you're interested in replacing them. Worth the trouble to check the fuel pressure regulator and injectors for carbon deposits too if they are still oem. Could be a weak ignition coil too which is a known issue for 9-3's, you can test all coils for spark with a tester.",saab
Whoever down voted this needs to check again. This is the right answer.,saab
"No, it's an upgraded Opel Insignia. Impossible to source body parts if anything happens to it.

I drive a Saab myself and I like it, but I can't recommend it to others, especially non DIY people.",saab
"If the temperature reads lower and drops as higher speeds, the thermostat has failed, the ECU is locked in warmup enrichment, the plugs get black, stubbles on acceleration, failed cold starts.",saab
No sunroof :(,saab
Damnit😭,saab
ALU28 have different offset for 9-5 and 9-3.,saab
I don’t know shit about cars but my 93 03 vector did the same thing until I got the ac/heater fan replaced. Idk 🤷‍♂️ if this helps,saab
Looks like mine 🤭,saab
Sweet!,saab
"Thanks for this great answer ! I'll look for that manual pump, however I don't think there is one by default in this car. I've seen some people installing one on their own because the car lacked one. I'll check in the engine bay anyway, just in case. 

Yeah, there could be an air intake somewhere, that would prevent the diesel from reaching its destination. I'll check that out. I also plan on bypassing the tank, by connecting the injection pump to a small bottle of diesel above the engine. 

You're talking about a valve and gasket, which ones are you talking about? I'm really uneducated when it comes to this type of engines and fuel systems. Could it be the injection pump valve? Gasket ? And if yes, which one more precisely ? Like, at the diesel input banjo bolt? 

Understood chief, yes it's the pump + module. Okay for the tech 2, I have a Saab garage not too far away, I'll call them for the tech2 part since I don't own one.",saab
"Looks great. I’d paint the wheels a different colour, but that’s just me.",saab
How much for it?,saab
"So I’m in Sweden after a Saab, very hard to find a rust free in good condition nowadays but after reading this it seem like the SAAB 9-5 has the least issues to worry about. The rear end sag and rust at the dog leg being the biggest issues. I do like the 9-3 SS more but ECU problems and timing chain issues, hmm",saab
"I have one, 5 door though! After a few times of getting a NG93 oil filter or fuel filter etc, ive just started saying its a 02 lol. How is yours specced? Mine is a bit weird, 150hp 2.0t with no optional extras except automatic aircon and isofix. No cruise control or even a radio from factory! Me and my friends always joke that they ran out of parts while making my car so thats why its so badly specced lol. Cabrios and Viggens were all made in the Uusikaupunki plant but afaik no regular 3 or 5 doors were made until the 03 switchover modelyear. Trollhättan plant was being adapted to NG93 production so they sent the bodies here to be assembled.",saab
Could just be the battery getting low? Are you taking the car for short trips only? Ive heard it drains the battery somewhat.,saab
"My engine mounts were shot and it did something similar, but u mean SHOT. ALL 3 and the torque",saab
"Check out this listing for a 2008 Saab 9-5 (manual) posted yesterday on saabnet.com.  Immaculate condition with extensive maintenance.  I’d seriously compare before pulling the trigger 

 https://www.saabnet.com/tsn/class/9-5.html#24032492612jdene",saab
"If it happens only when you've filled up with a full tank that makes me believe it's something with the evap system, but yea get the codes checked that should tell you what is going on",saab
Tell us you're stupid without saying you're stupid,saab
"It's usually corrosion under the rubber bushings for the slide pins. Disassemble, wire brush and coat with anti-sneeze or brake grease",saab
"2 saab 9000 cse, saab 9-4x,  saab 9-5og, saab 9-3ng cabrio and a saab 99 gl",saab
"I don’t know how to reply with pictures but it has a short shifter, a quick release steering wheel ,nardi wood grain, car play, garage moon power floor mats , and some other small things",saab
"Same, had to top fluid off a bit after a full serv.",saab
"Right, you need to pick boost or MPG.",saab
Another EV company bought NEVS and promises the Emily GT will be out 2025. I have them sending me a email when it's out. EV Electra is their name.,saab
"I have one sitting in my barn. Check for rust at critical points. Plastic is old and brittle, and clips and things will co tinge to break upon removal. Easy to work on, parts are becoming scarce. 

I would not buy it as a daily driver, but if you want a project and to maintain saab history. Looks like a steal.",saab
Very nice I would buy but have no room to store it :(,saab
"They are the same engine just small differences, can be dropped in",saab
I’d do her!,saab
"Awesome find! I’d definitely take the time to scan them properly, over the years high quality copies become harder to come by online.",saab
"Yes, it does, which means you need to check & refill it more often, Driving 100 miles with 2.5 quarts in the sump will dramatically shorten the life of the engine.",saab
"my 2010 9-3 has really, really bad rust rot on the front subframe. it's only hanging on by a thread on the right half. looking at getting it replaced asap as apparently the car isn't even roadworthy right now. I'm having a really hard time finding the part myself, but the shop I went to claims they should be able to find one for about $1000...


parked on the grass for a year or so a few years ago due to limited driveway space. wish I knew how bad doing that was, especially when compounded by the existing rust issues with that part. I had no idea",saab
Chub hub,saab
What kind of car,saab
"Thanks very much for the advice I'll definitely look in to it,  planning on doing a European roadtrip with it and it would be a hassle if I'd get stranded far from home 

Appreciate the advice!!!",saab
You may as well sell it on and get a Sportcombi if you want a lower one.,saab
"I have an ‘03 9-3 convertible also and have the same issue looking for parts. I don’t even bother looking for 2003 - I always search and talk using 2002.

It’s nice to know my 2008 9-5 wagon was made by trolls!",saab
"Nice. I like TX wheels better, though.",saab
Shit boxes be everywhere,saab
I cleaned out the MAF on my car after idk how long. Car definitely is smoother on idle and running.,saab
"Thinking about buying a '09 97x ($6500), been driving a Toyota that has gotten too rusty to pass inspection anymore (Maine) and found a Saab down south. My first car was a 900s tank that I drove into the ground. Any problems folks are aware of that I should look out for in the 97x?",saab
"Yeah I might have to lay off for a while, this is becoming more expensive than I thought haha",saab
Exactly!,saab
