Comments,Make
Interesting that dip unsettled the car that much. Doesn't seem like it should. Seems like the rear slipped out on the rebound.,subaru
"The 14 Outback takes a 5x100 rim - they didn't switch to 5x114 until 2015.  What's the offset of the rims you are putting on?  The wider tires will be closer to the strut, and a larger offset will exacerbate that - as long as you have at least a few mm clearance, you will be good to go.",subaru
The imagine didnt work :(,subaru
💯,subaru
"Oh wow, sold for $3000. OP got bent over and then shafted with a 10 foot long pole. 

The first clue that someone was taking him for a ride should have been that picture at the very end showing rust eating into the upper rear wheel well and body panel. Hell, I saw someone put up an 05 OBXT with a similarly rusty side panel and a hole in the exhaust for less than that.",subaru
"It's beautiful, your Wilderness I was waiting and waiting for it to come out and they kept pushing it back ! I had already financed by CT21 at that point! 😅",subaru
Maybe read the second paragraph,subaru
Damn thing looks brand new,subaru
I see what you did there... Haha.,subaru
Congrats!  I like that green color,subaru
Yikes!!!! Yes she’ll definitely be looking at where she’s going in the future. It looks like God was looking out for all involved this go-around!,subaru
I just saw the same one for sale. It’s a scam,subaru
"Her parents must be freaking livid. But I’m glad she’s okay! 😥

I’m sorry about your car! But I am super glad nobody was hurt. 🖤",subaru
Oof. That's a hit to the wallet. Still cheaper than buying a new car tho. I love my subaru so I'd do it.,subaru
"I dont know why you would downvote.  Do you want to run your engine at starting RPM which can be as high as like 1500-1600rpm with a dry oil filter?  Obviously you can't prefill an upside down oil filter, that is why we crank the engine without starting it to push some oil through the new, dry filter.",subaru
"Looking at the clean parts vs the dirty parts that engine has had a lot of time and money thrown at it recently.

That always begs the question “why?” 
I’m with NatureDry, either pass on it or get it checked over thoroughly by your guy, not the sellers guy.",subaru
"Around my area, any mid-2000s STI that isn't thrashed is $25-30k easy.",subaru
"This might be controversial, but I loved my experience with Carvana. It was so refreshing to not have to deal with sales people and I got exactly the car I wanted",subaru
"I did my third oil change today since new on my '23 6MT (~12k on the ODO; 1st oil change at ~3200 mi, 2nd oil change at ~7500 mi), and this is the first time I had a totally empty jug to pour the spent oil. Usually I have a jug with some leftover spent oil from a previous change, or some useless small amount of unused new oil, that I pour the old oil into and dispose of. And sine this car is new, doesn't leak, and doesn't seem to be burning oil in the exhaust, I've never had a good reason to check how much oil came out. Anyways, in went 4.7qt for my 2L model, and this is what came out… about 3.2 qt. Or a loss of about 1.5 qt (obviously a small amount is left in the old filter and in the container I caught the spent oil in, but that amount is fairly negligible). 

So I'm down ~1.5qt in ~4500 mi, which seems like a lot. I have always used 0W-20 full synthetic and oem filters with a new drain plug washer. I’ll also add that I drive conservatively, typically shifting at around 3k rpm. Exhaust color and smell are typical and I don’t detect any burning oil. And no leaks.

My previous car was a Corolla, and the oil out was almost exactly the same as the oil in. I know boxers are more likely to burn a bit of oil, but is this much typical?",subaru
/r/legaladvice,subaru
Congratulations!,subaru
And that's all that matters,subaru
"https://preview.redd.it/sibxgoegabqc1.jpeg?width=3456&format=pjpg&auto=webp&s=71f0ebbd82603535b366e72f5b4d4adfcf692783

Another respectful disagree.",subaru
sick,subaru
i’m not sure what the purpose is of the second thing with the plastic gears so i can’t find that one,subaru
"https://preview.redd.it/rgttm56817qc1.jpeg?width=4096&format=pjpg&auto=webp&s=d400b158bdacee32e69a12feebe0a08e0474b0d7

Mine got that Cybertruck (Cyberback?) aero profile",subaru
I find misaligned shifters like this annoying.,subaru
"i'd probably just mask it, it's on there with little plastic peg/clip things so they are probably brittle by now. The clips look like this and are attached to the back side and press into the car.

https://parts.subaru.com/p/Subaru_1997_Impreza-22L-MT-Limited-Sedan/Clip-Retainer-and-Molding/49264015/62733FA000.html

This diagram shows a bit about how it goes together but might not be overly helpful other than to show the locations of the clips.

https://parts.subaru.com/a/Subaru_1997_Impreza-22L-MT-Limited-Sedan/_51505_6030782/WEATHER-STRIP/G10-901-01.html",subaru
"Your car is safe to drive, but I wouldn't recommend trying to diagnose this yourself.",subaru
I’ll add to this people will say all kinds of weird shit about maintenance. Just follow what Subaru has listed in the manual itself. Not what the dealer says. Not what some random online says. The only thing Subaru of America won’t have listed is cvt drain and fill I would do that every 60k which is what Subaru recommends elsewhere in the world.,subaru
"It's a tool, like a kitchen knife, a pen or a ball pein hammer.

A car has very little in common with a spouse",subaru
is it anything in aprticular youre looking for in the manual? or just the manual in general,subaru
"No idea where it went, I haven’t checked the level for about 2-3 months because it never seemed to be a problem. And filled the radiator.",subaru
"Probably time to have a discussion with the shop. If I tell the shop to drain my motor oil and tell them to replace it with  75W90 gear oil they probably shouldn’t listen to me if the car calls for some 0 weight motor oil.

Shop is probably going to say the compressor was already toast and say the compressor in these fail with low refrigerant levels. You can ask if they tested the compressor before doing the work.

Unless the work was done and they pushed your car from the bay to customer pickup the shop probably nuked the compressor when starting the car to move it.",subaru
"These 04-08 manual xts are getting harder to find every year. I've had mine for 7+ years. They have all the power of the wrx but more space for hauling stuff and much cheaper insurance. I say buy it. Slap a turbo intercooler and ecu from a sti for power gains. Ringlands might fail 6 months later, but then you can get a built engine 💪",subaru
Got a Crosstrek now too and I miss my GTI,subaru
Plus a short throw shifter,subaru
"I'd get one of those no-spill coolant funnels. They come in handy for the bleeding process.

Fluid is about 2 gallons. Get OEM. I don't flush, just drain, install anything I need, and refill. Then bleed/burp it.

Use the funnel, turn the car on, get the temp up, bubbles will come out the funnel. Rev the engine a bit to like 2-3 a few times. Repeat. Get the heat on and coolant flowing through there to get the air out there. More revs. Maybe up to 4k a few times. Once no or very very little bubbles are coming out the funnel, you're good. No need for a vacuum or anything like that.",subaru
I haven't heard of this once and I work at a subie dealer. they're actually falling out??,subaru
"It’s my go-to phrase with my current brand’s customers. “I was told the part was backordered when I was in 2 days ago, I’m just checking if it arrived” “no, sir, I’m sorry, this is on INTERGALACTIC backorder. We’ll reach out in about a year when we get a ship date” 
Side note, one Subaru dealership told me my cv boots were backordered for like 6 months straight, but I went to another one just across town and got them 3 days later?",subaru
Yet … here we are.  They also cross threaded a lug nut.,subaru
Do not clear the codes. It needs to be in the ECM.,subaru
just went from 20 forester to 24 crosstrek. Wife and I both prefer the handling/driving of the CT. Gas mileage is also better. we are retired and dont need the space which is really the biggest difference in the two. The Forester has A LOT more room in the back behind the rear seat. I agree with others - go drive both - it was an easy choice for us to go with the smaller vehicle.,subaru
"Post pics of the carnage, i haven't seen that in a long while",subaru
That’s a sexy beast. Welcome!,subaru
I hate AI art.,subaru
"As a WRX hatch driver of the same model generation… I see so few of my gen on the road… and even fewer hatches. When we pass or ride alongside, its special.

Sad to see this entirely preventable loss.",subaru
This is the part of Subaru I don't like that makes them look bad.,subaru
Misleading title. Car can run just fine without refrigerant or even a compressor at all.,subaru
It sounds like my 03’s ej205. Whether or not that’s good or bad is up to you,subaru
"Also fwiw, don’t just expect warranty to be honored. They can easily claim abuse or neglect and deny you. They shouldn’t, but you also should’ve checked your oil before leaving. SO many people have had similar issues with oil changes. If things go to shit, get SOA involved and keep that dashcam footage",subaru
"No idea how they look. Not terribly mechanically minded past what I can learn from Google and YouTube. I enquired with my (non dealership) mechanic last service and he said it was best to leave them until the standard change time. He also didn't see any red flags with it. Plugs are original so they have done around 125,000 kms/77,000 miles.

I've spoken with two non dealership mechanics and they both said guys in their shops have Subarus that do a similar thing and to just run it on higher octane.",subaru
You ever change your pcv?,subaru
This is the way,subaru
"Ok. 

Fuck off. I don't give a shit about what you think",subaru
I have it mounted on the passenger side under the eyesight. It's a Viofo A139 Pro 3 channel.,subaru
"Just do some research on the best way to go about it, don't use or be to aggressive, watch some videos maybe small amount of goof off on a rag can work. I don't want you to mess up the new whip !",subaru
Could that noise be coming from the alternator? I know it’s a bit of a reach but I had a Daewoo in the late 90s that would whine when it had a serious electrical load.,subaru
This is BS,subaru
RPMs wouldn’t go up with an accessory belt slip.,subaru
Rusty rockers in the house tooonighttt,subaru
"Ok that helps more. That's your idle control motor. 
https://parts.bestbuysubaru.com/p/Subaru__WRX/Idle-Speed-Control-Motor-Motor-Intake-Manifold-Motor-Interior-Manifold/49226781/14120AA060.html?partner=googlebase_adwords&feedLabel=cvb_make_model&kwd=&matchtype=&device=m&network=g&userLocation=1014221&googleCampaignID=1680072149&googleAdGroupID=65747061776&googleAdID=326154022507&googleExtensionID=&gad_source=1&gbraid=0AAAAADxCSLtgLQf8TQNRxoi7KGApl8-zJ&gclid=Cj0KCQjw-_mvBhDwARIsAA-Q0Q53fF_ws264sumc0l78YqVRMPl1SWurm12BgtVxg029DB1kgjkI9-4aAlKrEALw_wcB",subaru
"Do you have any links for them? I’ve searched pretty good but can’t find any in the correct size and connector style. 

26/16in top locks. 

I can’t imagine nobody is making these",subaru
"Clean out the MAF with electrical spray, and change the air filter. The engine will throw all kinds of weird codes when it can't know how air works. Reset the ECU, and all is forgiven.",subaru
"I’ve seen ones like there, but it ends up being $1000 to hold it. Or they meant to type $10,000 but ran out of 0’s. 

Then when you get there with the rest of the money, they stab you. It’s a tale as old as time.",subaru
You could find a specialist shop. Would be less for better service.,subaru
"Nameless cat-back + Takeda aFe intake is a perfect combo for this car and some nice wheels. Been running this setup with Avids AV20s for 3 years now.

https://preview.redd.it/q68lpg9rxdqc1.jpeg?width=2181&format=pjpg&auto=webp&s=0c3450018fd5b77b613fd0bc3088aef15587d7e9",subaru
what a nice suprise.  they screwed you over and are admitting it by making you jump through hoops to get back money that you should never have had to pay in the first place.,subaru
You almost need an IAG or similar when going the 2.5 route with bigger numbers planned. Lots of success on stock 2.0 blocks with beefed up internals though 🤔,subaru
"Got a 14' dodge journey with 126k miles. Oil changed every 8-10k miles but the dinger goes off at 7k. Only normal maintenance with a throttle body and front socks and struts. It is a $21k throwaway car I bought brand new and always been my backup or girlfriend's car the times I'm with someone. I've treated it like shit but it won't die and I now will keep it till it does. 

Oil is cheap and yes, engines are expensive.",subaru
"My dealer has overfilled my 3 different subbies everytime I went for an oil change. Its apparently a subie thing. Now, your video…not too sure I saw them check the dipstick. Which shouldve shown an overfill..",subaru
Something has to be wrong with it,subaru
"I have an SF5 and it’s bulletproof. I think the only things that have gone bad (beyond maintenance) are the rocker cover seals, the PCV and the rear diff input bearing.

It’s got 225,000 kms and it’s nearly 25 years old - still starts first time, every time",subaru
Bro hydroplaning requires water..,subaru
It’s a pile of shit. Where’s it for sale at?,subaru
"Head gasket and studs are usually something people have forethought to upgrade before going for big boost, but it’s when you do that, that you start finding OTHER weak points",subaru
I bet you they drained the cvt not the engine oil and added oil to your already full engine,subaru
the lifestyle badges.  they basically are a demographic info gathering campaign.   they are literally tied to your vin.,subaru
Hi. My 2011 Outback has been in the shop for a few months now and it turns out it’s too old for the replacement part they’ve been waiting on. So the (not sure if this is corporate or the dealer) are going to try to call me and try to buy it off me. We will need to get replacement. Any tips for how I can maximize this so I can get the most value?,subaru
"“I have no idea what I’m doing” 


this car will not pass inspection and it’s not worth what it will cost to get it repaired properly.",subaru
"Not roasting you, just the car lol",subaru
push for them to buy out and get something fresh to you,subaru
"I have a 2015 Subaru Impreza Sport Hatchback that unfortunately sustained a sizable dent and chip in the hood (something must have fallen on it, didn’t happen while I was driving). A friend recommended someone to replace it and the new hood paint clearly doesn’t match. He says he’s going to repaint next weekend but I’m lacking confidence at the ability to match correctly. Any tips? The paint code is K1X, but he had this info so what else is there to try. Appreciate any experience/brand suggestions regarding this color.

And, what should I ask to ensure it receives the right protectant coat?

https://preview.redd.it/vvhbw7hi86mc1.jpeg?width=1700&format=pjpg&auto=webp&s=3555f17be78f8ee8dc1fedd4b80a3ae720d2bc0b",subaru
Could also be for safety. Imagine you’re laying under the car working on it and you spouse jumps in to drive to the grocery store and doesn’t see you. Car won’t start if the battery is disconnected.,subaru
I literally thought this was gonna be a video poking fun at the last guy that posted.. and simply show that the vehicle was making the boxer growl when it’s driven haha,subaru
"I feel like it's a dealer by dealer basis.

My dad bought a 2018 Forester a few years ago. Just wet in looking and his 2004 Forester was on the way out. Didn't really know if he wanted the Forester or even a new car. Sales guy wasn't pushy at all.

Dad asked for no extend warranties or extras, just the wheel package. Dude got him just that, no extras, good price. That was that.

Service departments are the same way. They can vary wildly within the same dealership. We have a Subaru service center at a dealership that's REALLY good - super curious to customer requests and go above and beyond to satisfy you. In that same dealership on the Nissan side, they're terrible. Steal change out of your car, don't even tighten bolts for brakes, calipers fall off while driving, lol. Literally this happened to my partner's car.",subaru
"Nice, love hearing this as a 2020 Impreza owner. Stick shift too, so hopefully my clutch last that long.",subaru
Thanks for sharing!,subaru
Depends on how willing you are to deal with the problems it will inevitably have.,subaru
CVTs are all trash. I can't believe they are so prevalent.,subaru
Tick tick tick goes the time bomb,subaru
"Everything timing related was replaced a year ago. 

But yes all of the idlers looked brand new still",subaru
Bugeyes are great!  Have some of the best front seats Subaru has put out.,subaru
Thanks! It's an awesome ride. Just got in front and rear strut braces and the difference is crazy. Can't wait for my lower sway bars to come in!,subaru
i am!,subaru
Where have you seen people do this? All my years wheeling I have never seen anyone do that. We run synthetic lines and use a winch line damper to alleviate those risks. The hood up is going to be more of a pain than a good shield aha,subaru
Ok thank you!,subaru
"They are 4% smaller in diameter, so you should be fine. Hopefully the wheels have an offset to deal with the extra width.

https://www.tacomaworld.com/tirecalc?tires=225-55r17-245-40r18",subaru
"That is incorrect, 1/3 of a quart per Subaru is considered excessive oil consumption",subaru
Yeah that in addition to the California summers. Fogeboutit,subaru
"Ah, interesting. That makes sense. Thanks for elaborating!",subaru
"Btw this is pressing the gas normally(not hard at all) and going from 0-20 mph. 

If I was flooring it, I would think this sound would make sense but I'm just pressing normally.

I'm coming from a 2016 Hyundai Tucson and that car never made sounds close to this....so I'm lost.",subaru
"+1 for this, Klima cleaner worked in my 18 to get the nasty smell out of the ac. We live in the desert, so the dust gets in there and the condensation makes it stick.",subaru
Car I’m guessing,subaru
"You'll need around 2 gallons for a drain and refill by pulling the lower rad hose.

A vacuum filler isn't perfect but does drastically improve the time it takes to purge any air.",subaru
"Was it the speed, or that dick head who cut them off?",subaru
"They sent me a letter saying I could terminate my loan early and get a new car....after my car has already been paid off for a year. 

I tore it up and tossed it in the garbage. I dont go to the dealership anymore after they tried to screw me over, so any mail for them is instantly trashed.",subaru
"Short trips, while the engine is not up to temp, are some of the worst for economy. The engine will run richer during this period. Open road and motorway driving generally provide the best economy. I believe the official combined rating for that car is 8.8L/100km, so I'd be unsurprised if you see 10 - 12L/100km on lots of short trips, but you should equally see closer to 7 on longer motorway travels.",subaru
"I just got a 2018 Forester. I live in Canada and the owners manual says do not use any gas that contains MMT? Do gas stations in Canada still put MMT in the Gas. So far by googling it looks like I can only by Gas from Shell, Ultramar and Petro Canada. I'm not happy with only having 3 choices.",subaru
Hi all I have a 2013 subaru impreza sedan. I'm looking for Windshield wipers and 2 different sets of rainX ones won't fit on my clip that they attach too. I've never had problems with Windshield wipers on 4 different cars. Am I taking crazy pills? Going to return these and try a different brand again I guess.,subaru
"Go to dealer, see car, test drive car, then secure a deal over the internet from a no b.s. dealer.  I did this for a Subaru in SoCal last year.",subaru
It would help if you revved it in the video.,subaru
"Swift Sport FXT springs gets you there.  It actually rides better than stock too because stock is a bit too...tall, think pogostick as in you often lift a tire over uneven terrain.  The Swift springs drop it down more towards middle of the suspension travel range so it can go up and down and not lift a tire.

[https://www.maperformance.com/products/swift-sport-springs-subaru-forester-xt-2004-2008](https://www.maperformance.com/products/swift-sport-springs-subaru-forester-xt-2004-2008)

Another thing that's nice to do is up the rear sway bar a little.  This just knocks out some understeer and reduces a little body roll to boot.  Do you want to do this?  That's up to you.

Now, thicker sway bars tends to load up the mounting points a bit, so if you go too big, you can start breaking stuff not meant for the stiffness.  20mm and under, you don't have to change anything, but you can anyways if you want, so this is nice to get when upgrading the rear sway bar.

[https://www.maperformance.com/products/rear-sway-bar-brace-brackets-and-bushings-20mm-kbr18-20](https://www.maperformance.com/products/rear-sway-bar-brace-brackets-and-bushings-20mm-kbr18-20)

For the 20mm sway bar:

[https://www.subaruonlineparts.com/sku/20451va000-20464va000-x2.html](https://www.subaruonlineparts.com/sku/20451va000-20464va000-x2.html)

(their fitment years stops at 2009, but it fits older)

A caveat about sway bars.  Sway bars are springs that are not damped.  They are added spring force side to side that is not well controlled because the main dampers are only tuned for the main springs.  So...big sway bars are a lot of spring force with no control.  You never want to go too big unless you have a different style of damper with AGGRESSIVE low speed damping.  This is not stock damping.  This is not AGX struts, not Tokico struts, not even Koni Yellow inserts.  You kind of need to get to serious race level damping to get really aggressive low speed damping to control big swaybars well.  And when I say aggressive I mean skip your car off the road like a stone skipping on water aggressive.

So with this said, what I liked best with my Forester for a stock ride setup was stock struts, Swift Sport Forester XT springs, and an upgraded 20mm rear sway bar.  This is a really nice, really comfy setup, that also handles pretty near neutral too.

I would also not look at changing the struts away from stock.  No KYB, no Tokico, no Koni inserts.  Anything else is going to lose you travel and lose you comfort, and there's no specific gain elsewhere on anything near stock spring rates.  KYB GR2 and AGX are only stock profiles meaning you don't really gain anything unless you want +15% damping.  A GR2 rear upgrade might be of interest, maybe.  I liked Tokico's D-Spec struts, worked great up to 350lb/in rates (front), but they're only useful if you're actually planning to go stiff and need the adjustment.  On soft springs, they're going to feel quite near the AGX setup anyways just with a slightly harsher bump impact.  There's not enough to gain.  Plus you can't fit as big of tires with its lower positioned rear spring perch.

There's actually some nice coilovers from Feal, Fortune Auto, and Stance if you want to go that route, but many are relatively firm for spring rates, although you can spec lower rates if you want.  Fortune Auto and Feal have a max of 6"" of stroke on their setups which isn't bad at all, but stock struts have more total stroke.  And it's not worth doing unless you're trying to go stiffer.

I've run a lot of setups on my Forester over the many years I've owned it.  I've dailied it, raced it in autocross and rallycross, and I have a solid idea of what's good for these cars.  For a better than stock stock ride, Swift Sport Forester XT springs + 20mm rear swaybar IS the best setup.  It rides better and handles better than stock.  If you want, you could technically run a GR2 rear strut (also called Excel-G, rear struts are parts 334344 and 334345, sold various places individual or as a pair), but there's no specific need.",subaru
"Dude, you can't park there, that's why that cop is writing you a ticket...",subaru
"Not a physical letter, but I’ve gotten similar emails from my local Subaru dealership before. 

In my case at least, they were offering way less than what my car was worth and anything on their lot was grossly overpriced. (Ie: they offered $30k for my Sti and had a comparable one in their showroom for $55k. Going rate at the time was 40-45) 

Long story short, it’s to extent your business through a new vehicle and turn a profit selling off your old one.",subaru
"Subtract what’s in the filter as well as what is STILL in the engine. 

You will never get it ALL out. If you let it drain for half an hour, put the plug in and come back an hour later, more will drain out. It’s coating the entire engine. 
You might have better luck measuring oil loss on the dip stick at consistent intervals.",subaru
Haha yeah the lug nut one is fairly common,subaru
"Facebook marketplace rule of thumb is if anyone says to email them instead, regardless of whether you're buying or selling. its definitely a scam",subaru
"my guess is they are the same, but slightly different displacements, probably for different regions mpg/emissions requirements.

the F variant has aluminum headers...and the D uses toyotas D-4s direct injection system... and both have different compression ratios  

i really cant find info on these variants.  id call a dealer and ask.",subaru
Ya it's usually just 100 sales posts of the 3xact same car trolling for a fool.,subaru
#Subie Gang,subaru
