Comments,Make
"It absolutely can still be the battery. Batteries come DoA all the time. 

That's the free and easy place to start.",abarth
"185 is doable. I've seen 193 from VL36 .

My VL38 only on stage 1 without any peripherals did 179bhp. Now with intake kit , de-cat 63.5mm exhauset , IC my tuner said i would get around 185 with 300NM of torque.

I have a dyno sheet of my 179bhp",abarth
what did you think about the BC racing ones? Thinking bout getting them.,abarth
"Definitely battery, crap connections or  a duff battery.
I had a duff battery that couldn't hold charge and took it back for one that worked properly.",abarth
LMAO I was about to say “Omg another purple one holy shit”,abarth
Sounds like the reverse switch is bad .,abarth
I would mention your $5-6 range before going to look.  Else you might be wasting your time and his.,abarth
"Sorry if this has already been asked - what did you use to apply them? I cannot get mine to stay, no matter what I use.",abarth
"No. The US model is significantly different from the EU model. We had a couple sent over and put them through the Chelsea proving grounds in MI. Lasted a day before a tire blew, then plenty of other issues. Many parts were changed to meet the reliability requirements of the then Chrysler.",abarth
"Good on you for doing this, this is a HUGE problem in the aftermarket parts world in general.",abarth
I like my red metal tire stem caps.,abarth
"Dnf?

Yeah i can see that",abarth
"But then it wouldn’t disappear if I pressed the clutch right? If it was something with the engine it would be there no matter if the clutch would be pressed or not and in my case it goes away if I press the clutch down.

Here’s an example video that shows when I press the clutch the noise disappears:

https://youtube.com/shorts/812n5RstsXE?si=y60MhtdpOckEUybR",abarth
Fix It Again Tony!,abarth
Omg I’m in Love with your colour combo! 💜 Wishing my 2017 Abarth looked like this. I have Rhino grey and red 😊,abarth
"Its my own car and in 2 weeks its going for another remap since i added IC,Intake,de-cat and exhaust.",abarth
Could you share a link?,abarth
Check https://shopeurocompulsion.net/,abarth
Yea that sucks curbin wheels,abarth
Definitely battery. Sand/clean the posts and clamps and try again or replace it.,abarth
"Placed right above center air vents. The design allows for it to sit below the dash but can be positioned in various different ways. Great for ensuring you don’t get a bunch of glare on your screen. 

SYNCWIRE Fits MagSafe Car Mount... https://www.amazon.com/dp/B0CLVBLC5Z?ref=ppx_pop_mob_ap_share",abarth
"""Exclusive parking space just for me"" is second only to ""that's fine I will just Go Around you there's plenty of room"" :)",abarth
I'm high reading this no need to edit,abarth
I picked up a 2015 for 12k with 42k miles no mods. It’s now worth I’d say 6-8k (US) just from being 3rd owner. I’d say talk em down to at least ten but I agree with nascar here.,abarth
The B is out of alignment and it’s all I can see.,abarth
Ooh 😯 nice 😊,abarth
"Yeh sounds like it’s a bit of a trait for them 🥲, really hoping it’s just a sensor problem",abarth
"That's a decent price of it has a clean history. Abarths are fine as is, without mods. Just make sure to use the Carvana test drive time to check the car over for any deal breakers. I'd buy it.",abarth
"Mods don't really add value to a car's sale price, unfortunately for the owner. Looks like a new turbo, new wastegate actuator, turbo blanket, intake, perhaps fmic considering the bumper bands... I dunno man. It's nice, if you like it and you were going to mod it for the results, you should buy it. Otherwise buy a newer one for less money and have fun doing it yourself. These cars are generally reliable, but I know firsthand that they can turn on you quickly. This would have been a ""decent"" (in relative terms) price 2-3 years ago when car prices were absolutely through the roof, but today, this car is probably only worth \~9k  


Of course, good luck convincing the owner of that. He probably just doesn't actually want to sell it.",abarth
"That's a good price. Dealership marked my 2017 with 25k miles at $21,000 😳",abarth
"Private sale, granted there was an issue with the turbo that could warrant replacing, but that’s nowhere near a guarantee. In any case, this guy is charging way too much.",abarth
"The only real downside to my US-spec 500 as a commuter is the oil consumption.  Because my cruise speed is 75ish MPH, the RPM is around 3200, and it just drinks oil at that speed.  I have to remember to keep track of the level because it burns it faster than it wears it out.",abarth
i’ve seen them on ebay,abarth
"For a second, I thought this was Forza Horizon 4...",abarth
Man these cars suck,abarth
She’s even dirtier now. This time of year is a nightmare,abarth
"If your in North America all parts come from Mopar. They have deals right now on Fiat part’s because they are trying to get rid of it all. Check their website. You can also or from Dicourse, and eurocompulsion they have upgraded parts and upkeep parts as well. Local junk yards and pick and pulls have parts if you have the time.",abarth
The T-Jet takes 10w50. The MultiAir 5w40. Very different engines.,abarth
"Just bought a 2013 with 66k miles for 6800. Similarly maintained to yours, along with a couple of mods and upgraded interior. Definitely not worth the 13k asking price.",abarth
Maintenance is a magical thing,abarth
I want one,abarth
ETSY or buy a 3d printer.,abarth
Amazon! Genuinely amazon is where I got all my bulbs and the brightness and leds are amazing. Definitely get it through them.,abarth
Pretty colour,abarth
Thanks! Im diggin the rubber around the knob too it's super  grippy,abarth
Dont give up and fix ittttt. Maybe see if an auto wreckers has any engines. Call around!! Look on local classifieds.,abarth
"As others have said...modded. Take a long test drive. Any issues may have been worked out...or not. Check the underside and brake calipers for leaks (after the test drive).  Unless the mods are things you were going to do anyway, they should bring the price down, not up. A mod-free car, for most people, is a plus.",abarth
"Nope, black leather. I wasn’t aware any abarths had cloth.",abarth
Should I use the OBD 2 or just the OBD scanner? Or is there even a difference?,abarth
"OP, do you know how to use a multimeter to test if your vehicle is charging, and then if there is a draw on your battery when the vehicle is off?

It's a 10 minute task and easy to learn if you're at all comfortable with tools.",abarth
Appropriate user name,abarth
"The heads I've looked at are re-machined/rebuilt units.  A lot less hassle and time for me -- as a DIY -- to go that route, rather than mess with the head I have.


Curious what the job cost you at a shop?",abarth
"Alberta as well and I've been driving mine for the last week, feels like shit, but it does get up and go! Only like 2 new noises as well!",abarth
Prob a worn out bushing on the suspension somewhere gonna have to lift it to see.,abarth
But it is so much sexier in human form,abarth
"Hi from Chicago. Great picture and agree on the black trim. Would love to get combo pic, I've got a red Cabrio.",abarth
You'll need to read the error code to be certain. It could be a number of things.,abarth
Drop the stickers then its fire dude and get the brak claws painted yellow looks way better on a black car,abarth
"Yes, you only live once. Live how you want to live regardless of others opinions. Everything is temporary, after all. Proud owner of a 2019 Abarth here. Last year the US got the gasoline powered.",abarth
Battery or more likely alternator,abarth
"Not bad enjoy the Lil Ferrari

Stock?

Any plans for mods?",abarth
"From memory, the springs are totally different sizes (both in dia. and length). Shocks *should* be the same and the mounting points in the rear might be slightly different as the whole rear axle on the US car is reworked to be quite a bit stiffer.",abarth
"So glad my 2012 Abarth does not have that gas cap, it would annoy me too.",abarth
now i don't feel as bad revving the piss out of my abarth pretty much all the time 😆. But ya sorry to hear!,abarth
I ask because it looks like it just mounts to the frame in front of the 4 bolts.,abarth
"Was this cold or warm? You said an upgraded exhaust, so is this a muffler exhaust because it sounds like it. I'm pretty sure they come from the factory straight piped from the cat back. Sounds like a 500T. The only thing that doesn't sound normal to me is the exhaust. Although it does sound like it's down a cylinder. It may need spark plugs.",abarth
Honda Fit/jazz Si v-tech. I’d be looking at this too.,abarth
That colour,abarth
"It is! I think I like the lavender more now though, is it a wrap or stock color?",abarth
"Wow that’s some upgrade! Thanks for the heads up, I might check Carvana for it! Enjoy the Quad, I had one and loved it!",abarth
I have rhino grey and red too?? Twin?!?,abarth
"I'm good, I think they look cool, but I prefer the simple look. The graphics make it look like a boy car.",abarth
"Thank you! Yup. I had looked at a FB Marketplace listing for one that needed love but it was like a catfish deal haha. Saw this one and stopped by on the way out of Dallas Sunday. Made the deal over the phone Monday and off I went. Definitely going to get her some new shoes pretty soon. Probably going to get some P Zeros on 17's and then get a good all season/winter set for the stock wheels.

Got him to slightly move down on price but not as much as I'm sure we'd both like.",abarth
Get yourself a Renault clio sport instead. 2.0L pref.,abarth
"Yeah, 

  
wheel checked no bent.  
Tire replaced.   
engine mounts ran a stationary rev checking with brake, it was alright.  
CV axle inner joint rebuilt,   
coil swapped,   
spark plugs are  replaced.

I heard control arm (where the ball joint is on) may do it. and the intermediate axle ( the longass axle cup) on the passenger side may do it. I dont know if there is anything else. LOL",abarth
The taillights are imported from Europe as the North American abarth didn’t have any changes in the style from 2012 to 2019 which was the last year of production in the USA.,abarth
"Nice! Are they wired for reverse? These lights will be my next purchase. Also, is that a wrap?",abarth
How much 🧙,abarth
The best rims!,abarth
"Also, if you are looking for a softer ride than your tuning shocks/springs, I can recommend KONI shocks paired with the red lowering springs from the 500 EsseEsse (15-20 mm lower than stock). Makes a great combo in my view. The car is still relatively low, but retains enough comfort.",abarth
"You only wrap the hot side of the turbo.

You're spreading misinformation with a fairly confident tone.",abarth
They won’t go below 12k,abarth
"None of the 595’s in the UK have cruise control unfortunately! You can get aftermarket for about £200, it’s on my list of things to do.",abarth
"Frickin cool colour, wow",abarth
Monster! What a whip.,abarth
"I’m in Niagara County, I don’t have a flake of snow in my yard. Wild!",abarth
"My brother has been looking at these, on a weekly basis for the last 6 months, but he still hasn't bit, he is still driving around in his shitty Nissan scrote.",abarth
Clean your battery terminals,abarth
Had to screenshot all of this was on my mind since 45-50K miles 👁️🧠,abarth
Good,abarth
"I have some coming from him as well, I think he's got like a 2 week backlog, nothing too crazy",abarth
"They’re quoting me 15k to replace the motor. I’m going to take the head off, get it repaired, and try to fix it myself. I’ll let you know what comes of it!",abarth
"Im in the US, and drive a 2012 year model. I don’t think I turned it on, the only thing I have changed it’s the range left. Will take a look later when I drive.",abarth
"Not ideal for the job, but it would be fun. If you want to maximize earnings and minimize headaches, get an old Prius, Corolla, fit, civic, etc. or a depreciated EV like a Bolt. My Abarth’s engine blew a rod prematurely. Thankfully I had a Prius for my delivery gig.",abarth
Unless it's a panda 4x4.,abarth
"Jesus Abarths are pricey in the US/Canada, is it because there's not many of them?",abarth
Hi- yes I am interested :),abarth
The difference having new tyres with all that fresh tread is what will make such a massive difference in comfort that you won't be able to tell if the width made any of it.,abarth
I wonder how many door handles they have gone through,abarth
Ask them to test the throttle body to see if it opens and closes as intended,abarth
"That they would never admit to driving one even if they hired one for a weekend and that it meant I like Willie's 😂.  I'm Not a willy enthusiast, I quite like women, and I like light cars that handle very well and have more power than they can use sensibly 😂",abarth
i prefer this tbh,abarth
Nice Mini,abarth
I got this one!,abarth
"Thoughts about this 2013? The asking price is $11K with 32K miles.  
Seems to be modified, the lady who posted the ad doesn't know what mods were done to the car. The Interior looks in pretty good condition at least in pictures, 2 owners, garage kept.  
https://imgur.com/a/bKRQJD7  
Thanks",abarth
"Cadamuro Designs

https://www.cadamurodesign.it/en/index.html",abarth
"Garrett's are not crap turbos - there is a reason OEMs trust brands like Brembo, Ohlins, etc.",abarth
I didn’t even see it was an automatic 💀💀💀,abarth
Leather isnt any better. Tearing and wear at the stitching on mine. Passengers seats are fine. The wear isn't really noticeable from a few feet away. But eventually its gonna give. Maybe get the Katskinz seat covers.,abarth
"The outlet you mean. It’s a royal pain in the ass to get in there, just letting you know. I fabbed my own intercooler piping so I didn’t have to worry about the stock piping.",abarth
"Yep, got mine 2👍🏾",abarth
That is the trick. Crutchfield usually carries everything you need for the single din. You can still get a screened unit. Just have to get the single din models. For double din. That gets a little more complicated. But those and the madness models require cutting the air vents in the dash.,abarth
"What might save you a few bucks is to order the part yourself from 500 madness, they have a big selection, including OEM, and then just find a local shop to install the parts. Worth checking out at least!",abarth
I love it,abarth
"The easiest way to check if you have a parasitic draw is this:

Car off, ignition off

Disconnect negative terminal on battery

Switch your multimeter to check amps, put one end on to the negative side, and the other end on the ground cable side

There should be barely any current. I would say anything up to 0.3 amps is allowable

Most likely though, sounds like your battery is no good. Reading your comments saying it drops to 9V means it pretty much fails the load test.",abarth
Welcome enjoy,abarth
Thanks! It’s so funny because I hadn’t either but someone has one at my local brewery.,abarth
Fuck thats more than the price of the car,abarth
"Im having trouble finding vented, drilled, and slotted. Anyone have any links?",abarth
"Check for. Tracker, had one on mine that was draining the battery..found it using a thermal heat cam to see what was hit while the car was off...was under the steering wheel little black box, removed no issues any more

Oh to add jumping it from a pack will fry the starter after a while...they don't like it",abarth
I had to wait 6 weeks for a sensor before and I'm in the UK so can only imagine how bad it is there.,abarth
"So true. I’m hoping that new film race for glory will highlight some of abarths exploits! 

After all they built two of the most successful rally cars of all time! (Lancia 037 and delta S4.)",abarth
"It’s an Italiancar,  it’s holding a grudge…… /s",abarth
The auto parts store always comments that you need tinny hands to do any mechanical work in this car,abarth
"We are taking it to a place closer to where we live to see if they say the same thing. It seems to idle smoothly, in fact you could trchnicslly drive it, I just worry ill grenade the engine if i keep pushing it with all the warnings going off",abarth
"Wow, the T-jet is something else. The multi-air needs 5w-40 and a very specific spec.  Is yours at least full synthetic? I'm guessing yes considering you were expecting a high price. In Canada it's about $75 for 5L but you can catch it on sale for half price. The nice thing is the engine takes 4 quarts so it leaves me just over an L for the inevitable oil burn.",abarth
"I love mine, which is going on about 8 years of use so far. It keeps the stock look, but also has a nice feel when shifting: a satisfactory metal clunk.",abarth
This whole thread is maximum levels of cringe,abarth
Thank you so much!!,abarth
I need that manual,abarth
could also be a boost leak scan it,abarth
Looks awesome! What did it take?,abarth
"Reliable until they're not.

Often run 200k+ miles with nothing but maintenance and replacement of wear parts - shocks, brakes, etc.

But then, it's not infrequently you will see posts here about  burnt valves and other major failures, often occurring out of the blue on well running engines.",abarth
"Drive in sport mode. Regular mode will seem sluggish. Make sure both windows roll up and down (regulators are a weak point). Pay attention to drive-line clunk when shifting while moving slowly...the lower motor/torque mounts commonly go out before 50K. Listen closely for any humming from the wheels...wheel bearings are also a weak point. Check for mods. I personally would stay away from a car that's been modded...unless the mod is one you plan on doing anyway. Check the inner axle boots to make sure they aren't cracked, broken, or otherwise spraying out their grease.  the CV Axles next to the wheels don't usually go, but the inner boots between the drive shafts and the transmission are super common failure points. As far as major services...this car (the American one, anyway) doesn't have a lot of maintenance items to see to.   I think the lack of maintenance items is a direct result of this being an economy car that's been souped up rather than an entry level sports car or luxury sports car--like a Mini by BMW.

**Maintenance Schedule**

**20,000 Miles**

Inspect front suspension, tie rod ends & boot seals.

Inspect brake linings & parking brake function.

Replace Cabin Air Filter

 

**30,000 Miles**

Inspect CV Joints.

Replace Engine Air Filter

Replace Spark Plugs

 

**40,000 Miles**

See 20,000 Mile Maintenance

 

**50,000 Miles**

Replace Engine Air Filter

 

**60,000 Miles**

Inspect CV Joints.

Inspect front suspension, tie rod ends & boot seals.

Inspect brake linings & parking brake function.

Replace Cabin Air Filter

Replace Spark Plugs",abarth
Why not buy a cool small car like a R5 turbo or 205 GTI Arbaths are shit.,abarth
Somehow have never heard about this fiat but I absolutely love how it looks. Definitely wish it was in the US,abarth
Looks great! Got a link to the head unit you bought?,abarth
Where I live. You want the center vents unobstructed. The side vent isnt enough. But that isn't a problem that just occurs with these cars and similar radios. But there are a lot of options for DIY Android.,abarth
It’s the 500,abarth
İt might not have the original engine.,abarth
Good maintenance...,abarth
"Lots of garages do 1 year, 3 year, or even lifetime guarantee on batteries.",abarth
"I used zen graphics when I had to replace mine. Really high quality,  even on for 4 years and they’re like new. 

https://shop.zengraphics.co.uk/abarth-stripes",abarth
How much of a difference does the dynamat make? A reduction in noise on the freeway would be nice,abarth
"We call our gray Abarth mighty mouse, since it’s so powerful, but tiny!!",abarth
"I'm a mechanic, I work with the typical mechanic type; homophobic, mildly racist, HYPER toxically masculine. They shit on my Abarth all the time, and I just laugh and go along with it. Who cares? If they're really that insecure about their manliness, they need all the support they can get",abarth
"Lots of typical mods. Also looked like I could see a front mount intercooler. Probably has a tuned ECU, I'd guess.",abarth
"Oh that's interesting, i'll have to go and do some ""testing"" and see if i find it also happens around a certain speed/rev range.

I never experience the loss in power when it's the brief flashing light. I only got the loss of power the one time recently when it was accompanied by the very obviously missfiring engine, so the loss of power with a missfire like that isn't too surprising.",abarth
West London,abarth
Its been modified. No telling how much? If the previous owner was halfway sane. Its probably fine for a 2nd weekend car or grocery getter.,abarth
When I had a fiat 500 a lot of older women would comment how nice my car was. Grandma age the were. My wife gave me so much shit ,abarth
Thanks found it,abarth
"Oh my god. Our cars next to each other would look brilliant. I’d love to drive a 595 someday since I can’t own one here in America :( 
But that means so much to me, thank you!!!",abarth
"I do, too many mods and parts replaced to let it go now haha... granted it's not my only vehicle but it's at 129k now and doing alright. I didn't have to replace the head, just the valves on that cylinder along with guides and I had the head machined flat again, only .002"" had to come off so it didn't warp or anything. I will say removing it and doing the timing are the biggest pains I ran into",abarth
iamted7 on instagram has over 230k on the chassis. He’s on his 5th engine? He likes to tune the engines and they tend to blow up,abarth
"Aye welcome to the club!!  It’s shitty but it happens, keep your head up.  I turned my valve into a mirror ornament. If you have any questions on the rebuild let me know, I just did a full top end rebuild on mine.",abarth
Yeah we're going to take it elsewhere that is closer to home. It was my wife dealing with them at first so we suspected they may take advantage of her since she doesnt really know much about mechanic stuff beyond change the oil. I asked three different people who are much better than me at this stuff and all three said to take it somewhere else if they wont even check the cooling system itself. They got all huffy with us when we decided to take it back.,abarth
Eu,abarth
"Pretty sure it has the same fake engine sound in the stereo as the 500e Abarth has.

Which is to say it’s pathetic.",abarth
😮,abarth
"Altough I agree on the part that both oils are excellent, Selenia (Petronas) uses full synthetic base oil, whereas Motul 0101 uses partial synthesis (HC). So base oil wise, the Selenia might even be superior. Still, both excellent oils without a doubt, and when changed frequently (at least once a year), the slower degrading rate of full synth vs. part synth becomes less relevant.",abarth
Where ya at? It's been 80°F for a week now. Been running the AC. I worry about the upcoming summer this year in Texas since it's already 80°F in February.,abarth
"Came to say the same, I paid $13K for my 2013 with 15K miles/manual/leather/Beats/satnav in 2015. Mine has been nothing but reliable but it’s bone stock/ OEM.",abarth
very nice looking car 👍,abarth
"Thank you! 

No sun roof for me then, kinda sad, it looked so cool",abarth
It’s screams “I’m from Ohio” - which tracks.,abarth
"If the battery died after one day, it'll be under warranty.",abarth
"Hoffentlich nicht die Multiair Einheit, ist leider häufiger ein Problem bei den 1.4ern mit der Einheit",abarth
Yes I have actually joined a few events! Though my car used to be red lol,abarth
Fiat 500,abarth
"Well, book time for pulling the head is apparently 12 hours, so either start learning how to do it yourself, or start learning, and don’t fall into the hole that I did!",abarth
Did you forget to turn it on? That ussuqlly does it for me.,abarth
"Are either of them the correct oil? I doubt there would be wear in the way of worn bearings, but the multi-air module drives the valves so good quality, correct grade, regularly changed oil is essential.",abarth
Yup. Diamond cut wheels are terrible.,abarth
You guys with solid roofs are so lucky. I have the c and I need to hand wash it.  I'll be waiting for the weather to warm up before I do that.,abarth
"Yeah thanks lol. We've had dump trucks moving snow out of the neighborhood all day long. We're just lucky it fell over such a long time.frame, last year we saw over 60 inches in like 36 hours and it crippled the city...something like 16 people died.",abarth
"Absolutely yes, it's just an exhaust, its electronics are independent from the rest.",abarth
They all joking until you floor it and they are gripping the passenger seat.,abarth
I have never seen anything like this. It's awesome! Too bad I have a c.,abarth
"Bombardone is nice, Record Monza is better, but the absolute best is [this one](https://monzaperformance.it/collections/scarichi-sportivi/products/abarth-500-terminale-con-valvola-apri-chiudi-wireless-con-telecomando), with an on/off button that acts as a mute/unmute.",abarth
Yea absolutely. These really vary car to car so I’m here asking. I swear by Ohlins for mixed use on BMWs but am aware it doesn’t always translate to other cars.,abarth
I always answer: my pink iphone and my abarth do not define my sexuality :) so they can f\*k off,abarth
