Comments,Make
"I spoke with Abarth Spain & Germany. Both told me to be very cautious and only use 10W50.

Dealers often recommend certain stuff in their own interest, but sometimes there’s a reason. 

Thx for posting. 1 more point for  (use what’s recommended by Abarth)",abarth
The smaller the car the bigger the dick. 😏,abarth
"I've been looking at this too, it seems the kits that need the scuttle cut are prone to the whistle.

I was looking at the RAMAir or the Airtec style to avoid that.

Be good to see the responses here",abarth
Mine is Celeste blue as well.,abarth
Katskinz is a really nice recover. Not just fabric over he old seats.,abarth
I drove that car on Saturday. It drove nice for sure but too much money. Sounds like the inspection went well. It ll need new tires.  Enjoy.,abarth
"Abarth has a sport pedigree, amazing successes in rallying. Now part of junior formula series etc.
Yes it's a small car but that's the point, have you seen first Porsche 911? Small call, front section basically looks like a frog. Abarth is passion, it's style and speed, it's fun! Every time I go for a drive or just coffee run it gives me so much joy. No one can insult that.",abarth
"How do tou achieve this stance, camber, wheels and tires? Thanks!",abarth
Let us know what you fig out was the issue,abarth
Ruined,abarth
"Making me jealous! We got rid of ours when we had kid no.3 as it's only a 4 seater. The Competizione was soooo much fun to commute with! It was 20 miles of smiles each day!


Never got mine remapped. We'll be getting another again in a few years so I'll be looking to getting it remapped though. ",abarth
"Yeah I love my little car but they tend to fall apart all at the same time, now it started going into limp mode, I can't hit the gas pedal a little bit because it goes limp, I'm getting from the forums other people that have same issues and they say that injectors go bad but ill try ti figure it out this weekend,  also DONT do the evap ""fix"", I did it and you can't ever get the check engine to turn off after that, big mistake.",abarth
"It does yes, to 14",abarth
"260? What mods are on in it?

I currently posses the supersport variant doing 180. Looking to up the power. An basic chip brings me to 200.",abarth
Can’t edit post but the abarth is something I’ve wanted for years is it even worth the trade my bikes worth about 1500 2k summer time,abarth
"I’m almost positive this has to do with the missing abs sensor. You cars tcm only knows what the wheel speed on 3 of the 4 corners is. When you are accelerating, the car is trying to brake the right front because it thinks that that corner is “slipping”. Our cars also brake the front brakes independently in cornering to increase turn in and stability. 

Fix your car properly and this will go away.",abarth
"Could be as simple as needing an alignment done, one good pothole hit is enough to throw the steering out of alignment",abarth
Trampy?,abarth
"2019, but 500L and 124 had their last year in NA in 2020.  2023 was last model year for 500X.",abarth
"The auto is awesome, fuck the haters.   It has more gears, can manually select gears, holds gears well in corners and just behaves really well.   As an adult who also has a city commute to and from work, it's awesome to just relax in traffic when you don't need to drive like a maniac.   It's still a more fun car than literally any of my friends have.

The auto isn't just a good choice, IMO it's the BETTER choice.    👺",abarth
"“Is that a fucking smart car?!” Is very funny.  But honestly I’m surprised that Europeans get made fun of. Because pretty much all the cars  are small displacement hatchbacks no? Here in the states, especially the Midwest its easy pickins for us.",abarth
I haven’t since the oil change at 71k. Not a bad idea to check it out though,abarth
"Wait, what? The US Abarth has a high interference? God, no. I was told it didn't...",abarth
"Water in the coolant tank should be mixed with antifreeze and have a sweet smell, so you should be able to recognize it",abarth
I do live in North America. Wi actually.,abarth
"I think the battery is your problem, try swapping it with a new one. If you have the receipt you should even get your money back for the old one.",abarth
"I won’t suggest it for deliveries as:
- suspensions are stiff
- turning radius is sacrificed if car has a lowering kit 
- rear boot is oddly shaped and tapers going up
- if already lowered, you risk scraping under the front bumper on steep inclines / high speed bumps 

 …but damn it sounds glorious",abarth
"The shifter mechanism on the gearbox side is the same design as the Alfa 147/156/GT/GTV which has the exact same issue.  I fixed the issue on my Alfa GT with this:

[https://www.totallyalfa.com/shop/clutch-gearbox-drive-shafts-v6/alfa-romeo-gtv-spider-916-v6-gearbox-linkage-bushes-46467103/](https://www.totallyalfa.com/shop/clutch-gearbox-drive-shafts-v6/alfa-romeo-gtv-spider-916-v6-gearbox-linkage-bushes-46467103/)

My Abarth now has the same issue so i am going to buy some of these again and see if they fix it.",abarth
"The tuner is very famous in Cyprus. He only does alfa romeo, fiat cars. The essese produces 160bhp stock with ihi turbo. So with remap it goes 180 max. The thing is that with ihi you cannot see more than 185 bhp...... So if i want to go more i will need td04 or garrett.",abarth
Revised display too. Never liked the pre 2015 speedo,abarth
Agreed,abarth
"At any given moment you can learn some part in your car was the one in a batch of 20,000 that quality control didn't catch

Hope for the best, expect the worst as the saying goes. Solid chance you're fine but there's no reason something can't go fucky, just be prepared for it. Even cars with 2,500 miles on them have issues sometimes, just the way of things",abarth
And Michelin pilot sport 5  tyres,abarth
"Where I live your unable to use your phone or even touch your phone while driving unless it's physically mounted to the car dash or mirror etc. 

A head unit with android auto or apple car play is really useful as basically you can do all that your phone did without touching it. 

Looks cleaner imho if it's just a nice screen incorporated into the dash than a tablet or phone.",abarth
"Yes. Remove the plastic close to the handbrake. There is the inertial central ecu from Bosch there. Cet the black wire and run a switch to the dash.

That's a hack to remove esp, ttc and tc.",abarth
Valve and piston had a little party in the cylinder. Reddit won't let me attach a photo but it didn't end well,abarth
Wow I'm starting to think this was done on purpose from the dealership...they were trying really hard to screw me over and I contacted the state attorney general and I had a feeling they just unbolted stuff lol,abarth
"I’m not familiar with Fiat cars but this screen and operating system looks identical to a Mazda’s, do they share parts?",abarth
Interesting. How did you turn it on via the OBD port? I’ve never done something like it before,abarth
"I'll do that, thank you. I took the knuckle to a small shop that was recommended to me to get the new hub and bearing pressed in. I've never had any work done at this shop before so given how my first experience went I'll look for another shop :/

Oh well, I'll try to get it done as soon as I can afford to do so, thank for the help",abarth
"I suspect the an air intake sensor. Had such a problem once. Hard cold start and could past 2500 rpm. With the check engine light on.

Ofcourse confirm my thought with an scanner.",abarth
"About 90k miles. The valves and cylinders kissed, and based on what the shop is saying I think it may be more than just the head. But I will look into it!",abarth
Lets see the interior,abarth
What usually gets it going again? Sounds possibly like a fuel pump iasue,abarth
"I don't have experience with Abarth valves specifically, but generally valves only stick for two reasons:

1.  They're bend and binding in the guide.  Common with piston-valve contact like failed timing belts.
2. The engine has sat for a LONG time.  Usually tapping the valve stem with a hammer is enough to get them free, but whatever stuck them (rust, solidified oil, etc) may not clear out without disassembly.",abarth
I’d put money on burnt exhaust valve.,abarth
"Check the fuse, if that's good check the relay. That would be where I'd start.",abarth
"9,0 Nice Abarth Bro 😎",abarth
Also there ist some pipe/hose (bent intercooler pipe?) blocked by yellow bondo!? Bottom section of the pictures...,abarth
"Trying to buy wheels aint no treat either. Everybody has something listed in 4x98 lug pattern. Who knows if its actually in stock. I actually went to a shop that said they had 4 of the wheels I wanted in stock. I was gonna order online, but I realized it was local. He looked them up. They dont actually have them. TSW just has them listed as being somewhere in their system.",abarth
Nope miles reflects the body . Only time you change that is replacement of the cluster and it has to match the old cluster.,abarth
I’m also new to the 124 Abarth game in Charlotte! Looking for a shop myself.,abarth
"My thought is that with all those mods is hard to tell if its normal

My multiair when consumes a little bit of oil start sounding like mini farts",abarth
"My intake keeps rubbing on one of the hose clamps below it and tearing a hole, need to move mine over like this",abarth
"Looks amazing!
Also the tail lights change to those of the newer generation (post-lift?) was a good move! These look so much better!

The old back lights and the steering wheel of the <2016 Abarths are the only things that aesthetically do not work for me.",abarth
"For EU owners, check out https://store.blackparts.it/ for aftermarket stuff.",abarth
What are impact structures? And why wouldn't they fit? What could I snap a picture of that'll tell me? Thanks btw,abarth
595 Competizione wheels only sold in Europe/Asia etc,abarth
Decals lmao. I’m so dumb. This UK time.  Would love to see the interior of it.,abarth
"No, they should not make whistling sounds. The pad runners/hardware could potentially do with some lubrication. This is commonly done at install time with anti-seize copper grease.

As for the rumbling, do you have slotted discs? They can produce more noise. We have slotted on our car and can confirm under hard breaking they can produce a quiet but deep ""rumble"". As long as you have no issues with the brakes pulling or vibration through steering I wouldn't worry too much.",abarth
Probably swaybar bushings,abarth
there's a big difference between keeping heat in the turbo and overheating the turbo.,abarth
How did you replqce them? Did you went to a shop or did it by yourself?,abarth
"A larger rotor has more surface area which results in greater mechanical advantage. The higher level of advantage, the faster the breaks will lock up. Why do you think Nascar & formula one use multi piston calipers & not single piston? Of course tire compound matters, but so does the weight of the vehicle.",abarth
This is the devil edition Abarth (see the last digits of the odometer and red accents). The owner needs to sell his soul in exchange for high mileage. Stay away.,abarth
Decent winters on steelies are very affordable.,abarth
I like it!,abarth
I needed some there and then and they had nothing else. Sales chap read on another abarth forum that 5W40 would be an alright alternative,abarth
I had a 13 in black with the red accents a while back and loved it. I think this color is quickly winning me over though haha.,abarth
"Thanks, don't actually get it till next Saturday, took on a test drive and sold my BMW. Ahhh, it is literally a beast 🤤",abarth
I Uber eats with mine part time during dinner hours. 2015 auto. I make like 500 to 700 weekly. So far no problems but I will need new tires soon. The income from last year paid more than the car purchase price.,abarth
Byte size,abarth
"Tried to fit a 45inch TV in a euro 500 Abarth, won’t fit laying flat because of front seats 😂 the car is too short",abarth
"Likely not: there are multiple Uconnect 7” radios, some have GPS (compass), Nav, and/or CarPlay.  Hardware itself is missing if it doesn’t already have it.  The label on top of the radio will say what capabilities it has.

So what you could do is find a unit with CarPlay, install that, and do a Proxi alignment.  That’s what I did for my US market 2017, which never offered CarPlay.  Bought a Euro radio, and then messed with the proxi until it was mostly happy.

You could also go the aftermarket route, which will also likely be much cheaper…  I think the radio I bought was $350.",abarth
That window thing is probably the stupid clip. Easy 20-minute fix,abarth
:-/,abarth
"With an open downpipe you will get increased performance and decreased gas consumptioneven with the stock exhaust.

By ""blow-off"" you mean the pop-off valve that releases turbo air? I have that, too. Very nice, and increases both performance and durability of the turbine.",abarth
"TY!

It rides totally fine for me, although I'm used to stiff on other cars as well so I'm biased.",abarth
Thanks guys,abarth
Smash,abarth
"Appreciate it, thanks!",abarth
Keen on the part number for the updated uconnect! Wireless CarPlay 👌,abarth
"Good to know, at least they aren't under dimensioned.",abarth
"Ah, so also a dreary drab ugly winter state, lol",abarth
For what it’s worth check your coolant level & that it’s circulating properly.,abarth
"So I purchased a 68 plate comp. CarPlay did it work, so I took the dash off, checked the label I. The head unit which confirmed it had CarPlay.

Than it was a case of turning it on via the OBD port. 

So my advice is see if you can confirm the headunit supports it before you decide what to do.",abarth
"Was du machen kannst vor dem Kauf ist die Kompression des Motors kurz prüfen zu lassen und einen Abgastest machen wie die Werte aussehen.... wenn Kompression und Lambdawerte stimmen, hast du schon mal eine grobe Indikation wie es um den Motor steht. La Deutsche Vita wäre dann noch mit Kamera rein und Kolben/Ventile anschauen ;-)

Ausserdem würde ich nach Ölverbrauch fragen (klar das ist dann einfach eine Ausage, pi mal Daumen des Verkäufers...), aber trotzdem. Wenn er dann Öl säuft wie blöd, hast du evtl. etwas in der Hand...

Nach dem Kauf dann immer schön 1x pro Jahr oder alle 10k KM Öl wechseln inkl. Filter. Kerzen wechseln (NGK 93311), wenn du Lust hast Getriebeöl (Selenia Tutela 75w-85 bei Handschalter) und Kühlmittel wechseln.

T-Jet Motoren sind sehr robust; aber klar wer weiss, ob der Turbo immer schön warm gefahren wurde. Mit meinem letzten T-Jet habe ich 250k km (120ps, nur alle 30k km Öl gewechselt, ein wenig Ölverbrauch) gemacht mit dem ersten Turbo, ohne Probleme, und beim aktuellen Abarth 500 habe ich auch 150k km runter ohne Probleme und ohne jeglichen Ölverbrauch.",abarth
Tell her I said hi!,abarth
You're 100k short :p,abarth
"""I never saw a man driving a 500"" in his defense he is an old racist British man.",abarth
"I really like a big spoiler on this car, wouldnt drivebit otherwise, looks very good!",abarth
"That's adorable! My Pop was Blackberry, and I'm thinking of naming this one Raspberry!",abarth
How tough were the side indicators to do? I may leave mine as is since the car is white but I like the idea of that.,abarth
"Is there a way to prevent this
Is it fuel related",abarth
😍,abarth
Unless there’s snow on the ground ;),abarth
"I have a yaris as my back up,back up car it always starts and its amazing what can fit in the back. Its a two door hatch problem free and low maintenance.",abarth
Its not a brand that anyone gives a crap about here in the US. Stelantis screwed this up anyway. Didn't need a whole new platform. Batteries up front. Electric motor in the back. Done. Could have even used two small motors.,abarth
"I'd actually be interested in hearing it. Even stock they're relatively loud cars, I don't think I have ever heard a quiet one, lol",abarth
Get the battery tested. I just had a brand new interstate..toasted the first day. Unless you’ve thrown an analyzer on that battery you don’t know. That’s the first step.,abarth
"Lmao, glad some1 said it. 😂",abarth
"Overall it's a decent unit but definitely has some quality control issues. When it works right, it's fantastic. That being said though, I am on my second head unit and third wiring harness trying to get all the quirks sorted out.

My first head unit was fault, and would produce a constant hum as though it wasn't bypassing the amp in the unit. With that second unit however, the harness has some odd short in it so it doesn't always turn off with the car and steering wheel controls cut out like once a week. Their support with them has been fantastic however, but you can tell it's a generic Chinese unit.

Like I said, when it works, it works great. Sound is just fine, having Android Auto and Carplay wireless is fantastic, and it looks great in the dash. And let's be honest, these cars interiors have more problems than a head unit that acts up once in a while!",abarth
"There is some guy in the UK who 3d prints attachments to connect those vents directly to the car, so no air just gets thrown around inside the console",abarth
Has anyone tried that how would i bypass all the electronics,abarth
You will notice the difference. I have the 330mm kit fitted to mine.,abarth
my dream color scheme.,abarth
"i see your point, but by that logic an audi RS6 is an A6 or an M5 is the same as a 520i",abarth
"Word of warning, I loved mine until they welded themselves to the valve stems and had to be Dremel'd off carefully. Might not hurt to put a tiny amount of anti-seize on the threads!",abarth
"hi I also go through this along with other drivers...if there's no problems found just remember the following.. 

there's a canister inside your gas tank and when you go below 70% full it can trigger the code...so say u need to pass inspection... 

reset the cel... then keep filling your gas tank every time you hit like 50-60 miles..never keep filling past auto stop either.

once the DOT monitors go back to ""ready"" status (takes about 200 miles of driving like you said) then you can get your inspection done and remember keep that tank filled every 60 miles... after you pass inspection don't even worry about it and it may come back if your tank goes lower but you can just do it again in a year lol..

reset, keep tank filled every 60 miles, when status is ready on all monitors get the inspection (making sure the tank is still above 75% filled) and once you pass just do it again the next year..

But yea thats if there's no actual leaks or problems... this is what it is if that's the case... good luck.",abarth
"In my country (European models) I have read several complaints about the automatic gearbox of Fiat 500, and most ""experts"" tend to stay away from it. Probably not without reason. 

I have a manual, and daily commute is not really a hassle. 

I would not buy an Abarth with automatic gearbox anyway, because that takes part of the fun away. And this car is mostly about fun.",abarth
"I hated the color in the original rear lights pic. Now, I love it seeing it all around the car. Great looking Abarth!",abarth
"Performance brakes do make you stop faster, but the biggest factor for stopping distance is grip, tyres are everything",abarth
"I paid $9750 in 2018 for a 2013 with 35k miles, Cabriolet (aka convertible), mint, no accident history, red/black leather interior, Beats audio, manual transmission, modified exhaust and air intake. Do what you will with this info but I think your car should be under $10k.",abarth
"engine mods are:- fully bolt ons, big turbo and bov, k&n air filter, upgraded turbo air cooler, prospeed1 axle back exhaust, dry intake Noz, tune and much more
aka things u can't possibly afford 🤣",abarth
"Honestly, I think the car had some other issue that they weren't fixing correctly. I think it was either an oiling or PCV problem, and that was causing oil consumption. Then, it would run low and eat parts. It's all a guess, but I would bet that my issues were more a failing of the techs than the car itself. Being a tech myself, I don't say this lightly.

I've learned that techs hate working on these cars, and for good reason. The packaging is impossible. They use every type of hardware available. And the plastic bits are as fragile as a tween's emotional state.",abarth
Thx I’ll look into it,abarth
It’s can be done. I’m not sure your level of expertise but I did mine myself.,abarth
"Ah, those are good ones. I did the stubby and shelf as well. Like the idea of the felt",abarth
My husband calls her an egg carton 🤣,abarth
That shit sexy as hell dawg,abarth
How would I know once I got it up?,abarth
Turbo should be at the front of the engine under that central heat shield in a European car,abarth
But is it extremely loud? Do you have your catalyst on or you went with a downpipe?,abarth
She’s mad at you for not driving her,abarth
"I have a meticulously maintained Abarth that burnt an exhaust valve at 67k miles.  Car ran perfect right up until the moment the valve failed.  There's examples of Abarths that have done 200k+.

There's no way to tell you what your car will do.  Even strict maintenance can't ensure you won't experience an issue.

But they're great little cars and I plan to fix mine.",abarth
"i’m one of the unfortunate souls who had their valves burn out. i can’t speak for others, but it was super expensive to repair so definitely have a repair budget",abarth
Ahhh every days a school day. Maybe they wrote it on to sell lower mileage ones at a higher price?,abarth
which launcher did you use?,abarth
Yes.  All the way forward,abarth
😂😂😂,abarth
I just got 5 pin pigtail connectors and soldered the wire to the contacts on the tail light. I just taped off my reverse so it doesn’t light up but I can just solder it to the blinker contact if I needed to,abarth
"Yeah, naaaah

The trick is to keep it looking as stock as you can in the outside...",abarth
That’s crazy! So early,abarth
"What springs or coilovers are you using?

My car is so low or already scrapes I would love a splitter but I'm afraid it'll come off",abarth
I am amazed one of these has 370k+ miles on it. Wow,abarth
Homemade or a kit?,abarth
"Have you considered taking your car to an upholstery shop and having them done? Perhaps Fiat sells the kits that can be fitted by the upholstery shop.  If it’s pricey, maybe just do the front seats and leave the back seats stock.",abarth
"So I have a N/A abarth (160hp), and I ran a race cat for a little bit and it certainly made it louder and you could hear the turbo better, but as for power I guess I can't say, maybe a little bit but I'm assuming it will need a tune to see any real gains... also be aware even with a ported o2 spacer I was never able to stop it throwing a cel completely, maybe every 300 miles so just be aware that without some ecu work that will probably be the case.",abarth
"that's ur preference, the spider abarth for me is a weekend/track car, I drive it to the bricks till it blows up, then I'll fix it and do it again 
my daily is 2022 acura tlx a-spec and 2020 4runner they're comfortable enough 😉",abarth
It was,abarth
Looks like a new punto to me. I like it.,abarth
😂 at least they are red and that’s cool.,abarth
Gorgeous! Despite the drawbacks I loved road trips in my Abarth. Have fun :),abarth
"For context a 2018 laser blue (rare color) with 93k miles just sold on cars and bids today for $12,750 (plus fees and maybe shipping). Also I like those mods as well.",abarth
"Decide who you want to remap it, then take their advice. Tell them what modifications you are planning. Some of the upgrades may cause you to remap it (again), and you don’t want to do it more than necessary.",abarth
Km or miles I do not believe that,abarth
"……that looks nothing like a Golf, i30N etc etc etc",abarth
Congrats.  That's about 55k more miles than I have on my 2017 Abarth :D,abarth
I am not. I mean it hangs in my house near the door out to my driveway but there is at least 20’ between the keys and the car.,abarth
Lmao. I love doing this but i park tire-to-tire so that no one thinks this an open parking space and blindly smashes into my car,abarth
"Boom. It's as straightforward as you think! Just pop that bad boy off and you're good
https://youtu.be/1FAdJYq-r_c?si=5LlJzWcn3Fsqtbsj

Edit: wrong link at first",abarth
I placed one of the mounts with the suction cup and the adjustable arm at the front of the dashboard above the glove compartment. I love it because it doesn’t cover my view when driving at all. I use it for Google maps all the time,abarth
We use 5w40 for multiair 1.4 engines in EU. It's fine.,abarth
Nice 😎,abarth
"Congrats, mine is white too, but I don't have the graphics",abarth
"The decat free downpipe makes the engine breath better, and it is certainly an improvement for its reliability, efficiency, and long-term lifetime. In the context of a Stage 2 upgrade, the car will go faster and burn 30% less gas. So counterintuitively, in most contexts it will pollute less. That said, before the MOT I would suggest reinstalling a cat or adding 10% isopropanol to the tank, or, even better, finding an expert mechanic to prepare your car for it.",abarth
"I just loved how nippy it was and easy to park, however mine had a horrible turning circle, especially for the size, but it was the only fault I had.   My husband bought it for me and he had a company car, he’s really into cars, he always said whenever he drove, “I get out with a huge smile every time I drive this car”!",abarth
