Comments,Make
"Might be one of the heat shields attached to the exhaust rattling. Mine had a similar sound because one of those shields had distached. The shield went all the way around the exhaust, so it was in no danger of falling off, but it sure made that noise for a long time before fixing it",saab
I bought mine 2 years ago for 170€. Times have been rough…,saab
">Solved for the next 5 years for $5 and 15m.


Thanks for the tip,hope the rest of my 20yr old baby will last that long haha.",saab
Beter!,saab
1000 miles is the length of 7282740.52 Zulay Premium Quality Metal Lemon Squeezers.,saab
I agree 🙂,saab
"Depends on preference and where you’re based - for the most part I’d say SAABs are fairly easy to work on in terms on mechanical stuff and servicing don’t use a huge amount of specific tools and sourcing parts I’ve found has been really easy (England) - only thing I say SAABs are difficult for is the electrics and the need for a Tech2 for some of these electronics and this can be abit of a pain/get expensive but for the most part I’d say they’re good to work and on and learn mechanics, plus with countless YouTube videos and forums, someone’s definitely done the job you need to do before",saab
They cause a lot of problems much easier to just get it out than clean it,saab
Chrome. Had a 2 door of this. Miss her.,saab
I have a couple places around me,saab
just get the code read. is this your first car?,saab
Moving from park to drive with two fingers (index and middle) after picking up those bagels in the brown bag.,saab
UK here. That’s gorgeous and I’m not even going to look at the &/$ conversion. Can’t see that being on the market for long,saab
"$6k USD? for a 23 year old car with over 100k miles on the clock?

Thats a lot of money for an old car that will need a good amount of work soon as things are hitting the point where they just fail over time (no matter how well maintained the car was).

&#x200B;

If you trying for a quick sale you need to drop the price significantly.",saab
">Sabbit Car buying guide

Double B, single A? ;)",saab
"I don't mind feeling the bumps, I used to stance cars when I was younger, but the OG9-3 feels like a boat compared to my 9-5, I hope lowering springs would help with some bodyroll.",saab
"Can't remember the engine code but it was a German car 1.3 engine. The thing had the nicest most satisfying sound when shifting and all the power you'd need on acceleration.

My next Saab is definitely a turbo OG 93.",saab
Crank shafts sensor,saab
"You need to pu... Oh wait, sorry.",saab
It's more like a piece of thin metal sandwiched between a sort of paper.,saab
"It's the valve of the crankcase ventilation, I bet. Just got mine back today after weeks of try and error.",saab
"The pain you save in reliability is paid back in finding certain parts and getting people who can do good work on them. 

They're good cars but they're quirky and some european car mechanics refuse to work on them. Service is really car-to-car, and Saab techs are harder to find nowadays.

I will say, the plastics and rubbers that GM used on the newer saabs age so badly. Like they just crumble apart eventually. That's a weak point for sure. 

It's difficult to list exactly what is good and what is bad because it changes from car to car. The newer ones mostly had solid engines in my opinion. The 4 cylinders are common so any issues are well known. The 6 cylinders are underrated and besides a few small issues are good engines too.",saab
"Applies to all b207s
https://www.saabcentral.com/threads/the-official-unofficial-07-09-intake-valve-tracking-thread.329066/",saab
[A ‘99 9-3 Viggen and ‘08 9-5 Aero Sportcombi](https://imgur.com/a/SmKpxED),saab
"I haven't seen anyone here talk about the diesels, so I'll give my own two cents. Feedback from people who are more experienced with these engines is greatly appreciated!

2.2 TiD (Available on OG 9-3, OG 9-5 and NG 9-3 until 2005): bog-standard GM Y22DTR, 125 hp, likes to eat high-pressure fuel pumps.

1.9 TiD/TTiD: Fiat Multijet engine that was shared with GM for both Euro4 (Z19) and Euro5 (A19) emission standards. Single turbo variants were fitted to both the OG 9-5 and NG 9-3 since 2005 until 2012 and was shared with Opel's (CDTi) and Alfa Romeo's (JTD). The twin-turbo TTiD remained only for the NG 9-3 and the only other car to have this engine, the last generation of Lancia Delta.
There are a few variations which I will go over:

Z19DT (120 hp) is the most reliable of the bunch, only suffering from normal diesel issues, like clogged DPF's, EGR valves, injectors, stuff like that.

Z19DTH (150 hp) besides the normal diesel issues, suffers from a failing oil pump pickup seal, which is a cheap part in itself, but it's a bit of a hassle to actually replace it, and if not treated in time, can lead to worn out bearings. The swirl flaps are also said to be brittle and made out of plastic and may have a tendency to just break and fall in the engine.

Z19DTR (180 hp, twin-turbo) has the same oil pump pickup seal issue as the DTH and I have seen quite a few people claim to have had the same swirl flap issue, but I have also been told that the swirl flaps are actually made out of metal and this is consolidated by the fact that the intake ports and manifold are a different shape than that of the DTH. Also, since the turbos sit a bit cramped, you may or may not run into some issues with melted electronics around the turbos. A part I'd be looking out for is the radiator fan controller, which can only be bought as a Saab Genuine part, which costs a lot of money, or you could go and look for second hand ones off of Saabs or 3.0 diesel Opel Vectras/Signums.

A19DTR (130/160/180 hp twin-turbo) same issues as Z19DTR, just upgraded to Euro5 emissions. There might be slight differences in some parts/engine auxiliaries, so check part codes thoroughly.

2.0 TiD/TTiD: A GM derivative of the 1.9 Multijet, not related in any way to Fiat's own second generation 2.0 Multijet. This engine was fit exclusively to the NG 9-5 and was also found in other GM products like the Opel Insignia A and Opel Astra J. It came in 2 flavours for the NG 9-5:

A20DTH (160 hp, single turbo)

A20DTR (190 hp, twin-turbo)

As with the previous generation, these engines became notorious for their oil pickup seal failure (especially since it was such a common issue on the Opel Insignia).

One caveat of the engines fitted with a DPF was that, unlike, for example, VW TDI engines, the regeneration process didn't remember at what state of completion it was at, so if you shut down the engine in the middle of a regen and started it back up, the process would start all over.

3.0 TiD (only fitted to OG 9-5 until the 2006 ""Edna"" refresh): I don't actually know too much about this engine, apart for it being shared with the Isuzu D-Max. I will add to this comment once someone can tell me more about it.

Fun fact: did you know that the NG 9-5 was supposed to recieve a 2.9 liter V6 turbodiesel?",saab
You could also unplug everything while having the car on jack stands and then lift the front of the car to clear the engine using the 1ton hoist.  Use a pallet and a roller to move the engine away. Done!,saab
Thanks for the info! I’m going to order the parts today. I have found someone who’s willing to install it for relatively cheap. Going to ask if he can take a look at the oil pan as well.,saab
"Geez, everybody stop panicking… This happens to my 2006½  every time we get a freeze in central Carolina.

The fan motor is starting to seize up from moisture buildup, making the lubricants in the stator housing get hard (like candle wax). The noise happens until the motor warms up and melts the “wax”. The motor itself isn’t going bad but it definitely needs lubrication.

Most people replace the fan motor, but my OCD won’t let me replace fixable parts.😅",saab
I installed a bypass cause the amp kept breaking I’ve gone the 4 since owning it,saab
Parrisadè?,saab
"86 SPG
07 9.5 aero sedan
04 9.5arc wagon
09 9.3 XWD combi
04 9.5 linear wagon
07 9.3 aero V6 sedan
07 9.3 aero V6 6 sp combi",saab
If it was a Viggen I’d go paintmatched looks waaay better than black,saab
It's a fairly easy diy job lots of videos on YouTube I don't think there's any bolts even it should just be a hose clamp at most,saab
"Whole pcv system is the kit you seek. Anything older and the hoses are prone to internally react with the oil, clagging pickup and sludging. Not visible from outside. Oem still manufactured.",saab
Do you mean under carpet or undercarriage? Ive just peeked down the carpet but it looks fine. Undercarriage is a bit rusty in the rear I must admit. But its not too bad,saab
Terrible. But you only live once and we learn from mistakes.,saab
"This is a 15 minute repair. 


 Remove that plastic tube 


Use a hammer and punch a hole in that plug with a nail 


Screw a 2.5"" wood screw into the hole you just made 


Use the claw on the hammer to pull out the screw and the plug with it 


Set the new $5 plug in the hole 


Use the hammer and a 13mm deep socket as a drift to tap the new plug into place 


Reinstall the plastic tube 


Solved for the next 5 years for $5 and 15m.",saab
God damnit. How do i go about this?,saab
Mine does this too my only cel is a vacuum leak,saab
It's also the place where the automatics build after 1999 have a vacuum pump for the brake booster.,saab
"Cool. Post pics when you get them installed. 

All the best",saab
"NG900, OG9-5. Sworn never to get a NG9-3 as I do repairs on all the electric problems with them",saab
Can those chains be replaced at home? 😅,saab
Yea it made me sad. I ordered new wheels and tires tho,saab
With car off and key out of the ignition pull out the fuse and look to see if there are two metal terminals that the fuse clips into.  If there are no terminals or only one then it’s just a spare fuse. If there are mating connectors it might be used,saab
I’m in the process of trying to get my passenger side nozzle to flow again. The other two work however!,saab
"So, you're claiming this to be strictly coincidence that these saabs were parked here together?",saab
"Does it happen across all RPM bands? E.g. if you baby the throttle does it still ""set out?"" Had a similar issue with a Peugeot 306 1994. Changed both plugs and coilpack. Fixed the issue right away.",saab
Thanks unfortunately i couldn’t find it on there but a useful link still :) i now have the part number from another comment,saab
I took all the pumps pulleys and all that junk off mine when I did it even took the harmonic balancer  off just to give me a little more room more you take off less chance you break it I did just unhook my exhaust manifold and flop it over didn’t bother taking my turbo and everything off,saab
"I managed to budge the front bumper by only removing the screws in the right wheelhouse and the clips by the grill. It was enough to push it out slightly to get my hand in on the other side and to have a closer look. Well the hose itself has been dragging on the ground and is very worn out. It also has a slit in it that's leaking. The end bit of the hose was cracked as well so there was no way of it clicking into place at the nossle of the headlight... Is there anyway i can seal of the broken hose as a temporary fix? I can live without the headlight sprayer for now, but the leaking not so much.",saab
He only mentioned the pump but i assume he wants to replace the hoses aswell,saab
"I have The same car in sportcombi!
Love it!
When you get tired of The engine, try maptun stage 1. It Will be a totally different car",saab
"1979 c900 GLs 5dr (daily driver), 1980 c900 GL 5dr (parts car), 1984 c900  GLi 5dr (ex-daily, now reserve car), 1976 99 CC 3dr - crashed, on its way out to a new owner for repair to roadworthy condition.",saab
I’ve got quite the accidental collection 😅,saab
"97 9000, 88 900 turbo, and 01 9-5 aero",saab
"Looking at a 1997 Saab 900s. It has 317k km, but looks really nicely maintained and has a full service history. I’m in Europe, so fuel economy is really important to me, could I fit into 9-10l/100km in the city? Also is the 2.3 motor reliable?",saab
"Mijn mentaliteit is altijd geweest als je het doet doe je het goed ander doe je het 2 keer. Dus daarbij al het bevestiging materiaal nieuw en op het moment dat de ophanging verwijderd is de tijd nemen of enige roest te bewerken en alle een paar goede lagen lak te geven 

De voorkant was in een middag gedaan hierbij was de grootste uitdaging om de moer van het schokbreker uiteinden te krijgen aan de bestuurder zijde, ze bevind zich onder het koelwater reservoir/rem reservoir. Door het koelwater reservoir te demonteren en wat gepruts met korte steeksleutels is de klus geklaard 


Echter was de achter as bij mij een lastige klus ivm met veel roest op de bouten en schokdemper draadeindes , de auto op een brug hebben zal erg helpen maar dit is niet noodzakelijk heb het zelf op de put gedaan met 1 putkrik onder de auto en 1 garagekrik onder het wiel een paar blokken hout zijn ook handig 

Veel succes!",saab
Oh yea? What kind?,saab
Interesting.  I’ve never seen one on the turbos I’ve had.  But I never owned one new so maybe by the time I bought it someone had removed it. Only ever saw them on the automatics.  I wouldn’t call them big.,saab
Sounds awesome. Any pictures?,saab
Never owned the others.,saab
The ‘01 was my war horse for a long time. It deserves a good retirement. :),saab
Don't buy an Avensis please 😂 But i'm happy you get my point. I want this to be a pure project at this point but I don't have a space and cant afford two cars right now. I'll buy one again in the future and man I have plans 😁,saab
How dare they?!,saab
It does,saab
Saab 9-3 2.0T Aero of 2003: NEVER EVER BUY IT.,saab
"Oh brother… I tried just gluing it first, and then found one on eBay… but you’ll need the whole knob and delicate hands from now on",saab
Hi all. My 2005 SAAB 93 has a weird thing where it's a little slow to reach it's idle speed when cold. It only does this after several hours of not starting it and starts instantly when warmer. any ideas?,saab
I personally think this is sick. Bike rack gotta go tho 😭,saab
Source and Seek in the other direction.,saab
Looks like a normal March in Kansas City…,saab
"Exactly, many people do what they think “is cool” by definition, not what they actually visually prefer. It’s also just kind of a “hopping on the bandwagon” effect. I.E most Americans don’t really think modern wagons/estates look bad if they see one, but if you ask them out of context they will say that they aren’t “cool” or visually pleasing.",saab
Designed to fall apart for safety is the spin.,saab
That is correct the brakes are larger on the TurboX and the bolt pattern is 5x110 so there are less aftermarket choices than 5x113,saab
You have to run the same size or larger rim and stock because of the brakes 18 or 19 I think. And run like a 235 width,saab
"Thanks, I think it came out well. That being said, I think anyone could do this. A couple cans of VHT (one wrinkle and one color coat), a cheapo heat gun, and a new gasket are really all you need. Took a bit of work but it would have been much faster if I was only doing the valve cover and not the engine mount, bracket, etc.",saab
"I tried to order the same hella pump from eeuroparts recently its not in stock but they wont update their website.

The spectra pumps have a good reputation",saab
Thanks! I just checked and it seems I don't have the latest version. The one you sent is good for the Saab 95 SE '99? Is it something I can do myself or should I have it done at a garage or something?,saab
You're not wrong I definitely gotta see what's up with it and how I could get it fixed,saab
"Yeah it was something with the EVAP a small leak detected and autozone said the solution would be a new gas cap. Going to purchase one tomorrow, hopefully it fixes the issue.",saab
Yeah that McLaren probably falls apart when you drive it. Junk!!,saab
This is the way,saab
Ah ok. This is a great resource as well: [Saab Service Shops](https://saabparts.com/us/book-a-service/),saab
Have them start the car stone cold after being outside over night. If it feels rough for the first 39 seconds perform a compression test after another night out.,saab
"If you are in Bristol, go and see Martin at Jamsaab.",saab
"If you find a set that's 4x108 you can use wobble bolts (floating lugs) to adapt them to 4x110. Just depends on your budget. They're very popular wheels for old school euro cars.

If you wanna go the BBS route you'll probably be spending between $2-4k on them.

Search the used market to see if you can find a good deal. I believe they came in 4x100, 4x108, and 4x114.3

Don't get any 5 bolt wheels cause they cannot be adapted.",saab
Let me know if you find one. I’m 30 mins from nyc and the check engine light just went off a couple of hours ago 😅,saab
"Yeah, I'm not sure exactly how much of an impact that would have, but it definitely won't help haha.",saab
I thought it was just me...,saab
go fast > look fast > sound fast,saab
Yeah but should probably get my car 100% running first lol,saab
Is the viggen like a different model or?,saab
"I guess I have enough reason to believe the head gasket is fine, so I’ll leave it as is. Can I clean a CCV valve myself? Or do I need a mechanic for that? I don’t know a lot about cars, so excuse my ignorance haha.",saab
"I removed it and tried putting it back tightly, my friend is sort of a mechanic and I spoke to him about it and he said to check the cap to see if there is a good seal like you said, if not im just going to order a new gas cap to try first, and then if not I will likely try to replace the purge valve",saab
Cool.  I thought about installing a heat sink too. Similar to alum or copper type in circuit boards or amps. But I couldnt figure out how to install and keep it in place.  I live in Texas.  109 degrees Farenheight yesterday.  Heat shield makes more since in this environment.,saab
"Nordic Summer Meet, check my video on it for some nostalgia 😁 https://youtu.be/dClVlb__1LY?si=m7smChUI6GJpc70N",saab
"I agree, find out what they are. Clear coat is big issue and engine sludge
This one definitely has more questions to be asked of the owner",saab
I'm not really sure. Try this. https://www.saabcentral.com/threads/infotainment-voice-commands.204895/,saab
Did the check engine light burn out?,saab
"Gorgeous, for sure. Hnng.

How well was it maintained? Is the seller the original owner? Stored indoors? 1992 was a long time ago, but if it was babied by a Saab enthusiast and you're willing to put in the $ when it inevitably needs work... it just might be a steal.",saab
Whoosh,saab
Yup! I parked in an empty space and then when I came back the other two either side where parked up either side of me. I live in a area with a lot of through traffic so I guess that stacks the odds in my favour.,saab
"I disassembled the original pump and installed a new ac delco sender and a walboro gss341 with the 400-791 install kit. Ran about $200 all in for  upgraded oem parts.

https://m.youtube.com/watch?v=_5eOlhrC-gM",saab
"2006 9-3 aero sport combi133000  SLc clean....
Michaeltnorthrop66@gmail.com",saab
"That makes sense, I’m in SE Michigan so there are mechanics on every street corner but I have a feeling that id need a specialist",saab
https://www.saabcentral.com/threads/the-official-unofficial-07-09-intake-valve-tracking-thread.329066/,saab
"Bolt pattern is the same for all ng900, 9-3 and OG 9-5. The offset varies.",saab
My 2002 SE 5 door was assembled in Finland; sticker says June 2002.  I've always assumed that late model year hatchbacks were made there because Trollhatten was retooling for the new Gen 9-3s.,saab
Probably just dirty,saab
Fitment is crazy,saab
"After a moment to think, sludging is also detrimental to turbo seals. Oil and coolant can mix at that point, even if not the exhaust side, producing smoking. Worth a check for turbo shaft play mostly on intake side.",saab
"I bought that one. Was a nightmare. Self leveling lights failed 3 months in. Aircon 3 times, 4 CD players, traction control unit would crap out on roundabouts. The fuel pump went after warranty period expired. The car spent more time in the garage than me actually driving it.",saab
"98-03 SAAB 9-5 had PCV issues. You'll need the so called PCV update 6. It's not super difficult to do the PCV system yourself, I did in 1 day. But dropping the oil pan to clean it out is a mess and needs a garage generally.",saab
"Maybe worth to invest in a document scanner, they are way easier to use than scanning individual pages on a print/scanner combo. May I suggest the Scansnap IX500? Have been using it for years and is quick and easy to use. You can probably load half a binder at a time in it and press start and forget about it.",saab
"No, but I’d throw on the sport lips on the bumpers and sport sideskirts",saab
Any Saab 2.3 from 99-09.  '04 and up are better due to improved PCV system from new.  You can keep the existing ecu and turbo.  If the engine has a knock oil could be contaminated and could affect turbo bearings.  New turbos are not expensive. (Ebay),saab
Oh that's hotter then we ever get here in sweden haha,saab
So many SAABers! 🚙🇸🇪,saab
Satin black just looks like a replacement part that still needs to be painted. Makes it look cheap.,saab
Great thank you!,saab
Is there a way for me to fix it myself,saab
"Around the flywheel somewhere, cant pinpoint it",saab
Yeah sorry i misstyped but yeah 9-5's and 9-3's have the same issues,saab
"[https://www.consumerreports.org/cars/car-value-estimator/results?modelYearId=4287](https://www.consumerreports.org/cars/car-value-estimator/results?modelYearId=4287)

This will give you both trade and private values for poor, average, and mint condition.",saab
"General lack of respect and moral fibre, I say.",saab
"Cool, I’ll give that a shot :))",saab
"On the older 900's (Pre-GM) be sure the car doesn't pop out of gear when in reverse on a Manual transmission -  A sure indication that the reverse gear in the transmission is worn or chipped.  Had 3 with that problem.  Edit:  Thought of another:  Be sure the heat shield for the catylitic converter is still intact.  The 900's were known to have issues with that plugging up, over heating the exhaust and rusting the heat shield quicker than usual.  As a result the floor boards heat up and often can cause the plastic shielding of the E-Brake Cables and the wiring harness to melt.  I had an '84 900's with that issue.  What an electrical disaster that car was as a result.",saab
"Strong advice. Plus, one should always keep money in the bank for failures instead of going right to improvements. I bought a lot of cars over the years from distressed owners... ""It needs a water pump I can't afford but has brand new $1000 wheels/suspension/exhaust"" is a story I've heard too many times. Get $2k in the bank for emergencies, then get to improvements.",saab
Easier to talk in international currency 🤷,saab
That car is dope.,saab
I bought my 9-5 when it was at 332k. I drove it until about 460k. I could have fixed a bunch of things and kept driving it but wife was less than thrilled and wanted a newer car 😏,saab
"Naaahhh. If I were you, I'd leave it as it is.",saab
 Saab>>>>>>>>>>>>>neighbours,saab
"True, and the car doesn't like anything other than the factory plugs of which can start to intermittently fail and not cause codes until severe enough. Other than those ignition coils, I would thoroughly check and then double check the all the vacuum lines paying close attention to the turbo lines, too, because I missed this myself and have one cracked from the turbo.


 Oddly enough, sometimes the lines are loose around the clamps, too, and the downpipe from the airbox as well as the throttle body can have cracking that's not even noticeable, but aftermarket pieces are sold. Gives you some options.",saab
"Current bid’s at about £9500, it’ll probably end up at at least 15k when it’s done. ",saab
Try an Irish one,saab
I have the car I need. Why are you selling it in Euros if you’re located in Sweden?,saab
This is one of the most Aussie things ever. Nice,saab
"The fuse had power with ignition on (tested with multimeter). There’s another slot that’s empty that had constant power but I need one constant and one switched (couldn’t make a fuse tap fit, maybe I’ll just need to get another?)",saab
[deleted],saab
Dude….,saab
"2009 9-5 2.3T Aero SportCombi, 2008 Saab 9-3 SportCombi 1.9 TiD, 2005 9-3 1.9 TiD, 2004 9-3 2.2 TiD, 2000 9-3 2.0l  and 1999 9-5 2.0t",saab
Fiat Pandas are very rare here in Finland. There's only like a dozen of them on sale on the most popular car selling website. We also don't get the newer ones which I think looks good. Do you get them in Sweden?,saab
"2 NG 9-3's with one of them being a 36k mile vert, and now a NG 9-3 and 9-5. I'd love to get an SPG one day.",saab
"Gorgeous car! Hot take, I’m sure, but I love the lower-level trims for the C900. The chrome window trim looks elegant and the base-model wheels look clean, plain, and simple. Enjoy her!",saab
NEED 9-5 SE turbo SportCombi. W/heated and ventilated seats. Sports roof rack and backend tie down system.  NEED it bad. Preferably Space Grey with black leather seats.,saab
"You could still do a bunch of other colors, grey/black/silver would all probably look nice with the red DIC.",saab
Yeah. I wish it was bigger!,saab
Yep definitely looks like it. Having a hard time deciding if repainting it is worth it.,saab
The fuck is up with that house glow?,saab
