Comments,Make
"Dealership or independent, there is always a chance of incompetence lol.",subaru
"When you say 1/3 up the oil dipstick... do you seriously mean several inches? The ""full"" line is like 3"" max from the tip of the dipstick...

I'd be willing to bet they filled your oil but did not drain it and you were driving with up to 12 quarts of oil. Your engine would definitely be shot after that, but they should 100% cover the engine replacement if we are not missing any details here

Edit: also one thing to note, in most cases, the service advisor is a customer service representative trained to do paperwork, translate technical jargon to the customer, and to some extent deescalate situations. Just because they know the words does not mean they know what they are talking about. Be polite yet firm, and wait for the technicians report. I was a tech and a parts employee; there are good and knowledgeable advisors, but half of the ones I worked alongside couldn't tell the difference between a serp belt and timing chain

Edit 2: to clarify, just because the advisor might not have the correct technical knowledge does not mean they aren't trying. Treat everyone with respect, kindness, all that jazz (until they clearly prove otherwise)",subaru
The cruise control light will flash (in error) whenever there is an issue with the car. They're often caused by faulty sensors unless you're actually trying to tow 1500kg consistently.,subaru
"You'll probably have more luck in r/WRX or r/WRXSTI.

There seems to be two schools of thought. Either buy one without a working engine so you get it cheap and build it up yourself or pay up and buy a nice one. The ones in between seem to be a bit of a crapshoot on how they'll turn out.",subaru
"I always tell people if you get past the headgaskets, with a potential valve body or torque converter but not guaranteed, I see the most high mileage 10-12 Outbacks and Legacys out there.   That engine is awesome in that it doesn’t have much tendency to use oil like newer models and I have never seen the internals (uncle Rodney knockin) fail like on the mid to late 2000s engines.  The suspension is well put together and they continue to drive well into the 200s and even 300s Ive seen a few.    

I really like gen 2 2000-2004 Outbacks as well.   They have their issues but simple cars that not much costs a ton to fix if you aren’t paying a dealer.  Engines leak but are less prone to rod bearing failure than the VVTs after them",subaru
Because that’s the correct thing to do. You are wrong. Hawkeye is 2 years. 2008-2014 is the stink eye,subaru
I'm sorry but if you win a case in court it doesn't really work that way. If they don't pay within the timeframe required there are escalating measures in place to make it happen,subaru
I was like ok LS swap pretty cool.. then it panned to the turbo...,subaru
That elk must have been going pretty fast to do that much damage! Were you stopped at the time?!,subaru
">Seems unlikely that they would have been happy to have been towed without the damage, the damage is just a circumstance that they could have prevented if they hadn't gotten towed in the first place.


You probably really identify with the people who say ""well you shouldn't have dressed so slutty if you didn't want to be raped"" crowd don't you? ",subaru
"I tapped my sub Forester  into a Toyota SUV in front of me. My sub crumpled up, the Toyota was barely scratched. I understand subs frames protect you and you are safe but can’t we have safety plus sturdiness?",subaru
That looks awesome! Have been looking for one for Impreza GR but can only find 1 aftermarket that is “carbon fiber”,subaru
Do you live in Tempe Arizona? I went to a group out there called subiworks and they are pretty good.  They mostly do just like mods to Subarus and make them more like tricksters and or off-roaders. They did a tranny flush. Kind of screwed it up but made it right so that was fine.,subaru
Has the block ever been a weak point though?,subaru
Ya that's why I got my Crosstrek for bc I have to go to work when it snows too! Worked out great. And take to all my fishing spots.,subaru
Sounds good! I live in Piscataway and was visiting my GF in Somerville yesterday when we passed the dealer and saw this.,subaru
"CVT make the engine rev differently than other vehicles, but the boxer sound is the sound.",subaru
That is fucking awful 😅.  But if you like it then everyone else’s opinion doesn’t matter right?,subaru
I'm getting the same issues and only owned mine for a month,subaru
Common hand tools and soapy water,subaru
Unless your current shocks are decently new coilovers are better for a 20 year old car.,subaru
"Probably 5th gen Outback/Legacy. Timing chain instead of timing belt, no head gasket issues, CVT issues from 4th gen seem to be fixed.",subaru
"Probably a vacuum leak.

Back when I was in those we would often run a Weber 32/36 carb, with adapter, pepped em up a little bit and were easy to adjust and tune",subaru
"I'm glad you are finally understanding this. Yes, foreign VINs usually won't work in USDM VIN decoders. Even when they are 17 digits, USDM based decoders often have issues. Japan didn't start transitioning to 17 digits until ISO3779:2009 took effect, so most of the VINs before then were short and need a JDM VIN decoder.",subaru
"> Whoever wrote that is a fucking dotard

Scotty Kilmer type advice.",subaru
"I just had a talk with my mechanic. Noisy brakes are just a Subaru thing according to him, I still have plenty of brake life and they are starting to squeal, but inconsistently.",subaru
We have a disc golf course on campus...LOL,subaru
The hoses of oil are dead consistent imo so you can’t 100% blame them when we don’t know exactly what happened yet,subaru
"Ohhh, that's why I had to pay cash!",subaru
"Yes, you are right, i have Forester SG with EJ201 125hp. Great reliability. Also LPG is installed.",subaru
"The white car in the back is the Subaru, got me at first too.",subaru
I catch myself parking next to Subarus in my Mazda because I forget which car I'm driving....,subaru
"You could buy from your local Subaru dealership for an exact OEM fit.

I don't mind buying whole blades, because the ones that can be replaced (AutoZone/Walmart) are the cheaper no frills variety.

Plus, I've noticed shopping online for Subaru wiper blades is PITA. Better to go to the actual manufacturer's websites.",subaru
I’m not sure but can the OP open an insurance claim and have the insurance go after the tow company?,subaru
Love it 🤍🩶,subaru
"I'm not very familiar, what revision?",subaru
"Yup scrap the whole car because of a leaky oil cooler…

Go figure rubber goes rock hard like plastic when oil saturated for 20 years.",subaru
I really want a turbo one. The bugeyes are the coolest,subaru
"It’s pretty much stock now- It just has a bora exhaust and some maintenance mods- almost 180,000 miles and still runs great!",subaru
"WRX, not Outback",subaru
"No way I'd be dropping $8k for an automatic.  I mean you do you, but I wouldn't.",subaru
"Exactly. I don't know the laws in the area, but I'm sure they are not allowed to do damage to your car. Where I live they have tow trucks that pick your whole car up.",subaru
It's plenty of storage for one person doing camping and whatnot. For two it's tighter. The Forester can definitely fit much larger bulkier items like appliances and stuff.,subaru
I am genuinely thinking of possessing one of these in the near future. Love me a legacy,subaru
I got a 2016 legacy for my first car and really want to mod it a lil. I know it a terrible project car but it there anything i can actually do?,subaru
"No, don’t get this. Many times the spray can cover drain ports and cause rusting.",subaru
"All good. Yes, market does change.  Could you try another dealership? Maybe they’ll want yours more for resale?",subaru
"I bought a 2016 Legacy at 89k miles and didn’t have an extensive service record. (Big mistake, I know. I learned big time)

My transmission valve body solenoid went out at 125k miles and it was past the extended powertrain warranty. My wallet cried… I believe that the spark plugs were never changed and I heard pinging in the engine.

The car has been sold since then (at 145k miles), but it taught me that regular and on time maintenance is a must for Subarus. A few hundred here and there is much more manageable than a $2,500 repair bill up front for the transmission.",subaru
"oh good, that would quell my paranoia.",subaru
"ill probably end up taking a look at it at some point this week, but idk if i’m up for dropping $8k~ just at this moment honestly",subaru
"Even in a naturally aspirated car it lets you launch harder.

Basically just gets the torque converter up to stall speed.",subaru
25 or 35,subaru
"Ej2.2NA ... all day... my EJ is currently at 433k miles... original Head gaskets, still drives strong... it shall never die",subaru
Might as well top off your blinker fluid while your there,subaru
"If in the offchance you do buy it, can you DM me so I could meet up with you and actually get a ride and maybe get to drive this thing for myself?",subaru
Making hatch gang look bad,subaru
Ooo nice! Budos Band for the win,subaru
How is it a red flag? It feels like an area-specific event because for some reason they really want Imprezas.,subaru
It's not technically a drop tine although very close. A lot of times if the antler gets damaged while it's soft and growing it will exhibit weird growth patterns. Not sure what was going on with this one. This is definitely a unique antler base. I had it in my stash of antlers for years just waiting for the perfect use.,subaru
Had those on my car for a bit. Everything’s been good,subaru
More- https://www.flickr.com/gp/200350275@N06/31959648D5,subaru
It appears that the A/C lines are partially clogged.  The issue is causing mold to grow beneath the front passenger-side carpet.,subaru
"Actually sounds pretty normal to me to be honest, I have a FA20 2016 WRX. Why don't you buy a newer one though this is like 11+ years old at this point?",subaru
👋NH😁,subaru
Take the belt off maybe?,subaru
"https://preview.redd.it/l5dmoti50jkc1.jpeg?width=640&format=pjpg&auto=webp&s=dfeb54d1333ac74644f200b13c1815ffa6e929ff

Anyone know what the ‘circular grill’ is for on this 07 Impreza center console?",subaru
When this happened to me it was because a rodent of some kind had chewed through my engine wire harness ☹️,subaru
But aren't you applying pressure to the syncros when pushing the clutch in as well?,subaru
"I think you shattered your car..... 
Glad you are telling us about it!",subaru
"Look into the legacy gt spc b first 
Less hot boi more stealth",subaru
One of us.... One of us....,subaru
Double check my math and everything. I don't want to be responsible if it doesn't fit! Is your lug pattern 5x100?,subaru
Not at all!,subaru
"I would if I wasn't a grad student on a budget ;(

  
My BMW E46 is serving me well as is for now although its technically on loan from my dad. I'd love to buy my own car (or buy the E46 off him fully) in the near future. Wouldn't mind one day buying a Subaru (I'm a lesbian so I gotta own the stereotype)",subaru
I love this subreddit. Thank you for that explanation!,subaru
2016 Subaru Crosstrek. After towing everything in my apartment from California to Washington I needed to do an oil change and a transmission fluid change. Oil change went fine. I drained the transmission fluid and sure enough it came out looking rather worse for wear. But now I can't get the transmission fill plug open. I got myself a breaker bar which wound up stripping the star hex fill plug. Is there any way I can fill this thing now? Or has my car become a brick?,subaru
"My first thought is piston knock or engine knock form the crankshaft, but is the check engine light lit? if its crankshaft knock, the crankshaft sensor will make the engine light come on.",subaru
"I'm guessing a WRX Type RA.  

**Exterior:**  
*  The black mirrors and black door handles are a common indicator of being an RA on a turbo 1st gen 1994+ (1992-1993 did have black door handles on WRX and STi non RA as a caveat)  

* Surprisingly, those aren't the original prefacelift V1 square mirrors, those are the rounded Ver2-Ver6 mirrors so that was swapped too.  

* The trunk sticker indicates WRX not the STi trunk decal, but the spoiler is definitely a ""Ver1"" STi spoiler.   

* The tail light trim also corroborates WRX Type RA, but not sure it's STi still.   

* There is no STi fender badge 


**Interior:** 
* The seats are WRX, not STi V1-V2 seats unless they were swapped.

* The steering wheel was swapped. 

* OEM roll cages were optional accessories, but they were typically black and offered in 6pt or 8pt cages.

**Drivetrain:** 
* The brakes were swapped to GD STi brembos. 

Does it have manual crank windows? What kind of exhaust? Intercooler sprayer?",subaru
Amazingly low mileage,subaru
"From NASIOC the 06+ had the same ratio.  So, the 05 Saabaru had a quicker steering ratio than the 05 WRX, which lead people to believe it had the STI version, but it was the same rack that went into the 06 WRX.",subaru
"That leggy slid around a lot better than my 3.6 outback does on dirt.

I think just because it was lower.

With the outback it gets way too fast way too soon on dirt.

Still glad I went with the outback over a 2.5 leggy, but I'm kinda sad I didn't go for a 3.6 leggy.

A 3.6 legacy with a manual trans would have been nasty. It's a shame Subaru never made that happen. Especially with raptor headers and a tune. 

If I ever hit the lotto that will be one of the stupid cars I build (with 2.5i badges too trick people into thinking I'm slow)",subaru
"Because you're a Subaru transmission expert and know exactly why what you're saying is a fact? Or are you just some random Internet know-it-all? Either way, you are telling me that Kia and Chrysler manual transmissions are better than Subaru's? Because I drove the shit out of both of those cars, not using the clutch on 4th and 5th gears. Only reason I got rid of the Chrysler is because it had an electrical issue that I got tired of fighting with",subaru
At least they're off the road now,subaru
"No prob, no odd engine noises? Everything feel okay when driving? How about oil levels?",subaru
"TY. I used to think they were all at or slightly below MSRP; I discovered a huge variation - above and below. 

I also always thought a reasonable profit was built into MSRP. It now looks like those charging up to 2x MSRP are simply making huge margins.",subaru
We bought one when options were limited due to COVID.  It was 21 and picked up an Impreza for my daughter w/ 0% financing.  They listed in their website they deliver to you. When they got it in the dealer my husband said bring it out. 30 miles one way with bridge toll. They didn’t even know that was on their site.,subaru
"me. too. ty. 

doesn't ever seem like i can get a repair for less than $1,000 minimum though. still cheaper than getting a new car though. last repair was a torque converter and that was pricey.",subaru
"You need to press the brake pedal and then hit the start button.  It says it in the dash display, but it's pretty easy to miss.  It's a safety/anti theft feature to basically say ""ok I'm here at the wheel with my key fob ready to drive""",subaru
Clearly. Please excuse my ignorance,subaru
Save the hatchbacks.  I’ve got a Crosstrek now (kind of a hatchback?) and I really miss my Focus ST.  Hope you’re enjoying it again soon.,subaru
I own an RS and love it! Have had 0 issues for the last 6 months,subaru
Scam.,subaru
"Yeah if I cram the nozzle in this happens.  I just try not to push it all the way forward and hand pump, where I can cut the flow back a little to let the vapors escape.",subaru
I bought one last year and so far I have no complaints! Great car.,subaru
"Easy to do. I was about to come unglued once when nothing was working, then I finally saw the message about moving the steering wheel. Still not sure what the point of that feature is",subaru
I always hate this racing mentality. I got a 21 STI and everyday some tries to race me at a light or on the highway. Like first off these are not straightline cars so there is plenty of cars faster off the line. Second that shit is dangerous. Third is who seriously gives a shit. Do you really have so little going on in your life that pretending to be faster than someone else at a stop light makes you happy. I have a fun car because it is fun to drive. Not because I have something to prove. I do drive fast plenty but I also know when not to and I consider the safety of others.,subaru
Looks like Groot’s cock,subaru
"Does anyone have a good suggestion for a dash speaker? I prefer clarity over volume and usually keep my music at a medium to low level. I've checked Crutchfield, but there isn't much available for the 2024 crosstrek limited.",subaru
"It's because of the efficiency and power output they can offer and that they aren't wrong. The efficiency is amazing, as well as the torque output you get. They used to be used in F1 until their ban in 1994 due to their advantage but actually never got to be used in an actual race, but those were strong as shit and in testing showed that teams can get a several second advantage per lap. 

However, the CVTs we get in our cars are weak, and the usage of CVTs benefits dealers and Subaru if we have to get it replaced outside of warranty. I wish we consumers actually got some strong and durable CVTs if multiple gear ATs were out of the question",subaru
"I sleep the front seat of my ‘15 legacy at service stations. With a good blanket, it’s actually more comfortable than my bed.",subaru
"Longer video:

[https://www.youtube.com/watch?v=6PVmQfWX7yA](https://www.youtube.com/watch?v=6PVmQfWX7yA)",subaru
"You are 100% correct. I did so to showcase the material. Pressing it on a vise didn't compress more than 1-2 mms. There are thin metal cylinders surrounding the holes, so I guess they provide most of the compression support.",subaru
"I went to one of these.  Got my gift card to target for $10, had a crappy free bagel and called it a morning.",subaru
"Yea there is a few things for sure to take care of right away, I already plan to get rid of the rust as soon as I get it, I’m not a huge fan of the dent in the hatch but the dents in the fender can be pushed/pulled out fairly easily and the rust isn’t to bad considering it’s a Canadian car I’ve saved worse lol",subaru
You wouldn’t be able to read data off the cad in the post unless you rig up a custom ssm1 windows clone or happen to have an ssm1 dealership reader,subaru
what car do you own,subaru
"So I’m just an interloper, not a Subaru owner. I’ll tell you what, though, the OP’s experience doesn’t inspire confidence, or make me want to get a Subaru. The car got towed by an “Integrated” tow truck, colloquially called “snatch trucks” because they’re commonly used for repo and parking enforcement. 

These things get used to tow cars improperly, all the time. Except when it’s a Chevy, or a Toyota, it doesn’t do thirteen grand in mechanical damage.",subaru
We share the same dream.,subaru
"I mean, it's a pretty cool Subaru...",subaru
"Uh… although I’m just an outback owner, I’ve never heard of anyone doing this.

Is this a thing these days in manual vehicles? I would think that shifting with no clutch would be remarkably detrimental to your transmission.",subaru
I had one just out of place once and I couldn't even stand due to the pain.,subaru
Damn yea lucky mine just bent the swing arm and they had a new one in the shop so it’ll be all good,subaru
"it won't grenade from a leak, only if the compressor is run under *vacuum* -- which is exactly what a refrigerant recovery machine will do.",subaru
Broken rib.,subaru
I bought those after seeing these kinds of videos.,subaru
It's 100% a scam ,subaru
Is it just something for the car to work with or? Because there is nothing in the car i can see the temp,subaru
Yes the saabaru came with the STi rack.,subaru
Golden Hill.,subaru
Op. I can buy your engine from a junkyard for less than $800. It takes at most a weekend to swap out and get back running with a couple YouTube videos or a friend who is mechanically inclined. Do it the right way,subaru
"When they killed off the impreza WRX STI to the WRX STI it took a dive for sure, but it’s still got a few experts on it.",subaru
"I went into a Toyota dealership to ask about either a corolla hatch XSE or a brand new prius. The receptionist had me wait for a salesman, who proceeded to tell me they have neither and tried to sell me a car in exactly the specs I did not want, down to the color. Car salesmen seem to love wasting time, especially when they think you don't know what you're talking about",subaru
I got new tires and the sound still occurs :/ its a shame because its so loud in person but I just can’t record it for the life of me,subaru
"As long as everyone is ok that’s all that matters.

Trucks scare me, I never know if they can see me or not, even when I’m in their mirror.",subaru
"Losing a hatchback just hits different. But at least a family didn't lose a loved one. 

F for the hatchback",subaru
I like it,subaru
"Once you realize they are stalling, the pressure comes on harder and faster.

As others are saying, just take it to court vs. wait.",subaru
‘Intergalactic backorder’ 😂😂,subaru
"Ah yes, classic SuBRRRRRRRTu shifter.",subaru
"Not that I’ve noticed. I recommend hitting the top and bottom with a little dielectric grease, otherwise sometimes they can squeak a little bit.",subaru
That's awesome. I suppose used inventory does provide higher margins if the vehicles are desirable.,subaru
"Had a subaru tech i work with who primed the system after a rebuild doing this on a 21 wrx (i think) and the engine damn near locked up. Had to replace cams and sprockets due to metal shavings and flush system. Our CFO told us to just fire it up, and dont do the fuel cut anymore",subaru
This is the dumbest shit I’ve ever heard.,subaru
I’m thankful for my 2013 and living in Southern California. Truly helps preserve this beauty.,subaru
I sure did visit all the dealerships my friend but I appreciate you assuming I didn’t. One problem with your anecdote- it’s 20 years old and companies don’t give a shit anymore.,subaru
The problem isn’t fuel cap. Obd 2 code told me it was o2 sensor and a mechanic friend helped me erased the code and am planning to buy a new o2 sensor,subaru
"It could rally or off-road if you wanted to.

Some of the best times I've ever had in a car were sliding around at 60-80 mph in a 2.5i leggy",subaru
Respect the serious answer 🤜,subaru
"I’m not buying it, I’ve just never seen one before",subaru
"https://preview.redd.it/hp0rpg5c3dqc1.jpeg?width=4032&format=pjpg&auto=webp&s=3f814d2c7ed6e39c972d0d1d7f7d748d2316e550

3.6R cruiser",subaru
Is just the o2 sensor acting up. Going to buy a replacement soon.,subaru
The Subaru WRX STI is a variant of the Subaru WRX.,subaru
They always say look at the hands.  Here we can count the fingers.,subaru
"And be willing to walk. Cars magically get a LOT cheaper if it's the end of the month/quarter/year, and you're halfway across the parking lot.",subaru
"I’m sorry that happened.  The reason I bought my Subaru in 2020, was due to the NO pressure salesman.  It was such a relief after the almost bizarrely stereotypical sales behavior at other dealerships I visited.",subaru
It’s going to be real expensive when you melt a piston. How do your spark plugs look? How old are they?,subaru
"I had this same year, model, trim, color combo car. It was the best car I’ve ever owned. I currently work in automotive and to this day keep a Polaroid of it at my desk. ",subaru
What is the current mileage?,subaru
"I’ll one up it, I’ve swapped Subaru seats into non-Subaru cars. Many Subarus use recaro as the OE supplier so when you find one in a junkyard they make for a great upgrade.",subaru
"They’re a sophisticated entity that does a rigorous 120 point inspection prior to buying it. OP is just a lay person with no definitive documentation that an issue with the CVT exists. 

Maybe it’s a squeaky alternator belt— who knows, best leave it to the “expert buyer” to appraise it accurately 😂",subaru
Get rid of it and buy something decent,subaru
woah this is literally like a 5 min walk away from me,subaru
"rattling from the engine? or is it more drivetrain related? could be a bad wheel bearing, loose axle or maybe s diff problem.",subaru
"You could include relevant information like the model and year of your car, as well as the model of your phone.",subaru
"At 120k or after a car gets about 5 years old, time to not go to the dealership. Find a good, local mechanic. Preferably one that knows Subarus somewhat.

Get the list of maintenance intervals and just ask them to do it. At 120k, there should have been a lot more than just oil changes done so far. Coolant should have been changed at least once with the new blue super coolant, spark plugs at least once, CVT fluid a few times, rear diff fluid a few times, PVC valve, brake fluid, etc.

If you're so inclined, a lot of the fluid changes are rather simple. Takes a simple socket set and a jack, or maybe a special funnel or something.",subaru
I always dreamed of modding an old 3.6R Legacy to make it glide over potholes called The Cruiser. Its fraternal twin would be a 3.6R Outback modded to be an off-road monster called The Bruiser. Thank you for partially fulfilling my dream.,subaru
