Comments,Make
"I dono, a big part of the Fit's greatness is the amazing cargo room for such a small car.  I can literally stand my full size cello up behind the passenger seat.  I'd hate to lose the awesome access the rear doors provide.",Honda
This is a 1.5 turbo. IIRC only the civic SI applications are factory tuned for premium fuel. Beyond that it’s not worth the money without a tuner.,Honda
Lol i’m pretty clean myself but transporting 3 little brothers certainly doesn’t help,Honda
I've always wanted to put an odyssey type r badge on an EP3,Honda
Never be late to soccer practice ever again!,Honda
CRV for the daily and Ridgeline for the workin and trippin,Honda
"Are you doing the work yourself?
If not, leave it to the professionals to determine what needs replaced, if that happened there could easily be more issues and potential future issues that they would find.

That said, if you’re doing the work yourself, bare minimum replace the lower ball joint, rubber brake line, and tire.
If it were my own vehicle, I would replace basically every other wear part as well. So add inner and outer tie rod, upper control arm (comes with new bushings and ball joint), lower control arm, sway bar links, and maybe the axle too.

Also times that by two, if one side gave out like that, the other side is probably thinking about it.
And get an alignment after, anytime you’re messing with suspension components it can take it out of alignment. 
Not to mention your tire already shows uneven wear, so you needed one anyway.",Honda
"Did you have your windshield replaced? Your ADAS system needs to be reprogrammed after an install, if not done correctly it could have some of the symptoms you have mentioned above. 

A dealership will have the required tools, also some glass replacement shops will also have the right stuff.",Honda
"Loooooove the 2004 Odyssey. I feel like the Pilot is the move if you want more off-roading capability (albeit not much), the looks, and the driving dimensions. That being said I drove a minivan from when I had my driver’s permit and its size didn’t pose a problem to me. I’m sure new ones have sensors and other tech galore to help you out too.",Honda
Hell yea boi that’s the spirit! Take that silly duct tape off the hell let that bitch be free!,Honda
"I’ve found the HFP/mugan lips and skirts so far still no grille, any leads? 😅",Honda
6th gen accord V6 sedan and a manual element.,Honda
"Those are misfires. If your fuel pump was acting up, due to the recall failure, it probably wouldn't have started",Honda
"The pumps just kind of go sometimes.

The high pressure hoses have a weak point where the metal fitting has the hose pressed into it, and tend to fail at a higher rate than other parts.

I imagine most of that cost is labor. The fitting on the steering rack is a serious pain in the ass to access. But you might be able to find a better price somewhere else, I would shop around. 

It isn't a hard job, just a tedious one.",Honda
Have you scanned it to see what that engine code is?,Honda
"Ozone really works. I’ve had it done to restore cars that were abandoned.  It can be dangerous, so let the pros do it.",Honda
If I’m not wrong that looks like a non vtech 1.5L 4 cylinder.. I guess it’s a D15B series engine..,Honda
There you go! That's the best option! I would skip the rest.,Honda
"You're missing the point. Even if you pulled the label off and took the same picture, it shows as much as a blank white square would.",Honda
My dealer price matches,Honda
I didn't think about scrap yards there's a huge one not too far for me. Thanks!,Honda
Oil filter,Honda
Thanks for the info but that is very disappointing to hear. I thought Honda found the perfect material to make the brakes last and will continue to use them in all future accords but not do the opposite,Honda
"No way! I had a montreal blue lude, but it looks so dark here. Must be the clouds. 


It's a great sky blue with lots of flake, i liked the matching blue interior it came with too.",Honda
i would buy this,Honda
"No. There’s nothing you can do for the 2.0. Next time take a longer test drive and negotiate a better deal. 

That being said. Having had a 500whp mustang and a 300whp 2.0T accord, I find my 2.0 civic to be fine power wise for daily duty.",Honda
"2019 F150 for truck things, 2024 CRV Hybrid for my daily.",Honda
"It definitely is, but thanks for the comment and it doesn’t hurt to go back and check again in the case it is something related.",Honda
A single edge razor blade and soapy water for lubricant is your best solution,Honda
"Dude.....it's economy VTEC on an Accord. There's no aggressive pull or ""crossover"" or anything. 

A redline a day keeps the carbon away but I wouldn't make it a habit.",Honda
Also all the jdm import ones will be labled just k24a the one you want to find is will have 3 lobes on the cam . You can  identify it buy looking through the fill cap. The 3 lobe engine is basically  lower compression k24a2 .,Honda
Is it a stick?,Honda
">The yellow top in my car isn't the same size as the original battery, 

>the shop just fabricated one on the spot when I replaced the red top. 

You must have went to a reputable shop. Not too long ago I was helping someone and noticed their yellow top battery had no hold down installed. I inspected under the hood and seen the hold down was hanging on the other side of the engine bay.. just sitting on top heater core hoses. 

This battery was replaced over 4 years ago. So I guess the tech noticed that the yellow top was too tall for the factory battery hold down, so instead of notifying the customer and handing them their hold down, the tech just tossed the hold on under the hood and called it a day.",Honda
terrible,Honda
"Ohh wow, I just got a new battery in December for my car. My car is at like 33k miles. How do I know if my injectors will be covered or not? I have carmax warranty not Honda warranty. Also where can I go to get it fixed? Thank you so much for the help though.",Honda
"For a clean DOHC VTEC swap (or original) I could see 8k or more. D series just isn’t as valuable, but 4k on a clean manual EG seems about right, don’t know about automatics. There are shells in my area going for over 1k so… yeah not too far off",Honda
"If the car comes with Mishimoto ZX tires, I think it's 100% worth the asking price.",Honda
"Bad ball joints, bushings, struts, bent wheel, bad wheel bearing.",Honda
D,Honda
Batteries don't really have issues on these They are barely used,Honda
"I have a 2010 accord, and I have the same thing. It's probably for money/coins, but it truly confuses me why they put it right next to the 12V lighter so that it looks like an ashtray.",Honda
"got one myself and loving it, Congrats",Honda
"2000 s2000, 2011 Tsx Wagon",Honda
Nah man in in Australia sadly,Honda
"Alright, fair enough. Do you think that’s still the case 4+ years later? I don’t think so.",Honda
"Dude where is this I'll buy it right now. You're fucking kidding me do you know how hard it is to find an unmolested EJ1. Is 3400 too much for this? No it's a fucking steal where is it? 
 
Edit: Oh, automatic, never mind. 3k sounds about right.",Honda
"How are you averaging 36 mpg !?  I’ve a 2015 Civic, the highest average lately for me is 32 mpg. I try to make sure I’m driving in green mode when I can but so far nothing. When I first got the car, I got 41mpg once but none after that one day.",Honda
where in WA? I can do $4k this weekend 😅,Honda
He doesn’t have a 1.5T…,Honda
"Average price in California even with the mileage. 
I had a 2004 sold it the month of Covid start w/ 400,000 miles on it. 
November bought a 05 Civic w/200,000 miles for $2,800 5 days later a taco T-bone me, total.",Honda
I can see a car getting this dirty if you are a farm or construction worker.  If it is a personal vehicle you literally have a throw dirt in the car to make it this bad.,Honda
Great first car. You'll not have to really worry about anything except basic maintenance. I had a 2013 that I am still mad about selling.,Honda
"32 sounds about right for moderate city driving, but I've gotten mine to show as high as 43 after only Interstate travel.",Honda
"Easiest tell on an otherwise unmarked Accord are the tailpipes and trunk badges. V6 Accords are badged as such and will always have twin tailpipes on either side of the rear. Sport models (4-cylinder) will also have twin tailpipes and be badged as Sport. If it has twin tailpipes but no badging, look at the mirror caps. If they’re entirely body-colored, it’s a V6. If they’re partially black plastic cladding with a small body-colored cap on the front, it’s a Sport. 

I have a 2017 V6 automatic and primarily drive it in a dense city with a lot of traffic and stoplights. Around town I typically get 15 mpg because of this. On the freeway on longer drives, I’ve gotten as high as 40 mpg out of it. If I lived somewhere with less traffic and less frequent stops due to lights I could easily hit the low-to-mid 20s I think. I bought it for the engine, knowing full well the fuel economy wouldn’t be great in my situation. Currently I’m fine with it as long as a tank lasts me a minimum two weeks between fill ups, which it does.",Honda
"Could likely be the door lock actuator, as they are a fairly common failure point on those vehicles. But also could be the door wire harness having a break or partial break in a wire which could also explain the intermittent concern.",Honda
Kids and their seats aren't junk. At least for me. Lol,Honda
It doesn't matter where you're at. Check from a credit union is as good as cash and they'll except cash 🤟,Honda
Why shouldn't he turn the car on?,Honda
Save up for something cool,Honda
Is rdx as spacious as crv,Honda
Not looking,Honda
"As a RHD country enjoyer, this is so funny to me. Couldn’t imagine anything worse than left foot gas right foot clutch",Honda
I work at a dealer so I see plenty of them. Usually 30-50k out of them. Lowest I’ve seen was 23k,Honda
You can tell it’s not reset by one pic??,Honda
"I did have my windshield replaced, with a Honda windshield. 

The symptoms were present before the replacement, but it was noticeably worse after. I took it back to the glass shop and they said they would check the calibration, but really there was no change. 

I was hoping that their calibration equipment would solve the problem, but no such luck",Honda
Beautiful.,Honda
definitely me,Honda
nice wagon!!!,Honda
That gives me great hope! Unfortunately I just do not drive it much so it will take me 2 decades to get to that mileage.,Honda
"Weird, are you from a northern state? I've never heard of this!",Honda
"That’s a very reasonable price, especially given todays economic situation",Honda
A lifted crx on a solid rear axle. I never knew I needed this.,Honda
Literally looks better than the new Ford Taurus edition.,Honda
"Literally anything. Insurance, tires, transmissions, engines, intakes, filters, etc...  it's literally the least private thing in the world. Tell me what kind of ill intent a person can do with a Vin. Please tell me, lol 😆. A license plate has more sensitive information than a vin can ever have, and that's displayed on the car for everyone to see. Literally has your house address, your name, and any background issues that you may have.",Honda
"Lol, tell that to all the random people taking pictures of random type R or Si's on the road",Honda
That's a bargain at twice the price!,Honda
So beautiful 🥹🥹,Honda
So cute❤️,Honda
Whoever you are Bruv I ran a 2016 civic lx to 225k miles and sold it for 4K usd. Best car I have ever owned.,Honda
"Depends on what was repaired. Obviously people will tell you to stay away but if it wasn’t to bad it can be a steal, then run it as far as you can. But I’d get all the information on the repairs, where it happened, how much it cost, and the route the car took after it needed to be rebuilt to be more secure about the purchase",Honda
"2008 Acura TL Base and 2018 Acura MDX SH-AWD Tech...with an 06 Acura RSX base manual modded.  

Sedan, SUV, and coupe.",Honda
Especially if you're washing it by hand as opposed to the automated carwash that grinds everybody elses car dirt into your paint.,Honda
I never believe people that say x amount of marinate just done. And then they sell it and not even break even.,Honda
"The best kind of shii box 

We call em nuggets here",Honda
where? All I see is an old accord or maybe Crosstour with a shitty emblem glued on.,Honda
Grew up watching these and wishing I could be on [Maximum Drive](https://www.youtube.com/watch?v=bR2ibPf9W-E&ab_channel=Jmhammer424) as a kid!,Honda
"Same! Been looking for someone else who knows what I'm talking about, can't find anything. I thought it *may* have been related to the recall but I took it to the dealership and they did a full inspection to find nothing. Still not sure what it is.",Honda
"Check ground wires, just happened to me.",Honda
I brought mine back to the Honda dealership that I got it from but if you got it from carmax and have the warranty with them I think they would also take care of it from what I’ve heard from other people that have bought cars from them.,Honda
I have the 24 CRV hybrid.  Love it!  45 mpg.  The gas savings more than outweigh the extra you’ll pay for the car.!,Honda
definitely try them out! they’re expensive but worth it. throw it on completely spread out and drag if off,Honda
That’s a weekend warrior,Honda
Meguiars 100% I remember using the purple tire shine with my dad when I was a toddler. That was 30 yrs ago,Honda
I'll definitely be stopping at AutoZone to have them check that out.,Honda
"If I’m dumb, you’re Quasifuckinmodo.

Kindly go fuck yourself. My mistake for wasting the energy laying it all out.",Honda
"FWIW- I’ve had two car seats in the back of my accord and didn’t have to move my seat or the passenger seat forward much at all. 
My wife and I aren’t tall people by any means (we’re both women too) but we have never given space a second thought in a Honda much smaller than a CRV. 
We also took our backup car seat with us when we went to test drive new SUV’s (we went with a VW Tiguan) just to see how it fit.",Honda
I've been tempted to get the exact same one but the transmission problems scare me lol,Honda
"Battery could need charging or replacement. 

Looks like exhaust moisture leaking. 

Should be simple fixes",Honda
Anyone has access to HDS or an equivalent high end scan tool. And the targets.,Honda
I checked and that’s not it. That one’s plugged into something,Honda
Parts is the other thing probably more support for the si,Honda
All that for only $600? Lol. You did ok.,Honda
She rusty,Honda
It is the community stick...need a little take a little...or leave some if you have extra,Honda
"'94 Prelude, '08 CRV",Honda
B-,Honda
"With separation like that i bet youll need a control arm+ball joint, strut, tie rod, brake hose. But you need a mechanic to look at it",Honda
super common the solder in the gauge cluster is bad. give it a good smack or hit a pot hole and it might come back.,Honda
Other than a plastic piece near my driver side door handle. The entire interior is mint. I detail it often with a steam cleaner,Honda
"I'd buy it. Finding these cars in halfway decent condition is not easy these days, and many 5th gens have been completely molested by people building racecars, or trying to build racecars at least.",Honda
"I mean for our 2013 Accord V6, we get 30-33 mpg for highway during road trips.

Locally about 25-27 mpg.",Honda
Understood. Thanks!,Honda
There are some other subreddits where you can get better diagnostic like r/AskAMechanic/ or r/Cartalk .  It does sound like a failing transmission tho.,Honda
You win,Honda
Sucky sucky toobe,Honda
Congrats thinking of getting one just don’t know what color,Honda
I looked around for over and hour and never found it and I never moved it during the swap either. And I’ve just got a little jumper harness that goes from obd2A harness> p28 ecu. It’s maybe a little 6 inch long deal that plugs into the plugs from the engine harness and then into the ecu,Honda
Probably 4-5k. Thing looks mint. ,Honda
Check if wheel balance fixes your issue.,Honda
2012 si coupe and a 2006 acura tl a spec (6mt) at the moment.,Honda
That tire is bald.,Honda
Full ceramic pads? Why? Those are shit... they just eat rotors... dumbest shit ive heard in a while,Honda
1988 CRX Si with a dohc zc swap and im really looking for a manual first gen insight to daily,Honda
It's just not conducive to longevity. IMO that's why Honda now recommends 91+ for the 11th gen.,Honda
So let hear some good things or bad🤷‍♂️,Honda
Helix,Honda
"Okay, but as far as Honda is concerned the shop is WRONG lmao. OP's trans, and many other A/Ts and CVTs offered by Honda, are not equipped with ""lifetime fluid"". If they don't want the liability or they feel they don't have the knowledge, cool, but that doesn't make them right. 

Classic r/Honda.",Honda
Stock daily. Spend mod money on something less sensible,Honda
"Not a horrible price for a dealer for someone that doesnt know how to wrench. perks of knowing is peace of mind knowing you did it right, cheaper, and pick your parts.

&#x200B;

I feel like dealers use the cheapest parts, cut every corner and generally dont care half as much as you would. I had a bad experience with warranty work left me stranded in a storm because they forgot to plug in a ground wire.",Honda
"I was going to say, “Your entire interior is not an ashtray”",Honda
Using only genuine Honda power steering fluid cannot be overstated. The rack doesn’t like non OEM fluid either.,Honda
"J35A9: 06-08 Pilot 4wd and Ridgeline.
J35Z1: 06-08 Pilot 2wd",Honda
I have a D16A9 lmao,Honda
It should be done every 30k or 3 years....,Honda
Thank you!! Smart person right here. That's because it is the one LHT just put together! 😁 👌👍.,Honda
"That sounds about right, did they flush the brake fluid?",Honda
Looks fun,Honda
"@suisheep_ , it’s not Honda though. 

I’m not a fan of carbon 99% of the time but I actually like how it looks in this build with the bright as fuck green.",Honda
"Oh no, what happened to it!

My CRV is at 185k miles and going strong.",Honda
"yea, it was a p unique situation. i think most of the people here are assuming im just some asshole who parks where ever i want because it’s convenient",Honda
"If they still had the red 22s in my area for $3k I would have gone that route lol, every dealer I asked had no 22s, just the ability or order 23/24s. I think I saw the same one you did, and I almost went for it too. 

They had a couple of the ADV160s at the dealer I went to, and honestly I kinda like them. I like the Ruckus a bit more in terms of design but the ADV160s seem like pretty capable bikes. I’m not super techy either, I like nice flowy trails that don’t have me getting out of second or third.",Honda
I usually prefer white or black but the 91 integra in both looks mid,Honda
"Looks so nice!! I was trying to get into a 2024 civic sport. Currently I have a 2023 HRV Sport, I don’t like it lol it’s very slow.",Honda
"Seriously if that thing is in as good of condition/maintained as well as it looks in that picture.... Like a few other people have said, the best choice in my personal opinion would be to keep it.

Those things and all Hondas from that era are tanks! Continue taking care of it like it deserves to be taken care of and you will get another 200K out of it. If you buy a new car depending on the manufacturer you would be lucky to get 150K out of it without it needing some sort of serious repair.

So if you really really really just want to get rid of it, you could easily get 5 to 6K if you're patient.",Honda
Connect pins D4 and D22 on the P28 ECU.,Honda
"People love to be like hurrrr duurrr just do it yourself it’s so easy, but the if you have to ask, you most likely need more experience first.",Honda
lmao 15k yeah right bud jesus christ maybe 5 but not 15k we dont need to keep price gouging the car market,Honda
"and make sure the timing belt has been replaced, especially with that mileage",Honda
Black 18in Advan RS3 and coilovers,Honda
American Si didn't exist for model year 1998,Honda
"Imo they both look great! I think that having different colors would be better unless you find one color that to you just looks so much better than every other option. I personally also have a black 5g prelude and I’ve been wanting to get it a different color since it gets dirty so easily. Black looks so good, but if I am not washing it every week it just looks dirty. But I do think that the red looks great on your integra. Personally, I’d probably go with a blue on the prelude, and repaint the integra red.",Honda
Yes I have How Can I share?,Honda
It's beautiful is what it is,Honda
"I almost got the green, but my dealer ended up getting a batch of 2024s while the 2023 I ordered was still two weeks out",Honda
"It depends on your situation, for me here is where I am coming from. The non-hybrids use a turbo. IMO I don't like them simply because they put excessive wear on the engine, are not fuel efficient unless you drive like an old person and make it more difficult to do repairs (having to take the turbo and exhaust off to replace the water pump is asinine). This is from what I have been seeing with the last gen Accord, did they fix this on the current gen, I hope but I wouldn't think so.

The hybrid doesn't use the turbo but is not ideal for me. I don't drive over 7000 miles on my car a year and do keep my cars for over 10 years (currently have a 07 TSX with 125k miles). So battery replacement just because of age doesn't make sense to me.",Honda
I use the same and it works perfectly for me.,Honda
I saw that the other day. It’s PA… home of lifted Hondas and foxbody mustangs…,Honda
"I like it! It’s not a big motorcycle, just a groovy little motor bike!",Honda
Then you can be pissed off with your friends.,Honda
Slick!!!! ,Honda
"Somebody did build an AWD Type R.... Thing is Crazy!!

https://www.youtube.com/watch?v=qTDKglvnpqA",Honda
such a kid tlaking about eat me,Honda
"Unfortunately the original engine fell victim to whatever recall had to do with cracks in the cylinder walls or something, but that block still made an impressive effort",Honda
"I had the same thing on a 2010 CRV auto. After a bit of research I had a mechanic change the transmission fluid. This sorted it out - super smooth now. If/when you do it, you'll need 3 times the amount of fluid as you have to flush it through completely at least twice. Fill it up, run it briefly, drain it. Do this twice then fill a final time.",Honda
"i didn’t have the right, i made a judgement call, but i dont think borderline vandalism and obstructing my view of the road is the correct response to a situation that would have resolved itself if he just chilled out for a couple more minutes",Honda
Beautiful!,Honda
"It’s still the same they just added more speakers 

More speakers = more better = premium",Honda
You're gonna need a few different parts bud take it to a mechanic😂,Honda
So surprising to hear a jeep has lasted so long. Hows maintenance costs been on it?,Honda
"2024 Civic Hatchback Sport Touring as a daily 

Audi A4 Quattro 2013 as weekend car",Honda
"None of us know your financial situation. I did a quick autotrader search, and around me, 2018-2019's with similar mileage are $20-22K. So what you found isn't out of line.",Honda
"1996 Prelude, 2006 Element here.  Blows my mind to realize the Element is closer in time now to the Prelude than it is to present day; it was always my newer one.",Honda
People say that because pre covid automatic Civics of that era were basically cheap parts cars. Prices have gone up in recent years. But if that was a manual it would have sold for 4k no problem. ,Honda
"Same, my 2009 just rolled over 127k..",Honda
"You asking if they tried driving around with the hood open?  It's a bold strategy Cotton, let's see if it pays off for em...",Honda
It's Pee Wee Hermans.,Honda
"absolutely more than $150 in parts.  the fluids might be $150 alone.. might be cheaper, but add in pads and rotors and it's well over $150.

but I get it, you buy cheap parts, so yeah, it could be done cheaper",Honda
I don’t but my boss does. The car belongs to the shop I work at. It gets used like a farm truck.,Honda
are you dumb i wasn’t talking about the guy who answered me im responding to the user gunk who replied when no one responded to him so you can shut up as well,Honda
Cant go to an off market because the kind of Honda Accord it is I would need to go to the dealer dang thats what the muffler shop told me,Honda
Do you know why this would only happen once every few months and why it would drive perfectly fine otherwise. Also would this give me a check engine light cause I don’t have one.,Honda
That poor rubber duck.,Honda
"Im not certain of that as well. But from Yt what I got to know, cvt is not that bad, if you maintain your car, it will run perfectly",Honda
Intake boot,Honda
I wonder if Jeep guys drool over RHD Jeeps that are used for mail delivery? Silly.,Honda
"21 Passport Elite, 22 Accord EX-L.",Honda
What a real piece of shit. I love it.,Honda
"Mopeds have a motor…and pedals, hence the name btw. It’s a scooter",Honda
"
>I have been reading online that the HR-V Sport AWD should have 4-5 drive modes (Normal, ECON, Sport, Snow, Tow).

Where did you read this?

>Is this true? When changing my drive mode on my new 2024 HR-V (300 miles on it), I only see normal, snow and econ. Just making sure I have my information correct. 

Have you looked through your vehicle owner's manual?",Honda
