Comments,Make
"You need to reset the battery management system.  If the battery has been in place for more than a year, don't fully reset it. (I'll explain this in a moment) You only want the car to re-learn state of charge. What you do is turn the ignition on but don't start the engine (hold the engine start button down without stepping on the brake until all the warning lights come on on the dash.) Then, you unplug the battery management system sensor- this is the little black box with a plug on it attached to the negative battery terminal. You unplug that plug for at least 10 seconds, I go for 30 seconds. Then, switch the ignition off, close the car doors and hood, lock the car, and let it sit undisturbed for at least 4-6 hours. This will force the car to re-learn state of charge.

The full BMS reset is what you SHOULD have done when you originally installed the battery. Normally, this is done through VIDA (or a professional level bi-directional scanner) and if you have VIDA and a suitable interface (DiCE or a J2534 tool) or bi-scanner, use that method. If you don't, [here's a link](https://youtu.be/iu9z5m78Szw?si=Eqn5OBzQ02bZjFtm) to a YouTube video showing you how to do this without a scan tool or VIDA. Please note that you will get no visual confirmation of the reset on older vehicles with an analog instrument cluster (2013 and down) Only the TFT clusters tell you the BMS was reset.

Only do a full reset if the battery has just been replaced with a brand new one in the last few months, otherwise, you can cause the car to constantly overcharge the battery which will damage it.",Volvo
How much was the repair with parts and work?,Volvo
"You can’t replace quarter panels? Weird. I just replaced one yesterday.

Guess I’ve been doing it wrong this whole time",Volvo
I disagree. Your own two paragraphs contradict each other.,Volvo
"Allright, i feel like older Volvos had lots of differences in the packages :) my dad has a newer volvo v90 and i have an older volvo s80 and he has a more premium package than me but his feels less ”luxury” tho he have a lot of tech in his car that i don’t have.

Edit: inscription is supposed to be the most premium package right? so thats nice :)",Volvo
Oil separator/breather and fuel pressure sensor came in just shy of my $1000 guess,Volvo
Haha I’ll just be over here hitting triple digits in my R-Design every time I get on the highway.,Volvo
ipdusa.com,Volvo
"The 2012-2017 V60's has some of the nicest rears I've ever seen on cars.

And I especially love the 2016-2017 ones, for some reason, they are more well sculpted",Volvo
"They put more emphasis on safety than the other german cars, you can see it on the euroncap ratings and surveys in Germany.

Also the Mercedes S-class has been the de facto leader and benchmark in most things in cars since it was released in the 50s. 

It had adaptive cruise control and lane steering in the 2000s for example, before anyone else. It could almost drive itself before Tesla was even started. 

There’s was a saying that was true for a long while, ”If you want to see what tech future normal cars will have in 10 years, look at the Mercedes S-class today.” 

However, that might’ve changed with Tesla entering the market.",Volvo
Yes it its heavier with the battery. The MY22 or if it’s MY23 with upgraded battery is a huge improvement. Extending the range on electric drive and I think more torque to the ERAD. I love the color.,Volvo
Don’t worry I read your first post that it’s a dealer photo similar to your car and you made edits on your phone. Didn’t see anywhere where you said you removed your rear badging.,Volvo
"On the SUV side, Lexus NX. Saloon, ES for the S90. The brand that values comfort and reliability over sportiness. I think most Volvo people would consider a Lexus.",Volvo
 As a Volvo owner and driver… in a parking lot like that. Is there any other way to park?!? LOL,Volvo
"Even then, the car structure is compromised and it’s not safe to drive. Might look totally fine, but I wouldn’t set foot in the car.",Volvo
"Oops, yep, EX30!",Volvo
"They value safety, don’t mind being a little different and like comfortable style.",Volvo
"Yes, likewise! I’m going to start pushing now on sales price and getting multiple dealers on it. Still a little fuzzy on the three months issue, but seems like you can do it earlier, just not through the dealer directly. I will keep you posted!",Volvo
I'm not opposed bahaha,Volvo
Looks like a runflat to me considering that sidewall looks so rigid. I’ve never seen anything like this before but the RFTs on my BMW were terrible with getting bubbles from potholes. The roads in NY are terrible. I’m a pretty careful driver but I still hit them occasionally at night. My tire package I got from the dealer paid for itself in about 18 months after replacing 4/5 tires due to bubbles. If these are RFTs I would be willing to bet the failure had something to do with hitting a hole in the past and compromising the integrity of the tire.,Volvo
"I had a flat last year. I was on a highway around 120km/h and stopped like 1km after the tpms alert. The tire was severely damaged and I did need to replace it. I believe if I drove for more 1 or 2km with it in flat condition it would be like yours. As said, these low profile tires combined with not precise enough TPMS are a pain.",Volvo
I wouldn't use it on winding roads or roundabouts. It's  very good on motorways though.,Volvo
I call 🧢 I have a ‘24 and I may get 19 to 25 mpg,Volvo
We had a 1999 S80 that literally saved my life in 2004.,Volvo
Got a 2010 c70 - definitely does this.,Volvo
"Very standard here in eu to have even smaller tanks my V90 has a 60L tank (i thinks thats like 15,2gallon)",Volvo
Sounds like EC40 is the one you like.,Volvo
Dude an 850??? Lucky bastard..,Volvo
"Pretty sure it is 3.2, it's a 240hp",Volvo
Lulz,Volvo
I fill up my V60CC twice a week and average 31. Shell or Costco premium only.,Volvo
"My last two cars were Volvos, but I can’t say that my next will be. I think the looks are fine, but omg something different needs to be done with the interior. I know no one likes screens, but toss in a bigger one, retool the dashboard… do *something* to keep it “current.”",Volvo
"If you use properly weighted full synthetic oil then 10,000 miles is a perfectly adequate interval.  Just check it periodically to make sure it’s not low.",Volvo
Barely. ,Volvo
Oil change and software.,Volvo
You can look at orbit software on your computer and you can “unlock” polestar mode. That’s what I’ve done and costs about $200. Not sure if this fully optimizes the car though or just a transmission remap.,Volvo
"XC90 is amazing with kids-I’ve been driving one since 2018(then traded that one for a blonde interior 2021) , using the all weather/rubber floor mats and the interior has held up really really well.  I have 2 kids and 2 golden retrievers and I even took them all on a 30 day cross country road trip in it last summer.  Don’t let fear of the interior & kids stop you!",Volvo
What is the cars GVW?,Volvo
"I use it everywhere. 
If it can see the lines it’s pretty close to flawless.",Volvo
"I did an immediate lease buyout on my Fusion Energi PHEV because it was a $35k car. Lessor took the federal incentive off the value, making it a $15k residual. Lease was $300 a month, $0 down. So my total OTD was \~$27k.",Volvo
you can get tire and wheel coverage through most insurance plans dirt cheap.  don't buy the warranty,Volvo
is the carpet glued down or just pushed in with clips? Do you know anyone who has done this to their Volvo V60?,Volvo
"The packaging of Volvo cars and the quality of options rivals the other makes. To get the quality of leather, top-of-the-line sound system, passenger memory seats, one would need to buy the highest special trims of Audi, MB, etc.

And the plug-in hybrids of Volvo are mature and refined. I keep seeing YouTube videos praising the V60s and S60s, particularly the polestar variants.

We have a loaded 2022 V60 CC and are at the end of the term…I’m seriously considering the 2025 V60 Polestar…

Sure the screens are smaller, but the voice control of Google and built-in assistant are top notch. I don’t need a stupid AI or a “hey Volvo” gimmick that activates sporadically.

The exterior designs are still fresh. Yes, they’re a bit long in the tooth, but I think Volvo is still a solid alternative to the Germans.",Volvo
"2022 S60. I fill it up at around 400 miles. Getting 31 mpg on average. Usually half highway, half local roads.",Volvo
"First things first, the [two piece motor mounts ](https://freeimage.host/i/JjxYZdl) have to go",Volvo
"The timing belt was done at 118,000 miles in 2020. The car has been sitting for a bit. What I have heard the guy had 6 or so other Volvos and this s60r was one out of the 3 he had.",Volvo
"Especially when buying a used one.

What a statement.",Volvo
Not sure if you are joking or not,Volvo
My 2012 P3 has it,Volvo
My coworker said i give “rich single auntie vibes” in my xc60. I’m a guy but I can’t disagree with her,Volvo
Don’t show my bf- he would be up with a trailer before sun sets,Volvo
Lolll,Volvo
"Still for some it's just a car. I would focus almost entirely on safety which Volvo provides, how safe that car is going to be, etc etc. Wifes are really caring about kids and would definitely want more safer car",Volvo
I feel it. Yea it’s a beauty.,Volvo
Subscribe might be a better deal and you still have buy out options…,Volvo
Never.,Volvo
The V90 will be an order of magnitude better than your wrangler. I’ll take either of my Volvos through a blizzard over my Yukon. The only benefit to the truck is ground clearance. Since that won’t be an issue on your drive you’ll be fine. You’ll be shocked at how good it is in the snow.,Volvo
Chip boxes are always crap because they manipuluate values and lie to your control units....if you want a reliable (Power and sustainable) you have to do a map optimiziation.,Volvo
"One or two are threaded but on the HIB side, not the rotor. Unfortunately nothing in a manner that would act as a puller. That being said, taking the nuclear bomb approach is not out of the question; only needs to fire once. Drilling two 3/8-20 symmetrically to press the rotor out is not out of the question.",Volvo
"I have a Volvo c30 and got a Mazda cx-30 after driving the 3 and the cx-3 6 months a go. I really like the styling and handling of the mazdas as well as the interior in upper trims like my premium. I see cx-5 all the time around me and it's not unique nor is the Subaru Forester my girlfriend has but if I were in OPs position I'd seriously consider a well spec'd AWD Mazda cx-90 with a turbo, premium options and just add a few accessories or partial wrap to make it really unique if that's your thing. The new cx-50 is super appealing too if you're into the off-road and more manly look without needing more than 5 seats.",Volvo
"The Sanus(?) system in your car has been completely replaced with an Android based system that better ingrates into the dash. It was released a bit prematurely, but most the issues have been resolved by my understanding.

Considering how far behind some makers interiors on, this comment confused me, then I went to look at the Audi's current interior and was seriously underwhelmed. Hey AI, draw me a generic european car dashboard from 2010 -> Audi's current interior. The Audi doesn't have the generic short narrow center dash screen thats the current trend, but I see that as a plus.",Volvo
Could I just leave those speakers out and upgrade the 10 speakers my system came with?,Volvo
The new ones work so smooth you don’t even feel the engine switch,Volvo
"2020 S60 T6 and I get 23mpg combined, I only use premium. Unfortunately 95% of gas stations around me only have 93 premium, 91 octane is hard to find in CT.",Volvo
"The car will actually tell you or even take action on old fuel in the tank. [See here. ](https://www.volvocars.com/en-om/support/car/xc60-twin-engine/article/87adf7bc88f82e16c0a8015177252eaf)

If the quality is really bad the car will not only warn you but will force start the engine to consume the fuel. 

Btw my average long term consumption for my XC60 T8 is 32mpg, due to a lot of long trips.",Volvo
"But the interior quality in Audi is shit. Same cheap plastic feeling as many VW, Skoda and Seat (and same parts where you can't see).

A Volvo at least feels like it's going to last when it comes to the interior.",Volvo
If its anything like the haldex in my xc70 then its not great. Haldex fluid couplings arent a big fan.,Volvo
Wonderful cars !,Volvo
That's a feature not a bug. they are constantly learning and adjusting to the drivers tendencies,Volvo
"Oh okay that makes perfect sense! Definitely makes me feel dumb 🤣 not a car person at all, but it does have a roof rack! Thank you!! 😊",Volvo
"With the sport kit you’re lucky, aw55 tf80 or m66",Volvo
I considered Alfa Romeo! Glad to have landed with this S60 though 🙏🏼,Volvo
Yes all of those years have usb ports (usually in the middle console) that you can plug your phone in to to play music,Volvo
"Ya, they were fine before",Volvo
Congratulations!,Volvo
Because it’s not a wagon! All jokes aside that thing is very nice! Super low Kms too. I’d love an 850 but personally would go for the wagon if I had the opportunity,Volvo
For phones ya!,Volvo
Yeah seriously. What I love about my XC90 is you can make Home Depot runs (throw your dog in for the adventure even) but then spend a little time cleaning it up and it can hold its own against most luxury SUVs. It’s luxury enough but not so much so you feel like you have to baby it.,Volvo
There isn’t a single certified pre owned V90 within 500 miles of me. Makes me sad,Volvo
"2004 S60R with a bunch of miles on it... The car says that it gets an average of 22MPG, and a manual calculation says about 20MPG. I have a long commute, so I fill it about twice weekly with the required 91 (US) octane premium.",Volvo
Same,Volvo
"Well that makes me feel a bit better, ha. At least glad they didnt put the whole gear shift into knob form like some of these companies are doing.",Volvo
Got a really good deal when I got my 2019 s60 but window sticker had it as a $1300  add on which is definitely not worth it lol,Volvo
I feel like a lot of people in this thread have never owned a brick so they don't understand just how head and shoulders above everything else they were.,Volvo
In what unit of measurement do tires run 220?,Volvo
"The safety thing is really just some of the best marketing to ever exist. Volvos aren’t the safest cars on the road, but everyone coincides car safety with Volvo because of a generations-old ad campaign. It’s truly remarkable.

[IIHS 2024 Safety Ratings](https://www.iihs.org/ratings/top-safety-picks)",Volvo
"i keep my s60 above half, so i’m filling up every two weeks.",Volvo
I’d buy it if it was within striking distance of San Diego,Volvo
2020 s60,Volvo
MAF sensor. I had the same issue with my S60 T6.,Volvo
"My 82 240 DL had to be retired at 457k, and it was due to frame rust. It still ran fine. Sad day. If you maintain it, that is a car that will go for a long time.",Volvo
"It is of course possible.

You’re gonna have to remove all current gas equipment and the three tanks. Remove your current exhaust. Then get the normal 70l tank along with a normal exhaust.

You’ll also have to extend cables to the gas pump since they are too short.",Volvo
AAOS and the loss of features is going to prevent me from buying another new Volvo.,Volvo
Are XC40 tyres more expensive than for the V60 for example?,Volvo
"For sure. The T5 and the 2.5T that I had before the R were definitely more fun to drive in the manual mode, but that trans was dog water. 

I’m babying the TF-80 so I’m not “forced” to do a manual swap haha",Volvo
"Yes I switch from 2018 A4 wagon to 2021 V60 to 2024 V60. The 2024 V60 had the best infotainment overall, but the 2018 Audi much better than Senus. But the one thing Audi gets right (and VW) and nobody else does is the customization of the gauge cluster with the full screen map. And what’s wild is that you can get full screen maps on the Polestar brand interface which is virtually identical otherwise to Volvo. I just want full screen maps back.",Volvo
"You can’t just replace one tire? Wouldn’t that mean your other ones were due for replacement anyway? 

I’ve never had a problem replacing just one tire on any of my 330 x-drive and I know for damn sure that dealership would do anything to make an extra buck lol. I have always had the tire package too that covers replacement.",Volvo
I mean there are a couple more things but nothing significant,Volvo
"2018 XC90 Polestar, app shows 16MPG but it was just in the shop and I think they drove it pretty hard. Still better than our Jeep 😭",Volvo
Is there a particular car you'd want to discuss this about?,Volvo
I just showed my wife the safety ratings and now I’m on Volvo #3,Volvo
S70 is better,Volvo
"P2 s60r/v70r and the other early R design models, correct me if I am wrong",Volvo
I have it now since a month on my 2018 XC60 T8 and love it. Cost me 995€ with the owners package (apparently that’s not always included) and it’s noticeable in all modes that’s correct.,Volvo
They taught me to use low gears when driving downhill for long distances (mountain roads) to avoid brake fatigue. That’s how I have been using the manual setting of my auto cars so far,Volvo
Aren’t we all! Lol,Volvo
I'm happy to see other Volvos... but I'm ok with an empty space in between.,Volvo
Love how the paint still shines. And knowing it will look like new if buffed out. One thing that always got me was how the paint lasts so long.,Volvo
Ayo man do you ship to Italy 🥹?,Volvo
"I’ve been driving automatics for work for the past 6 years or so, averaging 100k miles a year. All of them the manual feature. Never used it once",Volvo
Ahhh that sounds very nice!!,Volvo
"This actually calmed down my nerves. 

Seeing the same numbers on my 2019 S60 with T6. Have close to 40k miles on it.",Volvo
"Just to be on the safe side I have to ask, parking brake is off?",Volvo
Exactly ! I’ve never mistakingly turned it with anything 🤷🏻‍♂️ I like where it is.,Volvo
"That it is, but the T5 and 2.5T are two different engines. T5 has 250hp and 2.5T has 210hp.🙂",Volvo
"Heh, are you kidding? That's it?",Volvo
"Only up to the 30k which is included with the car, Volvo will pull warranty in cases of clear neglect (20k no oil change) but after the 30k service there’s no reason to continue bringing it to them unless you have a service contract, recall or need a software update.  If your Indy shop reports to car fax and shows up to date maintenance Volvo can see the car wasn’t neglected.",Volvo
"Those new cloth interiors are pretty unique, TBH. If I didn't have a dog I'd buy one right now.",Volvo
And last time they replaced the light?,Volvo
"Right? With 9 feet/2.7 metres from glove box to tailgate, I could haul everything from full axles, to steering racks, possibly even whole engines. (suddenly very glad there's fuck all for scrap yards near me, or else I'd be hoarding parts 😂)",Volvo
"It' not a so. It's a friggin' screw.

Sorry about that. 

Have you contacted your insurance?",Volvo
"Subaru is playing a dangerous game where they don't recommend to flush the CVT fluid - it is deemed to be lifetime fluid. but in US only.

As a consequence they charge you $8K for a CVT replacement. You can see countless people have to replace them in close to 100K range. So I doubt CVT will outlive the high quality autos that Volvo has.

Perhaps Japanese electronics will outlive Volvo's electronics, and with all the potential repairs sans the CVT you'd be better of with Subaru, but CVT can cost you a lot.",Volvo
"I thought abt doing that too, but I have too many rock chips on the front of the car 🥲",Volvo
"Gotcha, sounds like a trip to the garage already then!",Volvo
Haha he would eat my d4 tractor!,Volvo
Agreed.  The lack of TPMS feels like cost cutting.  I’d rather have real-time pressures.  I’ve had 18 psi before and not throw any tpms alert.,Volvo
That was 2 years ago but I think they have them regularly. Just have to dig for it. Local dealer had no clue about it,Volvo
"La car company doesn’t build reliable vehicles by jumping to the newest/greatest techs; it’s all about  minor changes along the way while perfecting what you have. If you think Volvo is boring look at Lexus and Toyota. If the lineup is the same for Volvo in 2025, does this mean the v60 recharge will remain???",Volvo
"Some people are just comfortable with what they like and what they know that the change will just be too overwhelming for them. It’s like introducing a Mac user to Windows.. also, no one does Safety like Volvo",Volvo
"Can't insult the Polestar! 🤣  
I do love this sub but I've never seen a group of enthusiasts down vote each other as much as this sub does.   
I've actually been downvoted for saying ""I like Sedans more then Wagons""... By multiple people. I don't get it. I don't give AF... But I don't get it.   
I never DV anyone here unless they're straight up being a dick or double down on something that is blatantly wrong.   
In fact, I just got 2 DVs in this thread saying Ford doesn't own Mountune. They don't . They never have. 🤷‍♂️",Volvo
Ok. Help me out. So you get 1k miles on a tank of gas?,Volvo
My 2012 S60 T6 was total and it was only body damage to it. Major dents and scratches along the side. (Probably caused mechanical issues) but insurance decided it was better to total it. (They had told me the biggest cause of the totaling of it was because of the body damage),Volvo
It’s a sensor to monitor your swedeness and temperature of the cabin.,Volvo
Like the lights and the wheels. Exhaust looks like it belongs on a Honda. Mudflaps really look out of place.,Volvo
"2016 xc90 T6. Got a running lean code, now doing 14.4mpg. Used to do 21.5mpg, 50/50 highway/city. Taking it to the dealer this week, hope it’s just a bad o2 sensor or dirty MAF.",Volvo
"Generally my experience is with the older generations haldex systems but the P2 platform and onwards is rather advanced. The system continuously calculates the need for torque to the rear wheels, and can immediately redistribute up to half of the motor's torque to the rear wheels. Under regular driving the system is a front wheel drive bias system for better economy and predictable handling. The system can be seen on YouTube using rollers to test traction/load differences",Volvo
"Yep, unless there’s something wrong with it, the transmission should shift by itself at the appropriate time when in drive.",Volvo
"Disagree about Tesla changing much at all. The E-class and EQS has the only L3 autonomous system that exists in any production car. The Tesla has… *barely* a L2 system that they’re pretending is L3 (or even L4).

At this point IMO Tesla is no longer at the front of the pack when it comes to ADAS and autonomy generally.",Volvo
Hahaha I wish the xc40 could be my first car! I mean I’m not planning on buying my own car anytime soon so who knows👀,Volvo
"The first one is the closest to OEM spec. Expect it to be brighter than your old bulbs, as Xenon’s fade after a while. Night breaker will be a little brighter, the cool blue is for looks, I’d skip that one!",Volvo
"Thank you, I agree, I would love the pilot.   But I am feeling really stubborn about getting into hybrid.  They don’t seem to have one confirmed for their line up yet.",Volvo
"Yes I have the styling kit on my car. Everything in this photo is the exact same besides the charge port door and not having fog lights. Unfortunately my car only has the H/K sound system, which is plenty good for my ears. After playing around with settings in my Spotify app and the car it sounds good enough for me.",Volvo
EX30?,Volvo
"https://accessories.volvocars.com/en-ca/XC90(16-)/Accessories/Document/VCC-515671   
I think so. Call your dealer.  
What year?",Volvo
I hope it says that after decades of driving I have absolutely no confidence in the ability or decision making of other drivers and short of buying a dump truck a Volvo was my next best option for safety.,Volvo
"2.4L 168HP Non-Turbo 5 Cylinder engine is on the 95 850 GLT. (USA spec)

 Its a great engine for mpg's. Won't win any races, but it'll get you where you need to go.",Volvo
Link to the article/website please? Curious about V60 Polestar specs in US,Volvo
Classy is knowing how to spend your money wisely.  Avoiding depreciation and running a car for 5+ years is easily way classier than shiny new every 2-3 years.,Volvo
"Beautiful, welcome to the shitbox club!",Volvo
I get about 34 mpg on my D5 V70 from 2002 yearly average. I fill up about every 600 miles so 2 to 4 times a month on average.,Volvo
Screen name checks out,Volvo
I’m especially surprised that my car wasn’t as damaged as the Charger. That S60 was built like a tank and never failed me *once*. There is no way that I’m leaving Volvo after this.,Volvo
beck yeah!!,Volvo
"I ignore the miles remaining.  It calculates off very recent MPG and fluctuates a lot. 

I just fill up around 1/4 tank.

I get around 26mpg in mine with mostly city driving.",Volvo
