Comments,Make
It’s definitely not happy. I’ve never seen one in person until now. Interesting oil filter placement.,Honda
"https://www.civic11forum.com/threads/2023-civic-sport-rattle-noise-on-reverse-only-dealership-cant-figure-it-out-as-it-comes-and-goes.6212/


Here’s a link to what it sounds like",Honda
That front bumper is soooo f goood!,Honda
My Mistake. The inline was through 2006. I didn't notice the 15' until you said that. Did a double take. My apologies,Honda
I think the that’s this clear one in the picture with a blue wire and a white wire in one side and then the orange and black in the other. I’m just not sure which side I Shoukd jump since there’s something plugged into it already,Honda
"*chefs kiss* Fuckin looooove the mentality, mah dude. May all your miles make you happy! =)",Honda
"These were in 1992-1995 Civic VX, only came as a hatchback.",Honda
"Check your AC evaporator drain under the car. If it’s not draining properly, water will stagnate in the evaporator housing causing the smell.",Honda
"Hiding small things. Acorns. Cash. Change. Drugs. A lighter. I think it's probably actually there for change for tolls, but even Honda doesn't specify. 



My 2013 has a larger open spot and a door on the larger upper center console compartment. I put anything I need to reach while driving in there.

[20240322-095107.jpg](https://postimg.cc/mPS4LdyH)",Honda
Refer to your vehicle's owner manual.,Honda
Quite different OkT. That’s public. This ain’t. But whatevs.,Honda
"Asian versions where Acura isn’t sold has them too on the CR-V at least. They’ve gone cheap in general. Out Sport Touring CR-V doesn’t have figlights, HUD, ventilated seats, rear heated seats, pano sunroof, home link mirror, folding side mirrors 360 cam etc. Our 22 Accord Touring has 80% of that.",Honda
I wont use the chap stick in that dirty ass car 😁,Honda
Congrats. This style of Honda is my choice for a next car.,Honda
" It's called Deep Amethyst Pearl, they only made it for 96-97 hatches.",Honda
Well thats concerning....I figured most shops would be willing to charge for as many services as possible to make as much money as possible. Why wouldnt they do it?,Honda
"We make sure it runs. We do the oil changes, we buy new tires, we replace parts as needed but we have more important things to do besides clean a car",Honda
"Funny, this guy  has 770k miles on his 2017 1.5T civic. 

https://youtu.be/p8t1WXrVmUU?si=HQdblrOWZE8elAwL

But I guess this isn’t possible according to people who have never owned a 1.5T 🥴",Honda
"You might want to look into the insurance available for a car with a title like this to see if that meets your needs, too.",Honda
I would not use anti seize on these.  Just install them dry- no oil or grease or anything on the threads,Honda
"My 2012 Fit has done this, and it was a bad spark plug.",Honda
"Yeah, been using it for years. I’m talking 8-10 maybe. I dunno, time flies. They have a few gimmicks here and there but everything has always worked great for me. Never had an issue, always get good results. I’d try it out and see what you think!",Honda
Replace the battery first. It could pass the load test but not enough juice to start the car.,Honda
"Good to know, thank you!",Honda
"Some people are salty, but I like the grading system",Honda
"Taking pictures of a customer’s vehicle and posting on Reddit with permission, I assume?",Honda
There’s nothing more family friendly than a four door hatchback haha,Honda
"From the ones I’ve seen, I think it may be a manufacturing error with the gaskets, because I’ve had some replacement gaskets leak even, like they are slightly porous or something (what my manager seems to think, visually I never felt or saw a good reason for the gasket to fail).",Honda
"Take it to a local shop that isn't the dealer and get their assessment. 

A local place replaced the ps fluid and some o-rings on the pump in my 2006 Pilot when the steering got heavy. $150. The dealer wanted to just replace everything, including the steering rack, for more than I paid for the car. I consider that a ""fuck you, we don't want your business"" quote.",Honda
"this was not my car, it was my friends car so what im going to say might not be exact. He drove primarily highway miles as he was a courier. he did add a fuel additive every now and then. Id say the consistent fuel mileage was due to the highway miles than the fuel additive tbh.",Honda
That kicks ass man!!,Honda
But won't fix every flat,Honda
Yeah exactly. He said something about it sealed transmission being built to last lifetime of the vehicle which I read up online was false. I think he just didnt want his shop to have liability in case anything went wrong.,Honda
"2002 S2k, 2021 CRV sport, 2006 Accord V6 hybrid,  2005 Ruckus,  2016 lawnmower,  2010 Tiller.",Honda
"v6 accord coupe, 6 speed? thas fire tbh, try negotiate if possible.",Honda
Very impressive,Honda
"I live in a very small state, I've seen less than 10 others on the road since I bought mine about 2 years ago. Always get excited and wave when I see another one drive by!",Honda
"Looks dope! wondering what brand you used im considering using it on my 08 accord just afraid to drill through my roof, as i wouldn't really wanna drill through my roof so i'm trying to find one that won't damage my roof",Honda
Pimp tht shit!!!,Honda
"personally, i considered it battle scars and leave them be",Honda
"Activ pressure washer with foam cannon. Meguiars because it’s readily available, but will try different soaps based on friends recommendations. Turtle wax ceramic spray shine because it easy to apply and lasts a while.",Honda
Yea,Honda
"$17,000.  A lot for a 10 year old Honda but this is a special case I'd say.  It's right at the top of the blue book scale and I think it's worth it.

Considering possibly a K Tune and J-pipe as those seem like unobtrusive and effecive performance upgrades.  Maybe a stiffer rear sway bar.  Maybe nothing though, it drives great as is.",Honda
wow that's impressive I'd like to see your car after this.,Honda
"You’ll be fine on the size. For reference, [here](https://imgur.com/a/TRILLs0) is my 100 lb (sedated) dog in the backseat of mine. My husband is 6’6” and both my kids are 5’11”. The 4 of us ride in it comfortably.",Honda
Damn. You still got paint on your car? Jealous.,Honda
Gives me hope for my 09 accord with 200k,Honda
I love that car color,Honda
"Daaaaaamn!  I wonder what dealer markup is on those! I bet its got Sparco's in all 3 rows. 

I'm sure this person is just trying to be funny.  But...I never understood the ones who put ""upgrade"" decals on their vehicles with the legit intention of trying to fool people.  You immediately lose all credibility in everything -- like that $90 G-Shock you're wearing is also probably fake.",Honda
"My bad, give me a minute.

Edit: [I added a couple of pictures.](https://imgur.com/a/uR3JuUh) Please excuse my coworker. Word got around and now everyone is looking at it.",Honda
What if we domy have friends? 🥲,Honda
"Car leasing getting common these days, and I was offered the same, but it depends on the mileage I would say, if you're driving more than that, I think you have to pay 8-12 cents per km",Honda
Lol I wish the CRZ was as cool as a CRX and as light as a Miata,Honda
"I had an EG Si, same color, and it was either engine swap, or sell… I chose sell 😞 that was in 2008. I miss that car",Honda
"What does your manual / gas label say?

Do that. Forget what your friend is saying.",Honda
"Interesting I did not have that problem at Serra Honda in Akron, OH. However they did also tell me that this was the first time they've installed on a new civic (at least these workers). Tbh, you don't need the dealership to install them. I was under the impression that it required drilling but it's just a couple tools and clamps. Order the parts online, watch YouTube video and save yourself some money.",Honda
"i'd feel pretty good about driving this for a while. with solid preventative maintenance (tires, oil changes, air filter, brakes, atf fluid changes, coolant changes) it should take you places very reliably.  

components will start to get tired sometime beyond 150k and you can decide then if you want to keep driving the car. i have a honda (acura actually) at 200k miles right now and i'm looking at spending a couple grand on refreshing things and dealing with the small issues i've been living with. but after that i expect to drive the car for at least another 100k, provided nothing stupid or out of the ordinary happens.",Honda
Really? Most people on Reddit seem to hate their products. I have a whole bucket I got from the holidays but I’ve yet to touch any of it. I’ll have to give them a try next time I wash the whip!,Honda
If you go into my profile I have a landcruiser. The oldest post is right after I did my own paint correction on it. The paint was very dull before. You can tell how shiny it was after. I used all the chemical guys compounds to bring it back to life. Same with my civic I have. It was also dull before. Both original 35 year old paint.,Honda
I have fog light on my 24 civic touring. One of the reasons I bought it as I like the look,Honda
You should be able to put a Type R badge on an Odyssey no matter what. They’re just that good,Honda
It would be for a show car,Honda
Meguiar’s,Honda
Join us over on r/CRZ !!!,Honda
"Asked for the price, but it isn’t for sale. So yes, mark up is pretty high I guess.",Honda
"Ohh, how do I check the codes for that? I don’t know anything about cars sorry. Also a few months ago there was a screw in my car and when I showed the auto shop he told me I couldn’t drive more then 30 mins or it’d pop and told me I should just pay the $309 for a new tire.. I said im good and have been driving it for over 3 months now with no issue. The screw thing is still in my back right tire. Could that possibly cause it or no? Although if it did wouldn’t my tire just go flat or something which it hasn’t? Or would checking all the air and adding air in help or no",Honda
Well it's clearly not an Ass....,Honda
"Yes they played you. I took my accord for a diagnosis and honda tried telling me my brakes were dangerously low and I needed a break flush. They lied. What they didn't know was my bf is a mechanic. We got new breaks and went to change them out...  the ""dangerously"" low breaks weren't even halfway. 

They try to take you for these in hopes you grab.",Honda
"hitch mounts are so much better IMO.  they're easily removable, so you don't really have to drive around with them all the time.  i would guess they have to at least affect your gas mileage a little bit. 

plus its so much easier getting a bike on/off.  no wheel removal required. plus having the hitch is awesome, you can tow a trailer.  i mean obv not a big one, but i'm sure a civic could handle anything up to the size of a jet ski or small utility trailer",Honda
He would 100% spend more than it’s worth to fix the rust lol,Honda
"Wow, okay. They also said my front brakes might be due soon but I only opted for the rear since they said those are more urgent. Said it would be $750 for both",Honda
Thats 3 cars bud,Honda
"This video was a little different from the other ones I’ve seen. Will try, thank you!",Honda
"A brain, perhaps?",Honda
"I really like Meguiar's too.


I've tried a ton of Chemical Guys products, and I feel they're overpriced and just don't work for me for whatever reason.",Honda
"Youll need it to be engineered anyway. Unless youre on your p's it really shouldnt matter.

You only need an cert when the engine didnt cone in the car, this case k20 and k24 too. At least in vic thats how it works",Honda
"It takes time for the battery to charge. If all you do is short drives like I do, then the battery will never stay fully charged, so it's better to charge it sometimes. This does not mean that your battery and or alternator is bad.",Honda
Gotcha. And IIRC ABS problems make the ATTS stop working.,Honda
"Same rules:

No food whatsoever, not even gum, candy, mints, or anything else.

Bottled water only.

Each gets a microfiber cloth, and has thier sector of the car to wipe upon entry/exit.

They eat in MxDonald's, they ""ride"" in the car.",Honda
Thank you bro🙏,Honda
"Doesn’t mean it’s worth it, ever.",Honda
I actually like the oxy clean one that Oreilly had,Honda
"And you even kept the a/c, good man!",Honda
TOP. MEN.,Honda
"Yep! Out of a civic vx. My first Honda. Yanked it out in high school and swapped in a b16 turbo. Had lots of fun, but I’d love to have it back with the stock engine. Some guys get 50+ mpg out of them.",Honda
I thought it was gonna cost $2-$3 grand lol,Honda
"I've got a 2006 CRV, he drives an 07 Element.

We have a 93 Accord that we hope to revive one day.",Honda
9th gen looks good,Honda
My 2011 accord is at 167K!,Honda
"I agree, my s2k has the red ones. No I don't think it's a type r or anything. Just looks so much better than the cheap chrome looking ones imo",Honda
"You need a D16Y8 engine, accompanying ECU to match engine and transmission, additional wiring, and electrical connectors.",Honda
"Carbon roof is fucking nuts man, hatch looks great",Honda
What year CRV? Newer Honda have brake control that does not favor the front pads as much. Wear is more even front to back.,Honda
Nah. Any shop that recommends rocking a lifetime fluid is not a shop I’d go to. That’s the worst possible suggestion to give a customer.,Honda
Sadly the 2.0 is also kinda slow but I love the fuel efficiency and reliability. The car is also such a beauty. I would 100% also buy an HRV!,Honda
Flashing D is the transmission.,Honda
"No worries. Thank you. I got the single pedal drive working thanks to u/byedrive202. Now, I am 50% less worried. I played around the options to set the alert volume at max and Front collision avoidance sensitivity to max to no avail. Will pour through the manual today.",Honda
im at 177k in my 2013. even when transmission or engine tanks ill just have it rebuilt,Honda
I'm jelly. Nice pickup!,Honda
Galaxy Gray 2007 Civic Si Sedan and Sunset Orange Pearl 2005 Element EX,Honda
"Combo is a 2007 Honda accord 6-6 and a 2009 VW Rabbit 2.5l

I would prefer a rwd as second s2000, c5 or c6",Honda
I had one of these. I still wish I have it.,Honda
Cool but my lawnmower has more power,Honda
"TSX k24a2 and CL9 Accord K24a are the best ones. The next best bet is the crv, but anything but the tsx/cl9 k24 is gonna be a lot weaker and have less power",Honda
I'm clad I don't.,Honda
'14 RLX & '22 CR-V Hybrid is a good balance for me!,Honda
Nah the vape pen was already in the car long before the racks.,Honda
I’m just bored & seek dopamine to feed my adhd. Sorry you’re right. They may have overreacted.,Honda
"Good price, hard to find in good condition. I would definitely buy it. I have a 93 eg hatch and an s2000 so I'm biased ;)",Honda
😆,Honda
Mugen or rays wheels,Honda
a waste of a good crx. smh,Honda
Cool car. Not many survived. It's special. Don't fuck it up,Honda
Looks great. Do you park it on the street or have a garage?,Honda
Yes the price is fair. How much time would you have spent doing it yourself?,Honda
"
>1) Just found this out the hard way - I turned my car off with the push button start/stop, but I forgot to move it into park. The car turned off successfully but rolled forward as I was getting out of it. 

>I feel like there should be a safety that doesn’t let you do this?

It is a safety feature to be able to shut off the car even though the select lever is not in park. 

For example, when Toyota vehicles would keep accelerating even though the driver was pressing the brake pedal. Shutting off the engine would stop the car from going faster and causing a wreck.

[2009–2011 Toyota vehicle recalls](https://en.m.wikipedia.org/wiki/2009%E2%80%932011_Toyota_vehicle_recalls)",Honda
I'd keep it and pass it down to the kids. Those are a diamond in the rough.,Honda
Awesome is what it is,Honda
"Upholstery cleaner in a spray bottle diluted to whatever it says for the deep cleaners, then use a shop vac to get the liquid out.  Shop vacs have way more suction than a traditional deep cleaner and will happily pull fluids out of seats.  I love my shop vac for deep cleaning auto interiors.",Honda
I'm running underglow on my 2020 hatch. Absolutely love it.,Honda
might check that out. I‘ll try to slip in a mechanics schedule later today,Honda
"You should follow the maintenance minder for the majority of things.

Transmission IMO should be drained and filled (not flushed) every 30k miles. Brake fluid 3 years or 36k. Coolant is every 5 years 60k miles.

My 07 TSX while only has 125k miles, has the original transmission and original brake components. I just started replacing coolant items not because they failed but because they are getting around the mileage where they do. My radiator has not started leaking but a lot of the fins are flaking off just from age.",Honda
It’s a great vehicle! Transmissions can be bad so make sure there are no slips when changing gears.,Honda
Not yet,Honda
Call your insurance company.,Honda
I can agree with most of this. I wish they would make an awd in most of their vehicles. Could you imagine an awd Type R with more power or a V6 AWD Honda that could compete with the Supra or Z?,Honda
"03 Element, finished rebuild project 

13 P 981s Boxter",Honda
Civic goals tbh lol,Honda
"On a 3 year lease you won’t have to worry about the transmission. If there is an issue it would come after you turned the car in. So unless you end up financing the car at the end, you should have no concerns about the transmission for 36 months. It would also be covered under warranty for that time.",Honda
"For an suv, what do you think the RAV4 or the CR-V?",Honda
If i dont buy this car my life will never be good,Honda
Which products by them do you like the most? I can’t remember which ones I have out in the garage but I’ll have to check tomorrow lol,Honda
"CRV for the wife, hauling some stuff, and long trips.

VW GTI for fun stuff and because I like visiting the mechanic every 3 months.",Honda
"Well if it’s the SOHC, it’s the Canadian si. Dual cam in Canada is SIR.",Honda
Don't speed it's not a race car. Did you not test drive it before purchasing ?,Honda
"3 cars: 2020 Passport EX-L, 2004 Acura TSX 6mt, 2003 Honda Element 5mt awd.

Bonus: 2015 Honda Ruckus

Will be adding a 1990 CRX soon that is a family member's car.

If I had to pick only 2 I would probably go with the Passport and TSX.",Honda
He definitely didn't get permission,Honda
Oh yea mad. Yeah I'm only 30minutes south of it. Does he buy em and sell again or just buys em off ya for personal stuff?,Honda
"Yes. But also in this market, no.",Honda
"Thanks I should clarify, braking shake is all gone",Honda
Were u on the Oregon trail bud,Honda
"That would sell for $4k easy in my area. 

Y’all need to understand, its not 201x anymore. There are fewer and fewer cleaner examples like this nowadays, and they will become even more scarce over time.",Honda
"It’s a 6-6, he will get that. People love these cars.",Honda
You suggested ceramic pads.  They are trash.  Thats why they are cheap. They are harder than the rotors and destroy them. And they are noisy.,Honda
RETRO,Honda
"There it is. Yes, that makes good sense then. My best advice would be to go in, be open about your plans, make sure they review the numbers with you line by line, and see where you land. It’s hard to give even a range, let alone hard numbers without putting it all together. You should qualify for some kind of lease loyalty through Honda Financial. Sounds like you’re in a good position. Your payment will no doubt go up, but the Odyssey is a whole lot more vehicle. Most comfortable van I’ve ever driven.",Honda
Not an ashtray,Honda
These Type S Preludes are notoriously finicky when it comes to performance modding due to their torque vectoring system.,Honda
Air horn,Honda
"Griot’s Garage, ftw.",Honda
"Yeah, friend remembers the factoid that most turbo motors are designed to run higher octane fuel, just that this specific case (and many more modern engines) it isn’t true.

I’m curious what you mean about a tuned motor lasting longer. I’m curious how it could affect oil dilution.",Honda
"My idea is, as long as you’re cleaning your car, you’re doing more than some car owners lol",Honda
This looks very similar to the 2nd gen Acura TL,Honda
Have it inspected by a qualified mechanic. There may be damage that is not visible in just two images.,Honda
Nice! 90s Hondas are the best. I couldn't imagine ever selling my EG. I know if I did I would instantly regret it for the rest of my life. Such a great car. What engine were you going to swap in before you sold it?,Honda
All Honda's welcome. That's an awesome bike. I posted my lawnmower here so it's all good.,Honda
Now THAT is much more impressive than a 700k Honda that went 4-500k on the original engine before recall haha,Honda
Either learn to do it yourself or pay whatever you’re told by those that can.,Honda
"Unless you have a manual which the pilot didn't come in a manual, then there would be no reason to have a different engine for 4wd",Honda
"Once parts are available I'm sure they'll send out notices. Of the thousands of fuel pump recalls I've done over the years I've had 1 or 2 with an actual issue. They're being proactive, not reactive. This is me as a person talking, not me the technician - don't stress yourself out over this recall.",Honda
Small amount is fine.,Honda
I don't think I've ever seen one of those before. Looks pretty nice,Honda
Lol smfh.,Honda
"The problem is they’re very effective at stopping, but seem to wear quickly. I mostly seem to see it on 2.0t accords with the German pads",Honda
"yes, i illegally parked on his property for 5 minutes at 11 pm, doesn’t give him the right to superglue shit to my windshield",Honda
Stop being a child.,Honda
"not much, I got it up to maybe 60mph on a downhill. it’s only a 125cc with a 4spd so it’s not fast but it is a lil tractor of a bike",Honda
Yeah there's nothing special about these cars. People need to stop pretending they are collectors.,Honda
I would recommend using those spray bottle things that attach to a hose where you can really sud up your car easily and quickly.,Honda
Excellent choice,Honda
Educating myself but yes heard about gaskets being an issue on these cars especially on CRV and Accord.,Honda
it looks as good as the other one at least based on the photos. my car is black and it seems harder to keep clean if that's worth anything to you. i am unable to get super detailed with my opinion without opening up the engine bay or getting the car up on jackstands to take a real good look up its skirt.,Honda
A Fit first gen and a Civic sir 1998,Honda
"You have a CVT. It’s tuned for fuel economy on light throttle, and will bump up in RPM when you’re needing power. It’s not like your conventional 4 speed auto in the ‘03.",Honda
"174*

I’m keeping it until the transmission or engine goes out",Honda
Yea but you’ve gotta jump that connector first,Honda
I gotta ask. You didn't hear or notice any rattling or clunking noises or a loose feeling steering wheel for the past few months?,Honda
"[Rockauto.com](https://www.rockauto.com/en/catalog/honda,2011,civic,1.8l+l4,1447343,steering,power+steering+pump,7380)",Honda
"2022 Honda Civic sport touring as the daily. Great gas mileage, banging sound system, comfortable to drive friends around.

2001 Honda S2000 - VTEC go BBBRRRRR",Honda
"Dealership provides convenience for people that can't or don't want to work on their vehicle. Ideally technicians specially trained to work on a specific brand of vehicle. They will stand behind their work if anything goes wrong and use only oem parts. That's what you pay for at a dealership. Hardly being ""bent over"".",Honda
They do hurt your gas mileage though so keep that in mind.,Honda
MDX and RDX,Honda
S2K manual and V6 MDX.,Honda
"No, seriously, who's asking for your VIN to look up parts? I've never given VIN for anything besides insurance. Year, make, model, trim level, transmission is all I've ever needed to provide.",Honda
"Ah, I see you have a Japanese Honda...",Honda
"Damn, good to know! Throwing a crz on the “future silly potential project” list next to a Fit cause they seem like a blast.",Honda
"Thanks, that makes sense. 

Is there a way to check the status of the fuel pump (in terms of the state of impeller deformity)? Or are we waiting for it to fail completely? And diagnostics would be able to pick up a failing fuel pump? It’s one thing to not being able to start the car, another if it stalls all of a sudden while on the road.",Honda
Sounds like they fixed that problem on the next generation. Lol.,Honda
Many people like that sound. That's why they play fake engine sounds through the entertainment system speakers.,Honda
"Quick update, I do have a mechanic appointment. But its in 3 weeks, so that kinda sucks",Honda
Both side,Honda
"""You're absolutely right, I thought the same and I reported the situation to customer service. I made such a request relying on Honda's reputation. Why should a part of a new car be replaced?",Honda
"I absolutely Agree, there is nothing better than 9,000 rpm on the track. But the torque down low out of corners is just too good from the z7. Parts are cheap, maintenance is cake. And with an RBB head swap you can have a z7 rev to 8500 reliably.",Honda
🩵,Honda
Ahh man it’s the Tahitian green pearl too? Fuckin hell I’d buy it and take all that shit off then drive it,Honda
