Comments,Make
"You mean scratch the car with keys? Honestly that is one of my biggest fear, I hope nothing happens to her...",skoda
"Everything is ok, just not the price. This is 10 years old Škoda. For 16500€. I understand that we are speaking about RS, but 10 years old Škoda is to much. I understand inflation, car pricees and all of that. But ist to much",skoda
"Damn, that's amazing! I'm glad I don't live in such a place. I'd be too scared to drive anything if every car ends up like that.",skoda
"It was 220 on st1 and 250 on st2. With dsg tune it was 460€ total, most places wanted 400+€ for stage 1 only.",skoda
"I am going to enjoy it, just wanted to be sure and get oppinions from the community.

The mk5 gti is one of the best looking Golf's, remember getting obsessed with it when NFS Most Wanted came out.",skoda
The 360° camera is only good for one thing. Flexing about it. Other than that I find it pretty useless honestly. You have windows.,skoda
Its 100 percent from tailgating mine has them also and i sadly have the habbit of it.,skoda
">1.5 litre cup holders in the doors

In the doors I do not have cupholders, just an empty space to store things. One part of it is a bit wider, so I can fit there some bottles, but I doubt I can fit there a bit 1.5l bottle. Haven't tried yet.

No screens for me xD  
Just radio and AC xD

Idk, I don't have issues with ride quality and not much road noise (or at least it doesn't disturb me).

Note 1: my car has a manual gearbox (not automatic).  
Note 2: I took the car for inspection before buying. So I was pretty sure that it is in good condition (it had 73k km over 10 years, so very little used).",skoda
"Interval is 120k km OR 6 years, so depends how much you drive it's either 6 years or sooner.

My mk3 has heated windshield and both parking sensor (front and rear) but atleast front sensor are optional, since my friend doesn't have those. 
There's was also option to take reversing camera, mine doesn't have it but I'm gonna retrofit it. Not sure if heated windshield is optional of default either, you need to check on those when selecting car.",skoda
Report it to the dealer and have it repaired under warranty surely?,skoda
I can’t ignore a noise that make me turn up the volume of music,skoda
Checked the plug between the door and the A pillar? (I think its the A pillar),skoda
"hope anyone kodiaq 4x4 owner can give some info, hows it feel etc. Next week it will be checked :)",skoda
"Thanks for your input.

I'm going to check the OEM parts number and see what it would cost me to change it.

Looks like there are (probably non-OEM) struts for around 150€ a pair on ebay (see https://www.ebay.de/sch/i.html?\_from=R40&\_trksid=p2322090.m570.l1311&\_nkw=5e9+827+851+f&\_sacat=0)

The lock itself doesn't look like its 200€ though ( if i only need to change the 8R0827505A part, as suggested on this forum post [https://www.briskoda.net/forums/topic/467899-auto-tailgate-failing-to-open-consistently/](https://www.briskoda.net/forums/topic/467899-auto-tailgate-failing-to-open-consistently/), see parts diagram  [https://www.briskoda.net/forums/uploads/monthly\_2019\_08/SKODA.jpg.79e207261c2c4c7d179899361d183ebf.jpg](https://www.briskoda.net/forums/uploads/monthly_2019_08/SKODA.jpg.79e207261c2c4c7d179899361d183ebf.jpg) )

  
edit :Looks like most of this forum thread said that replacing the boot lid latch (8R0827505A) fixes the issue. I'll order one soon and report here.",skoda
You might say it's an EPIQ fail...,skoda
Do you think tweaking the settings with these will void warranty?,skoda
"The paperwork for mine is almost finished. MK4 PHEV Sportline in Gray. What does the 272 stands for? Or even the 4x4? I start to see that the trim levels in Portugal have different names from other places. Besides the Sportline, we have the Ambition, Style and Ultra, the last is a full extras and can't be customized.",skoda
"And yes, Aliexpress",skoda
"Just curious.

I have an octavia 2 2012, and planing to upgrade the infotainment system, to get rid of the phone as its distracting.

In case you have a 2023 Infotainment system, why do you need a phone on your dash?",skoda
New you mean 2024 model MK5?,skoda
"Also maybe try these solutions that I found  on Reddit.

Ensure your device allows the contacts to sync. Tap 'Settings', then 'Bluetooth' and find the vehicle with the pairing issue. Tap the 'i' icon beside the vehicle and ensure all of the boxes are checked, including 'Sync Contacts'!

These steps were slightly different:

* Settings
* Connections
* Bluetooth
* ""Gear"" icon next to paired device for car

Good luck! 🙏",skoda
"No smart dials. No varioflex.  Middle seat looks tiny. Boot space sub 500. Chinese design look.

Nah",skoda
Awesome,skoda
Try another time after 1 hour,skoda
It warns about speed cameras. In the settings you can disable different classifications. Disabling speed cameras solved my daily problem.,skoda
You could always paint it yourself?,skoda
"1.5 it's always better to have horsepower and don't need it, rather otherwise",skoda
Glory hole cover,skoda
Yeah 😊,skoda
I have done a fair amount of deep water driving since it’s been so wet this winter. I’ll give that a try too. I would think it must be a stone or something rubbing when on right lock. Appreciate the response 👍,skoda
"I guess he doesn't tailgate so much. But each paint does have slightly different characteristics, this isn't a Passat/Superb difference.",skoda
I would go for the diesel :),skoda
"So if it gets stuck open or closed the temp gauge won’t go to 90C, got it, thank you dude",skoda
1.0 looks ok for a small family with occasional trips. Get the 116 ps the highest 1l petrol and it will be a good engine to drive around the 60mph country roads.,skoda
"Thanks, bit of a pain the the arse they've replaced  £20 part with this but that explains why I couldn't find any.",skoda
+1,skoda
"Ne, bez pojisteni 5000 kc. S pojistenim nevim jaka je spoluucast.",skoda
"For the tune part, that sounds like a perfectly reasonable and honesty erring on the side of what would be classed a ""safe"" tune.


Providing you trust the tuner (not some random guy, have good reputation without complaints) - you should have no issue.


I had the older 1.2tsi tuned from 90hp to 140hp and I went 3 years with zero issues, I did NOT treat that car fairly, used to drive it like hell and it still survived with no problems until I had to upsize.",skoda
Possibly the best car you can buy today.,skoda
"Nice, my previous car was a Octavia 3 RS TDI with 184hp. I really liked the comfort and the fuel mileage, but really wanted to try the gasoline version. 

For the TSI engine it depends how hard you drive it if you want to achieve a good fuel consumption. On my last long drive I managed a 7.8 liters/100km, didn't drive very hard and was cruising on the highway at 130km/h.

I like spirited drives on the bends and get really bored on the highway.

I think I'm gooing to travel about 40.000km in four years.",skoda
Happens to every car.,skoda
"i had the same button, let me know what the others say",skoda
Unfortunately I can’t upload videos or sounds only images on here,skoda
I’ll look into that once I get in my car! I didn’t even think of it,skoda
This Skoda's going on an adventure,skoda
"Yeah, I think I might take the chance to upgrade it anyway. From what I can see online, it'll have to be taken to a garage to be coded to the car because I need both the screen unit and unit in the glove box. I'll have to ring around some places.",skoda
I’ve updated to 17.4 but I haven’t found a way to activate carplay on the instrument cluster. So I assume no.,skoda
Sorry you gotta buy RS version to get the full light lighten up,skoda
Toe whole,skoda
"Lucky you.. this happened to me too with our karoq, at about 600km, but smaller fortunately.",skoda
"If I was you, I'd use this as opportunity to upgrade the whole unit. I replaced my head unit in my MY14 Octavia with xtrons Android head unit, it was 300€ and literally plug'n'play.

What comes to fixing they current system, i'd believe the dealer, but maybe try to source the unit from crash damaged car second hand, replacing it is fairly easy if you are a bit handy yourself. 

Screen should comes off with simple removal tools4(Dealer might sell, but I got 3d-printed for myself when swapping the headunit)",skoda
"I have 18s on mine, looks good and the ride is pretty good, obv better tires help too.",skoda
Weirdly enough my superb doesn’t have interior monitoring but still has a siren and I’m guessing a tow away sensor.,skoda
"Never used them myself, but they get a decent write up at that price point.

Skoda saving money I guess!

[https://www.tyrereviews.com/Tyre/Kumho/Ecsta-PS71.htm](https://www.tyrereviews.com/Tyre/Kumho/Ecsta-PS71.htm)",skoda
Nice colour!,skoda
"Apologies, it’s from 2018. The warning is on the display where the speedometer display is. I keep my keys in a separate pocket from everything else, and on a coffee table when not driving. But I’ve only had one warning so far - when I was driving. It’s not an issue of the battery being pushed down. The key is probably talking to the car and killing the battery. I’ve changed the key battery I use and I’ll keep some battery in the car just in case! Thanks for the advice 👍🏽",skoda
"That's not exactly a speed radar detector..it's just traffic info app which works similar to Waze, it doesn't actually detect anything, it just tells you info that has been put into the app by other Škoda drivers. Does the app have its own specific settings?",skoda
I will retain the mod. Here in Romania the insurance companies don't care about the modifications to the engine.,skoda
"Wow what happened there? You need to take of the display and see what you can do to fix the issue. I don’t think you need to replace the display module, as far as I can see from pics the display needs to be clipped back on whatever it seats in.",skoda
"I didn’t know it can be turned off. Need to definitely do that! Only maybe turn it on when parking. 
Is the calibration something that I can do myself or do I need to go to a shop to get it done",skoda
The blacked parts were an option for you? I couldn’t choose anything at the dealership. they just showed me models and it came as they are.,skoda
About the stage 1 modification to the car.,skoda
"Hey guys, thanks for your comments. I have already fixed that. It was the lock on the rear seats where it meets that metal holder. 2 lines of a rubber tape fixed that noise so I can finally drive without any unwanted noises.",skoda
"Cool, good to know, thanks! I’m in the UAE so we also have a heat problem haha.",skoda
Solved - this did the trick! Thank you very much!,skoda
"I have the below, I am not 100% clear if it is the same car:

1. 2013 Superb combi
2. 2.0TDI DSG
3. 170CV
4. 246k km
5. Bought it 6 years ago, 100k km ago
6. I do the regular maintenance by the book, nothing more, or less, with an independent mechanic.

In these 6y / 100k, zero issues with the engine. Things that have gone wrong:

* Auxiliary heating (for freezing days) never worked, not worth fixing it
* Electric trunk. I had to replace the electric engine

and of course there is reguar maintenance (battery, timing belt, DSG, brakes, etc...) and a chip in the windshield and someone bumped into the rear bumper. But as hassle free as it gets.

**Overall: Super happy, I woud buy again.** If anything, I am bored with the car after these years, but it works as flawlessly and reliably as it could, zero reasons to change it.

Maybe google the specific engine and see if you find anything. But bear in mind that, like googling for anything medic, you will always find horror stories.",skoda
"Yes, of course, you can buy a Bluetooth-device with cable-set for Skodas e.g. at Amazon for installation in the Dashboard (see picture below).

https://preview.redd.it/x515c7jy6woc1.png?width=1381&format=png&auto=webp&s=8069416118f3c38f12fb216d0a68d6e63dfbf761",skoda
"As in stolen?  
I think you are playing with fire here. I'm a father, and if my son stole my car to drive around, I doubt he would be allowed to loan it anymore.  
  
With property as with sex, consent is very important.",skoda
Might have to move to Romania then that’s amazing,skoda
Welcome to the world of German motoring.,skoda
"Ah, thanks mate, didn’t remember the DQ250 6S in Superbs. OP, it depends on number of the gears ⚙️",skoda
"If I remember correctly (can't access the app right now), you can disable the speed camera warning from the app settings, but not just mute it or change the spoken warning to a sound, it's all or nothing. Annoying as such, as the warning itself is useful. I turned the warning off in traffication and begun to use waze, that just blings for the cameras.",skoda
"For those on desktop who can't see the full text of this question:

> Anyone explain what the little dot in the bottom left corner is for? There was a thin layer of rubber over it that was solidified, so I removed it. Does everything look okay?

I think this is the drain port, ensures that rain water can't collect in that location for too long. See [this forum post](https://www.briskoda.net/forums/topic/484727-what-is-this-hole-fuel-tank/)",skoda
If there's not one on both sides you have the base model. Check it's not need re badged.,skoda
google 🥸,skoda
I have a Passat that's got this in the ambient lighting settings,skoda
Well if you don't do something about it I guarantee an MOT will mention something about it in an advisory not dangerous but not good neither,skoda
My Superb has the same colour and I just love it.,skoda
Crack in Windshield,skoda
Infotainment is stable now from factory?,skoda
Got me a second hand O2 FL and got a chip on the windscreen on my first travel back home (though not as bad as this one),skoda
"It has to be aftermarket, or somebody somehow modified the car's ADAS system...there's no way that it comes as an option straight from the factory, because speed radar  detectors are actually illegal in some countries. Could you post a pic or something?",skoda
There are a few on eBay,skoda
I remember I had to change the battery in both my keys to stop that warning. Have you a spare as well?,skoda
"My Scala is a 2019 1.0 petrol manual (116hp like the 2024 version of the same engine). I do around 5,2-5,5 L/100km on mixed environment. I did a 5,0 trip for a 200 km trip on highway, CC at 125kmh, in 6th gear.
I don't drive sportily nor keep a constant focus on economic driving.",skoda
"Is it a TDI? (Because of the 184hp). I have the same, where did you get yours tuned?

I want to do it too",skoda
"Different for each country but typically:
Low->High

SE / Standard Edition
SEL / Standard Edition Luxury 
Other luxury trim names
Monte Carlo 
Sportline
VRS",skoda
Three cylinders engines are intrinsically less reliable than 4 cylinders. I'd opt for the 1.5,skoda
but how is the wear on your tires then?,skoda
"99,99 percent the bearings are shot. they are not that expensive. have an indepedent garage to dissasemble the gearbox to find out the cause of the whining. is gearbox fluid topped up?? for the first time i hear someone destroying a manual gearbox from the VW group (unless you have 500++ hp on the wheels)",skoda
Yes for battery xddd,skoda
"I'm cheap, but I've used Landsail Qirins on all my vehicles past years, cheap Chinese brand, but really good value.",skoda
"Change the wheels to 17 inch, and let the springs as they are, and test this setup first.",skoda
By 2016 1.2TSI was an EA211 engine with a belt.,skoda
"I will change all the motor oil indeed, I always do when the time comes.",skoda
"I’ve had an Octavia 3 2017 and now I have the 2022 Karoq. The Octavia feels like a bigger car inside and everyone has a more relaxing position. The sits in the Karoq are making you stay more up right, this is also for the rear passengers. If you don’t have the vario flex option you can’t recline the backrest. The Karoq’s interior is designed in such a way that you have enough leg room in the back to feel comfortable but the sitting position is lower than other SUV’s, this proved to be an issue when using rear facing child sits and it will hit the front sit unless you slide it forward a lot and a 1.80 m person would not be comfortable. The interior feels better quality than the Octavia, steering wheal is the same, climate controls are the same unit from Octavia 3, DSG shift is also the one from the previous Superb, but overall it feels OK. Noise insulation is also better than the Octavia 3. On the technology side I’ve found it to be lacking, for me none of the sensors work like it should, matrix lights are constantly missing and I get flashes for blinding incoming trafic, whippers don’t start when they should, parking sensors are missing higher objects, rear camera has no guiding lines (only if you upgrade to highline camera), ACC is breaking when it shouldn’t, infotainment is from 2015, it’s basically the same that I’ve had on my Octavia 3 only connected and as a extras it has wireless Android Auto but some how AA works worse even by wire (it’s not using the entire screen available, it has a thick 1cm black bar at the top of the image that should be used, not a problem with Car Play)",skoda
"If you’re not sure what you’ll need, are you sure in your ability to change them yourself?",skoda
"Maybe chrome delete,as suggested, black emblem on hood, black lettering on back, black mirror caps,maybe black foil on roof, black rims. For the interior,maybe some sport seats. Black and white imho is beautiful combination",skoda
Tow eye cover,skoda
"Mine looks the same and its amazing, i have the 2L TDI version though",skoda
"If you are driving at those speeds, it’s on you really",skoda
Exhaust hangar come loose ?,skoda
"I’m pretty sure I’m only talking about stuff that happens once it is already set, but I’ll consider that. Thanks",skoda
"Assume that it still has ""KESSY"" keyless entry and your car has a start/ignition button and you don't have to put the key in the ignition to start it?

1. Make sure you are using ""premium"" batteries (Panasonic, Duracell, Energiser) and not no-name cheapos
2. Make sure you are keeping your keys at \*least\* 5 meters from the car when they are stashed, as they will be trying to connect and stay active around this distance
3. If you have done/are doing the above and it persists, then mention it to your dealer.",skoda
"Can't tell whether you're upset or not 🤣.
But in any case, I suppose the answer would be, why not?🤣🤷‍♂️",skoda
"Same thing happens to mine, found out it’s probably a switch at the end of the ignition barrel?",skoda
"Can confirm! Ive had the 2016. VRS 230. After a few years driving on the 19” I switched to 17” with a fatter tire, the ride comfort went up a lot. 
I know how the roads in Eastern Europe can be, I also suggest changing to smaller wheels, it will save you a lot of headaches and money buying new tires 🥲",skoda
https://onedrive.live.com/view?id=3AE6945C79E4C9E!17729&resid=3AE6945C79E4C9E!17729&authkey=!AMn8y885S2R-6Xg&wd=target(5E%20-%20Octavia%203%20FL.one|326dfe26-71ca-45e5-81c0-c94d626da7ad/Abbiegelicht%20aktivieren|a51f011f-e2ed-4ae2-ac2a-31c37ffd2ab2/)&wdorigin=NavigationUrl&wdo=2&cid=03ae6945c79e4c9e,skoda
"Thanks, you’ve sold me!",skoda
It’s the mother in law’s ejector seat button,skoda
"I really don't, that is why I posted. Maybe a little discouragement, will help me to not think about it. Thanks 😊",skoda
"Might or might not need coding. It seems like it depends, as was explained to me by a professional in the area. I replaced a battery on a 2015 Fabia and it never complained or triggered any errors. I chose the more expensive Varta, so perhaps that helped.",skoda
"Thank you!

https://preview.redd.it/j3duxruyrvlc1.jpeg?width=768&format=pjpg&auto=webp&s=87a1aee72e655e3828c1bb4fa0f12fc873a8763c

I grabbed this from the dealers website, I haven't had the time to do pictures my own, but will do!",skoda
"I have the 2021 RS and I don’t have this. Check if you have the “Traffication” app installed. Try deleting it to see if it stops. Supposedly it has speed camera alerts, but I can’t confirm for sure.",skoda
"Thanks for your comment, it’s been really helpful.
We spoke to a gearbox specialist about doing the fix. He said the pressure plates in the mechatronic unit need to be replaced. He’s quoting €1500 for the fix.",skoda
Is it an easily order part? Can't seem to find them anywhere,skoda
[deleted],skoda
It’s a 7 year old car .. what are you expecting? Don’t bother respraying a shit box,skoda
"Thanks. Think they're all automatic and I'm wanting to go back to a manual so will have to give them a miss, could have been good otherwise.",skoda
Frumoasa masina. S-o stapanesti sanatos,skoda
"Shouldn’t be a big difference price-wise, but definitely something worth considering. Thank you!",skoda
Can you use apple car without cable ?,skoda
"that kPa/Bar rating is nonsense, is basically the same unit.",skoda
"Month ago I buy, Superb Sportline iV (2022, hatchback) in this beautiful Race blue, love it so far",skoda
What's with all the downvotes? Am I not allowed to be worried? The last car I sold had a stage 1 and mentioned it in the description.,skoda
Drummer here with 2015 RS wagon :D,skoda
"I’m driving everyday , commute",skoda
"Ops, forgot to mention. The baby is new Skoda Fabia Style (Selection) 2024, brand new built by myself",skoda
"Yeah it really is lol, i dont want to say it but i dont think nicely speced base engine octavia should cost 40 grand.",skoda
Ok so it’s 1-2 liter worse than the diesel.,skoda
"Since that engine is EA211 I would say it is pretty reliable. Only problem with them is carbon buildup in the intake, but that shouldn't be a problem for about 50 000 miles and even then it's not going to be too expensive.",skoda
"Such a rich and saturated blue, I think I’ve never seen this color on Octavia in person, looks nice!",skoda
Your call will sooner be eaten by rust than the motor will break down. Its simple engine,skoda
"Summer, Winter, all-year?",skoda
A makers mark! (To quote Top Gear),skoda
Warm them a bit if you can otherwise is a pain in the ass with just the floss.,skoda
I kind of dig the black trim. My Gen 3 is on silver trim and i am really wanting to try the black on it. Hmmmm.,skoda
Thank you!,skoda
"If you are losing cooling water, seal is brobaly broken, water is mixing with oil. how water is boiling in oil it makes this..",skoda
"Pump is changed in warrenty period already. Owners said, iz is first hand used car",skoda
"The one that broke now, is made by febi bilstein. When I ordered it back in Dec '23, it was the second most expensive in the list...",skoda
"It’s the tow hook as another user said.

Generally the vehicle is more structurally durable at these points, decreasing the possibility of damage to the vehicles exterior.",skoda
That seat look good and comfy.,skoda
Is it because of the taxes? The price is outrageous....,skoda
Diesel all the way 😂,skoda
My 1.5 TSI manual does 5.8 - 6.0l/100km with short trips in the city. 5.2 on long trips on the highway.,skoda
Thats a Skoda disease. Had that forever with my Octavia 3 and also when I was testdriving a Superb. You can ignore that for ages and nothing happens.,skoda
Emergency self-destruct.,skoda
Amazing. Absolutely love the split headlights design. Jealous that you can probably take it out rallying,skoda
it should be an ambient light and not a ganja lamps 😂,skoda
"So basically, the 1.0 tsi and 1,6 TDI is the same in terms of fuel consumptions?",skoda
"Because AI doesn't know any of it either, it just generates some text. You are better off Googling this",skoda
It’s 1500 to just replace the pressure plates in the mechatronic unit. Do you think that’s expensive? I can’t find the part for sale online. And would you think it’s better to just replace the mechatronic unit with a new one?,skoda
Thanks a lot! Any common leaks around the engine no? I knew about timing and water pump failure.,skoda
"Considering how it wore away on the wheelarches, I wouldn't be too sure of that.",skoda
"I asked a local auto gearbox specialist, and he told me the 7 speed is sealed for life, but the 6 speed would need an oil change. I have the seven, so did not ask any more questions.",skoda
For 1500km per week you will end up with roughly 72kkm per year. Does he maybe have a 0% interest deal for a diesel car?,skoda
"Bridgestone, continental, pirelli, michelin",skoda
"The switch was easier than bolero stereo buttons.

U will need tweezer solder iron to remove the old ones. Hot air solder gun. Flux paste in syringe. Solder wick and liquid solder paste in syringe. Leds are smd 3528.",skoda
"Well, afaik the logistic is a problem. Before shipment they have to load proper software (for every car specs) manually onto the boards and that is a bottleneck. I repeat, as far as I know.",skoda
"Mainly around the MIB3 unit and the dashboard display, there is often issues with the system even booting up and some major features can be disabled until both units are ready.

We had another VW group car in our family with an MIB3 unit and it would often have issues with navigation, sometimes the dashboard display would freeze, you can't switch user profiles until it is loaded.

On the MK4, heating and ventilation is controlled by the same unit, if you can't access the headunit, you can't switch on your window demist or get your car to a safe temperature.

VW apparently recently replaced their head of IT to try solve these, we've seen nothing yet.

Go look at the ID series, same headunit and there has been huge nightmares around that.",skoda
