Comments,Make
"If you see an item priced on marketplace that seems too good to be true, go look at the sellers profile to see what they have posted. The scammers usually have multiple (like a dozen) of the same item that they've posted in multiple locations nationwide. 
I hope this helps!",subaru
"If it locked up doing an oil prime, it was going to lock up on start up too.

Probably had some debris in one of the VVT ports. I had that happen once, galled between the carrier and cam. Snapped the timing chain during prime.",subaru
Yeah not possible on a hill unfortunately.,subaru
They’re going for their end of month and/or end of quarter incentive from the manufacturer.,subaru
Not me,subaru
"Also don’t design roads like this, its a three lane highway in a city environment.",subaru
thanks,subaru
Sry this is def not a gas cap lmao this is something much more serious.,subaru
"I’ve never topped off my gas before because I have ✨zero✨ knowledge of cars, and I’d rather just let the gas do its thing. I appreciate the honesty and thanks for the input",subaru
21,subaru
Snug like a bug!,subaru
"That’s what I think, too. It is also leaking coolant…or whatever fluid is bluish green.",subaru
"Go drive both for 30 minutes in different settings, the one you prefer should be fairly obvious after that because they're drastically different cars. They also are very different forms, so think about what you may need to transport/haul

If neither stands out to you, then either would probably work.

For me the Forester felt much more open and the visibility was great, gas milage was acceptable, luggage space was really good, and I gravitated towards that.

For my wife she really liked the Crosstrek which handled better and more like a car, was more fun to drive, and got better gas mileage.

It's going to come down to your own preferences, both are great vehicles but for different reasons",subaru
"Man and machine as one, the ultimate car&driver!",subaru
" Dash cam of the oil change…with the hood up to change the oil the dash cam has nothing to see!  Sounds like you made this part up.
Engines don’t “hydro lock” from over filled oil. Hydro lock occurs when the cylinder is full of fluid and it tries to compress it.
A “mechanic” would know this. 
Oil from the crankcase cannot physically get into the cylinders unless you blow a head gasket.
Even if the heads were full of oil it cannot get in.
Overfilled oil will cause your crankshaft to be running in oil which is tremendous extra drag so you lose power.
It’s possible it also churn the oil up and thus thin it out, THAT MIGHT cause a rod bearing failure. 
But it was not “hydrolocked”.",subaru
"251’s are in demand because of head gaskets going.

It’s usually cheaper to replace rather then repair.

But I still think the cheapest way to fix (and least troublesome) is to just throw an out of market 201 in those cars (no 2.0 sohc NA’s in North America) and just run them (less than ideal) off the 2.5 equipment.",subaru
Sounds like a Subaru. Just ball up some tissue and stick it in your ears. Problem solved.,subaru
Let me know the results of this as I am also having an identical issue in my 2014,subaru
"I always like to think the 2.0L EJ’s were stronger than the 2.5’s. Same block with smaller bore means thicker side walls.

And with many Japanese vehicles, the ones built in Japan will surpass build quality to those built outside of Japan.",subaru
"Fog light switch is on the stalk in these.

The blank wheel is for electronic headlight leveling, the button with the round dimple is for power folding mirrors, and the one on the right is for the very rare cargo exhaust fan.",subaru
"It's red, not a coupe, not STi, and an RA without a roof scoop. It's uncommon, but not a desirably rare model either. 

Do what you want with it !",subaru
"Thanks for the advice, I did a compression test when I changed the plugs and all of the cylinders were the same, 160 or 150 I don’t remember, but I don’t think I did a leak down. 

When the engine was replaced the shop said they were changing the ventilation in my gas tank. When I brought the car home it wouldn’t start after getting gas unless I kept the gas cap off for a minute and pushed the throttle a little. After about a month it was able to start with the cap on but it still needed some throttle while idling and then it would be completely fine. The gas pump stops itself constantly so I have to fill it very slowly and calculate exactly how much to put in. For about 6 months this was causing an extremely rough start after getting gas, but now I rarely notice anything just the occasional misfire and p0000 code. I can understand how this would cause that after getting gas, but could this cause that same issue when I turn on the ac and randomly while driving? I haven’t addressed this issue because it got better and I’m not well versed with the fuel tank related things",subaru
i absolutely demolished the cup holder cover by simply owning it lol,subaru
How about... An honest question. My kia has 225k miles and had been driven this way since 95k miles.,subaru
"I’m gonna email them and say there’s a scam happening with their car

https://preview.redd.it/yon9ry1zpjqc1.jpeg?width=1179&format=pjpg&auto=webp&s=969d5dedf007b6115eaabe0e61eddc25193a4d4f",subaru
If you're dead set on doing it and concerned about oil just wait until before your next oil change. 5k miles or so isn't going to make a difference.,subaru
"Don't forget to check your ground straps, they usually rust out and will make stuff act funky",subaru
It’s a dealership scam.,subaru
"They haven’t inspected it in person yet. Their initial statement is that it’s probably repairable, which seems unlikely to me. Just wondering if I’m wasting my time car shopping or not…",subaru
Got to love that BE/BH lifestyle.,subaru
"And one of the best transmissions, 4EAT could go 300k miles with no problem, you may need 2-3 CVTs to go those same miles.",subaru
"All Japanese market Subarus (that are made by Subaru themselves and not the rebadged Toyota or Daihatsu models) have a 9 digit VIN.    The rebadged models have a 12 digit VIN.

No Japanese Domestic Vehicle would have an ISO formatted VIN.",subaru
"They're just trying to sell you a new car.  Typical marketing, everyone gets things like that.",subaru
LOL. Not sure I'm buying this one. You shouldn't force it out.,subaru
"https://preview.redd.it/n82vkgq0ycqc1.jpeg?width=1080&format=pjpg&auto=webp&s=bb9880671a2e2f26687d02757c108d0876de7fc1

In terms of automatics, this was the best one by far. Basically a sequential but without the pesky clutch pedal off the start",subaru
Yeah we just had 5 inches of snow a couple days ago. Now it's mostly melted. This winter was brutal.,subaru
Last time I needed a new car - same thing happened to me at the dealership ... I walked and got a slightly used (lease) one at a much much better location.  If they only realize the hundreds of thousands of dollars they loose by doing that.  The service dept here screwed me out of $100 bolt - in the year 2001 .... I have never been back to them to get a car serviced.  Think about that - 23 YEARS of profits they have lost,subaru
Math ain’t mathing here.,subaru
Love those bug eye sedans.,subaru
"The local dealerships here used to charge msrp+15% for everything - they've gotten better, but its sad when online+shipping is cheaper than buying local.",subaru
"My 2002 Forester with a manual transmission has 304,000 miles on it and still going strong. I use it mostly for local trips. But my other 2000 Forester also with a manual transmission has 211,000 miles. Use that one for longer hauls up to the cabin.",subaru
DO NOT accept your car back until you know it's running exactly like it should.,subaru
"Even before that, asking you to go off FB is an immediate flag.",subaru
I have a ‘13 legacy. Love it so much.,subaru
Yup,subaru
lmfao you poor sheltered thing. no wonder you're confused.,subaru
"That's not just a Subaru thing. I got these for my old Chevys like over a decade ago, it's dealership marketing.",subaru
Y’all got cargo nets with your car? Where they hide those at?,subaru
My dealer keeps emailing asking if I want to trade my BRZ in for a new Impreza lol,subaru
Is it possible that perhaps your words or tone don't convey the message you think you're conveying?,subaru
I always use this site when I am looking for a model: www.subaru-impreza.de (you can change the language) maybe it helps.,subaru
"Can't really tell anything from that, need to look in side the oil cap and see if there's any froth for lack of a better term.

This is a pretty extreme case but it'll look something like this.

https://images.app.goo.gl/DMKmGkUdNHBnDZ3s8",subaru
Just refill the filter and start the engine. You’re fine. This guy is a retard.,subaru
Maybe 500 HP between the 4 of them...,subaru
Sounds like the accessory belt is slipping ,subaru
Those died 10 years ago.,subaru
"You are correct, brother.  

Considering these are compatible replacements,  CVT +AT should be printed on it to avoid any confusion.",subaru
"this impreza is a goner. Stage 4 rust right there, wouldnt expect to see this thing driving in a year from now.",subaru
There are good dealerships out there. Find one.,subaru
"No that one’s true, trust me. My dog works for Subaru engineering",subaru
Report this fr,subaru
That’s the sound we love.,subaru
Thanks but the specific scenario I am trying to confirm is if a keyfob can be cleared then added back. They said they could clear all keyfobs from the system. But they would be unable to add the one she had in her hand back in because it could only be programmed to the car once. So she had to buy 2 completely new keys and discard the one she already has in her hand because they can’t reuse it.,subaru
Where did you them from?  I have top hats from Rallitek and they are NOWHERE that flexible .,subaru
I find she likes pink fluffy cuffs better. ;-),subaru
"Yikes, how much?",subaru
"Understood I'll never get it all out, but if I measure 4.7 in, if there's still any appreciable volume of oil left in the engine, wouldn't the dipstick read over filled?",subaru
"Check the opaque coolant reservoir on the radiator for black/brown sludge, if you see it above the coolant line it’s most likely has a blown head. Other than that check for leaks on bottom of block for leaks from valve covers/heads and inspect heavily for rust especially in the rear arches if possible. Also when you start it see if it blows any smoke out the back bluish is oil,thick white sweet smelling smoke is coolant. Edit: just meant to say go for it if your inspection goes well. Just be prepared to fix it and be a good caretaker!! 06 wrx wagon owner here, good luck!!",subaru
I gather you're just a miserable person.  Maybe some day you'll find something that makes you happy.  Good luck!,subaru
"If you can I’d go in person with that to investigate what you can possibly get out of it, may be a new car maybe no payments on current something, or of course just call. Will say never seen something like that before.",subaru
if you read it you can only finance 20k of a 35k car to get the 0%,subaru
"I'm sure you deserve the tow, but the company definitely should have thrown dollies. Personally the company I work for always takes a picture of your car on dollies to avoid accusations of us ruining your transmission etc.",subaru
Oh sweet summer’s child,subaru
One crime does not justify the other crime.,subaru
I got a generic set of 3 wipers for $20 off amazon. works fine,subaru
Got one from Ford today.. 82k for my 2019 F450 that I paid 52K for new.,subaru
"$8,000 USD

You actually can go buy it",subaru
what did the leak down and compression test say?,subaru
Kick him.,subaru
Nope,subaru
"There is no code for ""low coolant""

Red<->blue flashing means the gauge cluster can't understand/can't read the the sensor. Depending on the car, likely the ECM is what's actually reading the sensor and sending the cluster a signal; in this case it could also mean the gauge cluster can't communicate with the ecm.",subaru
How many miles on the car?,subaru
I've only swapped 2000-2004 Legacy (usdm) seats...no issues OP describes. Only thing sometimes missing is the seat heater power which is easy to hack in.,subaru
You mean I don't have to run backwards around it twice before getting in and then promptly throwing my right shoe out the back passenger window just to keep the CVT from failing?,subaru
"look into doing a VIP purchase through ASPCA or one of the other organizations that do it with Subaru. You can get invoice pricing instead of MSRP for a donation to various orgs (ASPCA donation is $500 - I saved 2300 for my $500 donation to them last year when I bought mine.) Unfortunately asking here for a price range won't result in much as the prices change pretty drastically depending on where you are in the country. The best way is to get pricing from multiple  dealers near you on same options or go to Subaru main website and build one out there with your options to see pricing. It might vary a little from what you local dealerships have, but it will be very close to what they are selling for.",subaru
"I've used zip ties all the time on inner tie rod boots, it'll be fine",subaru
"This.  I just make sure to document it with receipts.  I buy a filter and washer from a dealer close in time, oil on the day of the oil change, and I keep a vehicle log book.  I make sure to cross reference and mark the receipts with date of oil change, vehicle, and mileage.  The receipts then go into a folder just in case a warranty claim is ever needed.  

I also make sure to stay within the service interval to the mile or date, even if it means changing earlier than needed just to avoid going a day or more past due.  

Once the vehicle is out of warranty though, then it's oil samples to Blackstone and seeing how far I can safely extend it.",subaru
Is it too late to get a ceramic coating? That was the first thing I did with my new crosstrek. They’ll usually correct the paint first. Kind of expensive but worth it especially if you plan to have it that long.,subaru
"Can anyone tell me if this is ""good enough"" for a Subaru Impreza 2015 engine air filter installation? I've tried both a Wix a Purlator One after market filter and the filter box is locked in properly into the ""tabs"" on the bottom but you can see on the side picture there's a tiny gap.

https://share.icloud.com/photos/07ddhx8VsgmeVLGjwWVhbdf0Q

I did notice the ""screen"" behind where the filter is has a couple 1 inch long rectangular  ""rubber bumpers"" in the top right and bottom left corners. I feel removing these would likely fix the clearance issues but they seem to be part of the oem inner filter so don't plant to touch that. 


Looking online it seems the 2017 and later improved the filter situation a bit but older Subarus are a pain in the butt lol. 

Appreciate any feedback! ",subaru
"ha ha yeah it's not everyone's taste, but I am a professional antler carver so it suits me just fine.",subaru
I left my house in a different car. I’ll check when I get home and will let you know. Thanks,subaru
BT at the end...how rude. :(,subaru
"After carving antler for almost 20 years, if I am not part antler yet, this would be the time.",subaru
"Yeah, it’s called cranking the engine which drives the oil pump. There’s no special magic.  Any engine can do that if you disable the ignition.  And it’s totally unnecessary to do between oil changes.",subaru
"No, the torque converter wouldn't function without fluid so you would be going nowhere. Though accidentally draining the transmission fluid on these is not super uncommon",subaru
"That dirty feeling afterward is just part of the typical stealership experience, sadly. Just remember, these people are not your friends, and sometimes you’ve gotta put your foot down and tell them exactly what you want. If they don’t play, leave.",subaru
"Great, that has helped me a lot. Thank you!",subaru
"The fob for that vehicle is a newer fob, so there is a chance that could be true but with every push button fob prior not requiring it, I can't see why the would change it. 

I forgot to clarify, I dont work for subaru. The place I work at does automotive keys and fobs. My claim is based off of the software and info from the company KeylessRide.",subaru
The world needs more hatchbacks :( hope you’re ok,subaru
"Pics, or it didn't happen",subaru
"""they told me it had almost no oil in the oil pan. Hugely concerning because I change my oil every 2-3k miles, the car did not give me any warnings or indication in the dash, and the oil wasn't leaking as far as I could tell (car is garage kept, my floor was oil free).""


Seems like common Subaru behavior. Check dipstick every other drive or 100 miles, whichever is less.",subaru
"My prior Subaru, ‘12 Forester, consumed oil at that rate, a quart per thousand and some times worse.  That should warrant a new engine under factory warranty.  They did replace mine in term with the settlement. They basically admitted with the class action settlement that up to a 1/3 of a quart per 1200 miles is the acceptable consumption rate.  I now have a ‘22 Forester and it doesn’t consume oil, knock on wood.  With a ‘23 I would hope you have less than 60,000 miles on it.  Why not have a dealer run a consumption test? Should be a free oil change at least.",subaru
chill….,subaru
This happens to me sometimes but never consistently. Some pumps are more sensitive for sure. ,subaru
"As cool as that is, I'd be hate to have my hand near that in the vent of a crash 😅",subaru
I appreciate the offer but will pass thanks.,subaru
"coated rotors are also cast iron -- the coating will only apply to the places the pad doesn't touch.

Personally I would say yes it's worth it for coated rotors where you are, but there's no mechanical reason you can't use what you've got.",subaru
"Lol, Zoolander",subaru
"can someone help me in identifying the part number for the little cover that is supposed to go on this hole near my shifter so i can find a replacement? it is an 03 forester and i only can find #35181SA010 on google which says it fits an 07 impreza. might that also fit mine? thank you!!

https://preview.redd.it/hnqjmtuir8hc1.jpeg?width=1290&format=pjpg&auto=webp&s=0f424d3642a82a259c07e14731aa28dca1dc72b4",subaru
Okok thanks,subaru
Awesome comment. Thank you.,subaru
"'17 Forester 2.5i, with 52k miles. Bought 7 months ago with 40k miles.

I got in one day and noticed the TPMS light was on. Drove it to Discount Tire to get the tires checked. This (the time I noticed the light) was the last time either one of my key fobs worked too. I can still unlock the door with the key that is attached to the remote, but it sets off the alarm. The only way to stop it is by starting the vehicle, which I can still do. I went to a car key locksmith and they tested both keys and detected frequency emitting from them. I also replaced the batteries in both fobs. Still no success. Again checked all tires and sensors and they are fine. Someone suggested it could be a battery issue, but I had that checked at AutoZone and again, it is totally fine.

I have called and visited a ton of locksmiths and mechanics who don't know what the issue might be off the top of their head (or have never heard of this happening before, but they suspect it is an issue with the car itself (immobilizer, anti-theft system etc.) Called my local Subaru dealer and other mechanics who will charge a pretty hefty diagnostic fee, but since this issue is so specific (key fobs stopped working AND tire pressure light came on at the same time), I'm beginning to think I have no choice but to let a Subaru specialist diagnose the problem.

I really would like to not have to spend upwards of $500+ to get new keys, new immobilizer, diagnostic fee, etc. I have seen posts about how to reprogram your own keys but I'm still so confused about the TPMS light also being on. Maybe that's a separate issue, but I kind of doubt it. Could it be an electrical issue, like a faulty fuse/wire? I did get an oil change the day before this happened, and went back there to ask if they might have messed anything up but they said they don't ever touch anything electrical.

Would really like some help/advice with this.",subaru
I’m thinking OP probably shouldn’t be buying anymore broken subis.,subaru
This is a pretty rare problem nowadays. That’s a port fuel injected engine if I’m not mistaken. Could you have excessive cylinder head and piston top deposits?  Have you been using lots of aftermarket fuel additives?  What’s your driving style (aggressive or gentle)?,subaru
"https://preview.redd.it/isflch3oddqc1.jpeg?width=828&format=pjpg&auto=webp&s=e63d860b7470f6a75846964efec320f4a770504d

Eyyyy! LGT gang!",subaru
"Oh zero judgment in that regard. I’m a mod for a few communities but my real life comes first, and you gotta triage - managing spam and people being jackasses comes before keeping the sidebar pretty.",subaru
always lol fuck if kids arent in here youd think i was a teenager trying to bug my parents,subaru
Toyota factory reman racks come with zip ties. It’s common at this point in the auto industry.,subaru
"Totally agree. The last two times I bought a car, we knew our numbers. We conferenced then walked from the first place and were chased. We bought. The second place I did  all the negotiating  - I had a deal on the purchase, but they were really lowballing me on the trade in. I was walking out and was chased for the sale. We keep any discussion about financing out of purchase conversations, then finance through my credit union.",subaru
"If meme famous head gasket issues and successful class action lawsuits over main end bearings aren't enough to kill it, the CVT won't.

Love the cars and owned them since the 90s, but they're piss weak vehicles. Particularly the WRX/STi, which are marketed in the performance category without performance category mechanical strengthening.

Selling my 14, my third STi, but I doubt I'll be back. Modern subarus are made of glass.",subaru
"Idiots, both of them.",subaru
Yea wasn’t sure on the replacement history of any of these struts when the car was bought it’s possibly they’ve all seen 140k miles with no replacement this just sucks cause imma college student and I JUST got the wheel bearing on this side replaced too so you can imagine my face when I thought the clicking/clunking stopped only to be met by now a bad strut 😂🤦‍♂️ like fuck me dude I’m ready to pull a strut from a junked forester at this point,subaru
What kind of issues?,subaru
1997 ok,subaru
"Here’s mine, 05 STi

https://preview.redd.it/dzmz3kx91iqc1.png?width=2796&format=png&auto=webp&s=48ec2255a0ecd3f3f75072b04648e097632f4b47",subaru
I had a day a couple weeks after where all of a sudden the tissue underneath my clavicles hurt.,subaru
"https://preview.redd.it/5r6kyji2f3qc1.jpeg?width=3024&format=pjpg&auto=webp&s=932c1910568182ccbd5607217c735f3a6e97f96a

How’s it looking? It seems a bit watery on the dipstick especially for it being 30°F rn. But color wise could it be mixed? Idk if I’m being overly dramatic.",subaru
Yeah maybe he’s just holding down the start button too long? Just need to tap it.,subaru
eyes are a wonderful invention my friend,subaru
"Do an image search, same car is for sale all over the place. Bogus and a scam setup.",subaru
I had a very similar smell in my 2014 forester and used this to get rid of it (so far) [ac cleaner](https://a.co/d/gx7qfy3),subaru
"They're all boring color options, no one will notice no matter which you buy. If you want it to not show as much dirt pick silver or gray.",subaru
"How much MPG do you get out of it? Is the climate control hard to use since it’s integrated in the touch screen? Is the CVT responsive?

Sorry for bombing you with questions, but I might be in the market soon and wanted to get an owner’s thoughts 👀",subaru
With all the eyesight hardware where do you mount the dash cam? What brand/model dash cam?,subaru
without putting it on a frame machine there is no way of knowing for sure. from my limited experience if the front frame horns are not bent too far they can be straightened and everything else is bolt on parts. if there is enough value in the car the frame horn can be replaced or fixed i would have it repaired,subaru
It’s under warranty regardless. You’ll be fine.,subaru
Put it in H!,subaru
"I checked some aftermarket filter makers and they sell the same filter that works with 38325AA032 and 38325KA010. 


https://spareto.com/products/vaico-hydraulic-filter-automatic-transmission/v63-0071#nav-alternatives",subaru
"I remember one time I was going about 45 in thick big flake type snow.  Just tapped my brake and did a full 360 basically in my lane and stopped facing the right direction.  I was just thinking I couldn't even have tried to pull that off if I wanted too, but man was it fun.  I loved that car in the snow.  All my cars are too expensive now to risk that kind of stuff.",subaru
As an estimator without seeing it in person hard to say but based on how tweaked that bumper beam is not cheap at all.,subaru
Because there are sensors near there which could trigger your airbags. And that's a Bad Day.,subaru
Cuz money. By the time you get it all busted down it’s probably cheaper to buy a new one and put it in.,subaru
Pray for me,subaru
">what break boost?

Big yikes.  If there is a break boost, don't even drive the car.  You don't want to hasten anything on the car breaking.

A brake boost should be okay, however.",subaru
