Comments,Make
"I have a 2019 Subaru Impreza 5-door (base trim) with around 70,000 miles. I bought it new in 2019.

Should I consider purchasing the Subaru Gold extended warranty for my car?",subaru
Lots of Subaru places do a trade up program. It worked better when used car prices were still through the roof,subaru
"I did look into it, and would like to have it all done and corrected soon. Just need that extra cash. Perhaps after bonus time… lol",subaru
God I agree.,subaru
"Third party promo companies hired by dealerships to get people in the door.  They offer gimmicks, incentives or prizes for walking in the door.",subaru
"Your forester does not have a telematics system, so you have some other problem and need diagnosis.",subaru
My key start 2011 Ford Fusion had to be turned off before driving due to the ‘my key’ feature that let you have separate settings for teen drivers that limited things like top speed. It was super annoying since I didn’t have a teen driver at the time,subaru
"Gotcha, thats good. Dont be gullible to obvious scams is all i was trying to say lol. Good man!",subaru
"You know how the dip stick has a twist half way up? The oil was just under that twist.


I'm not mad at anyone, a mistake was made but it's very unlikely it was intentional. I have a loaner. The worst the service advisor got was me saying ""Morning"" instead of ""Good morning"". I'll let them stew on that.",subaru
"Subaru sucks.  I just got a warranty extension letter relating to the DCM.  In other words, a cowardly recall.  I have put two batteries in a 16 forrester already and when i tried to follow their claim procedure, they want information that i dont have because i didnt know that they were stealing my battery juice at the time.  To make it this complicated for a simple fault of theirs should be criminal.  I hope someone class action sues the F out of them and makes it easy to claim.",subaru
"Well the starter turns the engine so it would be in this case, point still stands it’s just not necessary though.",subaru
"Into neutral when you need to stop, kill the engine, start in first. Trying to engage first from a standstill will most likely cause severe damage or kill your engine. I drove for 5 days 80+ miles per day without a clutch while waiting for parts. It’s not comfortable but if you know what you’re doing the damage is negligible.",subaru
You make the tone of my message whatever you want it to be.  It's text on a screen and you use your own view of the world with the text to make a decision on how that reconciles with your worldview.  Whatever that outcome in your worldview is fine with me.  So you're welcome to make up whatever story you want to rationalize the person you think I am.  Feel free to throw whatever bait you want.,subaru
These guys need to lose their license for a lengthy amount of time.,subaru
"I've had the same code in the past. 

It was a bad injectors cause by a leak in the fuel line, so the injector wasn't getting enough fuel. Went through 2 fuel injectors before I found the core issue.",subaru
😰,subaru
No shit,subaru
But how does it act under compression?,subaru
They still need good tires and a capable driver.,subaru
"I worked at a dealer that had a company that would send these out to drum up business and I can say many people hated it. I don't know this one for sure but the ones we had always way overpriced peoples cars the price they gave was like if you only put 5k on it a year and still have it looking like it just rolled off the showroom, even then those stupid papers would sometimes still be high. Basically these papers are designed in a way that you will almost never get that price. If you are interested in a new car I would say go for it but other then that I say don't bother.",subaru
"I had a dodge journey, the local dodge dealership would send me letter like this every few months. Probably just a way to get feet in the door.",subaru
"Either rear O2 sensor or bad catalytic converter.  In your platform, rear O2 contributes to fuel trims. Out of wack fuel trims can cause boost issues. 

Explore the above two possibilities.",subaru
"I have a google drive folder for each car and folder inside with service mileage.   Take pics of receipts, odometer, vin and oil and filter products.   Then a small word file of services performed.    ",subaru
whats  the best product to protext my fabric seats with? want to make sure they dont get stained so i was thinking scotchgaurd,subaru
It's why there are so many AT second gen Foresters still around.,subaru
Change the plugs. It can’t hurt. I do mine every 60k miles.,subaru
The Outback is a great all around vehicle with amazing snow capabilities as long as the tires are proper for the conditions.,subaru
"I mentioned it in another comment, but I feel like the 22-24 Wilderness Outbacks are “peak” Subaru.  It is my 4th Subaru, and is the best combination of elements from the past 20 years.

Edit: and most importantly, it is most in line with my “late-40’s” aesthetic 🤣",subaru
"Why is it that you and others are leaving out MANY years of the hawkeye from the years?  It's odd that you repeat the same 06-07 I have seen on ""info aggregator"" sites.  It goes until 2012 I believe.",subaru
"Wife's 2011 Forester 2.5 na traditional auto overheats after 10mins driving, looks like sludge/oil under radiator cap, combustion leak detector kit indicates no head gasket leak. I do a coolant flush and replace the thermostat.  (Drained coolant has lots of sludge, but doesn't seem like ATF, maybe not even oil. Just a slimy muted green. Maybe old cheap coolant?) Got everything flushed out and buttoned back up with new thermo. Engine off, cool. Filler up with new blue coolant, 6.8 glistening quarts of it. Coolant gushes out of the engine block somewhere underneath the intake manifold! Looked like several quarts of fresh blue! The radiator bubbled air as I funelled the coolant in, seemed normal for a closed system. Any ideas? Maybe a hose popped off when it overheated? I'm gonna go pull the manifold off after a little rest. Any suggestions appreciated.",subaru
"Thats exactly how mine are. The subaru dealership replaced them under warranty once at 24k miles, now the intermittent squeaks are back at 45k. Pads have plenty of life left. Im gonna put on some aftermarket rotors here soon and see if that helps. Otherwise its not a huge issue.",subaru
So sick!!!,subaru
Cult? Nah! Just a group of friends wanting to have fun together!,subaru
"Listen to this person, OP. I have done the same and I sleep like a baby",subaru
I see some dried leakage on your low side connection on the compressor.  If you do some work it may be wise to replace any o-rings that seem to be seeping.,subaru
"Here is a picture from a different reddit post. The passages next to each cylinder in this engine are supposed to allow coolant flow up past the cylinders and into the head. The head gasket sealer sealed up these passages which would cause the engine to overheat.

https://preview.redd.it/b4ry3u1e37x81.jpg?auto=webp&s=4018193c35a109e0eecda858efcf86df309df645",subaru
If the mechanic slapped it and said “ oh yeah she ain’t going no where” than your good bro!,subaru
It’s a good car.,subaru
"Just a simple reliability mod, no biggie.

Jokes aside, this is effing awesome. Much respect to the amount of time and work put in. Love all shape and size of Subaru - no need to be a purist and keep it flat.

Drag car or DD or...? What kind of HP/TQ numbers are you expecting?",subaru
What year?  Ditto for my 2018. 125k and just warming up. Been flawless.,subaru
Mmmmm I love me some nice fresh rear arches,subaru
"The clamp was probably on intergalactic backorder, and the old one rotted out or broke. That zip tie isn't coming off anytime soon. Don't even worry about it. The boot is sealed. If you don't like it, throw a worm gear clamp on it.",subaru
I think I spelled it wrong. But it's a type of power steering fluid. I know for my vehicle it has to be exact or the PS motor will eat itself in 6 months.,subaru
"It's not ideal, but only filling 3/4's is not dire.  Scared would seem to be a bit extreme, no? Usually, this type of thing is caused by incesent  topping off and borking the charcoal cannister, but I get the feeling this isn't the cause here. I don't have an answer, but I do wish you good luck in finding one.

A year or so ago while gasing up at BJ's I saw a woman top off to the point of gas dripping on the ground.  I thought I would be helpful and >politely< suggested that what she was doing was beyond the waste and pollution aspect, potentially bad for her car.  She told me to go fuck myself.... So, I guess I won't be doing that again? 😁",subaru
"I vote buying a gasket set and tearing the engine apart yourself. I did it. On my $1400 Subaru. 

Same thing too, I could see exhaust gasses in my expansion tank.",subaru
"After the warranty is over and outside factory recall , never use the dealership",subaru
Yes. Subarus are notorious for high(ish) oil consumption even when nothing is wrong. I would strongly recommend against going over 6k/6mo.,subaru
It’s a paid Subaru promotion. Vermont Sportscars (who prepare a lot of Subaru’s rally cars) is close and Subaru hosts (hosted?) regular events at Killington. There used to be a rally somewhere near as well but it think it’s been some time since that has finished.,subaru
"I’ve owned 2 WRX’s and I would never buy a modded one. I had a Cobb accessport and I knew how I drove it. When you have the extra power you tend to drive a little too hard. 
Of maybe that was me, i still haven’t grown up yet",subaru
Thank you for this information!,subaru
"Just because this person may have gotten scammed, doesn't mean they have a license to be a piece of shit in return. And yes it's still unethical to scam a big company like CarMax.",subaru
"I don't know if it's the best, but it really grew on me. In particular I love the way it, as with most Subaru paint colors, looks on cloudy days. I don't like how it's similar to a mid-2010s Hyundai paint color, it makes it less special, but there's no denying its charm.",subaru
8000$ CAD Just to Clarify,subaru
">Mistake.

well at least we learned something today :)

You're going to need to rewind the one that is currently stuck/applying. You can jump the motor if you're feeling confident, or you can manually rewind it using the emergency release procedure. It's a bit long, so [here's part 1](https://imgur.com/ynNM3gP) and [here's part 2](https://imgur.com/tEFWBDX) -- you're also going to need a Torx E12.",subaru
"We gambled and got both the gold warranty and it paid off for each. I do the maintenance on our fleet of 5 cars. I’ve nearly replaced all the wear items in our 2004 Jetta TDI to the point I can probably work on a BEW or ALH engine in my sleep. Our 06 navigator turned 18 this month and so far the 5.4 triton engine isn’t showing signs of detonating like most of its brethren. The 07 HHR that’s flex fuel doesn’t like flex fuel and will throw a check engine light 🤷‍♀️. 

Cars are weird. Some make it through just fine while others are temperamental.",subaru
"https://preview.redd.it/92yhuj13daqc1.jpeg?width=3024&format=pjpg&auto=webp&s=2c8f12e382b03dc26bbd7f71bbfc9d8caa37b033

I’m going to have to respectfully disagree",subaru
"Replacing engine oil with the wrong grade or evacuating the refrigerant is not a safety liability.  

Avoiding safety liability from negligence is not the same as requesting a shop to perform a specific procedure.  

Nice straw man argument. Try again.",subaru
"I'm in KY, I only have the order # from the Subaru website and no VIN yet. Deposit is paid tho.",subaru
"https://preview.redd.it/s9wp4x34ocqc1.jpeg?width=3024&format=pjpg&auto=webp&s=e2580d1e71da9d73b91c4beef8e04d40fd6dfba2

Ayyyy",subaru
"As you changed the battery and now it's working, that must be it. If you have a multimeter you could check the voltage, and if it is between 13.8 V - 14.6V (with the engine running and lights on) your alternator should be fine. But to be honest, this Christmas tree on the dash after loosing power is not unusual.",subaru
"I just had this and got it fixed. It was the Thermal Control Valve in my case which was still under the powertrain warranty, so no charge. The OBD2 error code for me was 2682.",subaru
Like a good Subaru? Lol,subaru
"WRX Type RA

https://partsouq.com/en/catalog/genuine/vehicle?c=SUBARU201802&ssd=%24%2AKwF_S1prKB4_fCYIegRkdSczExQKe3R5eGpFdj44CxwIBAIKWF9PCQkFHh4YGQBaXXgSPDg8DQsIcSQoMHR0ezQ7DDBrfTg8bwsIcn1-fXAsKiRhbi5od35-eCM2JDRucWgObjYAAAAAezq62A%3D%3D%24&vid=0&q=GC8026980",subaru
Or the aggravation of dodging the hungry sales guys stalking your phone/email once you get home.,subaru
"This is fairly common in newer cars. It does 'shut off' by changing the displacement, but the internals still rotate. It does not use a clutch like older cars.",subaru
"That’s exactly what to use it for. I have all weather mats in the back and any bag or lunchbox I put in there will slide around because I generally keep my seats down. My cargo net holds groceries lunchboxes, and my work bag all securely.",subaru
"No like, fill it, and drain the excess. It'll hold like a half quart once it soaks past the pleats.",subaru
…which are pretty much all rackets anymore if you look deep enough. The days of the textbook “fair and just marketplace” are long gone,subaru
"You should try turning it into their insurance first. A lawyer is gunna cost you money out of pocket since you aren’t getting a settlement for anything other than the damages being repaired. 

Show them the video, the estimate, and if the shop gave an opinion that the damage is in line with the claimed loss, def include that. 

This is a pretty easy claim, I’d be surprised if they fight you. They being the insurance, the tow company will probably suck to deal with lol",subaru
"It looks like it straight copied an image of a wrx then was like, “nah need to slap some mods on”.",subaru
"We just got a 2024 limited last month, and we love it so much, too! The seats are so comfy.",subaru
I didn't think of that.  I actually had this happen in the past though and the engine did start.  Just wanted to share for any others reading.,subaru
It sends its signal to the engine computer to make sure the fuel/air ratio is correct for a given barometric pressure. You probably can see the signal with a code scanner.,subaru
I’m going to eventually manual swap this but for the time being looking to just get it fixed,subaru
The engine has a filter. It will filter. 99.9% of people just drive their car and do nothing to it. That is why new cars have more and more maintenance reminders built into the warning screen. Because people would never do anything until the car breaks. They sure as hell are not changing the oil extra times the first few thousand miles and yet virtually every car goes over 150k miles easily today. It’s just fine.,subaru
Zip ties are a factory approved fix for something on almost every single vehicle. Zip ties come in a huge range of strengths and materials to handle different jobs.,subaru
"I mean for a lot of their models there’s after market grilles that keep the badge that look like that

https://preview.redd.it/1q2w5bid7pqc1.jpeg?width=3024&format=pjpg&auto=webp&s=257e2af418ccc3ac98b5894f4cdab9c9a7f58334

The company I chose called zunsport had upper and lower grilles.",subaru
My aunt had this car and later had to repaint and chose white. She later sold it with over 300k miles on the odometer. I personally love the look of that years body styling.,subaru
"Also if you have a Subaru extended warranty they try harder to get you to trade it in,so you don't use the warranty on your high milage vehicle and they have to pay out.",subaru
Hell yeah,subaru
"Oh nice! I love elk when I am blessed enough to have some, venison is easier to get lol",subaru
Yeah no turbo. I am also skeptical as to whether the cleaner will mix in with my new changed engine oil.,subaru
I’ve got an evap leak giving me a check engine light. Most annoying thing.,subaru
"Watch your mileage, though. They have a limit of 10k per year and will deduct from the value of your current car for every mile over that. That's a pretty low average mileage. This whole thing would have gotten tossed in the trash at my house because it just reads like a huge scam (even if it's perfectly legit).",subaru
"If you sign my paperwork that explicitly says customer declined all diagnostic and assumes all responsibility then yes. I would.    

Would I mention you might smoke the compressor doing so if I knew, yes I would. 

Would I go out of my way to check the all data and technical bulletins out lining the repair procedure and potential conflicts, no I wouldn’t. That’s time I haven’t been paid for and I have work to do.  

You pay the mechanic for all of these reasons, not just to change a part.  You want just a part replaced, you take liability.",subaru
"Just want everyone to know that I’m not gonna make fun of him, and this is goijg to be a listening part of the show",subaru
One of my favourite chassis in the Impreza/WRX lineage. Congrats,subaru
"Much less floppy. 2020 was the year that the OB switched to the “global platform” that the XV and Forester use. Its substantially more rigid which puts more emphasis on the intentional moving parts, like the swing arms and suspension. Because it’s a longer vehicle, it’s not quite as jarring as the ride on the XV or Forrester, but its still very “tight” feeling compared to the pre-2020 models. 

Just as a disclaimer, I’m not trying to sell you on the idea of an outback. It’s just worth noting that if the chassis was your main selling point for the XV and Forrester, you might want to explore the newer OBs.",subaru
I tried. She punched me. Instructions unclear.,subaru
"Subaru used to use zip ties from factory for those boots. 

Granted they were medium or thicc zip ties, but point still stands and if they tightened them right it’s never coming loose",subaru
"It's mounted backwards, in the rear of the van. The transmission has a kit that reverses the output rotation.",subaru
Idiots.,subaru
That's certainly the most cost effective path - a new setback is expensive.,subaru
https://youtu.be/Ctg7BOL-Xp0?si=7Zo8YKidRbLUO0Fe,subaru
"Looks like a great time.

Do you worry about oil starvation at angles like in pic 1?",subaru
"Feels like a huge FB scam, all of them like this are.  Look at their post history.",subaru
"no, that's for a crosstrek. should be 91036AN54A. if you give me last 8 of your vin I can tell you for sure",subaru
"yeah, i mean unfortunately the damage is done and im not trying to kick a dead dog. but that tow truck driver though...",subaru
Public radio jazz.,subaru
FYI there's a ton people in this sub that refuse to believe that many (most?) Subaru dealerships in USA say it is a lifetime fluid and sealed unit. My dealership absolutely will not do it.,subaru
🤮,subaru
"You’re totally right, I know I need to dig into the fuel issue but I’ve never messed with it and I’m terrified to screw something up that’s fuel related. I’ve seen too many videos of these things burning to the ground lol",subaru
"The Legacy for me is a workhorse. 

The trunk is absolutely massive, which is great when you heading out camping as a family of four + dog and need to slam everything in there.

Also tow a utility trailer with it to move anything large or that couldn't fit in the trunk. Last week grabbed 7 targets from a throwing axe place around here that I'll feed to my wood furnace.",subaru
 👍   will be everything you need and more,subaru
Exped MegaMat Duo 10 fits perfectly. Get it on sale for <$300 and you're golden.,subaru
Reddit user discovers boxer growl.,subaru
Clean!,subaru
Paint marker.,subaru
Word I’ll look into it 🙌,subaru
"I don’t really like seeing them on cars I work on, it creates a lot of unnecessary stress on your suspension and can lead to you need to replace bushings, ball joints etc sooner",subaru
"Worth trading in my (paid off) ‘19 forester limited or ‘22 legacy base (not paid off? for anything currently in the lineup? 

Mostly want something to tow so Outback or Ascent, but wouldn’t mind complimenting it with a hybrid or something good on gas. ",subaru
"I’ve had to go in to the dealership for parts & they’ll pull up drawings of that area or part & attachments, should be pretty quick.",subaru
"> but the PNW generally demands a higher price for Subis

ain't that the truth.",subaru
"When we got a new Forester Sport I looked and researched the best rust prevent spray. There were 3 that stood out. Wool Wax, Fluid Film, and a new one made by PB Blaster called Surface Shield. I bought the Wool Wax applicator gun and a gallon of Surface Shield. Put a tarp down, car up on jack stands and thoroughly coat everything. Will do it again soon as it gets warmer. The applicator gun allows the product to be sprayed into the channels of the frame which is good.",subaru
"I had always wanted a robust rally car, and the 2004 Forester XT really fit the bill.  I loved the hell out of the Forester, but ultimately wanted something new around 2013, so figured I’d love the WRX even more.  Turns out I’m not a very cautious person, so I really scraped and scratched the WRX to hell on curbs and such.  I just never really loved the car.  When the recent incentives came around, I took a look at the 24 Wilderness Outback, and just fell in love again.  I’ve had it for maybe 3.5 weeks now, and just look for every opportunity to drive the thing.  It is pinnacle Subaru in my opinion.",subaru
Ambient Air Temperature / Barometric Pressure Sensor,subaru
"Yeah, I really wish that subaru thought about making the CVT really durable",subaru
They give you an estimate yet for the damages? I had mine written off recently.,subaru
"Good idea. Part of the appeal of a Subaru is how well they hold value, but not if it’s been crashed.",subaru
"We're not 100% sure it's the fuel lines, but it seems the most likely culprit. He's going to do some digging for me to try to figure it out before we just start throwing parts at it.",subaru
"“The new Subaru of your choice will be available for less than your current Subaru Impreza”

I’d agree with the other comment but this line sure makes it interesting!

Maybe they mean less monthly payment over a longer term or something. But hard to say without going and inquiring.",subaru
"It's also behind the first Gen EZ30D. 

Currently at 210k on mine. And it'll still bury the speedo past 120mph....",subaru
Why bother replying if you don't answer the question I ask?,subaru
Have a 2021 and live in MN. Had no issue in the winter and car camp out of the back. Usually just have my sleeping pad in the back and a sleeping bag for roadtrips.,subaru
How much was it to fix? Was it able to be driven still or should I avoid driving with it until I take it straight to a mechanic?,subaru
I rarely use my wipers. I treat all my glass with rain-x. Pretty much negates the wipers.,subaru
"Thanks! I definitely got some semi-negative feedback on my other post. It's a little too different for the generic Subaru folks 😅 But I don't care. They are probably the same people that call me a witch under their breath, so I don't take it to heart.",subaru
"Well, since a dealer and a separate shop both said “sounds fine”, and I plan on putting a couple more reliability mods into it, I’ll be asking the next mechanic to do a teardown of the engine so I can finally be sure 😅",subaru
https://preview.redd.it/7mjex51fgfqc1.jpeg?width=492&format=pjpg&auto=webp&s=c3035187f339aea4ae5de7159960c7c6da1d087b,subaru
"Yep, it’s just the wording of the dealership that concerned me, they said it was “nearly empty”. But I’ve been checking it weekly since that happened, and the upgraded pan I put on it holds 6 quarts of oil in addition to having the strengthened oil pickup, so it’s beefed up and being watched closely.",subaru
"I have never had elk sadly, I live in MI and there is a lottery to hunt them. Deer is readily available though",subaru
Better to be safe than sorry 🤌,subaru
haha gooooooood one. i'm gonna get right on that. rrrrrrrrrright after i get my HEAD GASKET replaced,subaru
Yes. This was indeed a joke.,subaru
I've had this happen in my GMC. It uses a USB cable. Swapping out the cable did the trick.,subaru
I figured things like milk and such would fall over cause they're too heavy for the net.  It doesn't seem very strong and stiff.,subaru
"Damn, good eye!",subaru
"Would you evac this car, start it, and move it to customer parking if I told you to?",subaru
I did not want to read the fine print...  Congratulaions to you for making me read the entire small print.,subaru
Completely normal. That'll settle in. I think they use the same bushing for 2mm or pipe thickness variation so if you're using a 20mm bush with a 21mm bar it will have a small gap. Just pull up and down on the bar and make sure its secure.,subaru
"I dont even know what that is, but I stuck the phone out the window to get a better shot...?",subaru
I think the easier tell is there r stickers on one and not the other 😂,subaru
they will drive up and yank the car and disappear before they give a shit about the VIN. they want to be gone before the owner has a chance to intervene or escalate.,subaru
"I’ve run it about 2,000 miles and thoroughly cleaned it since I pulled it out of a garage. It doesn’t seem to be too sticky, thanks for the tip!",subaru
"I should be able to just as easily say that the tech would check the oil level before releasing the vehicle, so I won’t count on said tech noticing a difference in the trans",subaru
