Comments,Make
"Honestly an old SAAB is generally just for enthusiasts who can work on it themselves most of the time. If you don't have money and time, it'll be difficult to upkeep it sometimes. 

If you have access to a good mechanic nearby you'll survive.",saab
"9-3x griffin, 9-5 aero griffin hirsch, 9-3 aero, 9-3 aero saloomom, ng 9-5 aero hirsch",saab
Did you solve the issue yet?,saab
"Genuinesaab makes a t7 head plug to replace this leaky bit, I highly recommend. Requires removing valve cover and the leaking plugs bracket to install but it’s worth it. Mine has yet to leak since I installed it awhile back.",saab
Hmm ok ok,saab
Fly into Dc. I’ll pick you up Fri at IAD and drop you back on Sun.,saab
"You can find it for half or more in Denmark, ask around! ",saab
"1993 9000 CSE turbo - one of the last with the B202 engine (currently in the process of installing an Aero bodykit and new paintjob)

1993 9000 CD Griffin - awaiting to have time for its restoration",saab
Why do you think you need a timing chain?,saab
What is the timing service?,saab
"9-5 NG
Hi, I also noticed that my xenon lights are getting dimmer but no flickering or purple light coming from them. The lens is clear and undamaged but driving with a high beam is a must with this issue. I was considering converting xenon to LED just like Jonas Karikas did on his YouTube channel.",saab
Opel vextra wheels. I got them probably 13 years ago off Saab central.,saab
"It's not only the alternator, this car has left me stranded about 4 times in the last 6 months due to different problems.",saab
"I believe most olders seats just have a pressure switch that completes the circuit, letting the ecu know something heavy enough to be a person is there. My bag sets my 07 off constantly. If you could get the harness out of the seat leave it plugged in, I imagine it wouldn't trigger the computer & leave everything functioning. Plus, depending on the cop they will write tickets for faulty safety systems. In Ohio they love tickets for failure to keep required safety equipment functioning or w/e the air bag law says.",saab
That car is beautiful. Whoever you sell it to make it gets taken care of.,saab
Take that back :(,saab
Np,saab
"I could be wrong, and in fact probably am but I think that's for OnStar which is unavailable",saab
OG 9-3 is Beautiful,saab
I love Opel and Saturn wheels on Saabs. Just wish I lived somewhere where those wheels were easy to come by.,saab
"I've had 5 total in the family over the years.  All 9-3, all 4 cylinder,  all FWD with 4 snow tires on the winter.  My impression the 9-5 has more problems and so does the V6,  economics in my case.  I was happy and familiar with one configuration and I stuck to it.",saab
"Love how they’re all different years, colors and body styles even tho it’s the same model",saab
Not that ive noticed. Im just confused,saab
"Those odometers break if you hit the reset button while driving. 

Yes they are easy to work on if you have parts to replace.

Is it a non turbo automatic?",saab
My wife’s 2007 9-5 Aero wagon is fusion blue - great and rare color. And it’s a manual!,saab
Very nice! I have a 07 9-3 with 304k miles that I've been considering putting a stage 0 tune on. Is yours a automatic?,saab
My gf had a merlot 95 arc years ago and I've been loathing for a 95 since. It was such a nice car for a 04' but the head gasket had other plans and I wasn't too mechanically inclined then. I still dream about fixing it now hahaha. I think it was tuned too but it never built boost right,saab
"What year, mileage, location and price?",saab
Is it plastic? Mine is metal. At least the top part is,saab
"Should i take something off the engine, or should i leave everything (pulleys, power steering pump, etc) on?",saab
"Nice! I'm headed up tomorrow morning to ski, pretty excited.",saab
Bet tomorrow will be glorious for skiing! Enjoy friend,saab
I gave my son his first ride in the Viggen and we got in a fight because he kept asking me to put his window down and he didn’t understand the back window didn’t go down 🤣,saab
That’s sick!,saab
Just buy a euro bumper,saab
Why are you parting with such a beautiful beast!?,saab
What diesel?,saab
Oh thanks,saab
"It's gonna run like shit with the new turbo if I detune it, we upgraded it when the old one blew a week after I bought it 😂",saab
"I’ve been meaning to test the fans for a while now but keep forgetting. This is super helpful information though, thank you!",saab
"Cleaned the throttle body and put the new seal, will see if did anything after fueling up someday. The throttle body was pretty stiff and gunked up but now it isnt.",saab
"Modified ‘00 9-5 wagon, and a clean ‘98 900s 2-door hatch. Love them both :)",saab
"God, I love German. Can hardly wait until they rearm and end up in some sort of skirmish with the Ruskies.",saab
This is the 3.0 v6,saab
"Thank you sir, I appreciate that, I kinda like the way the gold goes with the red, maybe I’ll go get a set of factory spokes powder coated lol",saab
"eSaabparts as not only are you dealing with an American company, you are also supporting the Saab Heritage Museum which ultimately is also your museum.  If you ever get a chance you MUST go there.  There are only 2 Saab museums in the world.  One happens to be in USA.",saab
"Mid May, Pennsylvania",saab
"Yes. Someone downvoted but being on the owner side of a tint/ppf/wrap shop, it would be cheaper, if OP was able to wrap or paint it themselves. Wrap isn’t necessarily cheap, but it’s also not as expensive as everyone thinks…. They also offer afterpay through their websites. Labor is the cost that stops people from wrapping their cars. We start at 5 thousand for wrap.",saab
Fair point.,saab
I heard him talk in an interview and it just seems to me like he’s full of hot air!,saab
2008 9-3 Aero XWD (Vtuner stg 0) and 2010 9-3 2.0T XWD (maptun stg 1).,saab
"Check the plastic jack pads. If those are missing I believe it’s a hole straight through the underside of the car into the cabin. 

Also take off your door cards and inspect the vapor barriers. If there’s a tear in those it will leak water into the interior. Door seals also fail.",saab
"Make sure your brake pads aren't seized in the caliper bracket. Likewise, ensure fresh brake fluid is used and your calipers are not seized either. 

A Saab is not a Porsche, are your expectations reasonable?",saab
I’ll check the hose. Thanks for the info!,saab
"Parts are taken, thanks guys!",saab
"Shouldn't be as the battery is a few months old too. And i remember as i replaced it the start up issue was still there. Could be one of the cables going from battery terminal to startup engine, gotta check it for corrosion next",saab
Wait biopower sorry 😅,saab
"Check the hydraulic fluid reservoir & the lines. Might be busted. Usually have to take it somewhere but I suppose it's not impossible to do it yourself - if that's the issue - but I'd check up on various old forums for folks who have DIY'd it

The whirring you hear is the electric motors trying to work, including the one that will unlock the back from the tonneau cover.

[This is how folks usually do the cabrio conversion by hand.](https://www.youtube.com/watch?v=erOWLr6HqOs) It does involve pulling back some of the trunk liner and using the tire iron to operate a mechanical thing inside there. Have to get out of the car to do it and all, but once you have the whole system down it takes no more than 60 seconds. We did this with our 9-3 for over a decade once the hydraulic lines broke

EDIT: Here's a couple videos I found from Pancis on DIY'ing the hydraulics. 
https://www.youtube.com/watch?v=1lLKG2FT0Xg
https://www.youtube.com/watch?v=oIrKgEZQzdA",saab
"I had a V6 XWD for 8 years and it was fantastic. Reliable, fantastic sound and fun in the snow. The thing you should check beforehand is that the power delivery is smooth during hard acceleration. Stutter can be the clutches/hydraulic pump starting to give up. Hydraulic pump can replaced so that’s not a major issue. Also be sure to regularly change the oil.",saab
I've only done it a few times but it'll last about 4-6 months at a time. so maybe once a year for winter?,saab
"Hey, fellow Mainer!",saab
Heb zelf ook een 900 classic en denk al een tijdje om hem iets te verlagen. Enige tips waar ik het beste kan zoeken en welke onderdelen ik precies nodig heb?,saab
"I never knew a car could look promiscuous, but this one is a real hussy",saab
"Depending on your budget you have a few options.

Expensive: BBS RS (cross spoke)

Cheap: Enkei 92 gold, get them in 4x100 and redrill them to 4x108 to fit your 900",saab
Nah the chrome is classy if it was a viggen I’d go black.,saab
"Saab 99/C900 - The lower control arm mounting points are a fairly common rust point.  It is repairable with a patch panel (purchased or homemade, it's not incredibly difficult just time consuming).  You would hopefully notice this when inspecting the spring seats, but it is worth mentioning.  

http://www.saablink.net/forum/general-classic-900-posts-information/23318.htm",saab
"Remove intake and exhaust manifolds, turbo, axles, and any other engine parts you want to save. Take as much out as you can first. Disconnect all engine mounts, Drop the front subframe while supporting the engine and trans, then angle the engine with the passenger side up and the transmission side down, then slowly and carefully lift the thing out. Would probably help to remove the hood for this. 

Would also recommend removing as many parts from the chassis as possible, things like window glass/windshield, interior pieces, etc. selling them used could help save another saab!",saab
I've seen 500 000km for sale in france and working,saab
"Jesus theyre kinda expensive. I also looked at the lowering springs and it says theyre not suitable for xwd. What makes them not suitable? I looked at both coilovers, one says xwd, one says not, they have the exact same pics.",saab
Beck/Arnley kit. If you are having the car towed to mechanic don't worry about changing oil. If driving it change it and let whatever sludge out. Remainder will be done by mechanic. I get it about $$$. It will be worse if the engine out turbo dies.,saab
"I just checked all my coils and some of them had very tiny cracks so assuming they are bad I bought new oem ones from eEuroparts, moral of the story never buy used coils from eBay even if they say they come tested and in working condition",saab
The Forbidden Pepsi,saab
"I dont think this is that. It says that its voice controlls in the guide, and has a list of the commands that you can use to control the audio in order to spend less time looking away from the road",saab
"Wait a minute, he kept the turbo x wheels? 

Side note: check the Saab forums, car-part.com, Saab Facebook forums for wheels. 

You could also browse the web and see what other owners have done using aftermarket wheels and tires.",saab
"A common problem, that also has happend to me, is a bad crankshaft ventilation system. I causes the oil to sludge and with time your oil pump to make noises when cold. You should have it change along with oil and maybe give oil pan a clean",saab
"'86 900 T8 3door manual, '86 900 T16 convertible automatic, '00 9-3 5door manual, '07 9-5 sedan automatic",saab
"Link Is for MY99. Access is difficult. Recommend using a mechanic, different to the one you consulted. Initial work on a hoist eases installation.

Oil change by yourself before going anywhere, and at garage for sump drop.",saab
i did actually this is an old pic,saab
Agreed just had my balance chain guide and tensioner replaced,saab
"I actually just wanted to post one last picture and didn't expect so many inquiries 😅

Here are some details:

Saab 9-5 Aero 2.3 SportCombi with 306hp/400Nm Hirsch Performance Step 2 with Garret turbocharger, larger intercooler, 2.5-inch exhaust system with metal catalytic converter and downpipe, as well as dual exhaust system, Hirsch ECU, Hirsch Performance brakes, performance suspension with springs and dampers, 18-inch Hirsch wheels, front bumper, rear bumper, side skirts, and roof spoiler. Automatic with paddle shifters.

The brake calipers were overhauled last year, and the brake discs and pads are new.

Winter and summer tires

~305000km

New engine at 170000km

New TÜV 03/2024

Cons:
The paint is peeling on the driver's door, but I have a new door in the garage that just needs to be installed.

The new brakes sometimes squeak, but according to the workshop, they just need to be cleaned with a wire brush at the next tire change.

The headlight level sensor is broken, so the headlights are at the lowest setting. It never bothered me.

Driver's side seat heater broken

I've invested about €15000 in the car and would ideally like to get €10000€ ~ 13000€ back. But I don't think I'll get that much anymore. Make suggestions.",saab
"Oh shit very impressive lineup, was looking to get a XWD aero. Any problems with the haldex xwd system?

Edit: the 9-7x stands out in that lineup😄",saab
I almost shidded the first time I decided to try that button while cruising down the road.,saab
"2002 9-5 Aero
2006 9-3 Arc vert
2010 9-5 Aero
1986 900 Turbo",saab
Nope. Be zealous about changing the fluid and filter and she’ll take care of you.,saab
The bow-legging/cupped rear tires on the 9-5 is due to sagging springs (which are easily fixed with a spacer from JJJ Performance) or bad bushings. ,saab
"Nah I’m in the south but I’m not too far from a big city (Nashville, Birmingham) so I’m sure I can find someone to do it, guess I might as well kill 2-3 birds with one stone and have them put the tires on and balance them while I’m there.",saab
"Usually the service light comes on much quicker, like within 100 miles or so, and it's when the fluid needs topped off after having run through the unit.

I've developed a very small leak after doing mine a couple years ago; I wonder if perhaps you've lost some.",saab
"My opinion is it already perfect, perfectly make me feel comfortable when see this car",saab
If the. Shift breaks then you worry. But don’t worry over that silly cosmetic piece.  Unless you just bought the car,saab
Wow…,saab
Fix your vacuum leaks? You got check engine light?,saab
Go to Row52.com and do a search in your area.,saab
"Gee, I hope mine never fails.",saab
"My tip would be to drill a hole in the Firewall to the battery compartment
Get a decent size cable and rout it to an amp
Get some screws and bolt a new infotainment system inside of it
An dlastly dont forget the speakers on the missile hangers cant have that baby without some creedenve blasting on the outside.",saab
"Something like this: 

https://www.originalwheels.com/saab-wheels/images/saab-9-3-rims-68208-b.jpg",saab
You can but the oil lines are different. What's your end goal,saab
I so want to find a decent condition 3-door in the states.,saab
"Awesome, I love the turboX",saab
Good point,saab
He has good taste,saab
Right! Fuel pressure regulator I'm gonna check that one after the battery terminal cables. Lets see,saab
My buddy also had a blue viggen with RK2s on it he sold and he's regretted it since so make sure it goes to the little man. I have a project of a 900 going on and im just waiting for some more space so the little one and I can wrench on it,saab
I fear the day that combo pops up for sale; I will be too weak! I went from a 9-5 aero sedan back into a Viggen and I definitely appreciate how wild the Viggen is compared to the smoothness of the 9-5.,saab
"Not to get from 4x100 to 4x108. Those will cover a 1-2mm gap like 5x112 to 5x110, not 6mm or 8mm.",saab
"The only good complete kit is maptune. I run a set of Bilstein B8, with h&r springs on the front, and a set of 12"" 2.5"" ID 350 inlb springs in the rear from eBay. The only issue I have is the Bilstein shocks for the rear are different from the Nevomats from the factory, So you lose travel downwards. I'm looking into finding a shock with a longer plunger, or extending the Bilstein ones with a threaded extension",saab
Don’t put the Viggen up for adoption!,saab
yeah could just be the regulator which is like $50. that lower allen head bolt can be a bitch though.,saab
"Both rear calipers are almost new, happened with the old ones as well, as that's why i replaced them

They screw in very easely

My fuel econony went to shit when they added 10% ethanol in the fuel, from 5l/100km to 8l/100km :)",saab
"Well, mine has been trouble free besides the timing service. That's a big ""besides,"" but you're about 20k miles from it and you might be able to do it yourself. As pointed out, having a mechanic that will work on it is also a factor. But where you are, I imagine that won't be a big issue.

The Turbo4 is not a particularly complex car. There is a lot more to break on a Turbo6 or Aero.",saab
Yeah I forgot to say it’s a 2000 95 thanks for the help,saab
"It’s all one button, it’s just up and down for tuning the radio lmao",saab
Ive never seen an OG Pre-Dame Edna with painted door handles before.,saab
Esaabparts says it's unavailable + it's almost 500 dollars on their website,saab
"Built/modded cars don’t do as well on BaT. I’d start on SaabNet

It also looks like you bought the car for $25k last year!? Then had to build the motor…ouch. I wouldn’t expect you to get more than $15k for it. 

https://bringatrailer.com/listing/2008-saab-turbo-x-10/",saab
Facts! Surprised to see downvotes on this...,saab
Saab sellers are usually on some crack with their prices. I’ve long accepted that I will run all my cars into the dirt as I’ll never get back what I put into them.,saab
"6,3mm.",saab
I have one in NY if you still need one.,saab
[Saabnet.com](http://Saabnet.com) has classifieds. [SaabCentral.com](http://SaabCentral.com) might too. I'd try those. Also look for a Saab Facebook group local to you instead of just marketplace.,saab
"Well I have a wagon, but my buddy who has a '99 mustang convertible puts winter tires on it and once drove it to Chicago with the top down",saab
"Just two, 09 Aero Sport Saloon TTiD Manual and an 09 Linear Vert TiD Auto.",saab
"As it's the diesel it won't have 4wd which makes owning it easier as parts are hard to get. the front suspension should be the same as any other 9-3 but the rear probably has self levelling shocks so you have to watch out, also getting rear springs is hard but you might be ok as it doesn't have 4wd.",saab
Hell yeah 😎,saab
"Any mods on interior?
Pics please?
Just curious if you have changed gear shifter in anyway. I think aftermarket is way to go with these and looking for suggestions to fit the 6 speed reserve lock Saab 93 2010",saab
"BMW vanos I think covers the question nicely.

At least Saab had a sense of humour with the direct ignition cassette, urgh got a broken DIC again...",saab
Best you can get is aero break calipers with ventilated discs and OEM pads.,saab
"I recommend you not to run the apc valve without the map, you car is maybe going too lean or too rich. If you join trionictuning.com there will probably be someone that can marry them for you with t5suite2.",saab
It’s gasoline based on the rev counter,saab
Holy hell. I would be forever grateful.,saab
Is there a way that it could be that i need to grease the u joint(s),saab
"Thanks, I can do a pretty good write up on the first gen 9-3 and the second gen 9-5, and an okay one for the NG900, but past that I would only be able to point out the common rust spots. So if anyone would want to help/do those that would be great. I can organize it all into my post if that would make it easier to use. I think eventually when we are done Samurai666, you should edit this post so it just reads as the final write up, instead of a post asking for the write ups.",saab
nice first whip for sure enjoy,saab
That’s probably what I was thinking leave it on SAAB net then try BaT if no success after a while,saab
C6 Corvette Part,saab
That's a nice one.,saab
"Flushed my fluid a year ago, so that should be fine, might be the abs, as it is crazy loud when it's sub zero",saab
"It’s actually the next CD button, it only works if you have the external CD switcher connected in the trunk. It also functions as next radio station button.

The middle one (seek >>) does next track for cd’s",saab
Badass,saab
"Careful, you need a master cylinder that can move the right amount of fluid for a multi piston caliper.",saab
"The most important thing to look for at this age is things leaking. Look under the engine and examine around it. By age 24, all these cars will have had every gasket, hose and seal degrade. Taking everything apart to replace them becomes a large project. Also ask for a pre purchase inspection. Could save you a lot of money",saab
"Yes, the us plates don’t line up with the holes in the trunk",saab
Congratulations! I can't think of a better car to spend that many miles behind the wheel in. Here's to the next 250k! 🍻,saab
Yeah your missing a complete seal on that valve cover.... You can see the friggin oil leaking out... That brown stuff liquid is oil my guy....,saab
Double triples?,saab
"Save yourself alot of headaches, only buy OEM used CVs for any SS 5 or 6 speed manual. All the aftermarket ones are too short and will pop out once you start driving.",saab
"I have the same problem, you ether change the instrument cluster or just hit the dashboard lightly with your hand until it lights up and it will start (work with my car) thank me later.",saab
"Worst case you've only spent $5. 


I did forget - make sure you clean the hole thoroughly before inserting the new plug. There is what is probably acetate on the plug to allow it to seal. If there is oil etc in the hole it won't seal well and will leak prematurely. If the hole it clean and you drive the plug in straight it will last a long time. I changed the one on my SE in '17 and my Viggen in '18. Still bone dry.",saab
I gotchu😏. And thank you 🫡,saab
Especially over bumps lol,saab
Beauty,saab
Ok I will give that a try thank you...,saab
"Hi all, recently bought a 9.3 1.9 tid sportwagon. Runs smooth and pulls well through all the gears. Slight rattle-ish noise at low revs when revving and coming off throttle? I think it's potentially a DMF issue. Any ideas?",saab
Don't listen to the purist haters OP this goes hard as fuuuuuck.,saab
The volume of air hitting the MAF sensor is critical as it works on a temperature differential .The ECU might be miscalculating the air intake so inadequate oxygen is leading to inadequate combustion or' pinking like what used to happen with dirty  carburettors. I once had a 99 reg renault megane with a bad 1/4 inch breather pipe which used to walk itself loose and cause the car to shake violently on three cylinders essentially a vacuum leak.,saab
You need a mechanic already?,saab
"Doesn't matter where you go bud, always get a quote in writing and do not accept verbal commitments.

I had a similar experience with a vendor here in the east, where by on collection day my bill had rose and extra £600 with no justification, so I presented the agreed quote and forced the already eye watering but agreed price of £1100 for the work undertaken and that all other work claimed wasn't agreed in advance and therefore at their commercial risk.",saab
It is not like this. No need for tech2 if you put the battery on after a few months. My saab has 2y of battery off and it wans not needed.,saab
"2005 9-5 Arc 5-speed manual
2007 9-3 60th anniversary edition in rare Fusion Blue color

I’m looking to sell the 9-3 so i can get my 9-5 running again… i miss shifting through the gears.",saab
Worst case scenario is that the remote losses the rolling code synchronization with the car.  Repeatedly pressing the unlock button will resync it.,saab
I bought it…,saab
"Yeah, no way $300. 🤯",saab
"Might be specific to ""old reddit"" users, so my best instructions are:

1. Go to this website: https://old.reddit.com/r/saab/

2. Scroll down a bit and look at the right-hand side bar

3. Below where it says how many users are on the Saab subreddit, there is a checkbox that says ""Show my flair on this subreddit. It looks like: _________"" 

4. Put your desired flair/info in the blank spot!",saab
"Tbh, you should look into getting the window fixed sooner than later, as you run the risk of not being able to close it after parking in a public carpark when you're in a rush to go somewhere.",saab
That will make the security light come on,saab
"Im not sure, the seal thats in it right now has rubber molded to it all of the way around it where it seats into the transmission. I replaced it the first time with a metal one and it continued leaking. I figured the rubber coated one would be worth a try and seemed quality to be honest. I couldnt imagine it being worse than the metal one. Id say its probably not leaking around the outer edge of it. Its flushed into the transmission all of the way too.",saab
"You could just wrap it, would be less expensive (to a degree). A respray is probably the way to go though.",saab
No I made sure to put it back in the same spot in the engine bay with the same clocking,saab
"No, absolutely no. 
Unless you would like to be featured in r/shitty_car_mods",saab
They made great fucking cars.,saab
"It must be possible on the technical level I however doubt you'll find many Saab Enthusiasts who have done mods like that - it's not really in the spirit of the Enthusiasts I've met so far.   
  
My guess is you'd have to see how it's executed in that TT or similar and see if it's applicable to your Saab.",saab
Thank you very much!:),saab
Suspension looks broken.,saab
If you would slap some trim restore on your baby you wouldn't have that problem!,saab
Yup😂,saab
