Comments,Make
"Thank you, I shall try that :)",seat
It does AFAIK. I went for the 6-speed manual version myself.,seat
The 5F doesnt have an OCU module so you cant use the connect app :),seat
No it doesnt. At least foe the 5F... cant say for sure if its the same fir the KL.,seat
It's the 1.4T + EV motor with combined 245hp?,seat
"Good to know, could you share what one?",seat
"This is what it is saying under software version.
There is also alot of info under HMI I don't know what that all means 😂",seat
"Same thing, I'd phoned up to check and they said it's a recent change to 100k or something",seat
Toledo looks cool in the pic. Did you create the pic OP?,seat
thank you!,seat
I'm baffled as how someone has the means to replace cars as I do replacing toasters,seat
DSG service (oil and filter change) should be done every 40K miles. So you're fine as it's not due yet.,seat
It brings the car manual to you to read if you press,seat
"Any vag group car you need to be on top of oil top ups as once they tell you oil is low the damage is normally done and it’s to late, is it petrol or diesel ? Just basic maintenance, regular oil changes, usual servicing requirements should see you through.",seat
"No , not at all , just whenever I’m going at slow speeds at slow speeds , but some days it happens , and sometimes it doesn’t ",seat
"It should be a picture of a car beneath radio ( thats where mine is, 2014 leon fr, ) if not, next to the shifter if its not automantic",seat
"Thanks, how to update Sat nav and system in mk3?",seat
"WD-40 if they're a bit stiff, mine were hah",seat
Ooh dear. That’s the auxiliary belt tensioner that has snapped the casting off the mount. Luckily the mount is replaceable as it bolts to the engine block. Fairly involved as air con pump and the alternator will also need removing to replace but better than needing a new engine block.,seat
"I think it's too expensive. I know it has good options, but you can get them for much cheaper with lower milage if you choose a different engine. It also says matrix led which this car never had the option for.

In 2018 I was offered an Ateca FR with almost everything and the same engine with 20k km for 32.000€. I think it would lose much more value than 10k€ over the years. 

Do you have options to choose from?",seat
"Though I have to say, practicalities aside, I actually prefer the look of the pre-2021 facelift dash, the infotainment screen looks more integrated, no tacky red plastic vent trims and (faux?) leather coated surfaces instead of grey plastic...",seat
"That is a great deal! 💯 I only did this because my company offered me and included a fuel pas, otherwise i might have done the same as you :) looks like it just came out of the factory 👌🏽

And i also looked into the remap but because it is a company car i might get in trouble 😂 only option is to backup the old config and put it all back to normal when i give it back.

But maybe that is just throwing money and energy away.

I heard after the remap it all runs alot smoother tho and little faster ofcourse ;)

Congratz with your car dude!",seat
I have to look. Where can i find this?,seat
"Yep, I’m sure their will be a day I scratch it. 

Assuming it’s same colour as roof rail and grill outline too.?",seat
"Oh ok, I’m a bit worried about longevity tho. Not sure if I’ll remap it",seat
"I think you'd have to reset the ECU for every service (and even then SEAT may notice it's been changed) which could invalidate the warranty, which I don't think your company would be happy about.

You can get some external plug 'n play units (e.g. https://www.chiptuning.com/en/powercontrol.html) which override the car's ECU, which don't leave any digital trace when removed, but I'm steering away from those, as have heard some people say they can muck up the engine, by making it run too lean etc. and is not the same as a custom remap for your car.

What I may do soon, though, is to swap the stock 215/45 R17 Nexen Blue HD Plus tyres for something nicer when they start to show a bit more wear, probably either Goodyear F1 Eagle Asymmetric 6s or Michelin Pilot Sport 5s, which should improve both handling/grip and braking distances in both wet and dry.",seat
I’ll try that,seat
I think u just gotta have the heated seats upgrade i dont think its the usual,seat
I have a Leon 3 style version and the suspension is softer than the FR and is still pretty hard.,seat
Yes it will have a GPF but they don't really get blocked like a DPF because petrol engines warm up quicker and run hotter than diesel so they don't really ever need to have a long run to regen it just happens passively,seat
"In the east, close to vienna. Yes and might get an Ibiza ST soon, which I'll wrap nardo grey (and make efficient af).",seat
"It is pretty harsh on bad roads. Like ridiculously harsh.  My friend's Kia Picanto is more comfortable on uneven roads. 

However it is impressively stable when driven to the limits. Seems like it wasn't designed for comfort.",seat
[deleted],seat
"Doesn't sound broken. 

It's going to try to get you to shift up at 3000 to 3500 rpm. 

And shift down below 1800 rpm. 

It knows whether you're on a hill or not and I think it can include that data.",seat
Thank you mate. Waiting for it.,seat
"Well, two new rituals when entering in a car:
-turn off start and stop
-turn off ISA 
Thank you!",seat
"some people are able to hack even those units but herefore they have to open it and hook it up to a terminal. idk if someone in your area can do it.

aside of it. i think, that the full link is worth having.",seat
"I havent been charging mine as often as I should as I cant charge at home, so in the 4000km ive driven ive averaged 30mpg. Compared to the like 60+ i was getting in my 1.6tdi ibiza",seat
Not for MIB3.,seat
"The oil lift pump died, throwing the light, the 30 seconds you ran it for would have probably toasted your piston rings and at that point, the engine is worth scrap.",seat
"Basically lsd or ""Limited Slip Differential"" will take the power that gets wasted by the tire without grip and sends all the power to the tires with the most amount of grip.
Enabling to put more power where you need it the most, and XDS its the way Seat mimic this with software using the ABS and brakes instead of mechanical lsd.",seat
"Honestly, we have 3 of them. They have been misting since 2018, still no requirement to change them. So you should get a few years out of them.",seat
Don't like the change at all mate..,seat
"Auto parking brake, it an idiot aid for people that forget to put the parking brake on or struggle with clutch control.",seat
"> lte signal car booster

Did it before posting. Bunch of bullshit comes on",seat
"Fairly straightforward retrofit if you're comfortable cutting the hole in the bumper trim and running the wires to the infotainment unit quadlock connector in the glovebox. There's a printable template in the workshop manual to make the cutting easier.

5Q0980556B is the camera part number if you want the highline version with the dynamic steering lines and switchable camera views",seat
"Have you updated the firmware to the latest? You can get the files to do this from here: https://eastyorkshireretrofits.co.uk/collections/seat-leon-mk3

They can also supply map updates.

I used this place to get the files to update the infotainment screen to the latest firmware on my 2021 Ibiza FR, the update went fine, once I figured out how to get to the engineering screen (by holding the menu button down).",seat
So if I remap to 115 it's basically the same as buying the 115 version ? I imagine breaks are better and other things...,seat
"I did a remap on mine (2016) but same engine. 137hp and runs fine, zero problems whatsoever and the difference is night and day. Maintenance every year cause I can't reach the kms interveval. Good oil and good filters and runs just fine.",seat
All services has been at seat and on time. Fuel system cleaner is next,seat
As a VAG tech i can tell you that this would never ever be labeled as wear and tear at my shop. Take it to a shop and have Them look at it,seat
"Mind telling me what head unit you got, like the exact model and cameras?




Can the tyre pressure be reset using OBD perhaps?",seat
I know,seat
Wireless charger + amplifies signal,seat
Nevermind test drove one with the DSG gearbox today and f*ck the manual.,seat
"Looks just like mine, including the black alloys!",seat
Just what I've been looking for!,seat
"Driving 10 miles through Manchester city centre takes 30% of battery.

Driving 19 miles home on the motorway leaves about 5% when I get home.

So about 30 miles for me",seat
"Yes, essentially it is part of ESP programming, this is what VW said when it released XDS back when the Mk6 GTI came out:

""Sportier and safer with XDS:
For the first time in a Volkswagen, the XDS electronic transverse differential lock is being used. It significantly improves traction and handling properties. Tech­nically speaking, XDS is a functional extension of the electronic limited-slip differential (EDS) integrated in the ESP system.
In fast curve driving, as soon as the innovative electronics detects that the wheel at the inside of the curve on the GTI’s driven front axle is insufficiently loaded, the ESP hydraulics specifically builds up braking pressure at this wheel to restore optimal traction. So XDS acts as a type of transverse differential lock that compensates for the understeering that is typical on front-wheel drive vehicles when driving fast through curves.”

But then they made it all confusing because they also integrated it with the the VAQ diff and called that XDS+.",seat
Nice thanks. There is sparse reviews of it online from what I can see. Just some posts on VW or Skoda forums. Still under warranty so it is a year and a bit away for me at least if I do it.,seat
"It’s something you can do yourself mate, I’d have a look at the fixings on the other side and either go to your local salvage yard or eBay. The labour cost would be more than the fixings.",seat
So it's not a VW Group car then?,seat
"These days there’s twenty videos on how to do anything, so I’d suggest searching for remove mk2 Leon front bumper. Then make the decision if it’s something you’d feel like you’d like to do. 

Not breaking the bloody clips is the hardest bit honestly.",seat
"On is to turn off/on the AC. Mostly to turn off because the AC turns in most off the times you set something on the ventilation. The other is maximum coolness.

On the Left, not seen in this picture you have max defogger.",seat
"I think that must be the case. The new one is a complete unit and there’s no screws or obvious holes for screws. 

Looks like it’ll be a case of brute force and finding some appropriate tools! 

It’s also in the garage for something else next week so I may just wait and see if they’ll fit the new part on the cheap. 

Thank you for looking at it - much appreciated.",seat
"It would be loud if you shoved the microphone in there. I find intake noise to be much nicer than exhaust, to the point that a nice aftermarket air intake is a better investment for sound than an exhaust",seat
Imo electric makes most sense in small cars as well.,seat
Shouldnt it be on max?,seat
Fuck all.,seat
"Yeah I figured so, booked in tomorrow to the garage, fingers crossed it won’t turn out expensive

But yeah both lights indicated at once, at this rate you’d think I was collecting the lights like stickers (haha)",seat
Kind of useful in automatics but a real game changer for manual gearboxes!,seat
"Thanks I will try that, I also forgot to mention that the car veers noticeably to the left and requires a constant correction. Could this be related too?",seat
I believe it's a fuse box of sorts,seat
"There’s loads on eBay: 

https://www.ebay.co.uk/itm/285482307993?mkcid=16&mkevt=1&mkrid=711-127632-2357-0&ssspo=wbvHYi9vRRi&sssrc=4429486&ssuid=&var=&widget_ver=artemis&media=COPY",seat
I’ve had this problem happen to me a fair bit What usually solves for me is closing the Spotify app through my phone manually and re-opening it.,seat
An odd question to ask with a self explanatory photograph…..,seat
"Mine looks gorgeous in Desire Red, has nice silver 17"" alloys too (with no scuffs). It's just the regular FR model, not the FR Sport, though they're exactly the same mechanically, I just don't have the digital cockpit, alcantara seats or 18"" laser- cut alloys. It's an early post-facelift model, so has the sharper interior, nicer alloys and the new infotainment screen, have just patched the firmware of the latter to 0870, so that's pretty up-to-date now 

Thinking of putting some nicer tyres on it, such as Michelin Pilot Sport 5s or Goodyear Eagle F1 Asymmetric 6s, instead of the mediocre 215/45 R17 Nexen Blue HD Plus tyres it has on now, which should further improve the handling and braking distances (especially in the wet).

When the extended SEAT Dealer warranty runs out in 2 years I intend to get it ECU remapped, should be able to get it up to 130 hp+ then, even without using any modded parts, though it's no slouch as is.",seat
"Ac on and Ac max, can be used to clear a foggy/frozen window quickly",seat
Until somewhere half the 80th Seat has build several Fiat-models under Fiat-license. After Fiat quit these contracts Seat had rebuild some models to new Seat's. So became the Panda the Marbella and the Ritmo changed into a Ronda.,seat
"This is the answer, same for me.",seat
Just get them refurbed,seat
"Nah, it's not quite the same, but it's a very fun car anyway!",seat
Thank you!,seat
"Thanks again for the help man, I'll reach out to them",seat
Is there No power at the Bulb? Why Are you looking at relays when it works on one side? They share the same relay?,seat
"Your fuel consumption is worse in the cold months and by less than 10%? Yeah im going to take a guess and say weather and ambient temp is the reason.

During the cold months you spend more fuel to heat up the engine to operating temperature. 

And, atleast this is the Case here, additives Are added to the fuel we get in the cold months to better cope with the temperature, and more additives=less fuel per liter",seat
Thanks,seat
"Also keep in mind the sound proofing on this car is absolutely crap, so you hear less bass while driving",seat
"If it's worst case, [this exists](https://www.youtube.com/watch?v=UjxAQsePR7Q)",seat
"I had a look, I can’t find the paint code mentioned anywhere. Maybe worth asking seats live chat?",seat
Have you renamed yours?,seat
"Does it not disengage parking brake if left on?
I think it does😉",seat
No the Leon Style doesn’t have folding mirrors- I have the new Leon SE Dynamic which also doesn’t have them. I believe they only come as standard on the FR & Lux trim,seat
Thbak you!,seat
The wire harness are identical to my Ibiza 2009 but I think your battery are too small for the car .mine Ibiza is 1.4 what's your ?you might need to go to Halfords to check is the battery are right one.,seat
"Worth while checking with your breakdown cover or dealership. When my dad had his 1.0L (115ps) Arona it was the turbo actuator sticking causing that error to come up. In the end it was the AA who fixed it, but filing it down slightly. Thats is if your one has a turbo fitted.",seat
"Yes, the negative cable needs to be the same as the power feed, this will limit how much power can get through the amplifier. 

Also worth checking the “big three” cabling if you’re feeling ambitious. 
* chassis to battery negative terminal
* alternator to batter positive
* engine to chassis/ battery negative 

This will also help the general power of the car.

None of this shouldn’t affect engine performance though.

Car audio as a hobby quickly gets expensive!",seat
"Air con and max air con.

It says on the buttons.",seat
"Thank you for the reply. I did some googling with this as the lead.  
Came across this  
[https://www.seatcupra.net/forums/threads/epc-fault-check-sum-error-0601.397377/](https://www.seatcupra.net/forums/threads/epc-fault-check-sum-error-0601.397377/)  
could be something similar for sure",seat
"Jackpot! thanks a lot, I never tried ""double tapping"" the first button.

It sounds so much better now with EQ/fader :)",seat
"Yeah I love mine, I had a 19+21 and now 23 plate FR Sport 110 dsg and I cannot see sense in spending twice the amount on a low spec Merc A class and I always get compliments on my car",seat
"These cars are definitely going to be classics. 

  
They're very fun and reliable with lots of parts available due to the massive manufacturing of the platform.",seat
"Sometimes when I plug my phone in I have to change the access on the wire to all data share instead of charging only, other times it works 🤷🏻‍♂️",seat
"I’ve had one since October, absolutely love it. 

- make sure to get the Lux edition, the heated seats and extra features are amazing 

- mpg varies but on motorway with driving speed limit you can get 35-40mpg easily. 

- only around town is where ur mpg will drop, that’s where most of my fuel goes but motorways is amazing. You can easily get 400miles out of a full tank motorway driving 

- if you thrash it (which you will lol) it will drink fuel, which is expected. Anyways enough about fuel lol 

- the power is absolutely relentless, it’s faster then S3, golf r, ml35i. You just don’t have 4 wheel drive that’s why it’s quicker. 

- you will get wheel hop if you are launching it and full throttling off the line but I would recommend getting a Powerflex lower engine mount insert(£40) takes 10 mins to fit in and will remove the wheel hop

- very comfortable daily, I’ve done nearly 6500 miles on 5 months and it’s awesome. 

Don’t consider, BUYYYYY LOL",seat
Most likely turbo actuator but get a scanner it will tell you definitively.,seat
"Am sure you'd be able to disable it using an ODBELEVEN device, I bought one to use with my 2021 SEAT Ibiza FR recently (not that it has ISA): https://obdeleven.com/

I've used this to unlock High Beam Assist, as well as for other tweaks and can also be used to run diagnostic tests.

I didn't need to use this to disable Stop/Start, though, as there was already a button next to the gear stick to turn that off (and it remembers the setting).",seat
"ahh, I mostly do motorway driving, so not an issue and oil temp is ~109 degrees Celsius typically",seat
So I guess my best bet is to keep the same disks size so I only need new disks and pads. How do I know which size disks do I have?,seat
That's your actual cunt button for when you want to rev the car at 4am before work,seat
Leon for sure,seat
"Good car, quite fuel efficient, I think the 1.2 tsi engine is the most balanced. It's a shame that SEAT has discontinued it.",seat
"I thought all post-facelift lift FR models had the 9.2"" screen (without physical knobs and buttons, except on the steering wheel)? I've got a late 2021 Ibiza FR (not FR Sport) and it has the 9.2"" infotainment screen.",seat
Yes all cars do this in some shape or form. It will go to 1k rpm then go to idle at about 750-500rpm takes a minute or two.,seat
"Hi, I'm a 2023 owner and hate that gap on the screen. Could you please take a photo of software and hardware version of your screen. It has to be somewhere in the settings. I think it can be helpful for us.",seat
"Because the car weighs a lot, and has a tiny 1 litre engine in it. If you lug the engine it will wear it out.",seat
What about the 1.5 etsi's?,seat
Those revs are quite high for a flat road. Even with 5 people and luggage mine tells me to change around 2000. Sounds like there’s an issue.,seat
I can't add photo here but will send you a dm. Anybody else needs the info just let me know. Maybe i will make a new post of my software/hardware info if that helps the community out :),seat
"Typo, 90.3 MPG (UK)",seat
Yes. Standard stereo on a 2022 Ibiza FR 1.5. Dunno if the newer ones have fewer bands. But I know the display is smaller on 2023 models.,seat
"Thanks, yes our 2018 seat has android auto, just didn't want to fork out cash to get the 2016 one ""unlocked"" if it only gave ""mirrorlink"".
Some one else confirmed 2016s have android auto so all is well",seat
"My Leon fr is ridiculous and hard but boy does it hold on well when pushed hard, so can sympathise",seat
Are you a mechanic? If so do you recommend that I invest in something more besides the remap in order to not compromise the longevity of the engine?,seat
"I bought mine used from SEAT main dealer just a few weeks ago, cost me about half that. Has done just under 20K miles (about 32k km) and looks in good shape.

They issued me with a new 2- year SEAT warranty, so that'll run until March 2026. After that expires I intend to get the ECU remapped, should be able to get about 130 PS/HP out of it then!",seat
Prefer the old ones. The copper colour would be cool though. Have you thought about respirating/coating them?,seat
"Depends on how old the car is. Got a 2016 2.0 TDI with 150000km on the clock and I’ll do the service ar maximum 15000km. After 200000km i wouldn’t keep same oil for more than 12-13000km. A 10000km service (6.5k miles) never fails

It also depends on where you mostly drive. 10000km on highway vs 10000km through cities is a great difference",seat
It was fully serviced on Friday. When I get back to it in an hour or so I will take a picture where it says 6500 miles.,seat
"Still have a sweet spot for this model, looks great!",seat
"Thanks again :) 

Really hoping this fits. I'll ask around at some VAG garages if they might be able to compare and check the fit",seat
"yeah, no",seat
I have a 2014 1.4 16v dohc I get the timing belt changed every 4 years for peace of mind if it's a chain I highly recommend having it inspected for missing teeth etc!!,seat
"You’ll need to, I’ve a new Leon fr estate, 1.5tsi and it eats oil not even at 10k yet and I’ve had to top up about a quarter of a litre twice only at 7k but this is considered normal on these engines by all accounts",seat
Hahaha thank you,seat
why do you say that?,seat
The Cupra has the panoramic roof,seat
"Nice, and he noticed a big diference on the engine?",seat
"Well there is an ""eco"" mode too, though",seat
"There should be a rest bottom somewhere, in my Seat Ibiza 2020 its just down below the speedometer and revs",seat
Press lock button on the key once and hold it for a few seconds. Alternatively on mirror adjuster on drivers door can turn that and they will fold,seat
"Fun fact. December  2019 I got my Leon for 24k brand new. 12km because it was on lease so they had to take it to the inspection service to get licence plates.
Mid 2021 the cars worth was 26k.
Inflation, lack of cars on the market etc. And this came from the certified seller that they are able to sell used cars for bigger price than they sold it in the first place.

My car probably is now at 17k on 100k km.",seat
Good question.,seat
"This is a Cupra Leon right?
On the 2019 Seat Leon 5F not possible?",seat
You can code it to fold after you lock it (without holding the lock button). :),seat
Hill hold is usually separate from this system. The car won't roll back even if this is off. It's just to disable creep ,seat
Cheaper and MUCH less work than an engine swap anyway.,seat
An ODB-II coder and the know how....,seat
"Check on the video at minute 8:00, I explained and showed how I put the microphones. It also has captions. But basically I routed a lavaliere from the engine bay to the cockpit (I have a rode wireless pro setup) and one at the back. In the video you can see exactly the placement if the microphones",seat
"Pls send me the info, I have the same problem",seat
"I'll be better of replacing it like the other one before, thanks! But does that explain the random behavior of the wipers? Meaning they rest at the bottom instead of the top and when the car detects its at the bottom it tries to do a wipe on dry surface which just scratches my windshield.

I can raise the wipers, do a wipe and then put them back everytime before starting a car to prevent this but it becomes annoying.",seat
"Atleast for the earlier Ibiza for example VW racingline BBK is a direct bolt-on (atleast for the Cupra). Pretty much everything is the same with the polo GTI.

But I would guess just updating the stock brakes would help? I am running 430hp on the Ibiza Cupra and just got EBC rotors, ferodo pads and braided hoses and I'm fine on the track even with the power. But I also turned XDS off because I have a mechanical diff installed",seat
"Sounds good, I’ll get it booked in for diagnostic. Any idea on how I could trouble shoot it myself if it’ll be an easy fix?",seat
The 1.5 when I tested it in the Skoda Scala felt really nice. It's a smooth engine and has a surprisingly good amount of pull in the lower revs.,seat
"I got my new Ibiza last week. It features Beats Audio and the larger infotainment display. Prior to this car, I owned the 2017 Ibiza model, also equipped with Beats Audio. Music sounds significantly better thanks to the subwoofer. Once you’re used to it, you immediately notices when a car lacks it. However, I did observe that the Beats audio system in the 2017 model is superior to that of the 2022 model. The subwoofer is less pronounced now, and the front speakers sound somewhat too high. If I were you, I would consider trying it out at a Seat dealer.

By the way, the larger infotainment display is a necessity! CarPlay and Android Auto appear very small on the default screen due to the addition of a black sidebar that cannot be disabled.",seat
Toledo is the continents (outside UK) poor man's Passat.,seat
VW’s “auto hold” (and subsequently “hill start assist”) uses ABS. Nothing to do with the parking/service brake at all.,seat
