Comments,Make
My wife and I just did extensive car shopping for our first ever luxury purchase and the XC90 was indeed the most comfortable car to sit in but....as OP said it feels very outdated at this point. That honestly is what caused us to go with another brand despite truly enjoying how spacious inside it felt. The acceleration and overall drive also just felt ...bland and uninspired. The dealer seemed very polite and courteous and not at all pushy though so that was also appreciated. We'll look at Volvo again the next time we're in the market.,Volvo
No significant changes. Thunder Gray is being discontinued.,Volvo
anywhere near the east coast?,Volvo
"If it’s an Al caliper, that makes sense it looks so huge. The extra material is needed for stiffness, compared to the usual cast iron. 

Al calipers are actually worse for keeping the brake fluid from boiling, they more readily take on the heat via convection from a hot rotor and have lower specific heat than iron. I was surprised to learn that in practice through testing brakes with thermocouple data logging. Performance fixed calipers are of course Al alloy so that’s just a necessary trade off for light weight. Probably most heat is transferred to the fluid through the piston from the back of the pad.",Volvo
"There is a clean 2007 Silver on Nordkap, Manual, fully loaded with every option near me with only 120,000 miles. 

I’m tempted. Not gonna lie.",Volvo
So where is the 242?,Volvo
"Vehicle fatality rates tell a different story.  I think there were multiple consecutive years in which no one in North America died in a 240, and their current goal is zero vehicle deaths worldwide. Volvo doesn't engineer for the crash tests; they engineer for the crashes that happen in the real world.",Volvo
"I just saw an article where someone had wondered how the heck his car ends up getting this weird pattern on the thin cover of road salt on the hood, and finally cought the perpetrator on camera: a whitetail deer was using it as a salt lick, and the pattern was made of tongue prints.

Impressive footage!",Volvo
"It updates the estimated range pretty quickly off your recent driving MPG. So if you jump between city and highway, it will change drastically.

I had similar experiences with my XC60. Drive in city with 15-19mpg and have 130mi range left(7-8gal left). Go on short highway trip, probably got 20-25mpg and it stayed was at like 100mi(4-5gal left) after the trip(80mi) and then when I went back to city driving for a few miles, it dropped back to 55-65mi(4gal) range. 

So usually I expect the range to stay the same or increase if I go from city to longer highway drives(but that assumes you continue driving highway), and to drop drastically when going from highway drives to city.",Volvo
no shit,Volvo
"Old Volvo's and Polaroids, no better combo! 


These are class what camera are you using? I love that wing mirror shot!",Volvo
"I fill up the XC60 about once a week (because that’s when we’re near the store with the cheapest fuel), and it generally only needs around a half tank.

Last I checked we are getting 21-22mpg (mostly city driving). Our last road trip returned just under 27mpg.",Volvo
"My wife has run flats on her bmw, so if there is a puncture she can drive to get the tyre changed (at low speed)",Volvo
"It's for mountain driving, extreme up and downhills. Low gear will prevent your brakes from melting when driving downhills. When they melt, they fail, it's not fun when you can't stop yourself from driving down.",Volvo
"I’d skip.

Don’t warranty something that won’t hurt you financially.",Volvo
"Do as you want, I would not install it.",Volvo
"I just bought a used 23 v90cc, crossed shopped the outback and Audi a6 all road. Couldn’t rly afford an a6 all road but didn’t like the interior as much as the Volvo. 

I rly am liking my v90!",Volvo
">manual mode

Drives an automatic... It's still just pressing a button. The slushbox won't do anything you tell it to if the speeds are wrong.",Volvo
On my 2020 XC40 the button to the right was for different drive modes.,Volvo
"I’m not sure I’m understating the question.

Volvo offers a factory tune called Polestar Engineered. Year and model dictates what all it does but for most models it’s a change in the power mapping, throttle response and transmission mapping.",Volvo
Edit 2018 56k / 2012 117k,Volvo
They will be very very boring,Volvo
Found the other 240 driver,Volvo
It’s also a Volvo approved performance upgrade that is IMO very worth it.,Volvo
Same m steep holes too so you don't ride the brake.,Volvo
This is always a shock after the first 3 services are included. We start preparing everyone at the 10k for the cost of the 40k.,Volvo
The v90 will proform better then the jeep.,Volvo
"Those car had recall about vacuum pumps, ask dealer",Volvo
Yes 😬,Volvo
"As far as I can tell, it’s used to start the engine and perhaps get you moving from a stop. I hear it’s the reason the auto start-stop system is so smooth (which it really is!)",Volvo
2019 XC40. 26/27 mpg. I fill up about 3 times a month.,Volvo
Best answer.,Volvo
"There's no such thing as too many miles. Maintenance is important, though.",Volvo
Very good point and I agree! There is a sense of sophistication from an intellect point of view with Volvo consumer base.,Volvo
I would like to see a refresh every 4-5 years to stay with the times.,Volvo
"[Yep. ](https://freeimage.host/i/Jh6SGeI)  
The manuals are online in most countries under the owners section.",Volvo
"Decently reliable compares to vehicles of the same price range. Drivetrain wise it's very good imo. That said, it's expensive to fix just like all European cars.",Volvo
"Just noticed the downvote. Trying to help you.. and you down vote me. Nice.   
Good luck with your car.",Volvo
"I use it for descending from the mountains. It saves you from glazing your brakes and the pads and rotors last longer. Mine has paddle shifters, as well.",Volvo
Oh polestar blue are just perfect color. I love audi especially 90s s2 wagons ohoooo. But i like the boxy look of Volvo but since they kind of lost their look now i would LOVE to have like a a6 allroad. What audi did you buy?,Volvo
"I bought my C30 last month and was told the battery needed changing in the fob, did that but it still doesn’t work so I am having to open and lock the car with the metal key same as you. Please let me know if you get this resolved or if anyone else has any ideas it would be greatly appreciated.",Volvo
How are you getting it off the island?,Volvo
"Wouldn't the ethanol gas mix, mix with any condensation just like dry gas to míx with any water in the tank?",Volvo
Sophisticated individuals for sure 👍,Volvo
">90s - handme down from rich parents

Probably more common in the '00's.  Which I can't believe was like 20 years ago.",Volvo
Was this car owned by a couple of Volvo Techs? Look’s familiar?,Volvo
4.4l/100km with my V70,Volvo
🎶 I will not go,Volvo
"Not really fair to compare an XC40 with an A4 as they’re in different classes. A V60/XC60 would be a better comparison. I switched from an A3 to a V60 and can say the quality is comparable but understandably the V60 came with more features and was more luxurious, but it’s a step up in price too.",Volvo
What’s funny is we own a V60 CC and get the occasional person asking about it. I’m always surprised when they start asking me about my car. It does stand out in a sea of white domestic SUVs.,Volvo
That is a sexy ride.  I like it!,Volvo
Show on this n/a whiteblock where turbo has touched you,Volvo
"2019 S60 T6 Polestar getting around 21mpg 70% city/30% highway (Winter with remote starts)Before moving, I was getting around 27mpg 70% highway/30% city. I refuel once every 2 weeks.",Volvo
"This is exciting news! I thought about getting one in the fall. I’ve always wanted a Volvo, and I’ll be making more in the fall. I’m just not sure! I’m wondering how much I should be making to be able to afford one. And how much it is to maintain.",Volvo
"The V60 would be my choice. (As someone has already said, many wagon fans in here) 
Better quality interior and higher grade of car. 
Equipment wise, the panoramic roof steals headroom, don’t worry about a car that doesn’t have one. 

I’m sure you can find ones with better equipement. The standard Momentum Pro I have, would be ok equipment wise. It does however have any options added by the first owner. You may well find one with the extras too. (B&W, Towbar, Pilot Assist, Comfort Pack, Winter Pack and more)",Volvo
I think the Prius prime is causing it to not add up,Volvo
I had several BMWs with frameless windows and they ALL did that.,Volvo
"2012 S60 T5, mostly highway driving. 27mpg.  
I fill up when the tank is empty, 2-3x a month.",Volvo
"Yeah, if that's a front I'd swap it for the spare if OP has one, even if the installer is close.",Volvo
"Pirelli won’t warranty the original tires, only replacement sets. You’re technically not the purchaser of the original tires. I always recommended replacing the stock Pirellis with Michelin/Continental once they wear out because Pirelli is so difficult to deal with.",Volvo
How would one keep an eye out for this?  Is it on their website?  New to Volvo just got an xc60 but would so bite at the upgrade if it went on sale,Volvo
"My 2022 XC60 has rear temp controls, did they remove it recently?",Volvo
I never thought I could get jealous about something like this LMAO,Volvo
"Where are you see wireless charging is locked? No ACP is not. If you let the data plan expire, you would have to tether your phone for data.  
https://www.motorshow.me/uploadImages/GalleryDocs/Doc7640.pdf  
Aha! Found it. Yea, I don't think that's correct about the wireless charger.",Volvo
"All European brands are making the change to smaller engines because that's what the EU says they have to do. They say that the cars have to produce less emissions. Koenigsegg even has a 2.0 3cyl turbo that produces 600hp. The Germans are all going towards the 4cyl turbo hybrids with some having a v8 still available but those are nearly impossible to afford. The only American brand you see on the road here is Ford, but only their European cars.",Volvo
"Be sure to keep the bent run them and get it repaired. It'll be a good back up if you ever have another problem.

I don't buy that the strut was damaged by the tire. Maybe an arm got bent but not a strut assembly.",Volvo
"Would love to see the rear lights on the other two.

First one looks like Jeep or a Durango and the third has Honda CRV vibes.",Volvo
The small amount of displacement you lose is far outweighed by the increase in power. Also theres block shims for mild builds which are more then tough enough for 400hp. Rods and pistons aint cheap but the cars have forged cranks from factory which helps. Kinda gotta build these like the old hondas specifically the d series motors. Not the stoutest but if you do the resewrch theyll take a besting and come back for more,Volvo
I use the orange as the primary key,Volvo
Mines the same colour but broken down in my driveway,Volvo
I was downvoting you for incorrect information. No need to get butthurt.,Volvo
"V90CC …
Audi A6 Allroad if they still do it. 

When I was looking for my V60, I looked at the opposition but wasn’t enamoured.",Volvo
S60 T8. Commute 130 miles per day. All time average is 44mpg. Fill up once a week. Love this car!,Volvo
"All these adorable, sporty little sedans are really making my giant XC90 feel like a rally car support bus. 😂",Volvo
Any good place to order parts from in Canada?,Volvo
Mine did that because it was old (after it went flat driving 100km/h). But new tire should not do that,Volvo
Am I the only clueless one that doesn’t get it?,Volvo
"2022 S60 T8. 29-36mpg highway, 65-85mpge city, depending on the time of year / headwind / exterior temperature. mpg really drops below 0C and with a 40 kph headwind.

Approximately 2 fillups a week (~1000 miles / week).

Purchased as CPO 5 months ago, and it's a terrible car, with at least 1 CEL per month (all evap issues covered under warranty but with multi-day waits for parts. The hybrid system has been without issue).",Volvo
"Okay, you didn’t have to downvote me bc I didn’t know that lol wtf. I wasn’t disagreeing with you, just commenting.",Volvo
you forgot to mention sabaton starts playing,Volvo
"Mercedes E-class and BMW 5-series are available as wagons and with AWD. Both are great cars.

I've owned a 2008 530 and a 2012 E220. Both were great and very comfortable. I prefered the BMW but the Merc were a lot more reliable.",Volvo
"Well, as a former owner of a 2018 A5 Sportback, I can attest that my biggest disappointment with my 2020 V60 is the dash screen and the center screen compared to the Audi. And yes, in 2018 Audi hadn’t reinvented what they released in 2014 in the TT (the first car to get the Virtual Cockpit) so what does that tell you about the equivalent tech in my 2020 that doesn’t compare favorably? Way, way behind, then. Now? Don’t know, I don’t own a new one of either brand.",Volvo
"I mean I just got a 2019(?) s60 T5 r design with 31k miles for $18k. Clean title, original MSRP was $52-55k. Still covered under CPO until December and I can extend it if I want.",Volvo
"Driving around town like 25-24ish and on the freeway and long roads around 36ish 

I drive a 2017 Volvo V60 T5 premiere the 240hp turbo 4 cylinder",Volvo
"Love our ‘07 XC90 and ‘13 C30 T5R manual.  Our ‘17 XC60 is meh. When it came time to get youngest daughter a safe car, we found a ‘17 Volkswagen Passat with more advanced safety electronics than the Volvo and surprisingly comparable strong a/b/c pillar strength (I forget the term IIHS uses for roof crush tests).",Volvo
That's an awesome replacement. I am loving my '24 recharge s60. Just oodles of torque. Almost more fun than my challenger.,Volvo
"Oh no! The S60 is a great looking car! I'm waiting for them to bring back the chrome look. Not a fan of the ""dark"" theme.


I've been eyeing replacing my S80 with a CPO S60. Used prices are finally coming down. Finding the right color combo is hard though. Love the blond interior but most the ones I see are black.",Volvo
2022 one. $2k for two years gap is the great trade off. What country you’re in? Both options are a steal..,Volvo
You should read the reviews on the MB subs. They live in the shop and fail all the time.,Volvo
“Oh no my European luxury suv is expensive”,Volvo
I feel you [bro/sis! ](https://freeimage.host/i/Jh2Sk37),Volvo
"2016 xc60 T5 here. Driving 16 miles is really ok, check your dipstick it should be just below two X more or less.",Volvo
"I bought my 2020 last year CPO. Was an off lease car, driven by an elderly woman (who I knew in a roundabout way) with 25k miles, now at 48k. No problems.",Volvo
My original comment is in regard to the text OP posted. I never disagreed that documentation of warranty is hard to find or coverage is bad. It IS totally possible the salesman/woman mislead OP or OP mislead THEMSELVES that warranty covers wear and tear parts because the warranty does have good coverage. u/betasp comment is misdirected at me and OP. I can argue why buying the warranty is a bad financial decision for most people if we want to go that route.,Volvo
"Well i don’t want to sound like a fan boy. But I think you’re underestimating how advanced and what potential Teslas system has, as a lot of people do. The Mercedes L3 software only works on one piece of road under specific circumstances.  It’s basically more of the same as they’ve always used.

Teslas system while flawed and needing improvement is very different and still is much more advanced and i believe it has a better chance at achieving full autonomy. The mapping, data collection, always connected capability and processing power is what makes me believe it. 

All Teslas are basically powerful desktop computers while the most are still on Nintendo gameboy level processing power and Mercedes perhaps on console level in their best most expensive cars. No Mercedes can even get close to do what the Teslas in their beta full self driving mode can do in the US. The Waymo cars in San Fransisco are probably the ones that come the closest.",Volvo
"It’s your ride, you do you. My only suggestion would to also get black badges for the rear VOLVO, S60, trim lettering on the rear deck and the front grill to complete the look.",Volvo
Welcome to the family.  I hope you love yours as much as I’ve loved mine!,Volvo
"No. If the quarter panel is damaged badly enough that it requires replacement, it's definitely not something you can do on your own. They're welded in place and are a structural part as well. That's something best left to an actual body shop who has the ability to do it according to Volvo's official procedures, because if it's not done correctly, it can affect the structural integrity of the entire car. However, there's a good chance that the existing panel can be repaired, but again, that's best left to someone with the knowledge necessary to do it well.",Volvo
I'd splurge for the carbon ceramic pads too then. Haha,Volvo
"I’m in the same boat, I was a fanboy but recently moved away from the brand.

Reasons (2019 V90CC)
- too much roadnoise
- unrefined engine and transmission
- interior looked great but too many squeaks from cheap plastic
- dash was boring
- did not give me a feeling of being built to last, which my earlier Volvos did
- matrix led headlights were a joke compared to a 2013 Mercedes (!)",Volvo
"They’re moving towards full electric, why would they invest a whole bunch of money in making minor changes in a vehicle that is soon going to be retiring? I think the rear camera washer is a great idea.",Volvo
"Yeah I agree the XC90 is probably due for an update. Also like others say, there are some small things (wish there were independent heat/ac buttons, button to change drive mode not on the touch screen, wireless CarPlay etc). I honestly just use the built in google maps and blue tooth audio mainly anyways though. I still vastly prefer the Volvo setup to what I saw from Audi, Lexus, Mazda, Toyota (I know the last two aren’t luxury but still). 

The recharge XC60 is just an absolute blast to drive as well. It was our first PHEV and I was surprised to feel how much more responsive and fun to drive it is on the lower speed end. Fast as hell when you need it to be, and buttery smooth even on rougher roads.",Volvo
"All I know that you shouldn't go for anything from VAG, PSA, or Stellantis, Mercedes has dropped in quality significantly since 2020-ish, don't really have too much experience with BMW, but I know they're expensive and complicated cars to repair. Source: I do remote diagnoses for work",Volvo
"This is the answer.  

Volvo could be using that old Saab ad slogan on these modern cars: Those who test drive a Volvo, usually buy one.",Volvo
You can replace a quarter panel it just has to be cut out and welded on.,Volvo
"Make sure you see a doctor and get some physiotherapy, and impact that hard is likely to cause issues. You can feel fine for the next six months and then you can end up with neck and back issues that will haunt you for years. 

So glad that your beautiful girl did exactly what she was supposed to and saved your life.",Volvo
Cringe,Volvo
"Volvos contemporary to the Saab were pretty different in style to everything else as well. Ok, maybe not the 742/744.",Volvo
"My last 4 cars were BMWs, 6 months into my XC60 and I doubt I'll ever buy anything other than a Volvo again.",Volvo
Of course!! Message me on Instagram @periodcorrectuk and we can make it happen!,Volvo
Lol that's cute,Volvo
"It depends on what we are talking about, I believe styling wise we are timeless but we are outdated, that may not make much sense but a 2021 XC90 owner getting into a 2024 style wise it did not change much. The recharge series is a game changer, I drive a s60 recharge a lot and it’s faster then most think, but again it looks just like a 2022. We still have a 9” display with no wireless CarPlay in 2024, I’m sorry to say but that’s behind in my opinion. 

As I’ve said my sales are higher then ever in terms of volume but as you can see in this Reddit I’m not alone in thinking we are behind the other luxury brands.",Volvo
Literally the reason why I fell in love with this car,Volvo
I had something similar - turned out it was the sun roof shade - opening it just a quarter of an inch made the rattle go away.,Volvo
"2020 XC60 T6 mostly city driving 
Every 2 weeks 13l / 100km (18mpg?)",Volvo
"FCP Euro has a lifetime warranty on all of their parts, even used oil filters.  They are a great company.",Volvo
Was it sliding normally with the main handle?,Volvo
Ran these on my xc40 and love them.,Volvo
2022 and up gas XC60s are mile hybrids with the 2025 included. Last year for s60,Volvo
That's an awesome looking mug,Volvo
Cosmetic and repairable.  Very small chance there's a crack but really unlikely based on location and size.  If it became a negotiating point that would cost around $300 to fix.,Volvo
S90 gets about 32 mpg combined.,Volvo
So long as she is safe it's all good right. I have an xc90 and have run over screws before but never had a blow out like this,Volvo
"I want to thank everyone for their comments and opinions, It gives me great insight on how current and possible Volvo owners feel about the brand and where its going. I love this brand I want to see it grow into what many believe it could be!",Volvo
"Show the ease of loading long gear onto a roof rack with a wagon when the kid seats are installed. Picking up a basketball hoop, lumber, snowboards, etc. are all easier with a wagon, and you can even still fit in a parking garage with a roof box on.

Our Forester is useless in the city when we have the roof rack geared up, parking options are cut in half.",Volvo
Not sure if this is the 2.9 or2.0 T version or the T6 version. This  is the first generation volvo s80 made when volvo was owned by Ford. Some folks who owned the first earlier editions were plagued with issues. The subsequent years after 2002 were better,Volvo
"I got into European cars because of a late 90s BMW I owned. 

I just couldn’t stomach the thought of the poor reliability of a modern BMW and I don’t need or even want a ton of fancy tech, so Volvo made more sense.",Volvo
"Don’t cheap out. I get customers with cars of the SPA platform complaining about vibrations, most of them with cheap tires. I recommend Continental tires but there are other good brands out there.",Volvo
I changed the battery 2 years ago and the low battery indicator shows up from time to time. You mean it's too late to reset now and I just have to learn to live with it?,Volvo
"I had a rear driveshaft failure on one of these (90 kkm). Drive it hard up a hill, motorway > 110 kph, you should not hear an ominous rumble.

I miss that nice purr from the 5 cylinders, though.",Volvo
"Honestly, i have clients that hate start stop and when I go on test drives with them I ask them if they noticed the car being off and they usually don't with the new mild hybrid battery.",Volvo
"Boggles my mind how Android Auto supports more apps, better UX thanks to split windows, etc. 

Then we have AAOS which struggles to do anything in comparison.

I have an older aftermarket head unit in my 2009 Kia Soul and it does wireless Android Auto flawlessly. I get a better experience with it than my 2022 XC60.",Volvo
Volume has gone up…what is it that you can’t take?,Volvo
I have one s90 recharge currently. 99% of them are custom order. Hard to get,Volvo
That’s a seriously mean looking blue,Volvo
Get the 2024 pilot and you will be thankful.,Volvo
"the car will intentionally inject more fuel to heat up the engine at the start of a trip. when ur trip computer weighs this duration heavily in calculating range the range will crater. 


just ignore the range indicator and go with uh, feels. ",Volvo
He just got done assembling it.,Volvo
i had to pay $700 for cruise control after a $100 cruise module for the steering wheel on my 07 C30. I thought it was a little overkill lmao,Volvo
I'd buy a clean manual right now but haven't seen one in months around here in SoCal,Volvo
This is an indicator that tells it’s time for a new tire!,Volvo
I would strongly consider the Mazda CX-90. Mazda's are really out batting their average lately.,Volvo
Depends on the model/trim level.,Volvo
Are they not coming with the EX30 and other new electric models?,Volvo
"It's typically full at it uses regenerative braking to stay that way. When you brake, you should see it ""fill up"" with a visual indication there.

The click your referring to is the battery recharge engaging and disengaging, I believe. That's my deduction from experience.

Nothing to do, operating as expected. Enjoy.",Volvo
Wow hate to say but whom ever did your timing service did a few things wrong parts wize and were oddly given a 2nd and 3rd chance to ruin your car.  Engine & brake parts are the not the items you should ever be cost cutting.,Volvo
Love mine. I’m at 96k miles and she is running strong.   I do need to do some suspensions work this summer though.,Volvo
"have the same car (T5)  here in Sweden. 31 mpg in winter tyres, 35 on summer. Dont live in a city.",Volvo
"My car didn’t come with it, I did turn on the setting and it works as it should (so I should be thanking you; one of the reasons I bought Orbit, and Adaptive Cruise control). I actually turned on the drive modes and “made” a button on the CSM to change them. I was thinking I’d write up a tutorial.",Volvo
They made Volvo 240 for 20 years. Volvo for life. Don't need to change all the time. Buy your Volvo and drive it for as long as you can.,Volvo
