Comments,Make
"I owned a 2011 Saab 9-5 for 5-6 years until my wife totaled it :( (replaced it with a 2020 Volvo s90)

It's a great car. Feels absolutely premium even by today's standard. Fwiw while the market is scant and you can't really be choosy, I'd spring for the highest package one you find. You'll see that it holds up well even against entry level luxury vehicles a decade later. 

Car drives great but there are some quirks. A few electrical gremlins always seem to plague them. While rarely anything serious you'll see a light pop up and disappear with no real explanation. We had trouble with the front fog lights/running lamps going out. The rear blinkers would always blink like they were about to burn out, but they weren't and never did. Even a brand new blinker bulb would flash like it was gonna burn out but would run like that for four or five years. On the topic of lights, the rear trunk lid light would always go out. Not the mandatory legal brakelights or anything but the the light bar that runs the top of the trunk lid. It's a super common problem in the 2011-2012 9-3/9-4x/9-5. It's something to do with the ballasts or w/e. You can try repeatedly fixing it or just resign to the fact it won't ever really work. 

We had to get the right passenger seat butt warmers fixed once, but they worked after. 

Mechanically, the car was fantastic. Drove great, rode great. The best driving experience I've ever had. My Volvo drives great too but man the 9-5 was a dream. Sound system was awesome, and there was never a single mechanical issue with the car for us. Just make sure you pay attention to it and follow a somewhat regular maintenance schedule. If you have a Saab mechanic or a euro guy in your area all the better, but honestly any mechanic familiar with similarly specc'd 2010-2013 Buicks should also be able to handle it. They have a bunch of common parts. 

If you Google around, the biggest issue I'd always seen on the 2011 9-5 was the electrical issues. And I can definitely cosign that. But in the grand scheme of things they were minor annoyances more than actual problems. The silver lining to it I suppose was that due to the car market right now we got almost as much for the car from insurance in the total loss as we bought it for. Car really retained its value.",saab
Such a beautiful car... wonder how much it ends up selling for,saab
Looks good... I always like the NG900/OG9-3 shape in white.,saab
"Those are nice, I have not seen them before.  I think they will look great.  These are my all time favorite Saab wheels

[https://www.stockwheels.com/Saab-9-3-2000-17x7-5-Aluminum-Alloy-Chrome-5-Split-Spoke-68200-Wheel-Rim](https://www.stockwheels.com/Saab-9-3-2000-17x7-5-Aluminum-Alloy-Chrome-5-Split-Spoke-68200-Wheel-Rim)

By the way, I like your Saab, it looks real clean.",saab
"No, don't remove the shift knob before flight!",saab
Fantastic lineup 😎,saab
Alternator is a really minor repair as far as they go.........,saab
"careful - be sure to keep a distance, it may set on fire",saab
"With my original 9.5 Aero on 98 octane fuel, I get 35mpg (6.8l/100km) on a very good day and 26mpg (9.0l/100km) on the worst days. This is while driving normally. If I do a spirited drive, the numbers are smaller, maybe down to the low 20s.",saab
I owned 2 of those but they were both Turbos. I loooovved those cars . I have  a 9-5t now and I still love it.,saab
"I know a fail safe in OG Saabs is to shut the fuel pump down when they over-boost. I had a 900 SE with a frozen wastegate that had amazing boost but when it leaned a bit too far into the red, it did exactly what your car seems to be doing.",saab
"Ran 17s on mine from an xwd 9-3 , have to make sure they clear the calipers as not all 17s will fit",saab
Thanks for the input! I'll check it out and see if it's in my price range,saab
"""We have tons of intermixing from og900s to 9-5s to anything in between"", you said. 
So the experiences of us who drive 96s are not welcome, is that what you're saying? If that is the case, can you tell me why?",saab
"Also just out of curiosity, in what state did you buy it and how much modification did you do to it?",saab
Don’t do it. Or make sure it ends up with someone who will keep it safe,saab
"Yeah, i was thinking same. It is world most used diesel engine, many brands was using it. 

It have full service book and history. Previously was another Saab-hobbier daily driver. I just fitted new timing kit and fully oilchange service.",saab
Wth is that grill thing on the front bumper? Looks kinda wack.,saab
The silver is for sure my favourite spec,saab
I know how it seems from an outside perspective but I keep this car immaculate. I Personally Change the oil every 3.5-4.5k miles. Maintained by a Saab specialist in ME every other year.  It’s my everyday car and I don’t just short trip. It receives on average 15-20 miles a day. Pcv was changed 35k miles ago.,saab
Oh this is the donor car?,saab
"Bc I drive a lot for work I always try and get oil changes done right on schedule (it’s almost a game to me and I’ve been within 50 miles of it being due) I also am reimbursed by mileage which is always about 30% higher than what I spend on gas, which is like a built in savings account for repairs and upgrades. No one else here is very optimistic, haha",saab
Nice car. But wtf is going on with those wheels?,saab
I have an exhaust on my NG93 and my 3 year old daughter calls it the racecar,saab
"Tbh 70 an hour is about right down here, it's the complete wanker they've got behind the desk that I can't stand.",saab
"9-3s and 9-5s are definitely easier to work on.. If properly maintained they will last a million miles. 

Rust can be an issue, and some year models rot much faster than others.

They are still modern, electronic filled cars, so they require adequate knowledge and equipment.  Parts availability is good to excellent (at least here in Europe). Most mechanics will shy away from them as they lack the know how.",saab
"Sure. There are a bunch of videos on YouTube that show you how.


However, in another comment you said that the noise is still happening with the engine off and the car coasting in neutral? That makes me think it's something else. Do you have a wobble or drift or any other symptoms that you notice while the car is moving?",saab
Is it aero same as vector or vector is ok in the 2003 model?,saab
"the auto transmissions are not great, but since it is a non turbo it might be ok.  make sure you put new fluid in it

if it is 5 speed you are probably golden.

the alternator is a pain to replace unless you know the tricks.

the tranny is basically the oil pan of the engine so if you have to do work you must pull engine (yes I know some people have dropped just the tranny, but it is harder)

the A-Arms need to be inspected, they can break when you are backing up for some reason

parts are getting hard to find.   

I have not seen one in my local junk yard or craigslist for a long time.

That said one of my co-workers has several and I am trying to get him to sell me his SPG

&#x200B;

I have owned lots of these cars and nothing today comes is even close to being as good.",saab
"Yep, glue works lol",saab
"Sounds like subframe bushings are probably bad. I would change the gear oil too, Redline MTF is good, or you can look around for the GM stuff.",saab
Good one!☝️,saab
Fair point:) it’s very unique that’s for sure.,saab
"Does anyone have wisdom to share on the 9-4x? I’ve been wanting one for years and now
I’m starting to want to really do some in depth research to prepare. 2011 9-5 info would be also appreciated. I loved the direction they were taking their design right before the bankruptcy :(",saab
"Haha yep, I wish the previous owner went with black instead of blue. I think that would look way better with the glitter.",saab
"It's already got it, lol",saab
2 900s one 9-2x aero,saab
"Several things:

If you are only draining 2.5 quarts from your engine you are running it DANGEROUSLY low. There should *never* be less than \~3.5 quarts of oil in there. Ever.

If you primarily drive short distances, you could be seeing moisture contamination floating on top of the oil. Normally this gets vaporized and sucked out by PCV, but if the oil never gets hot that moisture will accumulate.

It's possible you're just seeing aeration of the oil, which is more likely if the oil is over- or under- filled, and *probably* amplified by loss of viscosity due to overheating due to insufficient oil.

You need to take better care of your car... check the oil regularly, keep the oil properly filled, see if the condition continues.",saab
Yeah lol,saab
"Filter just screws off, you may need a filter wrench to get it off. Dont use the wrench to tighten it unless you have weak grip. In that case just be very gentle. Make sure you do a hot drain. The plug is 13 mm and the car takes 4 qts Assuming it's the same as my 99 9-5. Double check the manual if you can, otherwise start with 3 and use dipstick to check. MAKE SURE THE CAR IS LEVEL TO CHECK DIPSTICK.",saab
Orio makes good replacements. I almost guarantee they would look better than what I imagine a 3D printed emblem to look like.,saab
Both have dude 🙃,saab
"The car is doing math about how it should run and you removed some key things for the equation.

Does it run normal when you put it back?",saab
Okay thank you for the insight ill just leave it be then😂,saab
This one right? : https://www.ebay.com/itm/403785467373,saab
"Thanks man, I've tried doing most of the work myself. But I don't have my own space so I always have to rely on my friends having a spot open in their garages. And since this is my only car it gets harder and harder to justify having to call them every time something goes wrong 😩",saab
"I have a 2002 9-5 aero but I can’t find the window track for the window going up and down, someone drop a link for it and I already looked it up the cheep version breaks cuz I already bought it",saab
I’m not to sure I’ve really never work on Saabs,saab
"That’s a bit higher than I paid in 2021, I paid $165 for the bundle. I can believe that prices have gone up since then, but wow",saab
🤣,saab
"would buy it in a heartbeat if I lived closer, Nice car though.",saab
"Current family stable:

•2011 9-3X 2.0T 6AT

•2009 9-3 2.0T 6MT Combi 

•2009 9-3 2.0T 5AT Combi (winter beater)

•2008 9-3 2.8T 6AT Aero Convertible 

•2006 9-3 2.0T 5AT Combi

•1995 900SE 5MT Convertible

Previously owned Saabs:
2006 9-3 Aero Combi, 2002 9-5 Aero, 2007 9-7X 5.3i, 1999 9-3, 1995 900S Convertible, 2001 9-5 Aero Combi, 1995 9000 Aero, 1994 9000CSE, 1994 900SE, 1989 900T, 1987 9000S",saab
I work for a salvage yard so I come across these things,saab
"Their scanner will work. These cars have an OBDII connection, which is what pretty much all cars and scanners are using these days. It will give you some generic codes that you google and research. It's your best starting point. I've fixed many a car with a basic OBDII scanner and the codes it gave me. 

You don't really need a techII scanner at this moment, which is essentially the same thing, but it does special things for the car in some instances that you need to fix particular issues. I don't for see you needing one, but we will know more when you get the codes.",saab
Don’t change a thing. That thing is timeless!,saab
They're ugly as shit and they have almost nothing to do with saab... No thanks,saab
Why did you drive the rear tires forward onto the ramp and not reverse onto the ramp?,saab
An effin Navigator and McLaren? Trash!,saab
"I'm interested, PM to discuss details",saab
"Priorities have changed aswell, I don't need a big car anymore. There's no point in keeping it just because, before I was driving long distances for work, now I work 15 min drive from home and I don't need all the boot space. So it's time to move on, but like I said. As soon as I can find a garage I will pick one up again as a project.",saab
It's a service gm offers that like calls the cops if you crash or something,saab
I hope the top was up,saab
I live in Vermont! Lemme check this out,saab
What a beauty!! I’ve owned my ‘95 900SE Turbo vert for 19 years now and with 210k miles it’s been the most reliable Saab I’ve owned!,saab
"Looking to buy my first Saab. It’s going to be a second vehicle.

There are three near me I am considering. 

2000 Saab 9-3 convertible
109,000km
Black
Sold at junkyard 
$3,750


1993 Saab 900 classic convertible
270,000km
Black
No rust
One or two owners
$3000


1995 Saab 900 SE convertible
152,000km
Red 
Comes with winter tires, new battery, new rear brakes,
$3,950

What could I ask beyond the basic questions to help sort these? Is low mileage paramount to you all? The 900 classic is a beauty…

Thanks!",saab
F it we ball🫡,saab
R/shittycarmods,saab
"Yea, i knew that but i insist :)
Opel has the same problem with the hand brake on the same model of caliper. The one that has the cable upside. The model with the cable in the lower part, does not have any issue. The dust is cillected there, the moisture, and the mechanism is stuck. 
Saabs has ATE calipers.",saab
Good luck to you.,saab
"USA Owner of a 2008 here. I got the connects2 kit. I got if from eBay from a store in the UK. It was around $200 and it came with cage, trim and harness connector for amplified systems. 
I was able to fit an Eonon android unit.",saab
"Hi everyone-- I'm looking at a manual 2003 Saab 93 2t with 120K miles. Seems to be in good condition, going for $3,000. Worth going to take a look? I'm a little wary of buying an almost 20 year old car but everything else is out of my price range for the time being. Thoughts?",saab
YES,saab
"It’s both too late and too early for another EV start up.  The future outlook for startups like Canoo and Aptera seems increasingly grim, and even brands that already delivered consumer vehicles still have a long road ahead of them…Lucid, Fisker, even Polestar and Rivian.

EVs are still a fast growing segment, but apparently not faster than manufacturers anticipated, for various reasons.  Building a vehicle is one thing, ramping up to mass production is another, and convincing consumers they should buy a newly designed car from a brand that effectively already died once before is a big leap.  

What I mean by too early…aside from the still somewhat niche market share and the not-yet-standardized chemistry and infrastructure, I think only a large company like GM could survive a recall like the Chevy Bolt EV’s battery fire issue without going broke.  Even without a huge safety recall, if the nearest dealer is 500 miles away as is the case for other startup owners, then owning a NEVS pretty much has to be a second or third car.",saab
which tune do you prefer? i was going to buy the vtuner one on monday for my 08 2.8 aero fwd. He seems to have a lot of insight on these cars. ,saab
"How do you feel the handling changed after to lowered it? I want to lower my OG9-3 some time in the future.

Yours look realy good btw.",saab
I can only hope to share my Saab passion with my son(s) in the future! 🇸🇪,saab
I think the chrome really suits the car,saab
Either the drive shaft between the front and rear or it is the haldex.  Based off both videos sounds more like the shaft,saab
"Had these on my '01 SE for several years. Great option for a daily but they are not up to track use.


https://www.rockauto.com/en/moreinfo.php?pk=8268044&cc=1401994&pt=13824&jsn=438",saab
"Thanks alot for the input, do you need T5suite2 or can you do it with Tech2 aswell?",saab
Indeed... If it's being scrapped just cut away the front and drag it out that way.  ;),saab
Black is overdone. The chrome is tasteful and looks good with the red. Keep the chrome,saab
"Very difficult to obtain parts for this car 

You would be waiting months / years if you needed a part",saab
"I can definitely appreciate that. I'm very indecisive, myself. However, you shouldn't let other people's opinions influence your own. Only you know what's best for you. You have to look deep inside yourself and figure out what gives you a massive, automotive heart boner.",saab
Happy Saabin! 207k 2007 9-3 2.0T,saab
"I second the window roller issue on the 9-5.  I actually keep a spare set around in case it happens again since mine is not garaged.  Easy fix to do yourself. The Rollers are on Ebay pretty cheap.
Also, the PCV valve on top of the engine gets brittle from the engine heat over time and can break very easily.  The replacement part comes with the rubber hose already attached and is a PITA to install into the back of the engine.",saab
$150 or so. It was ACDelco brand.,saab
It’s amazing to me that the later models are still on the road.,saab
Somebody had leftover bass boat paint,saab
"seems like wrapping the car cost around the same, found from 2500 up too 4000 euro depending on who and what brand they use seems like painting would be the way to go at least here in Sweden if that's where u live",saab
Nice window vent,saab
"Bonjour Séb  


Congrats...I fully agree with you: looks beautiful. 


Enjoy riding curbside, new foliage in spring is even closer as shown (guess if you wanna have an undented used SAAB in France you'd have to get one from UK 😂)",saab
"Get creative... Junkyards, ebay, other owners, fabricate stuff. If people can keep Tuckers and Packards alive they'll be able to keep Saabs alive for a minute yet.",saab
No european saabs have them. Your better option is to import some from here. :),saab
Just rip it out of there and put in a cheap Kenwood./s,saab
"Mine makes what sounds like the same sound, see my recent post in r/saab",saab
"Looks beautiful. If it’s made it this far, the PCV system has likely already been replaced. That was the weak point that caused sludge build up in these early engines.  Good luck with the purchase. :-)",saab
"OhpEbo, if I may ask, how often do you seal your canvas top with water repellant?",saab
looks nuts lmao,saab
"Yeah, and i also worded the question incorrectly. Sorry.",saab
"+2 for Jamsaab Martin, he did me a solid years ago when I was in a bit of a pickle at Castle Combe, I'm still hugely grateful for his help.

You really are spoilt for choice in that part of the country!
I bought a car from Perry and Prowse in Taunton and couldn't of been any happier with their service. I certainly wouldn't hesitate to buy another from them.",saab
"I wish I had a pic, but I did mine in metallic gunmetal grey, and it looked pretty rad.

Get a second grille to paint, don’t mess with your stock one if the chrome is in good shape. They’re like $100 on ebay.",saab
I did the same thing.,saab
It’s worn down,saab
"If you don’t do your own maintenance, I’ve averaged roughly $1500/year in dealer-only maintenance for my 9-5 Aero. Total is $23k over 18 years of ownership excluding inflation.",saab
"A failing crankshaft position sensor, CPS, is not unusual. The ECU cannot see the engine cranking, the tack does not move, the ECU does not close the fuel pump relay.

When you turn on the ignition, the ECU powers the fuel pump briefly and you can hear that, easier if you can flip up the back seat. The fuel pump fuse is energized.

You can do a fair amount of diagnosing with the above.

The ignition cassette plug is tight?",saab
Thank you. Does saabparts.com have tech 2’s or Amazon?,saab
I don't and understand that might be the way to go but I also have a parts car and might try rebuilding it's transmission first.,saab
Check the oil return line from the turbo. There is a O ring that is supposed to seal the line to the block.,saab
Glad you got it solved! ,saab
It's funny these are called US city lights where I'm from because no cars come with them here a lot of people like the look and pay big money to import and retrofit them,saab
Elle est belle ! :),saab
Bro got the paddle boat paint,saab
Stay away from the xwd....trust me,saab
Ok thanks. I appreciate it,saab
Fuel pressure issue?,saab
Thanks for the detailed steps!,saab
30-40 minutes*,saab
2011 93 aero 2.0L 98k miles,saab
"160k km is not much so if it is in good condition...

I bought my saabs for:
- 2700 EUR for 9-3 with 300k km
- 2300 EUR for 9-5 Aero with 220k km

5k might be much but 4k is doable",saab
"Thanks for the advice, I've got 17"" wheels on and checked how much space is left to lower, and I don't think I should go too low in case of rubbing the tires. I'll probably keep the susupension stock for now",saab
You changed the sprung to unsprung weight ratio. Higher sprung weight ratio vehicles usually ride smoother.,saab
"Bought it from a friends dad, they always serviced it on time and everything so I don't know why it's been acting up so much. I don't even drive it hard 🙃",saab
Not many saabs where I live but my friend has one,saab
"My first guess is the starter.

Next would be a fuse and wiring.

I forgot, the ground wire connected to the engine block is a common issue because of the gunk, or even a loose connection.",saab
"Only 900’s and 3’s.. all manual, mostly softop. All prior to 2006. They slam like airplane doors.",saab
"I love how the snow filled the car and perfectly formed a roof! Nature, you are amazing!!",saab
Is the belt and belt tensioner loose?,saab
"I’d say you’re pretty safe with that mileage and if it’s spent it’s life in that cold an environment. If it had a problem I’d expect it to have manifested by now. Both our 2008 manual 9-3s have around 170k miles on them and still run and drive great. I wouldn’t hesitate recommending them to a friend.

Quick edit: Remember, all the posts on Saab central and other forums are there because they’ve experienced a problem. If they haven’t experienced a problem they’ve not posted.",saab
1990 900 turbo convertible & 1973 Sonett III,saab
"I will be checking the wire harnesses, battery, and grounds tomorrow. Is there any good write-up/video on how to do this?

And what do you mean by Body codes?",saab
Closed. Done.,saab
"https://www.esaabparts.com/saab/parts/12787182

Just had this problem no more than a month ago",saab
"I would. I miss mine. I sold it out of fear I wouldn’t be able to find parts. It still looks amazing, and it was great to drive. My only complaint was peeling buttons.",saab
"Here's my fiancé and I's lil' collection as it currently stands:

- 2000 93 Viggen, Current daily, named Charlotte
- 1985 900 SPG, named Layla
- 1978 99 GL, named Veronica
- 1976 99 GLE, named Cozzie
- 1969 96, named Rosa
- 1969 Sonett II; my fiancé's baby, named Calliope

We'd love to have a 93 Aero Sportcombi, or 95 Aero Wagon, and I'd love to have a 92X Aero (Saabaru! :D).",saab
"I agree with this, he has a whole store full of Saab stuff!",saab
"The idea is that you can unlock the driver's door and get into the car safely without worrying that someone is waiting to jump into the passenger seat. Most cars switched to this method in the '90s. As u/poul0004 points out, it's an option you can control with Tech 2.",saab
"I went to autozone they scanned it and the solution says I need a new gas cap. The codes that came up was P0442 EVAP system leak detected (small leak) and a secondary dtc code? P0441 EVAP system incorrect purge flow.

If I order one off Amazon im hoping that will fix the issue? Or should I just purchase from autozone? Or is there somewhere better to buy saab parts from. Thanks again",saab
"Loose translation:

  
Performance is our nature.

Test drive the new Saab 9-3 for a chance at winning a ticket to the Saab Performance Drive.

  
Arrange a test drive until 31.12.2007 and with a little bit of luck, you may participate at the Saab Performance Drive. Experience an unforgettable day with the full performance of our current Saab 9-3 models.

  
For arranging a test drive, contact your official Saab partner or call our Hotline at 0180 2 249595 (0,06€ per call, mobile prices may deviate), or book your appointment directly at www.saab.de.

  
\[Offer for leasing a Saab 9-3 SportLimousine Linear 1.8i for 169,-€ monthly)",saab
Chrome for OG 9-3 and before,saab
I junkyard alot,saab
Stanced broken same thing,saab
r/projectcar,saab
From the GM parts bin. Same as a C6 Corvette if that helps.,saab
"This is the place, where the naturally aspirated cars have their ignition distributor. On the turbo models with the direct ignition cassette over the spark plugs this spot is empty. There's a kind of plug in the hole, but it's prone to leak. Nothing to worry too much about.",saab
Not anytime soon!,saab
Yeah I doubt I’ll be able to find another anytime soon!,saab
"It’s an aftermarket one, so i will check everything and if everything seems fine, but the car still has issues i’ll buy an oem one, maybe that is the issue",saab
"Yeah, looked nice. I went to reload the craigslist ad the next day and the person took it down. Bummer.",saab
"oh, and the 92 has a plastic gas tank instead of the metal one the older cars had.

make sure it is not compromised.",saab
Christ you're smug aren't you 😂,saab
"mouse eats hole in cabin air filter, stuff gets in fan, fan goes out oi balance when moving",saab
Get saab wis for windows and you will have service things there. All the “how to.”,saab
"Newer 9-5s dont have that. Ive had a 2005, 2007, & 2008.  None of them had it. It might be a manual only thing or at least a pre2005 thing.",saab
Anti-lag systems are loud AF. And dramatically reduce engine life. Unless you live in the country and this is a throw away car don’t do it,saab
Saabs probably seen a vast amount of the worlds history. They really did shit.,saab
"4k is reasonable if they aren't trying for a quick sale and have time to wait for the right buyer. 

For a quick sale.... they need to drop the price significantly.",saab
