Comments,Make
"Camera guidelines with wheel rotation work pretty well I think. I haven't completed the camera calibration to be honest - I had to reset my headunit due to unrelated issues and then life got busy. One annoying thing about 360 cam app was that when I set up split screen (2 android apps) and 360 is triggered due to my turn signal, the split screen is not resumed. I disabled 360 cam trigger on turn signal because of that.

Teyes headunits are more expensive I believe and their cameras are probably better than what I have.

Regarding annoying bugs - nothing major, the headunit seem to work pretty ok. Several things that I experienced:

* I tried to set up tasker automation scripts to do different action on wheel key presses and tasker was always being killed. Took me a while to find a hidden setting that whitelists tasker from being killed.
* I am using NaviRadio+ and having issue with it being interrupted with different radio station. I believe that is due to me trying to do a custom ROM update. I think OS reset will solve the issue but I haven't done that yet.",seat
And you love it ? :),seat
"Too much for one ride, max weight of Ateca is 2000kg and curb weight is around 15xxkg so you have cca 500kg of load at once…",seat
"belt intervals depend on the engine.

If it's worrying you, do it for your own peace of mind more than anything else.",seat
"not there either :( only information like ""driving status"" etc",seat
"Since you're going to get the wheels rebalanced might as well do an alignment and at the same time ask the guy to check for any obvious wear. You may have knackered control arm bushings or something of sorts which is causing you to constantly counter steer to drive straight, but if you can't fix it at the moment just do an alignment and it will be better for sure still.",seat
"there is probably a screw that fell out or plastic damaged. 

Maybe bigger washer will seal the deal. it did for me",seat
The new Leon's are horrible . Both inside and out,seat
Thank you I have same problem I think. Do you know howmuch it cost around to fix it ?,seat
"Ive remapped a few at my old job, they usually make 130 just fine and hold it easily. My old colleague tuned his to 130hp on his brand New ibiza 1.0tsi, its now 6 years old, 95k km driven with 0 issues",seat
"The screen is just a screen, you would need to change the unit to get more features. Also it dependa on what unit you have. if its a MIB2 (not MIB1) with Nav, you can unlock Android Auto/Carplay yourself.",seat
" Confusing isn’t it. They really need to be clear and just put it in the service book. My 1.4 TSI Leon from 2018 was due at 5 years or 60k which is when I did it. Though someone else told me 150,000 or 10 years.

In short, I’d definitely get it done if I was you",seat
I have the Ibiza FR with the 150bhp engine. They are rare enough because the engine was discontinued in the car early on. They wanted to keep it for the bigger cars. I love it. Had the car 5 years now,seat
"Yeah there a little noisy when cold but soon quieten down so no major issue really.

These engines are quite quiet once warmed up and running.",seat
"No. The 1.6 diesel uses a common-rail fuel system, not PD.",seat
Yes but i have 2.0 tdi 150,seat
"Update wise the newest software is 1969, but in order for you to get that you need 1899 first. When we do these at work we usually do 1899 first then 1969. Idk if you can get 1969 or 1899 OTA, but you could try. Go into your settings and click softwareinfo, then search for updates.

As for full-link, it depends on where you live. Here in denmark its standard, but not if the car is imported from sweden. So its not standard on every car.",seat
"What's your point? You're literally just repeating what I just said. Also, you do realize that you can roll forward on a hill?!",seat
It's a software unlock which costs £500. Which is ridiculous as its now included,seat
"Is the warranty with Seat or a garage that sells Seat e.g warranty with the garage / third party . If the former you should be covered. The later might be different depending on the root cause.
Emission triggers, are generally lamda sensors, or the map/maf sensor. Generally a simple fix.
How long have you had the car?",seat
Incorrect. It also indicates when there is a fault in the ecu system (sensor usually). Notice that the vehicle is running in the picture.,seat
How many kms it had when you remapped and how many kms do you have now ?,seat
"Could be anything from tyre pressures to twisted chassis, from incorrect parts fitted to too much weight in one corner of the car... without driving the car, no one will be able to tell you what it is....

Also, don't forget roads in the UK are cambered to the left, and cars WILL follow the camber of the road...",seat
Yeah it’s a 6p from 2016. It’s sadly only the 95pk FR spec,seat
erwin.seat.com,seat
"I have never heard it on mine, does it stop or increase as you go past 115?",seat
"If you want to do it yourself and you don't know the answer to this, don't do it. And if you get it done professionally, ask the mechanic.",seat
Rear dampers on the estate is the only problem i have had,seat
"When clicking the settings wheel on the radio page, I only get settings for the radio (radio channels, traffic info) and media (USB)",seat
I was wondering if maybe I had another app open on my phone that had a video playing in the background or something. Need it to happen again to check but hopefully someone can help us 🙏,seat
Cooling or heating I would say it depends on the local climate in a particular area.,seat
"That's weird. IIRC all Ibiza KJ have Full Link. Maybe not all have wireless. Mine has Full Link and wireless can be activated at dealership (it's getting it in a couple of weeks).

My KJ unit says 

Part number ending in 868E

Hardware H59

Software 0837

Although my car has the big touch screen so that's why the versions are different from yours.",seat
Aaaaaaaaaaaargh!,seat
"2 main issues with the 1.4tsi

Most common and worst is that the bolts for the cover for your exhaust camshaft adjuster isnt treated with loctite, causing Them to back out, damaging the adjuster, leaking out your oil onto the timing belt and potentially starving your engine of oil. Changing the adjuster along with your timing belt is generally a 3.5 hour job, but then timing the engine correctly requires a 4k usd oem tool and takes another 3 hours. 

The second common issue is that the injectors back out, warping your fuel rail and breaking the bolts for it, so you need to reseal injectors and a New fuel rail. This is a manifold off kinda job so takes a few hours of labor aswell.",seat
[https://www.seat.com/car-terms/a/auto-hold-function](https://www.seat.com/car-terms/a/auto-hold-function),seat
"Yeah you’re right, just got in the car and can see the thin blue line all the way to the top now. I assume that depends on battery % as was low yesterday and nearly full today",seat
We will never know,seat
No it's not. The parking brake engaged automatically in VW cars when the ignition is off and you open the door. It's a convenience thing so that the car doesn't creep forward (automatic cars) or move at all when letting go of the brake pedal let's say at a red light. I use it all the time so I don't have to press that gas pedal when standing still as the car does it for me. No it doesn't use the parking brake. Hill assist is also a different thing.,seat
"Those rules Are only for New cars either produced after july or EU approved after july, so why worry?",seat
"Very good point! 

[Images](https://imgur.com/a/29Zl9xB)",seat
Yes,seat
"In the UK definitely certainly colours are more desirable and some colours are less desirable.  Back in the day when I bought a MK2 1 facelift Leon cupra as a used car there was £1000 difference between the yellow and silver.  Yellow less desirable.  I think that was more a fact that the yellow was less desirable, it's not always easy to compare as there are so many other variables.

I miss that silver so much I just bought a silver mk 5 Ibiza for the family.  It shines so we'll with the right treatment.",seat
Make sure you're phone is updated,seat
"mine has hill hold but doesn't have a button to toggle it, it's just always on?

edit:
this is to disable creep in automatic gearboxes, not hill hold",seat
The wheels look amazing!,seat
you could just try to code it first... maybe your port does support apple anyway :),seat
"Underrated car. Had a 1.6 TDI for 2 years, it was faultless. Loved the huge boot, loved the narrow body which makes it perfect for urban driving and it was equipped with just about what you need and not fancy but useless crap. Swapped it for an Octavia because i wanted a petrol and petrol Toledos are quite rare where i live. My only minor gripes where the front seat didn't have enough lumbar support and the ride was a bit on the firm side.",seat
Is this knuckle (6C0407255A) the stock 6J one? Or a different model one that happened to fit on the particular 6J you saw?,seat
I know it’s only been 8 days but is it worth it so far? Spent about 4 hours yesterday updating the maps manually in my FR Sport 2020 - apparently if you subscribe to Connect you get automatic monthly updates but not really sure if it’s worth,seat
"The current Ibiza is also by far the best-looking car IMHO of the equivalent VW, Skoda and Audi models and probably also the most fun to drive (I haven't tried the Audi, though). I recently bought a 2021 Ibiza FR 110, though did test drive a few Polos and Fabias too. Decent boot space too, for the size of the car.",seat
No,seat
"Hmm, I must say I have a different experience. Can't speak for the manual gearbox. This weekend, I did a 200km trip and averaged 5.0L per 100km. I was really impressed with that. I do live in the Netherlands, so no hills around here.",seat
"

Did you do a software update for this? Or did it came out of factory like this? My colleague has the Style version (SE version), 2024 manufactured and I will receive my FR Business Intense (combination of the FR and Xcellence version) in June and I’m very afraid for how CarPlay looks. I have the 2017 Ibiza now with the optional bigger 8"" screen but I think the 8,2"" in my colleague's car looks less usable.",seat
Not sure DIY but recommend East Yorkshire Retrofit Solutions in Bridlington,seat
I get about 35-40mpg if I'm driving carefully. Got it down to 29 this morning with some spirited driving on the way to work.,seat
"Nope, no battery light flickering at all and I know it’s not the extra weight as the car feels nippy with extra passengers aswell to the point where my girlfriend even thought the car felt a bit sluggish when I pointed it out",seat
self destruct,seat
"There were no problems before, it worked fine. We tried the diagnostic scanner but it didn't show any codes.",seat
"The 150 is nice in the Leon, sounds even better in the Ibiza",seat
"Ibiza 1.5 TSIs are very rare in my country (UK) otherwise I would have preferred to get one instead of the 2021 Ibiza FR 1.0 TSI (110 PS) that I have, but I still love the car. Am planning on getting it ECU remapped to around 130+ hp once the warranty runs out to give it a bit more oomph!",seat
"Can't say, seems reasonable for UK prices but in Europe they tend to be a lot more expensive.",seat
"So far what I've noticed is:
1. Better acceleration.
2. Gear shift during auto/sports seems to be better. 
3. Noticeable increase in HP. 

For fuel, I haven't really took any notice as I've just done it recently. But what I've heard from from other EA211 platform users is that fuel economy is better.",seat
"Maybe try a fuel system cleaner.

Has it been serviced etc?",seat
If you have buttons on steering wheel try finding it those settings,seat
"Press one on the first button, the one with the 3 diagonal stripes to go to the main menu, then press it again for the apps menu. There should be an app called “sound”. If I remember correctly it is showen as a little speaker icon. There should be an EQ.",seat
**Auto Hold**,seat
"On vw engines once oil light comes on the damage is done normally, sounds like catastrophic loss of oil or oil pump failure either way engines likely done.",seat
"Bloody hell, interesting. Not the sort of stuff the majority of people would have looked at in a service. I service mine once a year, and had a new belt at 40k as per Seat's recommendation. Not sure how much more I can reasonably do!",seat
Remap it.,seat
"It had about 30k kms and now is at 98k kms and everything is good. Maintenence every year running on Motul oil and Mann/ Hengst filters. I'm about to change to Castrol oil to see if there's any difference. I always change every filter and did change the spark plugs at 56k kms. As I said, everything running as day one, amazingly hehe",seat
"First of all, take care of gas recirculation system, which means 15-30 min trips on a constant 3000rpm every now and then

Then it depends on kilometers number and engine code. On TDI you mostly have to care about the timing belt, oil pump and turbo. Turbo / egr problems usually appear at 180-200k km. 

Service every 10-15k KM and you’re good to go",seat
The gearbox works fine. Just the sound. It's the same sound as in this video: [https://www.youtube.com/watch?v=LjO\_gXssBLI](https://www.youtube.com/watch?v=LjO_gXssBLI) in 0:03. Also I get this sound after starting the ignition and turning off the car (like the gearbox is adapting or something).,seat
"Probably on the back of the boot itself when you lift it up, open it and sit on the boot edge and look up?",seat
"What do you mean with the fault in hesitation on pulling off? Also ive already took the plunge and financed the car, getting it next week and love the look of it, it is an automatic DSG if that makes any difference?",seat
I would start with disconnecting the amp and measuring the battery and alternator. Figure out how healthy both are. Then reconnect the amp and measure again. Perhaps your battery is a bit low.,seat
"Same issue with my 2018 Seat Ateca FR. I am afraid this is an well known issue, with no solution. During my 5 year warranty I kept complaining about it at every service appointment, with now luck.  
They even changed the multimedia system once (well they said they changed it, but wasn't sure about it), after sending them numerous videos where the connection got lost without touching the phone, but the problem still remains. 

It got much better though with my new Samsung S23 Ultra and a new USB cable, but I still have a disconnect every now and then",seat
This is mine: [https://imgur.com/a/wjm5eaR](https://imgur.com/a/wjm5eaR),seat
I think you might need link for in built sat-nav.  But if you can get ApplePlay or Android equivalent can you use something like Wayze,seat
"Sell car, buy one with these options.

Unless you're prepared to retrofit yourself I would not bother.",seat
I really love the new Cupra logo. A copper S was too boring for me.,seat
"There are usually screws under the clip which the door clicks close onto but I think on some VW cars the whole thing is mounted under clips and needs to be unclipped and pulled out using plastic squidgy tools. 

Have you got the new unit, check to see whether there are any screw holes in the new unit. I am assuming you purchased the whole fuel door unit.",seat
"I just bought a 2015 leon fr 1.4 tsi petrol and have been wondering about the same thing as the mileage is at 90k. I am hearing a whining noise which sound's like a belt. I've been told it sounds more like a fan belt, but I am unsure. Considering getting it checked for peace of mind.",seat
"Probably yes, i know there are people that can unlock hidden options, so i think this can be implemented as well. It would probably be a bit dissapointing since the 19 Leon FR actually had more performance equipped. Nowadays the FR line is just another luxery version ( wich i am pretty bummed out about it)",seat
Assembles the Avengers?,seat
My 1.5tsi belt is recommended at 140k and ‘inspect’ rather than a yearly recommendation. Hope that helps.,seat
"I mean you said it yourself “so that the car doesn't creep forwards” which is the opposite of rolling back on a hill. As in with it activated it will stop the car from rolling back and as soon as the accelerator is applied enough to move the car it disengages. 

Older hill assists uses abs to delay the disengagement of service brake",seat
"That's strange, I'd be inclined to reset the dsg box and see if that sorts it out.

It sounds to me like the actuator/pump noise is causing one of the mechatronic solenoids to fire when it shouldn't (suggesting a dodgy seal inside the unit) and why the pump sounds like it's running for longer than it should. Personally I'd leave it until it becomes a problem as the repair bill will be the same either way if the mechatronic does eventually fail.

You could test this theory by plugging in to a scan tool and measuring the actuator pressure and seeing if it holds steady or drops more than it should.",seat
Me too,seat
"Yes, but those extra ponies under the bonnet must make up for it 😃",seat
The older model (the one I have) has this down by the shifters anyway. You should be able to get the part for the old model and swap it out afaik and just run thr cables to it,seat
ajector seato cuz,seat
"I'm still getting used to it, but I'm having fun driving it",seat
"It's exactly the same engine mechanically as the 115 bhp version AFAIK and others have reported getting 140 bhp out of that engine after a stage 1 remap, with no apparent adverse effects.",seat
"There are companies/people who can unlock features like full link, provided you have the right hardware, or even upgrade your hardware if it isn't sufficient!",seat
Actually if you check my profile I just posted my car asking about window tint. I added a spoiler a couple days ago.,seat
you defo cant get that wired properly. all the buttons for volume control are right under so it'll be way too much to do all that imo,seat
A picture of the cars fuel flap area would be very helpful,seat
Jerks you off,seat
"Most likely advertising error... Polo GTI is built on the same platform as the ibiza, but has a different setup. Racingline probably done all their R&D on the Polo GTI... also if you look on the spec page for the brakes, it doesn't mention ibiza at all (but weirdly it mentions Arona...)

You can always email their customer support and ask directly though...",seat
Touché. Spelling clearly not my strongest point there lol.,seat
"Just so you're aware, it's true they say the belts are for the life of the car, but they also indicate that ""life"" is 15 years or 140000 miles...",seat
I think it comes with MIB 2 or 2.5,seat
"You other option would be to install the mib2 toolbox and remove the CID Lock which prevents you from using any 3rd party sd card.

Thats what i did btw. :)

Edit: here is a tutorial for it https://youtu.be/ZOf-XEYhFbQ",seat
"My 2016 Leon has Full Link that gives you access to Android Auto, Apple Car Play and MirrorLink. As far as I understand MirrorLink is for those who don't have an Android or Iphone.",seat
"Mark my words, next to remapping your ecu, i bet there's a way to disable that system via software programming. If they can unlock hidden feautures then they will absolutely be able to do that too.",seat
Cool! Must be software then. Thanks for your answer.,seat
"That's not something I've noticed but maybe, not laggy in a way that bothers me.
A tip if you didn't know about it, if you tap both cold and warm you start the seat warmer ;)",seat
What is the problem you are having? Codes are only half the story.,seat
"I have a towbar on my Leon, from 2020 MK3. 

Do you want a picture, can PM you?",seat
"Take it to a new mechanic, this one's clearly a muppet.",seat
"got it thank you, i couldnt see the join in the light so i couldnt see how the panel came off, but sorted now, will check the fuses and hope its just that, thanks again",seat
AC max sets the temperature to Low and maximum fan speed.,seat
"There isn't one... wired directly to the Central Electrics control unit ""BCM"", won't be a fuse either because both headlights share the same fuse

I'd double check the light bulb is the correct one and is fitted correctly, then check with a voltmeter and see if there's voltage at the bulb when the lights are supposed to be on, live against a known good earth and earth against a known good live

If there's no live, then you'll need to check at the wiring junction inside the car and then at the BCM (at this point I'd recommend taking the car to a SEAT/VAG specialist)

If there's no earth, chances are it's the headlight, since there's only 1 earth wire at the plug for all the lights and gets split for each bulb inside the headlight, if only the dip beam doesn't work and it's a bad earth, that only leaves the headlight itself


Just make sure the bulb is the correct one and is fitted correctly, number of times had cars come in from other mechanics condemning the BCM when the bulb isn't sitting right...  it's actually scary...",seat
You would use the AC Max if your windows suddenly fogged up. The lower button is just air conditioning. How ever if you use the middle dial on auto and set the required temp it’s much nicer. Also I read recently that you get best economy if you keep the air on recirculate mode and engage A/C. I’ve noticed when I’ve been in Australia that recirculate is the default setting.,seat
"i always drive on normal mode, i tried going into eco mode and drove for 5 minutes but it was behaving the same way so i just switched back to normal but nothing has changed. I wonder what the issue could be?",seat
Check for cables under the accelerator pedal or handbrake release,seat
"yeah, and what happens after those years",seat
The parking brake also disengages automatically with it off. The two are completely separate systems. Like I said: auto hold utilizes the ABS system.,seat
Danggggg gotta do this!,seat
"Hard to say, the price of mk4 Leon’s fell a lot though, I bought my 2021 for 21k just over a year ago and it’s now worth 16k 🥲",seat
The mk3.5 do come with Copper S as standard. But i actually really like the new badge so i did the same with mine!,seat
Definitely would like to know what the fuel economy is like when just driving normally?,seat
Surely that just means the number below is your fuel economy figure? I don't think your car has driving modes..,seat
Thanks a lot. I appreciate it,seat
"I don't like seeing the rusty discs (is this a mk3 leon/st thing or just because I look at these more), so would go for the more obscured black ones.",seat
I have a Leon 12/18 with MIB 2 and my car only show the Bluetooth Logo.,seat
"Thaks a lot man, worked!! You saved me lot of time",seat
"i don’t know too much about cars but why’s it trying to get me to shift up at those rpm? and it’s not just hills, it happened on normal flat roads too",seat
"I think the Corolla would ve rhe more realible option since, well it's a Toyota ;)",seat
Thanks so much mate! I'll look into it :),seat
"Looks like you are in Ireland. The van has white euro plate on the back. Me too. 

I have the same car. If it only has one SD slot in the glove box and your head unit system has a code like something below. 

MST2_EU_SE_ZR_P0351T very tipical for non nav and Irish / UK market. 

Then it needs to be taken to the dealer, I was quoted 340€ for this, a rip off but doesn't surprise me here. Less than 200 in England for the same. 

I heard as well you can do it at home but you need to solder components to the back of the radio.",seat
"Thanks for letting me know, I was looking to buy the 1.5 Evo FR Black Leon and the dealership sent me a video, amazing looking I just thought damn that sounds like a diesel but I imagine they literally started up the car and took the video straight away without it warming up hence it being quite noisy",seat
"Hope so. I just got a new Ibiza and am really happy with it. It seems to be just about the only car on the market that fills the niche of a small-ish mid-range hatch at a medium pricepoint that has enough power you can drive it ""normally"" (the 115hp is the smallest sold in my country, not like some anaemic 60hp thing that struggles to merge or overtake), but isn't a hot-hatch boy-racer model.

I guess that's not what sells any more though, I guess most of the new-car-buying demographics want SUVs and crossovers if they're not looking for an enthusiast/premium type car or an EV.",seat
"Going to try and get a test drive this weekend as that’s the only way to really see, was yours 150bhp also?",seat
"Yh I’m seeing quotes for like £500 for a retro fit, I just want to use Waze lol, the nav on the original display is terrible",seat
"try long pressing the power button on the infotainment and keep pressing until it reboots. then just reconnect your phone with a cable. I find that helpful when carplay won't connect in my Leon.

or your phone didn't give needed permissions. try forgetting the car in phone settings and try again.",seat
"That I’m unsure about, I’m guessing you wouldn’t be able to. Only thing thst I could think of is having it set to what you need, or reset on OBD any flags",seat
https://www.seat.com/car-terms/x/xds,seat
"Ok, thanks for help.",seat
It's normal for them to come on shortly before you start the engine I wouldn't worry about it unless it stays light up,seat
