Comments,Make
"The V90 is another alternative I left out. If you haven’t dealt with handling two kids especially during infancy then you wouldn’t understand the size constraints for the 60’s and 40 with car seats. As they get older then you have trunk space to begin worrying about. I prefer smaller sedans, wagons, and hatches but most people’s lifestyles don’t match to those smaller sizes.",Volvo
Yep true,Volvo
Yup it has been a few years since I have been in the shop but that sounds about right.,Volvo
Same! He said it’s the reason working for a Volvo dealer is so easy in a lot of ways. Also he said I could buy another if I wanted.,Volvo
"Mine handles really well.  Not sure what you mean by horrible steering. 

I have mine set to firm.",Volvo
"wow!    I almost bought one long ago

moar picsssss",Volvo
"I had a 2019 S60, my mom had a 2018 XC60 and a 2021 XC60 (the Most expensive Model) and honestly, the plastic Interieur from Volvo just feels cheap. I cannot compare it with Audi, but BMW and Mercedes feel and Look far nicer.",Volvo
"I’ll be honest with you guys, there isn’t a whole lot in it for the dealer. Volvo charges us $900 every time the software is downloaded to a car.",Volvo
Also looking at a 2022 XC90 Momentum with 10k miles for $44k.  Which would you go for?,Volvo
"Hell yeah, welcome to the P1 gang!!",Volvo
I find the estimated range after I fill it up rather optimistic.,Volvo
SDXC memory card slot for your navigation map update,Volvo
"If its 6 speed auto, make sure to test all functions of the transmission. They can act up if not fully taken care of.",Volvo
"dealerships are way too expensive and you should go to an independent Volvo specialist

*That being said* :
Scheduled maintenance isn't a failure. All cars need maintenance to some degree. They won't cover mechanical failure if you don't look after the car either. 

Honestly that's why it's not worth buying new cars. You still have to have maintenance done based on the miles you drive regardless. You don't escape that in a brand new car. It's just nicer :)",Volvo
I am a big fan of **VREDESTEIN QUATRAC SL** all-seasons.  I have them on my 240 wagon and on a Miata.  Great all-around tire and I think they would be excellent on an AWD.,Volvo
Thanks for the reply,Volvo
"The french can make really pretty cars, but they’re horrendous quality wise, especially the diesels with their own proprietary additive stuff, adblue is bad enough already.. The electronics are prone to failure too, mostly the BSI",Volvo
"I can tell you from personal experience that if you're thinking ""I wonder if it will be able to do this?"" there is a good chance the answer is ""nope!"" 

I wouldn't rely on it for anything outside of pretty narrow bounds. And as I'm typing this I realize I haven't used it in months because it did too many things that were more annoying or dangerous than were worth the minor convenience.",Volvo
"Let’s hope not. Volvo has really nailed the recharge line, I’m super happy with mine. They already have the 2 fully electric and I’m hoping they’ve worked out enough of the issues/kinks between the variations that the EX90 will be another slam dunk. I wouldn’t buy the first gen but I have higher hopes than the crap job MB is doing. 
There’s been a lot of people picking them up damn cheap because of the Amex $12k + $7509 but that’s showing you how desperate they are to move these shit boxes.",Volvo
"They are not too uncommon here in Sweden, although there are considerably more V70 T5 with a manual than the s60 T5",Volvo
"Teslas definitely have some cool tech, but man do they make weird choices sometimes. 

I drove my co-worker's Tesla recently, and to put it in reverse, I had to swipe the damn touchscreen. I really hope that doesn't catch on with other manufacturers.",Volvo
"Could be the internal stability wire, or a piece of external wire fro the cut angle, either way get it changed ASAP as you'll get done if stopped for (EU / USA / UK) fine and points etc",Volvo
Are y'all selling any S90's? I tried to test drive one locally and was told they don't have any on the lot. The sales guy also told me they sold less than 15 in the past year.,Volvo
Do you have a T8?,Volvo
I’m wondering this as well. I’m so out of the loop on new cars (currently driving a 2011 accord lol.) I thought Volvo’s got free OTA updates?,Volvo
Go to Ikea customer service desk. Tell them you are driving a Volvo... They will give you access to the secret ultimate Swedish Ikea shopping experience...!! ;),Volvo
That C30 is freaking gorgeous 😲,Volvo
Ahh mine is denim. Almost twins!,Volvo
I group you in with the 90s guys as the designs didnt change at all...,Volvo
Looks great! The slight poke on the rear is just barely noticeable.,Volvo
2000 s70 here (non turbo) and I'm getting about 23,Volvo
I’d call it C pillar. Coz it includes the dog leg of the B pillar.,Volvo
"Here a video comparison of the P2 volvo xc70 (2001) so first gen with vicious coupling vs a V90 awd haldex system.

https://youtu.be/zUXxqbPjvvo?si=6zAy1bI9Zb3tpiOB",Volvo
"O Volvo of the lake, what is your wisdom?",Volvo
"One thing I haven't seen mentioned is that in a lot of later Automatics, the gearbox learns from your shifting behavior when in Manual mode and applies that to its own shifting logic when in auto.",Volvo
That tune that gets you 460 at the wheels looks cool haha,Volvo
"Same thing happened to me on almost new Michelin tires. Didn’t hit a pothole, didn’t drive it on flat.",Volvo
Really?,Volvo
"Even if you don't want to tackle the brake flush and/or oil change, you can order the engine air filter and cabin filter and do those yourself.  It's literally just popping a couple covers off and swapping out the filters; takes maybe 15-20 minutes tops.  

I did the same thing a few months ago and once you factor in the cheaper cost of getting the parts yourself, it cut the bill by almost 75%.",Volvo
"The old one had a small piece in it that could destroy the motor if it broke loose and got sucked into the intake manifold. The odds of this happening are low, but it's an easy part to change with the updated version if you're in there anyways. Actually, it would be more accurate to say that this bolt is a headache to replace, but you're going to have to take it apart and put it back together anyways for this job, so you might as well put the improved version back in.",Volvo
5 cylinder 2.3L is my guess. No turbo badge on rear so unlikely a turbo. You could just as easily typed this into google,Volvo
So helpful thank you,Volvo
Thank you !,Volvo
just trade in the Prius when you do the lease. It’ll reduce that bottom line balance number and that’s what sales tax is going to be figured on. I don’t know if you have to pay the sales tax upfront in Cali or if it’s broken out over individual payments,Volvo
"If you have a 60 or 90, trust me, you don’t want the wireless charger they had. My 2021 XC90 had it and it was complete crap. It took away some valuable storage in the center tunnel, nothing would stay in place on the charger, and it didn’t even work with iPhones for a while… and Volvo had a serious attitude about it being an iPhone problem. I was so happy to see the 2024 doesn’t have the wireless  charger anymore.",Volvo
"Quarter panel, or D Pillar basically depending on if you're talking about the outer sheet metal or that section of the car",Volvo
"I get that message with my 2010 XC70 T6. I don't wait too long to top it off with a quart of oil but when I check the dipstick there's still plenty of oil. It's not like it's dry, it's usually just a quart or less low and adding a quart gets it above the midpoint on the dipstick. I wouldn't plan a road trip with the light on but I've learned it's not the end of the engine. My car has 178k so being a quart low before the next oil change is pretty standard these days.",Volvo
"Welcome to the club I have a 2024 XC 60 and I’ve already spent one oil change and it has less than 45,000 miles on it",Volvo
2018 V40 D2 5.2l/100km,Volvo
"Based. Just change cooling hoses, expansion tank and its cap. Oh, and thermostat housing if its same as on t5.",Volvo
"I am not sure about the situation with 100km>75km with highway driving, but a similar post was asked(also with XC60) on the range gauge. 

The XC60 I drive,  I drove an approximately 80mi(128km) trip starting at a 130mi(209km) reading while previously driving at 15-19mpg(\~15-12L/100km) city driving. By the end of the trip I came back to having 100mi(160km) range. Was about 20-25mpg(\~12-10L/100km) driving on the highway. But as soon as I went back to city driving, it dropped immediately back to 55-65mi(\~80km-100km). 

But it seems to make sense with the change from city to highway and back. And in this instance, I went from 1/2 tank to 1/4 tank--so maybe my tank wasn't low enough to show such issues as you described.",Volvo
"S60 T8 Polestar Engineered 

39mpg at the moment. During summer it is 42-45mpg mostly city driving.",Volvo
"the question is what kind of road are you going to be driving on. is there steep elevation change especially high degree inclines and slopes? snow performance is hugely relative to slopes and speed. if it's all flat roads you should be fine but on slopes you can't control the grip needed for stopping.  

the pirelli AS are pretty bad and tuned for summer performance. i wouldn't chance it if you are going up and down hills in heavy snow.",Volvo
Sure,Volvo
Black rims look too much like my shitty winter steelies lol,Volvo
Any Android phone can emulate a USB stick better than an iPhone.,Volvo
"Yes, two actually, on either side of the hood",Volvo
"You made the right call, IMO.",Volvo
"Thanks, that's an interesting observation. I park my car in a garage, so it usually is around 10-15 degrees celsius even in winter.

How much higher is the consumption?",Volvo
I wanted blue in particular because i also want yellow rally sripes so there's a swedish flag theme. And i didn't want black because they wouldn't pop out,Volvo
"Same company that makes Deka, makes the batteries for Oreilly's and Napa. Fyi.",Volvo
I’ve had the blonde for 3 years with 2 teens & 2 dogs and I have to say it’s held up far better than I through it would.  I do have the rubber floor mats which helps a lot.  But no issues with blue jeans.  One of my kids did somehow manage to make a brown mark on one seat?!? But I love how light & airy it feels after having the black interior previously.  I’d definitely get the blonde again.,Volvo
"Its interesting that technology is a big issue. I personally don't think I want a car newer than what I have, 2020 V60 CC. The amount of bullshit like microtransactions and data being collected with forward facing IR cameras and all that nonsense. I just don't want it at all, and if I change my car in the future it will almost certainly not be a new car. Its just becoming too much, and its strange to me that most people don't feel this way. I should add I'm not a boomer, I'm 27.",Volvo
Amazing pair. Probably the best sedan of the 90s and best wagon on the 80s.,Volvo
"Thank you, I most definitely will!!",Volvo
The current XC90 seems to be on pace with the old gen since we are about to be 9 years without a change lol.,Volvo
"Yeah, well at least he can read a car owner’s manual lol",Volvo
"This is the answer? You know that depends from other person? Not everyone is interesed in cars. My sister for example got Skoda Scala 2023 1.0tsi 115KM from her work recently. I asked her how that car is running? Is it ok, or no? She said that it drives forward and backwards, turns and brakes. And horns if you press that funny button on the steering wheel (joke ofc).

If she would ask me to help find a car for herself, and I will show her Volvo, for her it would be 'just a car'. Not everyone, especially women, treat cars like we do.",Volvo
"I was thinking the same thing the pre-GM Saab’s were wonderful quirky cars, but considering that Saab is long dead not the best example to use.",Volvo
https://www.carfax.com/vehicle/YV4952DZ1C2264086,Volvo
Agreed.  I haul half a household back and forth on the Eastern Seabord! Plus a sleeping bag in case things get dicey and I need to camp out--the back is big enough!,Volvo
"Vampire 💀 JK. Someone who values a safe, dependable, classy ride over some flashy toy (looking at you, Tesla and BMW owners)",Volvo
"A lot of cars that have a BMS require a reset of some sort.

It's kind of annoying, but it does actually make a huge difference in how long the battery lasts.",Volvo
"That's not just a holder. It's more like a dock that is connected to the front seat electric and it charges the iPad. Also has port to charge another device.   
It's pretty slick.",Volvo
I love it. Amazing color. I am glad you stayed with Volvo,Volvo
Show her the integrated booster seat at the back for when the kids get older,Volvo
Gotcha. I've just been searching with the model number cause the configuration of s40 I have seems to be quite rare. Sounds like my cylinder walls are the thing holding back my 500hp dream.,Volvo
"Resetting the BMS is like the first thing that pops up when searching for this issue, yet people seem to live in denial about needing to do it.

Just a note, removing the fuse to reset state of charge for BMS didn’t work for me. I ended up having to reset the system through VIDA, which worked perfectly. I never knew it could be done the way that YouTube video says, would have saved me some headache getting a DiCE and VIDA working.

Thanks for the informative post. Hopefully it will guide people to do the job properly.",Volvo
really? should that work in a 2012 V70 also? will try that asap ...,Volvo
Because Volvo.,Volvo
Yeah seriously beyond CarPlay I don’t want anything else. Even pilot assist makes me nervous and I can rarely use it for more than 20 mins at a time.,Volvo
"2006 modified V70 2.4i - about 1-2 times a month, and I get 30mpg on a bad month, and about 40ish on a good month lol",Volvo
"Redblock Volvo, maybe. Modern Volvo, no.",Volvo
What’s new is they ruined the infotainment with the built in Google nonsense,Volvo
"Okay, just wanted to be sure :) Thanks !",Volvo
west.,Volvo
"Good to hear, enjoy the new ride!",Volvo
I don't see you mentioning which jeep you had. Unless it was something newer with intelligent AWD capability then you only every had 2wd or 4wd. This is fantastic for wheeling and off-road. On snow and ice it becomes dangerous. A FWD based AWD like any Volvo would give you the most confidence inspiring handling in inclement weather. It is why Volvo switched to FWD only so many years ago.,Volvo
"You should know that diesels warm up very slowly especially in city driving. It consumes more fuel when not up to temperature. If it's freezing where you live, you might almost never see the temperature gauge in the middle when driving in the city. Our 1.6 diesel cools down when I drive in the city.",Volvo
They were also in the XC90 V8 Sport.,Volvo
"An aftermarket ghetto Pioneer head unit in my 2009 Kia Soul has more functionality via wireless Android Auto than my 2022 XC60 with AAOS. Seriously, Android Auto has way more app support, allows for split screen, reads messages, etc. AAOS is barely Fisher price at this point.

Doesn't help that Apple Car Play was enabled and it works so much better than AAOS too.",Volvo
"you don’t have to pay the rent charge when you buy it out. You only have to pay the portion of the three payments you make that is interest. Your payments will be comprised about 50% interest, some principal, and sales tax (depending on state)",Volvo
What does that mild hybrid system actually do?,Volvo
2-3 minutes with the rim pinching the sidewall on the road at highway speeds is all it takes. The wheel and road basically acted like sheers.,Volvo
Depends if you know the brand. I can tell the difference from a 2021 to a 2022 XC90 while most of my customers cant. Its very slight changes as for some its not enough.,Volvo
I get like 24mpg max. Usually less,Volvo
"What market are we talking about? US I suppose?

Here in NW-Europe the one brand that has similar reputation if not even more ‘boring’ than Volvo: Skoda.

Especially the Skoda Octavia is very similar to the V60 (both hatchback and stationwagon). I can say from my own experiences.
SUV’s idk about, both have models and Skoda SUV’s are also very popular here.",Volvo
"Another thing I was told by Volvo is the lease buyout makes it a “used” car so it won’t qualify for any sort of special financing rates, like the 3.99% they currently offer, the interest rate at my local credit union is 6.79% so an additional almost 3% of interest needs to be factored in to the calculations, unless you plan to pay cash or payoff your loan early or refinance if rates go down.",Volvo
My V50 D5 about 800-1000km per tank and 5-6l/100km average. I drive a lot so once a week is my fill rate.,Volvo
"On my S60, the button to the right engages the hyperdrive or the death ray, depending on how hard you push it.",Volvo
"No, do your own homework.",Volvo
V60 Cross Country. Both win a you the V60 and she a crossover.,Volvo
Hahahahaha good point! 😉,Volvo
"You could if you wanted to, but personally I’d add a dashboard speaker just to have it sound more full. Base audio systems may seem like there’s a speaker in the dash but there isn’t. As for the 10 speakers, I’m not sure if you need new wires for that",Volvo
I was upset until I saw this post. Getting 19.9 mpg mostly city in my 19 s60 T6.,Volvo
The most reliable Volvo is the T5 and at that low mileage? It's absolutely a waste of money. Buy 10 shares of Reddit and make some money.,Volvo
"2000 v70, getting 18 on the dot, filling it weekly w premium",Volvo
$100CAD a week in an S60,Volvo
"Press and hold it for about 3 seconds. It opens your trunk, and if you press it again you can also close the trunk.",Volvo
"I was at a dealer today. Newer screen? I guess. No one would notice. Wireless AA/ACP? Give you that.   
But body? No friend.   
These cars are still fucking gorgeous. They had a ton of stock, I saw it all. I think the ugliest car in the lineup is the XC90. It looks too much like a lot of others.   
But everything else?!? 😍 Don't you dare touch it!    
They are spending a lot of money on the dealership though to make it look like the new ones.  
Lots of them in NE Ohio.    
Volvo is doing ok. 👍",Volvo
From what I’ve read Volvo is trying to cut ties with polestar.,Volvo
Weezer reference? Wouldn't surprise me with Volvo drivers.,Volvo
Parked at the Swedish mecca. Well done.,Volvo
"I’m not going to show the shit show that are my Momentun Pro wheels. That I cannot blame anyone else for messing up. They all track true and hold air perfectly well. 

That’s just a small chip out the wheel. The worst part is the coating is broken and you’ll get corrosion seeping under it. Especially if you use acidic wheel cleaners.",Volvo
"Not sure if it's any different but the 360 camera in my MY19 V60 is brilliant, one of my favourite features of the car alongside pilot assist.",Volvo
Yeah we got -36.2°C this year,Volvo
"Anyone ever have that text easter egg pop up.

when we got out 2016 xc90 I was driving and my wife had sent a text, I had the car read it , in the text she mentioned a completely north American male name  but the car changed the name to Sven when it was reading it back. 

I checked the actual text and everything to make sure. 

It's never done it again, or any of the Volvos since.",Volvo
"Agreed. I had an almost new CX9 rental (I guess they are now cx90) and it was shockingly nice.
Lacked the power I prefer, but I imagine a new Volvo probably feels similar coming from my 3.0 T6",Volvo
"The transmission should be alright pushing power, I’d be more worried about the awd system. My s40 is fwd and after getting a tune the wheel hop is scary, awd would be a lot better depending on how it holds up.",Volvo
"2019 XC60. I normally get around 16mpg, but that's because I drive like no more than a few miles per trip (< 5k miles per year).  All in-city miles. I use about 1/4 of a tank per week, so I usually fill up every few weeks.

If I do a wide open freeway road trip it's closer to 30mpg.",Volvo
"The 360 view in my xc40 is just very distorted and Lo-res, despite the individual camera views actually being quite sharp.. clearly the software that stitches them together for the 360 view isn’t really up to the task.  My Allroad’s 360 view in comparison, was very clear.   That said, it’s still useful - just disappointing that it isn’t as good as it should be.

And to be clear, I do not dislike my XC40, but as I only recently changed cars, it’s quite easy for me to compare both.  I do like the Pilot Assist and the matrix headlights, and the heated steering wheel / seats and windscreen are excellent (way faster to heat than the Audi).",Volvo
"11 1/2 thousand off is about the best you can do. You do not have room to play here. That’s all Volvo incentives and the only way you can get 12 or 13,000 if you had something like Volvo affinity for medical professional or the thousand dollar Volvo loyalty bonus.

Jesus Christ man they’re showing you 11,500 off the price of the car and you think you’re gonna get more? Don’t get greedy here they’re hooking you up.  You absolutely cannot get 10% off the sticker price plus the 7500 or other various lease bonuses. Anybody who told you that is nuts. The margin on the cars is only like $1800, all this $11,500 in discounts you’re seeing is all Volvo incentive money.

If you do the buyout from the dealer, you have to wait 90 days and you’ll have to pay a doc fee. 

If you call Volvo up and do the buyout directly, you won’t have to pay the doc fee and you won’t have to wait 90 days (and Volvo will pull back from the dealer about $2000) so you’re literally screwing them over after they’re trying to help you figure out how to get the car for a net of 8500 or $9000 off sticker price",Volvo
"Delete the chrome, get better wheels but not black",Volvo
"block shims will get the block to safely hold 500bhp. the regular recipe would be something like a bigger turbo using a jap R manifold, bigger injectors/fuel pump, block shims, water/meth, 3.5in maf/inlet, larger intercooler, full 3” turbo back exhaust and some misc stuff will get you to 400-500bhp using 1.5-2 bar. or port the head, high duration high lift cams, port the inlet manifold, get a long tube header, bigger turbo, intercooler, 3.5inlet 3-3.5 exhaust, bigger pump/ injectors shim the block, make similar power with more flow, less pressure.",Volvo
"Mhm Piece of candy, Mhm Piece of candy, Mhm Piece of candy , Mhm Piece of candy",Volvo
"Honestly, you probably only like it more *because* you're using apple car play, thus avoiding almost all of the pitfalls of the system.

Voice assistant is only great, cuz again, you're using Apple car play and didn't have it previously. Those of us with Androids already had this voice assistant working flawlessly with our phones plugged in on the old Android Auto.

Not gunna lie, the car makes me want to get an iPhone just so I could use carplay instead of the car OS!",Volvo
But you can be an agent AFAIK.  When I get it right you are a volvo vendor.,Volvo
"Current style (exterior) is timeless and doesn’t look dated at all. 

Interiors need less piano black - it ages terribly and does look dated.

XC40 and V60 CC need extended range PHEV options. V60 T8 should be available in non-Polestar trim.",Volvo
"Completely agree with this. Like one of the previous posters, I've spent half a lifetime driving on snow ice and slush in darkness and blizzards mostly in front wheel drive Volvos 100% with either studded or winter tyres. Never ever without. It's not the car - it's the grip of the tyre on the road. Take a train or a professional bus driver and go on a winter driving training course.",Volvo
Thanks. I did wonder.,Volvo
"If this is happening for no reason because a car is next to you?!? Something is wrong.   
You can turn off most stuff but there is one setting you cannot shut off.",Volvo
"Can I ask, we just bought a 2021 V60 and the electrified tailgate squeak when closing (but never when opening), the noise alternate between the right and left strut. The dealer we bought it from said it will go away by being used as they claimed it is self lubricated. 

We bought it as a VOLVO SELEKT (not sure if it’s only a Swedish thing) and we have a 2 year extended warranty, what can we do?",Volvo
"didnt comment on the last comment, I am PUMPED!! Taking tuesday or wednesday off to ski next week too =)",Volvo
so you have the Valet key which only opens the drivers door and the ignition ,Volvo
"I fill up once a week and get between 31 and 35 MPG(US) usually. All highway miles. 

2000 V70 / FWD / NA / auto",Volvo
Volvo heads in U.K would buy it,Volvo
The leather on the newer steering wheels isn't as nice as what is on my 2012 S80. I've had some loaners and the steering wheel definitely feels cheaper.,Volvo
My XC 90 has 250k + and I love her. She kicks ass. My only issue is she is a thirsty girl and goes through gas like crazy!,Volvo
Are they hard to replace? Mine has some damage and I'm thinking about replacing it myself (not a mechanic).,Volvo
The height of the sidewall has nothing to do with owner negligence of not checking their own tire pressures before a road trip.,Volvo
This right here. This is the goal,Volvo
I only know l/100km but a Google search tells me it's 24 mpg,Volvo
"No afraid now. 

And all the MMI boxes that enable it plug into the Aux channel. Therefore are no better than a usb to jack adapter (though more convenient).",Volvo
Could it be the Polestar 2?,Volvo
