Comments,Make
"Every single time I pass a car at night that has their high beams on, it’s ALWAYS this generation of civic. It’s become a running joke between my wife and I.",Honda
Looks clean af!,Honda
"Air intake tube, or air intake snorkel",Honda
4k usd,Honda
I had the same issue. I changed the battery and it went away for a month and came back. I pulled the code and it was the fuel injectors. I took it to the dealer and they said it was the fuel injectors and the VSA module. You can smell gas in the oil. I got the injectors done for $2000 Canadian. The lights are still going off. I'm in the process of sending the VSA to be rebuilt. I hate the vehicle,Honda
"Had to block my address, they made the label absolutely massive",Honda
Yas!!! I love my Trail 125! Got the 2023 in green myself. Great bike!,Honda
The 86 had more style than the 2024!,Honda
"I do not consider roof racks to be a cosmetic mod. They are there for a purpose, to carry stuff.",Honda
Are starters directly connected to the key being on the accessory position and being able to turn everything on? The starter did go out last year and I had it replaced with an autozone reman part along with a new battery because of old age on the battery,Honda
"95 si for the gas milage and looks, 04 tsx for more modern interior and comfort plus looks. Both manual",Honda
The part that is ALWAYS cracked lol,Honda
"I'm not saying the AC \*caused\* the musty smell, just offering tips on how to help it go away.",Honda
"Keep the Accord, it's roomier and still fun to drive",Honda
"2021 Honda Passport Touring
2024 Mazda CX-5 Premium Plus",Honda
There is no way of knowing what its worth without mileage.,Honda
"“no reason” to us consumers but that doesn’t change the fact that 2wd 06-08 pilots have vcm and awd 06-08s don’t. 

2008-12 Accords having VCM was based on body style and drivetrain.
2005-10 Odysseys having VCM was based on trim level.
2006-08 Pilots having VCM was based on drivetrain.

The 4WD and 2WD Pilots literally have different engine codes: J35A9 for 4WD and J35Z1 for 2WD. 

Transmission type is just as arbitrary of a reason as 4/2WD to have VCM or not.",Honda
"The Mugen Supercharger kits, or any of them for the matter, are not suggested for the CVT transmission. And after weighing out my options, keep in mind I do all my own work, I can K swap my car for about the same price as a fully decked out supercharger kit. 

There was a dude that owned a white Mugen Edition CRZ somewhere in my neck of the woods. He won multiple awards at H Day for his build. Don't think the same state, but some where in New England. 

A K has way more potential than the factory motor does.",Honda
"Had one of these for a few years - same color as yours. 5spd manual. Pretty good interior space, stupid reliable but man, was it slowww. 

Loved that car. Enjoy!",Honda
"remind me of the auto repair shop that works with a neighoring body shop, they'll drive over with a work car to pick up auto body cars to do work on. and the vehicle they leave behind is a total disaster",Honda
"The tarbanator, it’s connected to the motor",Honda
Most american done at 200k? Feeling little patriotic aren’t we?,Honda
thats very fair you sounds like you got a deal even imo. you wont go wrong taking care of a Honda. built to last.,Honda
Meguiars scratchX and a good automotive polish. You could be lucky and get most of it out,Honda
Even better than Toyota’s? I heard that the cost of ownership is lowest with Toyota hybrids. I’m really hoping that it’s not true as I can save $4000 by going with the used CR-V as opposed to the RAV4. ,Honda
"Possibly couldn’t hurt, all the ones I’ve seen never seemed to have loose valve cover bolts, just the gasket that failed",Honda
Clean as a mf man,Honda
"For what they did?  A couple hours.  I'm not saying the price isn't fair. They have overhead to cover. . 

It's maybe $150 in parts if they replaced the rotors. Under $100 if they pad-slapped it. 

 People at the mercy of the dealer need to get used to being bent over.",Honda
"It's a fair price, but dealerships will always be more expensive. If your cars out of warranty, there's no reason to take it to a dealer for basic maintenance.",Honda
All of them,Honda
Bro you are the childish one here,Honda
"the accord wagons for 1990-1993, 1994-1995 are so bad ass and unique.

if i had one, would keep it completely stock, no tints, no rims, just lower slightly on the oem alloys that are on the EX models..same for the sedans of 1990-1993 models.",Honda
"i did it one time, under circumstances where i’d get an even less desirable outcome if i parked legally.",Honda
I'm a 2nd owner but it barely used with 18k miles on it and now I'm at 200k miles for my 2006 accord coup🙃,Honda
"I just drove past someone a few hours ago with those daft tri colour strips. It was the German flag colours though, and they were in the order of red yellow black. Not sure which version of the German flag that follows from.",Honda
Eat me,Honda
Harvard blue pearl DX.,Honda
"No OCD here. It's why my other car lasted twenty years, and sold for top dollar...because food in a car deposits baceria that festers into coonies that evolve into a biome within the car, creating that ""smell"".

The ""used car smell"" is a complex olfactory experience arising from the interaction of organic materials with the car's internal microbial ecosystem. This presentation will explore the scientific underpinnings of this phenomenon, highlighting its impact on vehicle value.
Phase 1: Deposition and Colonization
Ingress of organic matter into the car's interior occurs via various routes:
Food and beverages: Spills, crumbs, and sugary residues become a readily available carbon source for microbes.
Fragrances: Artificial scents and body odor comprise a complex mixture of volatile organic compounds (VOCs) that some microbes can metabolize.
Body Odors: Human sweat harbors a diverse microbial community. Bacteria on skin break down sweat components like proteins and lipids, generating characteristic odors.
Moisture: Condensation from breath and humidity provides a crucial element for microbial growth.
These organic materials adhere to car surfaces (carpets, upholstery, plastics) due to:
Porous fabrics: Fibers trap food particles and offer a high surface area for microbial colonization.
Hydrophobic surfaces: Fabrics and plastics repel water, allowing organic matter to concentrate.
Phase 2: Microbial Proliferation and Biodegradation
The deposited organic material serves as a substrate for various microbial communities. These communities are dominated by:
Bacteria: Particularly proteolytic and lipolytic species that break down proteins and fats from food, sweat, and skin flakes.
Fungi: Molds thrive in humid environments, contributing to musty odors and potential allergens.
Microbial activity leads to the biodegradation of organic matter, generating a range of volatile metabolites:
Short-chain fatty acids: Products of protein and fat breakdown, responsible for pungent ""cheesy"" or ""sour"" smells.
Aldehydes and ketones: Breakdown products of VOCs and other organic matter, often contributing to a sharp or acrid odor.
Microbial byproducts: Ammonia, thiols (sulfur-containing compounds), and other volatile products with unpleasant odors.
Phase 3: Olfactory Assault and Value Depreciation
The volatile metabolites produced by microbial activity collectively define the ""used car smell."" This odor is perceived as unpleasant for several reasons:
Evolutionary aversion: Humans have an innate aversion to foul odors, which can signal potential health hazards.
Association with neglect: A strong used car smell suggests a lack of prior cleaning and maintenance, potentially indicating underlying mechanical issues.
The presence of this odor significantly reduces a car's perceived value. Potential buyers associate the smell with uncleanliness, past ownership habits, and potential health risks. This can translate to a lower selling price or difficulty finding a buyer altogether.",Honda
Hey buddy!,Honda
And V6 on MDX is redundant,Honda
I’m under the impression that it makes it so the ecu won’t compensate for ignition timing while it’s jumped so you can get it set accurately. It also makes the check engine light flash to check codes since it’s an obd1 ecu,Honda
My 92 oil change sticker in 2012 said 475xxx.  I still daily drive it……..,Honda
"If you are using the Reddit app on your phone,create a new post on the sub by using the + button. Near the bottom left side you can see an icon resembling a photo. If you click it you can select the images and then press ok to attach the images. Complete the post by giving a title and body text. Then post it. 

You can also upload the images in Google drive and post the link here. Please search for a video tutorial on the web about uploading images on Reddit .",Honda
Let them fuss. Easy laughs for the wife and myself.,Honda
"Not true. Had this exact year and model and at 30k honda tried to play me with the same ""repairs"" when my breaks were not even half way and tried telling me my break fluid needed to be flushed. It didn't. My 22 civic they also tried to play me with that shit. This time I've beat on my civic a little so I kinda believed them",Honda
It’s always possible.,Honda
"Wow, perspective in that first pic is kinda trippy.",Honda
I did buy a warranty and thankfully still has some original warranty left too!,Honda
"Looks to be a D15 or D16. I believe this to be a D15 but I'm not %100. The engine will have a stamp somewhere on the front of the block, I wanna say right under that upper radiator hose on the left of the picture.",Honda
Perfect,Honda
"I don’t trust myself on a faster bike lol, I’d get in too much trouble

It is a bit much, especially considering a bike like a Grom, Monkey, Pappio SS, or even an XR150L would be cheaper AND faster, and I could’ve gotten without waiting. However, the Trail ticked all my boxes. It’s more off-road oriented than a Grom/Monkey, and unlike the XR150L, its fuel injected (no problem w carbs, my other bikes are carbed, I just wanted something I could take anywhere without having to rejet. I live in a state with a lot of elevation changes. 

Honestly I’m really happy with it. I could’ve gotten more bike for less but this is the bike I really wanted.",Honda
"With turbo and/or DI I always recommend premium gas,  but many people have different opinions.",Honda
Civic family! We almost got into that trap with crvs hence acura,Honda
Thanks! You think this can be done DIY or at shop only?,Honda
What is blue book on this?  Use that as your guide.  3 grand or so doesn't sound like a lot if the car checks out.  Check your insurance cost too though.,Honda
It’s not my car. It belongs to shop I work at and we don’t have time to clean it.,Honda
"The CRZ was a failure when it came down to it.  Marketed as a ""sport hybrid"" but it was neither sporty nor fuel efficient.  A Fit puts up better numbers on the track and gets better fuel economy (and has way more room).  I'm just not sure what Honda was thinking with the CRZ.",Honda
Use Goo Gone or try Tar from Carpro,Honda
Damn I was about to ask for a referral on window tinting,Honda
Funny seeing a RI plate on it. I remember there was a purple manual one of these that sat at the Honda dealer in Johnston for YEARS. Eventually some old lady came and bought it.,Honda
i would love to make a top mpg build out of my civic to commute in if it didn’t make it look stupid,Honda
"We have a 2007 Honda Civic coupe and 2012 Honda Accord, both have been great!",Honda
I mean technically you could fill it with 91. But I’d suggest just running 87 since it’s cheaper. You’re just wasting money using anything higher atp,Honda
"I have a 2017 accord and I'm at 120k miles. Don't drive like crazy, change the fluid every 30k ish miles and you should be good",Honda
"CR-Z daily, Del Sol Si Sunday driver",Honda
"Thanks, I bought it from the original owner last year who was 95 years old. It only has 125k miles.",Honda
"Thanks!

And fuck 'em lol. What I said was accurate.",Honda
"It's true but honestly autozone, cleaner aisle, have bunch of carpet and fabric removal cans with built in brush. Blot out stain with dry towel",Honda
"One posts the customers Car and chassis number online, another one sits on the customers car, tf kinda workshop is this",Honda
Wicked sick work bro! How the weather in gun wavin’ New Haven?,Honda
'08 was a rough year.,Honda
No. Use one of the 200 hp variants.,Honda
I can tell you what it's not.,Honda
"Change, chapstick, and loose knick nacks. It's a bullshit collector. Mine has red felt so it's more fancy. Haha but, it's definitely ""NOT AN ASHTRAY"". LOL",Honda
Not just picture. Take video,Honda
"sounds like they're making shit up cause it probably doesn't pay enough for them to bother.  

but honestly, if they told me their own rack breaks while shipping, i'd start looking for a higher quality rack if that's actually true.  you don't wanna mount thousands of dollars of bikes/kayaks/snowboards/skis on a flimsy rack that can't even survive being shipped.",Honda
"My 07 Accord with the same engine is at 661k and still runs great. Original trans, too.",Honda
5k for a bike that barely does 60mph? ur a better man than me cuz wtf 🤧,Honda
People are gonna tell you it's too ostentatious but that looks really sick.,Honda
best factory color ever imo. nice find,Honda
make sure it doesn't have the number 13 in the VIN  :),Honda
"Are you using the word indicators instead of  turn signal ? If so, your turn signal switch is bad.",Honda
Automatic!,Honda
Adam’s polishes,Honda
Grandi! Perché non venite a dare una mano anche a me? Portate anche i soldi,Honda
"6-6 coupe for the weekend, 2nd gen insight as a daily",Honda
Toyota = worst road noise,Honda
Hell yeah,Honda
1995 Honda del Sol Si (x2) one boosted and one rat rod,Honda
Its a 20+ year old engine. It probably just needs a tune up. Driving open header for a few days wont cause a misfire.,Honda
"i had a 2001 accord with the bad batch automatics. due to the class action and warranty program i had it replaced in 2006 and gave me no more problems until it got totaled by a frat boy in 2014.

meanwhile the CVT on my '15 honda fit lasted 90k miles with no problems whatsoever until i traded it in for a civic. honda has always had issues with automatics but their CVTs seem to be reasonable if you don't beat the shit out of them and change the fluid every 30k.",Honda
They probably replied lastly like “this is expected of our products” and shut him out 😭 welp. Worth a try,Honda
The auto 07-08 are clear of the transmission issues.,Honda
"Never drive a car again, if you don't maintain it, (guessing by the condition of that tire, you clearly don't) you are nothing but a danger to others and yourself on the road. Use public transport.",Honda
Probably just two that run tho,Honda
"Sadly dude just wanted to rob me, otherwise yes good deal",Honda
😧,Honda
"For the love of your car, please please please clean it!",Honda
"It is whatever auto these came with. Although I certainly like Hondas, Idk much about them; I come from Subaru-Land.",Honda
The V6 engine. My mom had a 2014 Honda Accord EXL and man I loved that car. It would get up and haul ass in sport mode. It had the lane watch camera which was a nice feature. It had black leather seats and seat warmers. I do like the refreshed 9th gen accords. I would push to either get a EX. The coupes are nice too if you like them.,Honda
"I don't know how I missed that, THANK YOU!",Honda
The Bentley of minivans!,Honda
"I live in Sacramento area, I found this up in a tiny little town called Nevada City.",Honda
09 civic x 24 passport.,Honda
Build a friend with your car?,Honda
"In this instance, Honda made a bad decision. That's why the 11th gen requires 91+ octane with the same powertrain.",Honda
"Looks like the lower ball joint gave out which also led the axle to break off…. Happened to me in my crv 97 …. A lot of boots and rubber pieces tend to be cracked or worn out so I would have both sides inspected or get a kit to replace suspension parts…. Upper control arm, lower control arm, lower ball joint….If the axle would have been the piece that actually broke it wouldn’t cause the whole knuckle to swing … axle are design like an elbow where if it get twisted to certain angle it will pop off",Honda
"it was a parking lot for an apartment building in the inner city and street parking was full for like 5 blocks. i wouldve taken the walk if i wasnt about to shit my pants. i think the people who are angry at me think it was like someones driveway or something. i’ll accept the downvotes and the anger, i do deserve it a little bit. i just got most of it off using goo gone and a plastic razor, per the suggestions from this comment section and the person at the hardware store.",Honda
Not bad at all. I’ve seen people get charged $800 just for rear brakes on a Honda Pilot.,Honda
"Sugarloaf Mountain, ME.",Honda
"26 mpg? When’s the last time you had a valve adjustment? 

But then again, it’s not easy to find someone who even has the time to take their time and preform that task optimally.",Honda
"That’s what I have heard as well, CVTs have actually been very reliable overall compared to traditional autos for Honda.",Honda
"Forward collision warning is non-existent. I dearly miss the 'B' drive mode and single pedal drive mode. Brakes don't inspire confidence at all.

That gave me the impression. MY apologies. It's all good.",Honda
I’d say at least 6k- that wagon is in great shape,Honda
Looks like homer simpsons hair,Honda
GORGEOUS!,Honda
"Damn…this is my current car, 4th in my life.",Honda
"Most likely not, unless you have access to HDS or an equivalent high end scan tool. And the targets.",Honda
"I think it needs to be lower and longer, I dislike the roundness of these cars, I know its a hatch but it's to much for me.",Honda
"That’s because these work trucks/cars are meant for work, not to look pretty.",Honda
Honestly a good deal,Honda
I hope he uses them properly,Honda
Doesn’t mean Honda doesn’t use K-control….,Honda
You see markups for used civics. I've seen plenty of 2013 to 2015 9th gen civics going for almost 15k if not more,Honda
Highly recommend the LX trim. Go for it,Honda
No. It mostly gets used to transport classic car parts that haven’t been restored yet. Actually a lot of those parts are cracked so…technically.,Honda
Thats unfortunate. I made a post about the 1mil civic a little while ago. I swear by honda and toyota.,Honda
"I really like the crz and always have, I’m just a tall mf so I’ve never really entertained owning one. Love the look of yours though, really slick",Honda
This is the way.,Honda
I’m in fl and it only smells when it’s hot,Honda
The .5 v reading is perfect.  if key flashes then I would look into the key getting a new key and if u have 2 keys alrdy does it do it with both ? U looked in to the ecu and scanned the car and nada so yea maybe something simple like that,Honda
"maybe like 4-5k with that mileage and no huge issues, im sure people would maybe pay even more",Honda
Head gaskets go brrrr,Honda
Wings West isn't Ebay trash. They're OG in the game. Wings West was the 90s pretty much,Honda
Snuffleupagus?,Honda
"u/tofu2012 this is my first Honda, so just want to clarify - is the Maintenance Minder just the computer system in the car? I thought it was the name of the schedule, but didn't realize the maintenance would be built into the system. Would a local mechanic know what the codes mean? or would they be Honda-specific?",Honda
Boost is the fastest way to those numbers. You’ll need a decent amount of work in order to make that much power out of that motor.,Honda
My english is not enough to explain my self. I used GPT for translate. ( But this is mine),Honda
Valve cover and intake manifold looks like a D15Z1. The D16 doesn't have the -E on the valve cover.,Honda
"Can you say a bit more about this fuel pump recall? I'm looking for a used car and considering a Honda Accord (2017). Are certain years or trims affected by these recalls? A quick Google search showed 2018-2020 Accords. Honda is a whole new world for me (Only have had Nissan and Hyundai cars), so I appreciate the insights.",Honda
Why have it towed?,Honda
It looks like its internally shouting 'plz kill me now',Honda
I have a 2012 civic with 202k miles. Only repairs were alternator at 180k and a strut at 140k. I’m also going to replace my serpentine belt and tensioner as a preventive maintenance.,Honda
"Dude that green goes so fucking hard, and the carbon is a perfect accent.  What's the drivetrain build gonna look like?",Honda
Run out dial with rotors on the car is the ticket. I can’t remember the tolerance though.,Honda
"Honestly to the right buyer and condition, it could go upwards of $10k.  I’d get a carfax of it as well so gives potential buyers an idea of her history.  Good luck with the sale!",Honda
"definitely not $10k but close to it!

https://carsandbids.com/auctions/9QAJ5bbe/1992-honda-accord-ex-wagon

if it was a manual i think it’d get $10k for sure tho",Honda
"I like the new civic, but if I had a 10th gen accord I wouldn’t trade out of it for one. You’re essentially downgrading, unless you really want something smaller and more nimble.",Honda
I had that exact beast!  Great car!!!,Honda
I have Yakima racks on my Crosstour. Love them.,Honda
"Before Covid, many manufacturers ran leasing deals. They would offer deeper lease discounts to try and move cars. So a couple times a year you could get a lease that was 20-30% lower than the norm. Sometimes they would offer something like the OPs price with no money down. And as long as you didn’t go over the mileage your 3 year cost of ownership was quite low. Then Covid hit. With vehicle shortages there is absolutely no reason to offer a good discount on leases. They were never designed for people that keep a vehicle ten years.",Honda
"Currently, Honda does not offer a standardized return policy across all its dealerships. Unlike some retailers that have a 30-day return policy, car dealerships do not usually allow you to return a car simply because you've changed your mind.",Honda
Thanks!,Honda
"Don’t sell it you will regret it, unless you can get something crazy like 8 to 10k.  I wouldn’t be surprised if someone would pay that much these days.  These are getting harder and harder to find, I had a 94 but the rust belt got the best of it.",Honda
There’s more important stuff that has to be done at work instead of taking time out of the day to clean it.,Honda
"There is no such thing as lifetime fluids. Lifetime generally means up to a certain milage/kilometer or amount of years for example, lifetime = when your warranty is over. So they won't change the fluids when it's them covering the cost but once that's over and it breaks because you didn't get the fluids changed, it's up to you to pay for it. 

To be safe, if you have over 40,000 miles on your car, take it somewhere they'll change your transmission fluid. I thought by now this shit would be illegal.",Honda
"I paid 4250 for a 93 wagon with 217k. He had just put 5k of maintenance into it and was sad to see it go. A week after I bought it a dude at a gas station offered me 7k for it after I told him the miles. The right buyer will pay a lot for it. Consider doing the maintenance on it and listing it on bring a trailer, a few years ago one sold for around 15k with sub 100k miles.",Honda
"If you really wanna sell it, I would consider fixing those issues first, they’re pretty easy fixes and it takes away anything for someone to pick at when looking at it.

But with today’s market and how rarely I see these nowadays, I would say you could probably at least go for 5-7k if you find an enthusiast, probably more if you cleaned it up enough for bringatrailer.
Anyone else would just see an old car in decent shape, look at the mileage, and probably offer 3-4k.",Honda
So they end up with a CVT?,Honda
Came here to say this. OP is a fucker,Honda
"Yep. I'm no mechanic but I've seen teardown videos, honestly I have no idea why people are so terrified to work on CVTs. They're usually pretty simple on the inside.",Honda
It’s a really good car It’s just personally I would’ve gotten a manual but that’s a personal preference. I would really recommend that car :),Honda
Looks good,Honda
I'm building an 05 EP3 and my wife drives an 09 Accord. Took me a while to talk her into buying a Honda.,Honda
"Looks like the air intake.  That will affect the air / fuel mixture if you are sucking air in and bypassing the air flow sensor that sits between the filter and engine.  Also that air going into your cylinders in that manner is unfiltered and could cause issues by introducing dirt into the combustion chamber.  Not hard to fix in short term with duct tape if hose clamp can’t do it, until you can buy new one.  I had to replace one on a Hyundai Santa Fe and got it on Amazon for 25 bucks.",Honda
yup the timing belt was replaced at 96000km and i will definitely look out for the transmission. thank you :),Honda
"1) don’t park where you’re not supposed

2) use a good solvant to easily remove glue",Honda
"I’ve only seen a handful in the wild, people would part them out when they were selling their cars.  eBay might be your best bet.",Honda
"If I walked into the shop and saw homie sitting on my car like it was his car to fucking sit on, I wouldn't be pleased.",Honda
Don’t think so,Honda
