Comments,Make
"I don't think you are going to get much help here.  

Your best bet is to take the issue up with your dealer and if you are not happy you can post a review on their Google Business page along with your local social media.",Honda
The 1.5 engine isn't good. Buy yourself an older CRV if you need a new car. Maybe a 2013-2015 or so.,Honda
"I have used anti-seize many times on plugs. I've never had a problem.

Then again I wouldn't put anti-seize on a spark plug that I wasn't supposed to put it on. There are spark plugs that have the shiny coating that are already treated to not need it. However there are other spark plugs with regular Black oxide for example. It's okay to put it on the plugs that are not already coated however I wouldn't recommend putting it on the plugs that are already coated. By putting it on the already coated plugs you are changing the torque specs.",Honda
"That explains it then, work cars are always abused :p",Honda
"Had the exact same problem on my 92 Prelude and spent some time troubleshooting ut. 
Turns out it was the FITV. The plastic cup had come loose inside. I simply cleaned it and put it together tightly and it worked.",Honda
"trust when I say : ""Its gonna outlive you""

Seriously.",Honda
i use a touchless drive thru wash. n i dry with griots towels. best towels in the business… worth the extra coin,Honda
Pronounced aosagi forgot to add,Honda
+1,Honda
I dont think its too much if it runs well. That actually looks nice. I would buy it. You're not gonna find a running Honda any cheaper than that price. Unless its completely beat up. That one actually looks in good shape. Put some seat covers on it. Apply a good clay bar treatment to the paint followed by a paste wax and then its gonna look much better. I recommend Mcguires brand clay bar kit. And Mcguires Gold Class Carneuba Plus paste wax. It works especially well on black paint jobs,Honda
"I bought one just like that (95 EX, 177K auto) for around $2000 a few years ago",Honda
The 10th gen accord is a beautiful vehicle. Keep it until the wheels fall off.,Honda
Depends on mileage of the car. But typically no it’s not worth it,Honda
"If it's an automatic, that's the version. Honda has an above average automatic transmission reputation, but not perfect. However, the H5 combined with the smaller engines compared to all the other contemporary small cars is probably the most durable combination from that era. The Nissan and Ford small cars sold that same year with automatic transmissions.would have needed five transmissions each to reach those miles. Ha! As much as I love a Honda with a stick shift, this combination is probably even more rugged or at least needing fewer dollars to maintain. Just a little fluid here and there. I'm one of those weirdos that loves to drive that transmission as it's got a very particular personality to it.",Honda
"Plasti Dipped CRV.... hmmmm

cool pic I guess it looks like the house",Honda
I don't think it's visible in this picture actually.  This looks kinda messy.  [It's just a small connector with 2 contacts that is oddly hanging around not plugged into anything.](https://www.team-integra.net/d2/legacy/images/articles/electrical/connector2.jpg),Honda
No crust,Honda
87 or higher is all you need,Honda
Stock and auto? Yes imo,Honda
Has anybody else noticed how dirty this car is?,Honda
Use a paperclip or jumper wire to prob the back of the connector. The D4 and D22 pin are the same wire as if jumping the service connector.,Honda
"Well if Honda had manufactured these engines to NOT develop cracks, it wouldn’t have needed to be replaced lol it is what it is.",Honda
">You suggested ceramic pads.  They are trash.  Thats why they are cheap

Tf?

All of this is stupid wrong.

Have you ever done brakes or did you just type ""ceramic pads"" into Google and then come here to vomit up your own idiocy?",Honda
Never,Honda
"A 2012 Nissan frontier and a 2023 civic sport sharing the geerage with an 05 Harley.  Yeah, I’m old (67).",Honda
"I think it looks great!!. Takes me back to my 16v CRX, decades ago but yea, needs an engine. B18 or K swap sounds great.",Honda
What do you mean a damaged antenna? This seems like a flaw along with the stains during vehicle pdi and the detailer prior to sending the car out. These being such small issues doesn't mean Honda is any less reputable.,Honda
"We have a 22 Model 3, 2009 Rav4 and a newly acquired 11' Accord ex-l v6.",Honda
"Thanks! 

Couldn't believe how cheap it is, then the shipping... :(

Subtotal Amount: $1.26  
Estimated shipping: $25.05

&#x200B;

Got the part number at least can try to find cheaper shipping. Much appreciated",Honda
"Not gonna go into detail to give myself away on Reddit, but it was more than a week. It was definitely within the same month, and I’m like 99% sure the same guy sold all 3. The dealership lost money on them, but the salesman made out like a fucking bandit because they were sitting on the lot so long, somebody put a big ass bonus on them.",Honda
"Lower control arm and axle.

Check the brake lines.

Get it on an alignment rack, and that will tell you what else you need.

I would replace the LCA on the good side also.",Honda
Fix the issues/detail it up and throw it on bringatrailer,Honda
2017 civic Si sedan and 2023 HRV Sport,Honda
You should give it to me.  I can use it.,Honda
I miss mine so much :( lookin good,Honda
That’s normal for a dealer. Fair even,Honda
Agreed entirely. Thank you for the perspective.,Honda
Kachow,Honda
"I've seen plenty of salvage accords that were repaired as cheaply as possible to maximize profit. Depending on the level of damage a lot of these cars are either now less structurally sound, develop annoying noises that are hard to track down or have suspension/frame damage that was never properly addressed and results in uneven tire wear or pulls that don't go away. Furthermore the issues used cars have still remain and it all depends on how well the car was maintained in the years before it was written off.

If you can get a pre-purchase inspection done and the damage repair is satisfactory and an alignment check comes back good, sure. I personally think 7500 is a bit on the high end for a '12, and if you ever plan on getting rid of it you can kiss resale value goodbye. Aside from that a salvage repair can be excellent bang for the buck and I've had a few friends of mine buy salvage Hondas that got them around with no issue.",Honda
I love this!!,Honda
Great first car!,Honda
That high beams.,Honda
"Automatic car with ebay corner lights, ebay tail lights, ebay spoon replica mirrors, and likely ebay lowering springs. Who knows what else cheap parts are on it. 2k. I'd do 3k for one that's 5 speed, and all stock.",Honda
Have you tried the Lysol method?,Honda
NGK instructions are for DIY guys that don’t know what a small amount of anything is. The FSM is for actual mechanics. Use your own bad judgment. ,Honda
"Looks even weirder because the badge is smaller than the original. 

And it’s always people with LX or Sport trims…",Honda
Get the check engine code read first. Everyone else is speculating,Honda
Damn! I’m impressed!,Honda
What did you pay for that? Wago drive train is worth a shit load if it's awd,Honda
"S2000 for fun, CR-Z for Daily. 94' Acura Integra project",Honda
"2017 Civic Touring Coupe, 4 Hella Horns, DiodeDynamics OEM factory placement LED fogs, Won27 turbo, TIP and cold air intake, Injen intercooler, stainless cat back exhaust, Hondata tuned. 2018 Accord base model, all stock except for touch screen infotainment upgrade.",Honda
"2016 accord. This was an independent shop. Thats why I'm not sure if he was lying because he didn't want to say ""We dont have the experience/equipment necessary to do it properly (and/or don't want the liability in case anything goes wrong)""?

Of if he is telling the truth and transmission fluid replacement is just a way for dealerships to make extra money nowadays?",Honda
"Jesus Christ. The yellow top in my car isn't the same size as the original battery, but it would never occur to me to not have a hold down set-up, the shop just fabricated one on the spot when I replaced the red top. I don't want anything slamming around under the hood, I almost can't wrap my head around people driving around thinking ""This is fine!"".


Then I see the people asking if they can drive with softball sized tire bulges, and realize it is that rough out there.",Honda
That's merica.,Honda
Honda CRV and Toyota GR Corolla,Honda
"Are there any trustworthy companies that sell motors, I’d like this in my Sol",Honda
This,Honda
"See if it says ""eh"" when you use it or see if there's maple syrup in the trunk.",Honda
Very good deal,Honda
Lol let’s hear it.,Honda
In for more pics ! 😍,Honda
"I have an old shitbox Lexus that I’m about to give the old rattle can treatment to, I’ll take this as motivation",Honda
"Have you had to stop really hard before noticing this? Like a highway situation? I'm not picking on you but do you intentionally or possibly unintentionally ride the brakes? 

Sounds like a warped rotor.",Honda
"I always liked these. I remember skunk2 K swapped one, and it was pretty sweet. I kinda wanted one after that, lol

Yours is tastefully done. Good job 👌",Honda
It was insinuated from how he wrote the post. You may have autism.,Honda
Coin's,Honda
I have a 2014 accord with 180k and never serviced my cvt. Shifts like the day I got it.,Honda
[link](https://www.hondapartsonline.net/oem-parts/honda-cap-reserve-tank-19102r2hm00?c=bT0xJmw9MSZuPVJlY29tbWVuZGVkIFByb2R1Y3Rz),Honda
Rubber ducky’s baby holder,Honda
That'd be around what I'm aiming for considering it weighs nothing. Thx man I'll have a look around,Honda
"Correct. I am in Colorado. $3k will get you a used 2021/22 model here that’s been dropped a few times. Dealer MSRP is $4199 for the 2024s if memory serves?

I bought it fully intending to ride trails with it. I grew up on a PW80 and a TTR125 with my dad and grandfather, so trails aren’t new to me by a long shot. I’m not a very fast rider on trail either so a slower bike is perfect for me.",Honda
I am in NY and the VIN is right on the registration. Also the vin is usually visible from the outside of the car usually on the bottom of the driver side windshield.,Honda
"That's a ""don't put this on your car"".",Honda
Why is dude just sitting on top of that beautiful prelude like that. No respect,Honda
That sounds reasonable price. I would consider it if they negotiate down to $500 or under..,Honda
"My entire point was that you can't always trust the manufacturer's liturature on the subject. With Subaru I've seen it where Subaru of Japan and Subaru of Canada recommend changing the CVT fluid every 45-60k miles or so, but on the same CVT Subaru of America magically decided it's a lifetime fluid and doesn't need to be changed ever.

Manufacturers lie sometimes, and at least for me it matters as I have a fleet vehicle and what's approved or not depends on the manufacturer's recommendations.",Honda
Ya,Honda
This is the way,Honda
Ready for Radwood!,Honda
"Rock Auto. Brand AISIN. 

That is Honda OEM and goes for about 100 to 150.",Honda
So dumb to buy a RHD version of a car that was available here. JDM nonsense.,Honda
I run that shit through an automatic wash whenever I feel like it because it’s a Honda and not a Rolls Royce,Honda
"Apples and oranges, but in Australia I’ve seen manual civics of this era ask 12k+ (which is 8k or more USD)",Honda
One of the very few hybrids available in a manual transmission.,Honda
OG can still be ugly,Honda
I have a 2nd gen that I love so much I’m worried my next car won’t be able to live up to it,Honda
Van life is best life. Ask anyone who has transitioned from large SUV to a van. I've had 3 vans (2012 2008 and 2006 all odyssey ). Traded the 2012 after owning for 3 years for a Mercedes SUV then after 2 years sold the SUV to get back into a van. Sold the 2008 because I found a VW alltrack that I've been wanting for a while. Got my current 2006 odyssey with 180k miles to haul stuff and I still love it. So much room for activities. Edit: I also had to deal with loading a kid. Sliding doors make things 1000% easier.,Honda
"You can tee off the oil pressure sensor for an oil feed but the main issue with turboing these is that there isn’t really any good way to tune it without going to a full standalone or running an aftermarket  tuner like Hondata flash pro and even then, it’s probably not going to support the automatic transmission.  I would plan on swapping to a 6 speed manual and swapping pcms to one that will support flash pro and then go turbo",Honda
"lol. So trust one guy. Ok. Meanwhile I know 10 people personally with 1.5Ts over 100k miles with zero issues. You’re pulling the 200k figure out of your ass. There have been multiple other dealer techs on here saying they are not seeing the head gasket issues that guy is seeing. 

Again, you’ve never owned one and are just spewing shit without actual statistics. The people who aren’t having issues (millions) aren’t thing to say anything.  “Well maintained” shouldn’t matter if it comes to head gasket issues buddy, if it’s a supposed design flaw. 

 Maybe, just maybe, 1.5ts are way more relatable than you think. 770k miles is more than nearly any Honda ever has done. If it wasn’t a reliable engine, regardless of maintenance, it wouldn’t make it there.",Honda
The rice kind,Honda
"2006 accord at the bottom of a lake?!

My guy, clean your car!",Honda
97 Prelude Type SH and 2002 NSX for fun on nice days and 2008 Nissan Frontier for daily runabout duty,Honda
You don’t get a tire but you do get a tire kit in the Honda insight. Which has one time fix a flat and cigarette lighter air compressor.,Honda
"It was $36k out the door with the two weather packages, tint, and taxes",Honda
"Heres a response. You're bringing up one example of a well maintained 1.5T that didnt have issues. What about the thousands that have had issues? Want more proof ?  Go watch the Youtube channel Honda Mobile Mechanic.  Hes a senior Honda dealership mechanic that makes videos about the cars he works on. Hes posted dozens of videos on the 1.5T and how hes never seen this many head gasket failures on one engine, and he even said in a recent video that hes gotten more head gasket jobs on the 1.5T Accord than any other Honda model combined. It was a video he posted last week about the most unreliable Honda engine ever made. Go check out his channel. Dont need to take my word on anything",Honda
If those transmissions are original to the car they're at the end of their life and V6's need timing belts every 65-80k miles.,Honda
"Yeah I don’t know I opened the hood and slammed it, opened the gas cap and slammed it, opened every door and slammed it hoping it would fix it😭😭",Honda
"2022 Odyssey
2023 Type R",Honda
Lol just one part?,Honda
"If a CRX has a child with a Miata

Result?

CRZ",Honda
"Bought 2022 Honda Accord Sport just about a month ago now and have come accord AEB go off randomly to a complete stop on the road. No car in front or nothing, just slams on the brake and have nearly been rear-ended once already. It has already happened 3 times. Twice with myself and once with my mom driving. Does anyone have any idea what could be causing this and what to do??",Honda
Of course. Being in FL I gotta have AC lol,Honda
"I have an 07 with probably more miles than yours, love it. 

Might want to see what your deductible is, and what it will do to your rates. 

Aftermarket cat off Rockauto isn’t too bad.",Honda
Health to drive. Love an old Honda.,Honda
"Did the mechanic take it for a test drive under the conditions you described? That might be what needs to happen. Just looking at it up on a lift might not be enough. Dealers can get expensive, but i had a mystery noise once and took it to the dealer. I described the noise and the conditions it took for the noise to appear (in my case, making turns while driving under 15 mph). The mechanic took it for a test drive to see what the issue was. After he fixed it, he went out on the road to confirm the fix. In the maintenance notes (the bill) given to me, there's a full description of what the guy suspected, what it turned out to be, and the steps he took to find it.",Honda
"thanks a lot, I‘ll try to see a mechanic the coming days and hope my car doesn’t blow up till then lmao",Honda
"If anything I’ll be driving less than the 12,000 but the difference between 12 and 10k miles per year is hardly any so I’m decided to go with 12k just incase. Did you feel like you were getting a fair deal?",Honda
"Well much like the movie, dude was crime oriented lol, tried to rob me",Honda
"Wow, the maintenance light stop working kinda feels like Honda programming it as “end of useful life”. But the car still keeps on going.",Honda
Thank you so much. I will do that.,Honda
Something about the RH drive in the USA that I just couldn’t go for it.  Even if it’s a great car at a great price.  Probably kill yourself trying to pass on a 2 lane road.,Honda
Haha yeah I realized that the second I hit the highway. Definitely a notable wind noise difference.,Honda
Griots 100%,Honda
"No the SC2 (I believe, coupe)
The Vue Redline used the Honda 😉👍",Honda
Exactly lol. Same people bitching about CVTs when they forget how many automatic transmission issues Honda used to have.,Honda
Still better looking that the Cybertruck,Honda
What kind of service?,Honda
I absolutely love my Sport Hybrid. I don’t think I’ll ever go back to a non hybrid car.,Honda
It’s a Honda. Japanese cars have small compartments for stuff. It’s not made for specifically one thing. Use it how you like,Honda
"It was a joke, chill lol bro. It pretty much is  the only kit you could get.",Honda
Sharpie time.   We won’t tell anybody,Honda
Did you get that at a local dealer? I tried getting one from College Hills Honda but they won't ship them. They said they break easily during shipping.,Honda
It's kinda sort of like a baby Crosstour,Honda
Definitely looks like it smh...  I live in an apartment complex and I'm always nervous when I see the big F250 that lives across the parking lot back up.  It's way too big for our little lot lol,Honda
That's an EK tho,Honda
2023 Ridgeline RTL and 2023 HR-V Sport,Honda
What a shitty pic… Could be anything in there. Lazy ass content for fake internet points.,Honda
"The 1.5T uses K-Control to reduce timing even in stock form on 87.

\+5 to 7 HP. [https://www.caranddriver.com/features/a28565486/honda-cr-v-vs-bmw-m5-ford-f-150-dodge-charger/](https://www.caranddriver.com/features/a28565486/honda-cr-v-vs-bmw-m5-ford-f-150-dodge-charger/)

Is it worth the price?  No.  But it does work better.",Honda
Looks amazing. Which paint is that and which mods have you made?,Honda
"16yr old drives the 2005 Pilot, 2015 4door jeep is our minivan, 2020 392 charger is the grocery getter, 89 RT wagon is my daily.",Honda
Honda dealers cannot resell those fuel pump recall cars to the owners who want to buy their leases out. It goes against their franchise agreement with Honda. OP can buy his lease out with his own lender OTOH.,Honda
"Nope, they're right. Without knowing any details about the car whatsoever, I can confidently say as a random internet person that that shop is completely full of shit.",Honda
Breemahater.,Honda
"Yes, it says theyre doing a brake fluid exchange. So you think the price is fair?",Honda
"Yep. But depending on where the car was sold, some RHD cars have the turn signal and wiper stalls reversed. This JDM Prelude would be one of those, but one originally sold in the UK would have the stalks the same as a LHD car.",Honda
"You know, you're not wrong.",Honda
for you? crack dispenser.,Honda
You put it on your lips to moisturize them. Or on a creaky door hinge. Also really good to lubricate screws so they drive in easier.,Honda
"Would you buy a 2013 Insight with only 89k miles for 4k?  If the body is in good shape, I think it's a great deal.",Honda
[deleted],Honda
3400 for a car that technically is worth mayb a max of 2k since COVID the used car market is all fucked up. people are getting top dollar for a complete piece of shit no way days I've had at least 4 eg chassis I've never paid over 1k for any of them and they all ran and drove.,Honda
That’s not high for the dealer my BMW would cost a lot more than that for those services,Honda
Um no one is reading this post. Holy crap.,Honda
"Your vehicle's [Maintenance Minder](https://mygarage.honda.com/s/honda-maintenance-minder) will notify you when to change certain fluids and when to perform other tasks. Your car's computer uses data from the engine and the climate to notify you when the optimal time is to perform maintenance. With the exception that, if a Maintenance Minder indicator does not appear more than 12 months after the display is reset, change the engine oil every year. Or if a Maintenance Minder message does not appear more than 36 months after the display for item 7 is reset, change the brake fluid every 3 years.

Follow the Maintenance Minder. There are sub items, such as, inspections that should be done to catch small problems before they become big problems. There is no set guide on how to maintain a car for thousands of miles because every car is driven and maintened differently. Vehicles are also in different climates, a car that spends most of its time in a desert will have different needs than a car that is driven in snow for half a year.

If people have questions about the condition of their vehicle's fluids they can always have an oil analysis performed.

[BlackStone Labs](https://www.blackstone-labs.com/engine-types/transmission/)",Honda
CRX ED9 DOHC,Honda
We have a 19 and a 23. The extra leg room in the 23 is much better for a car seat. No issues at all,Honda
"$18k is definitely too much, but not really ""crazy"" in the whole scheme of things.

For that many miles on a 2016 a quick check of my local area is 13-14k.  I have a 2016 civic touring and it's looking like around 20k is the sweet spot for my miles, it's hilarious because that is more than I paid for it in 2019, lol.  I paid 14k for it then with 26k miles.",Honda
Thank you for being one of the smart people on this subreddit that doesn’t just bash the 1.5T cause like the rest of the hive mind,Honda
"Okay dope, awesome to know it actually existed 
Any info you’ve got might help me track one down.",Honda
"Shuttles are cool, but that one's in rough shape.

On facebook Jeremiah Freeman has a lot of parts for them.",Honda
"That's different, obviously. Sorry, I guess I just know too many of the ""I can drive! But wait, give me a minute to go in the back seat and move a bunch of junk around."" type of people.",Honda
"Rosso red, mine too. Loved it. K24 would be boss in that shell. Good luck!!",Honda
"Sounds like a misfire.

Check your ignition system (cap/rotor/coil/wires/spark plug.  Then check your fuel injection system (fuel injectors, injector pigtails, fuel lines (for leaks) then check your air (air filter/throttle body/ sensors)",Honda
"As a Honda tech, they still have trans issues, primarily due to lack of maintenance especially on the zf 9 speeds they used in the pilots, passports and odysseys. Surprisingly we don't have too many issues with the CVTs we occasionally have them in for warranty work and the occasional replacement.

But they really don't warrant the hate they get imo. I'm a die hard manual fan and I still ended up with a 21 civic with the CVT as my daily. 70k no issues, but I service all the fluids regularly",Honda
"Gonna second the z7. It’s the same engine as my car and I love it. The only downsides to it is that it has a single port exhaust which is somewhat restrictive, and you only get vtec on the intake cam, so the “crossover” is less aggressive (but definitely still exists). 

Besides that, it’s a fantastic motor and I love redlining it everyday. Super easy to work on.

Though my choice k series for a Miata would probably be a k20z3 from the 8th gen Si. Revs to 8k rpm and makes similar HP to the z7. The k24z7 has significantly more torque throughout the rev range, but I think the k20z3 is still a better enthusiast motor and it would be great in a light car like a Miata.",Honda
Unfortunately I do not :/,Honda
"They’re already common in some US cities. I saw a Cresta on my way home from the grocery store and there’s at least two kei trucks in my town of 16,000 plus my own Aristo. And there are two importers in the city my town is a suburb of.",Honda
"So efficient and tough, it can run on little to no oil",Honda
"Probably could be the battery, samething happened to my civic after I didn’t drive it for a while lol",Honda
This is my friend’s car. Search up my previous post. Evidently I don’t have an edit post button. My bad. [Click here for previous post](https://www.reddit.com/r/Honda/s/kHkr1XkYTt),Honda
How long ago was it rebuilt? If it was recent? I’d stay away. If the rebuild was a long time ago then odds are the repairs have held up well.,Honda
Would be awesome if they didn’t have to recall the engine like halfway to his goal but yeah,Honda
Sexy,Honda
Well in that case ☺️,Honda
He’s a he???,Honda
Thank you!,Honda
I paid like 2 something for an oil change and transmission drain and fill. The oil change is like 79 and the transmission was 130ish so this seems about right,Honda
"Honda Ridgeline and Honda Element.

Ideally I want an MDX type S and CTR or Integra type S in the future.  Hopefully the used market trend keeps moving down because these two are stupid expensive, brand new.",Honda
"My 2013 Accord v6 gets about 18 around town, and 32 on the highway.",Honda
