Comments,Make
"They are a cheap mod indeed. A massive pain in the butt to install though. That one bolt at the bottom to secure the blanket is a blind ""feeler"" install and requires hands of a child to reach. Hated every single second of working in that area. Lol",abarth
Warranty/dealership lol. 0 out of pocket,abarth
Hell yeah they look Superb!,abarth
"On a related note, what's the difference between the North American rear suspension and the Euro rear suspension? Is it a spring/damper tuning difference or is there actually a physical difference that would prevent mounting Euro dampers in a North American 500? 

It seems odd to me that Fiat would use different structural parts between the two as it would increase cost. 
If it's just different rate springs and different damper tune then what's the difference?",abarth
"I dont know if it would help in your case, but twice ive needed something fixed i ended up ordering the part myself for them to use. I think dealerships/shops will only order through certain vendors or are just stubborn and dont want you to usurp their absurd profit margins. When the gas cap seal on my BMW busted the dealer said it would be $60 and two weeks to get the part. I ordered a whole new generic Mini Cooper cap (which BMW uses) from Amazon for $14 and it was at my house in two days. When i had my C8 Stingray one of the front fascia parts broke off, the dealer was on backorder for a month and the part was going to be $170. I found the exact part prepainted for $50 on ebay with 5 day shipping and got it myself. 

I know it may not be possible with some parts, but it may be worth a try to look around.",abarth
"What state and city?

9k otd should be a workable deal.

Good luck",abarth
"[https://imgur.com/6favdhV](https://imgur.com/6favdhV)

Are you sure its impossible? IHI VL38 without any peripherals.",abarth
"Physical cable, windows laptop and proxy alignment, it may work straight off the bat but the mileage will flash",abarth
love it mate,abarth
[don't give up!](https://i.imgur.com/D2zi0QZ.png),abarth
If ur taking the wheels off why not throw it in the hatch?,abarth
5w40 is on my tjet punto manual. I kept using that (motul xclean c3 not selenia) for 250hp setup. I switched to 5w50 amsoil for 300+hp setup. Don't worry about it..,abarth
Imagine recommending a car to someone without knowing any of their criteria.,abarth
"I guess I didn't know Cruise wasn't standard on all of them, pretty sure it was on the north American ones anyhow.",abarth
"The 500 Abarth engine, in its original state, doesn't move too far from its thermal limit, partly due to the compact design within the engine bay. Therefore, I would only use oil with at least W50 viscosity (especially in summer). I personally switched from Abarth 10W50 to Motul 8100 Power 5W50. According to my research, the Motul Specific 0101 10W50 has a slightly lower quality base oil compared to the 8100 Power, but is still a good oil of course.

Financially there is no point to switch to 5W40, as the 5W50 alternatives cost around the same. In Germany 5L of Motul 8100 Power cost round about 50 EUR. And as others have stated before, don't cheap out on oil, but at the same time the prices of the Selenia 10W50 are just unreasonable imho.

I change the oil more or less twice a year, roughly every 10k km. With a rather small engine oil capacity of close to 3L, frequent changes are a must. I drive a 2009 T-Jet EsseEsse.",abarth
I luckily had a personal connection so I paid for the wrap (about $1000) and got it done for $800. Typically it’s a few grand to get it done going somewhere.,abarth
Think it was around €70 including a wash.,abarth
"Yes, I am thinking of trying the two low cost options before anything else. 

Aftermarket bump stops and the spring assisters. May as well do them together.",abarth
Looks like a snow month,abarth
Does look cool. Not a fan of EVs still I just think it’s a crying shame abarth didn’t do some really special petrol cars before going full EV,abarth
"I did an analog to digital swap, it worked well, the only thing I needed was to change the odometer but it was easy with multiecuscan",abarth
Personally I love the lines the Abarth already has and I feel like the liberty walk one takes away from its beauty,abarth
Broken wiper cover gang.,abarth
17k miles and still holding great 😏,abarth
Come to Portugal cars don’t depreciate 😂,abarth
"Okay I did just order a axel, is it difficult to do myself?",abarth
That's the picture used on the Stellantis page so must be it.,abarth
"I have the 6A in my 15 no issues, big turbo at 44k miles",abarth
"Only the comps in the UK have the Garrett, mine has the revised newer IHI, thanks for your help it's booked in for a stage 1 map on Friday!",abarth
Enjoy 😊😊😊,abarth
"Thanks. Not keen on a red one looking for yellow or white/grey...or anything two toned. 

Is red the only one that may/will fade?",abarth
https://youtu.be/YasD1lLTI7M?si=2U73iPs77L-SgroK,abarth
"This looks pretty modified. If you're into that and are willing to accept the risk, it's probably fine. If you want something you don't have to worry about, I'd steer clear. There's no telling what mods have been made that aren't immediately visible.",abarth
"Had to get a motor for mine, it showed up after a month. 3 months later and the shop still hadn't finished. I was pissed",abarth
"No. 

I work at a dealership. All dealerships are different of course, but just no. 

We charge *at the most* $250 for an AGM battery installed. Even Honda list is only around $300 for an AGM. They have a 3 year full replacement warranty then a shit ton of prorate. 

If people are out here willingly spending $800 on a battery and just shrugging it off as ""Oh well, it's a dealership after all"" then I no longer feel sympathy towards the general publics distaste for dealerships.

Maybe you did just get completely taken advantage of and I guess that sucks, but next time please do not go to that dealership and do some due diligence before agreeing to things.",abarth
"They are worth it, though, if you can swing it. Have had mine for several years and they've held up incredibly well. A picture of them is shown if you Google Madness reviews. I'll try to post it here, if I can figure it out.",abarth
U will love it great color scheme is it a manual? Everyone I found in that scheme was a auto :(,abarth
"Fix it again tomorrow 

Found in a tip",abarth
"Wow man that's unlucky, besides wheel bearings I've only had wearables to replace...that said I've got some more trim-y items that are starting to break that I need to deal with this spring.",abarth
How much mileage does your abarth have? Just curious.,abarth
"No worries! The engine we got has its fair share of quirks and problems, but the turbos are Garrett turbos, better than the stuff they got in the UK. Europe did get some better-looking cars though, if I'm being honest",abarth
"I don't, actually. I removed the rear seats in both of my cars, lol.",abarth
"""it could be anything""

a leak down is next after compression and will reveal which ""anything"" it is.",abarth
"yup, trampy, tacky, so so weird",abarth
"Could get a regular fiat 500 remapped, half-way house. Should add a load of torque, would feel quicker on the hills.",abarth
"I have one sat in a box that I don’t need anymore l, depending on where you are in the world! Would sell it cheap as it’s been in the garage two years.",abarth
"The 205 has more surface, therefore probably less weight per area, so technically easier to slip at breaking or cornering, who knows.",abarth
"As mentioned, the pop and bang is from unburnt fuel. This unburnt fuel is ignited somewhere within the exhaust instead. This can damage seals. The exhaust gas goes through the turbo, so you can cause damage to the turbine or the housing.",abarth
" I have a 2015 Abarth 500 that I love but have recently determined I need to let her go… I moved into a rural area and I feel guilty driving her on gravel for several miles when I have to head the city…  (plus when they grade the road I have to dodge displaced rocks)

On regular black top she’s amazing :)

I head to town 2-3 times a week (200 miles round trip) and the only thing I need to keep track of is miles so I can replace tires before they go bald… 

She’s got 107k miles… I bought her with 230 back in 2017… 

If it says anything about my confidence in her reliability.. I’ll deliver for the right price… 

I am horrified when I look at what KBB says she’s worth… total BS for a beauty like an Abarth",abarth
If manual u need to step on clutch to start it. 😂stick new battery in it and go from there,abarth
"I checked again just out of curiosity, and it's gone. It was going for 6k CAD. Now the only abarth for sale in the area is a '17 124 spider for... get this.... 32k CA. 

I should have bought one instead of my 500, Could have been had for 20k at that time. 2 seat vs 4 seat, went with 4 for 17k",abarth
Yes its the original anniversaro spoiler which you can adjust with a screwdriver,abarth
What it does have are those stunning carbon buckets. I would buy it!,abarth
You are under estimating how cheap they are in the UK,abarth
"Picked up the Alfa. It's amazing. too bad it's not a stick, Could definitely modulate power better in race mode. Paddle shifter will take some getting used to.",abarth
Is there a bump stop missing or something?,abarth
Carvana is overpriced as hell.,abarth
"Yes mate they're from Ms-racing, come in various colour combinations",abarth
"It’s not that we got different trims- it’s that when the ROW model updated, the US one didn’t.",abarth
"No real noticeable difference, it’s an Abarth 💁‍♂️",abarth
So true,abarth
"I appreciate the info, though I've seen this video before.  The problem is, it doesn't address the removal and installation of the whole caliper, just the top portion and the pads. It doesn't address removing and reinstalling the brake fluid line and the hand brake cable. I have yet to find a vid that does.",abarth
If you’re gonna keep the car then maybe investing on Ohlins will be ok but from what I have gathered they’re track oriented with the Fiat 500 Abarth.,abarth
If you’re worried about street use you could go with koni + eibach springs. It pretty good with street driving but then you can adjust it for track use.,abarth
"They might not even be 4x98, but 4x100! Tire Rack does this a lot. You can tell they're the wrong bolt pattern when Tire Rack requires you to buy wobble bolts with the wheels.

I've started to price wheels in Europe because of this BS.",abarth
Torque pro,abarth
I read somewhere that cutting the bump stops down should help. I will try that. How would I know if the spring is upside down? They aren’t progressives which would make it more obvious.,abarth
"Noticed the other day that I got a bit more boost than normal pulling away... needle all the way around the dial!   
Then a few mins later the dreaded engine management light popped up, warning on the dash (the whole cluster went super bright!) and into limp mode, limited revs! 

  
Turned the car off and back on again (you can tell I work in IT!) and apart from the engine management light being constantly lit, the car was ok ish. I had a bit of boost back, but the needle still wanted to go all the way around & if I kept going for it, back into limp mode.  
  
Got the ODB gadget hooked up, fired up Torque and ""P0240 - Powertrain Turbo/Super Charger Boost Sensor ""B"" Circuit Range/Performance"" came up.  
I had a look under the bonnet, apart from a bit of oil being in places it shouldn't be (another tale!!!) visually things seemed ok.  
  
So off to the interwebs, a bit of sleuthing later I had decided my issue was the Pierburg boost control solenoid, so I ordered a slightly better one up and a nice silicone intake hose, if I had to take the stock one off to get to the valve, a fancy one might as well go back on!

  
All the bits arrive Friday morning, I was working from home so I went out to start the job at lunch time. 10 minutes later I came back indoors cursing as I had just discovered a split vacuum line I didn’t notice before... 150mm/6"" of 5mm ID hose between the turbo & boost control solenoid with a spilt had caused all my issues.  
Ordered up a couple of meters of 5mm ID (2.5mm wall) silicone vacuum hose & some clamps which arrived by Saturday lunchtime.

  
Today, all the new bits went on even though it was only £1 of vacuum hose that needed replacing. I did replace all 3 lines to the boost control solenoid too.  
Full boost ahead.

  
(excess oil... the drain bolt on the oil catch can was awol!)   
  
TLDR; P0240 cause by a split in 150mm of 5mm ID vacuum hose between the turbo and the boost control solenoid",abarth
Mini focus if you will,abarth
THANK YOU!,abarth
I bought mine with a catless downpipe. Bought an EC high flow and didn’t notice a difference. It’s tuned as well which makes a world of difference,abarth
"The only things i can think of would be a Kona N (basically a Hyundai 500 Abarth) or a used GLA 45 (the ""crossover"" that definitely isnt just a hot hatch)",abarth
I'm not mad at it,abarth
Any recommendations for Android phones?,abarth
"I feel this, even with a block heater in use we had a small battle against the ambient temp start delay to get ours going in -35C (-51C wind chill). I think the start delay checks against -30C/-22F",abarth
Definitely don't get 30+ mpg flooring it everywhere.,abarth
23 cars but can't post the video 😂,abarth
Ayy Wisco friend!! Where ya from bud?,abarth
"That Is so sick, I've still never seen one in person😂",abarth
"We have a lot more ""small"" cars in the UK, so I imagine it stands out less than your side of the pond. Having said that I love being able to nip through / into small spaces.",abarth
Cravenspeed gemini mount. Most permanent solution that you can get but still be able to revert back to stock.,abarth
"Why not run the oil designed for the engine?

Selenia ABARTH (10W/50) [https://www.shop4parts.co.uk/?name=store&op=Product&ProdID=4373](https://www.shop4parts.co.uk/?name=store&op=Product&ProdID=4373)",abarth
Depending on the tune if it's a stage 1  I wouldnt sweat it,abarth
"I'm having similar issues on mine. Its definitely speed dependent and mine does it between 80 to 100kph. Vibrations go away after 110kph. I took it to my dealer for a look and its got a slightly leaking CV boot. 

They think it's the CV axles since no codes were popping up and their inspection of the engine and transmission came back good. 

Vibrations got really obvious when I swapped over to coilovers. So I suspect it's because the car is sitting lower and the cv axles don't like the new angle that it sits on. 

I've yet to get them replaced, but I suspect I just need new CV axles.",abarth
"Jep :-) Hab gerade gesehen, dass 4L (2x2L Büche) Selenia mittlerweile wieder für unter 80 EUR erhältlich sind, da würde ich nicht lange fackeln...",abarth
"It’s a common fault across them all. It’s the outer skin that rusts quickly, just crap design it’s the same on my 2016 one. If it helps I’m in UK (very wet) and the inner skin doesn’t have anything except a very small amount of surface rust, should be fine just keep an eye on it if you buy it

With regards to replacement, it doesn’t need doing until the inner skin is compromised I.e. when it starts blowing",abarth
"Gotta get mine detailed once it gets a bit warmer, salt is a car killer🥲",abarth
For a competizione? Yes,abarth
"Had to have the bank repo it. I can’t afford it, I still owe 25k",abarth
"I have the exact issue, doing some research I think it’s the boost solenoid! Buying a new one next month.",abarth
"Balak trim looks awesome, what kind is it.",abarth
"Lmao I love it! 

So I'm not really sure how it's all going to work out with the dealership. I owe about 4.5k-5k negative equity so rolling it over isn't really an issue, but they will... owe me(?) Like 5k difference so it cancels out (?) The negative equity. I have no idea how it works lol. Which is why we want to talk to someone face to face and why we can't go through private parties even if it would be cheaper. It sucks ass because even a pop is like 5k used lmao. But our whole goal is to go from $663 a month to something a lot more manageable now that I'm not working and waiting on the VA to do their jobs lol. 

This has been such a positive experience in this sub though ❤️",abarth
The cowl intake pulls air from outside. Its louder because it is right behind the dash. Performance increase can be up to 5-7% in some cases. The upgraded intake just allows the air to flow better. You arent really going to get more air in the system than it ever could. It just has less restrictions. A K&N filter and some silicone tubing replacement for stock intake for the airbox. Will give just about the same performance. And is quieter. Better off replacing the inter-cooler with a better model.,abarth
"That sounds like a solid deal. Have a respected, local mechanic do an inspection on it before providing any sort of payment. Note that if he's done work on it, I would be careful in what kind of work was done. Engine mods, etc. could mean the engine was beat to sh\*t so just be aware but for that price, you can't expect a Ferrari.Just to give you some context: I purchased a 2013 white Abarth Cabriolet (convertible) in mint condition, manual transmission, Beats audio package, black/red leather interior, modified exhaust and air intake with 37,500 miles for $9,750 in 2018 direct from a seller in New Jersey. However, prices seem to have increased on these little beasts since that time.",abarth
"Alles gut, war nur der Gaspedalsensor der gemeckert hat",abarth
"1000% yes it was a super reliable daily for 4years. Didn’t have that much miles when I sold it (45k miles). But the only modifications I did were the wheels, coilovers and rear seat delete. Sold it for 9k",abarth
New Jersey Speed Shop in Dover. I have no personal experience with them.,abarth
Yeah I paid $16k a year and a half ago for my 2013 with 56k miles. Motor blew up at 64k almost on the dot,abarth
Engines were built to drive. That's what's happened,abarth
I'll get that checked thanks,abarth
Honestly the GR Corolla is looking really nice..bonkers on the markups though,abarth
5/10 It needs the white wheels and red paint other than that its pretty cool,abarth
What preventative maintenance would you recommend to someone with a 2015?,abarth
Looks like my Abarth but mine is a cabriolet  2015 with just over 27k miles.,abarth
"Could be something as simple as coil packs, my car did something similar, coil pack 1 and 3",abarth
The turbo-blanket also keeps the heat on the turbo and away from the intake-tubes so the silicone intake tubes are colder inside. Especially in the winter.,abarth
"I’m curious if they did away with it in the refresh? My 2014 has the speed beep (not what OP was trying to fix) function, and it’s set up to have a popup on the dash if you exceed the set speed. It probably gets disabled by most owners, but o personally like it for when I hop from my semi into the 500 and forget how light it is.",abarth
It did! We just rebranded and are now actually part of the main Fiat America group.,abarth
Then it's likely the springs that are too short.,abarth
"Good idea, always thought about adding a few more😂",abarth
"The sooner, the better!",abarth
Oil filter housing customer! Thank you for chiming in! Much appreciated,abarth
do you have a link for the timing belt cover video?,abarth
Is it a U.S. Abarth or an EU?,abarth
"Mine is a 2013, tuned, 27+ PSI on original engine, original turbo, original clutch, uprated injectors and aftermarket intercooler. 160k. Zero issues.",abarth
"older ones don""t have any plug",abarth
"I had a huge binder with proof of oil changes every 3k, all the other stuff, etc. It was very well maintained. I actually bought it with a broken turbo and oil in all the intercooler lines. I replaced it and added a FMIC for the sporty look. I only had it a short time, and like I said, it was a hoot to throw around in the mountains. My personal opinion is that it's a great weekend toy, but a little too small and finicky for daily driver status.",abarth
"Oh no, sorry to hear that. Come to Germany where we have realtively well-maintained highways and on some stretches no speed limits.",abarth
"I meannn liberty walk has one, u got the funds? They’re so coool.",abarth
Head units aren't worth the effort these days. A phone will do it all. Im likely just gonna ditch the head unit altogether. Stick a cubbyhole there with wireless charging. Just use the aux out on my phone for connecting to the stereo.,abarth
Yep looks like a mini cooper,abarth
"There is definitive information that proves the success of one intake over the others offered in the market.

https://www.atmspeedshop.com/collections/fiat/products/2012-fiat-500-ram-air-intake-kit

This page has several graphs showing the results measured from IATs and it’s relation to performance figures. Although, I did not know the ORRA intake had a relocation design for the windshield washer fluid reservoir, I will edit the post soon to add those details. 

Thank you for the input!",abarth
"Oh yeah, good ‘ole ghost parking will leave you with a punched-in boot, lol",abarth
Warranty. Dealership.,abarth
"good to know, I am right behind you with a 2012 Abarth with 26,000 miles",abarth
"The brake light up top is just a sticker that illuminates the word “ABARTH” which I absolutely love for such a simple mod. The taillights from 2018+ I think are amazing and so cool how they are embedded to the body with the center trim painted, and it also makes my car look newer so that’s why I decided to retrofit them.",abarth
have you.... checked your oil?,abarth
"Yeah, there's some differences in the rear suspension too, enough that you need to specify which continent's model you have to get the correct rear shocks.",abarth
Thank you - now they make sense!,abarth
"After sitting at the Mechanic for one month, I needed to purchase a battery for $800 and it needed three sensors for fuel efficiency to be replaced totaling $3000",abarth
Yes it is manual!,abarth
"Having an Abarth previously made me so happy, I never felt insulted. I felt embarrassed for them that they didn't know cars",abarth
"Take the 2016, it has the revised trans",abarth
It’s a manual,abarth
Thanks for your information!,abarth
"The cars don’t suck, the owners usually do. There’s lots of people who will jump in and neglect to check their oil or do full boost pulls on a 115F day in Texas.",abarth
The spoiler looks ridiculous,abarth
It’s a non issue if you’re keeping up with maintenance. A lot of people with fiats rely on dealerships or 3rd party repair shops that don’t want to work on the car. A bit of TLC with your own hands and tools goes a long way in keeping these cars on the road.,abarth
"Yep! We have the 1.4L MultiAir, we don't get the T-Jet.",abarth
I mean my 2013 is at 106k,abarth
"Is it me, or is that yellow Abarth sticker not level?",abarth
I got stuck yesterday in mine. Not nearly as fun as I had hoped.,abarth
"For the extra 22 hp, 34 lb-ft of torque, the suspension and the interior.",abarth
"I’m calling that bluff. Pics or didn’t happen.


Edit: make sure to have pictured one of the lousy stickers on the car with the hood up so we know stock images didn’t come to the rescue (sorry, I’m opinionated on stickers, you do you)",abarth
"I bought a reman head, and had it installed already, took the better part of February to get it done, but she’s back on the road and running better than ever now!",abarth
I have not had to do that specific pipe before but I believe removing the battery and tray along with the modules should be all you would need to do (assuming a left hand drive manual anyway) not sure how all the configurations are laid out...,abarth
Shops these days are more likely to recommend replacing the motor rather than changing the air filter.,abarth
"Your battery is fucked. Replace it, problem solved",abarth
You could try spring assisters on the rears. I’ve used them on my Panda 100HP (same rear axle and same problem) and they seem to have worked. For £15 and 30 mins to fit it’s well worth a try.,abarth
"I wondered, lol. Honestly, the blackout swap is a night and day difference. I ordered a package deal from Madness, so I got the headlights paired with the daytime running/signals. Taillights were separate, but now Madness carries the Euro style taillights which I prefer. I had bought mine before they started carrying the Euro style, though. For the side markers, I swapped the factory clear for black and now regret it. I should've done smoke, since my Abarth is grey. But they're going to be near impossible to get out. We had to bash them with a mallet just to get them in. 😩",abarth
"I'm 6'2"" and on the larger side and have found a happy position in my 595 and love it.

I am looking at a steering wheel spacer to make it a bit more comfy.

One thing that doesn't come up in these posts much is foot space, I'm a UK 12 (EU 48) in Nike Cortez style trainer it's all good, by happenstance thats the only footware I drove in on the test drive and the first few weeks of ownership.With a more formal shoe, the extra shoe length and sole width is doable, but I have caught the edge of the brake with my clutch foot a couple of times. Nothing major but worth bearing in mind.

Time for a test drive friend",abarth
"No, spring.",abarth
Haha!,abarth
"I believe they are Supersport 7.0 x 17.
We've the same wheel on our Comp but in silver.",abarth
