Comments,Make
"The good news is that with facelift versions, nothing metal or structural is altered. Just the plastics and maybe a wiring loom tweak. 

So you can interchange the bumpers and headlights with relative ease but they need to be a joint package. You may have issues with the positions of the clips/attachment points though so a bit of messing about may be required",seat
"Expect it to be good on fuel until the electric runs out then will probably see like 30mpg all the time.

I typically put it in hybrid and let it drain naturally and then set it to recoup up to 50% then drain again.",seat
Yes it's an Auto 1.0 TSI 110,seat
"Simple, blows everything up in a 100 meter radius.",seat
"Red, white, yellow, orange, purple.. These colors are usually cheaper where I live. 

Black and grey tones (dark colored cars) go for a higher price.",seat
"Thank you for the information, not sure if this makes a difference but when I first added the sub I didn’t notice the difference of power however the next day I changed my ground cable from a 4AWG cable which came with the kit to a 8AWG cable as the original 4AWG cable was too short for the amp connected to the sub. Would this make a difference and causing my problem?",seat
"Just checked my ODBEleven I can change my 2016 TT to 10,000km roughly 6300miles if I wanted to. Maybe someone has done this before you owned or if owned from new someone else has?! 
Is strange though.

Example: https://imgur.com/gallery/qECxq9e

Just proves not every car will be the same and can be changed, so can't just say what it should be, rather what it could be... So clearly SlimMaster knows their own car 😂",seat
"I got a 2010 1.2 6j back in September. Got the exact same sound coming from the exact same spot. Try lifting the mirror up, that was the case for me, the mirror is damaged, so that changed the air flow and started the whistling I guess.

Edit: Also, if the whistling starts from 80-90 kph and above, that might be the case.",seat
"I've heard the same. I test drove a Leon 1.5 dsg and it felt a little indecisive as to what gear it wanted to be in. I'd say go manual, VAG gearboxes are pretty reliable and cheap to maintain.",seat
"Theoretically LSD on VAG cars are usually on performance models like Audi (R)S, Volkswagen R, Cupra etc. 

FR 1.8 doesn’t even have 4Drive, so i dont even know how would a differential lock system would even help

“2.0 upper trim” could either mean 2.0 TDI (150ps) or 2.0 Cupra R (4Drive, 310PS). The latter definetely has some sort of LSD, while the earlier does not",seat
"Hey, there are two types of the infotainment system. First one is running maps from the SD card and the second one has maps saved on ssd disk inside the infotainment unit. If your unit is running maps from SD card, you are lucky, that is an easier option. If you have maps on the SD card that doesn’t necessary mean that your unit is reading from it when navigating. I had also SD card with maps in my SD slot when car was delivered but my unit is reading maps from ssd so I have no idea why they even provided that SD card. 😀 So try if you really need that SD card in your slot and after that we can move on. It would be even better if you can provide photo with information about your infotainment unit, but I can’t recall the exact steps, so just try to look for it in settings.",seat
Is your car a 2.0tdi?,seat
"Funnily enough, that’s the first thing I did everything is clear",seat
Yeah. I'll actually try and arrange one next week.,seat
"I drive one of these myself, same spec... everyday I get to drive all models and trim levels of seat and cupra, and sometimes other brands like mercedes and range rover. but at the end of the day this is the one I actually enjoy driving",seat
"I used to have those issues only when using wired CarPlay. Since I installed a Carlinkit wireless CarPlay adapter, the issue is gone. I assume it has something to do with the cable connection between phone and car.",seat
"Amigo, soy de México y tengo una pantalla de 8.25"" Xcellence 2023

Apoyanos en enseñarnos la versión de software, para enseñárselo a mi concesionario de favor.

Se ve increíble el full link en pantalla completa",seat
I have an open spot there for the hazard button just can’t take the plastics off to access the wires,seat
"It is a very nice car, it was a choice between this and a 2021 Leon FR. I chose the 2019 mainly because of the engine (only a few common faults) and the fact it has physical buttons for the climate control (I really dislike the idea of needing to navigate through menus to change the cabin temperature)",seat
yep. I fear that there's some diesel leaking from the injector or something in the engine 🫣,seat
Turn the mirrors knob with the point at 12 o’clock or lock the car and keep pressing the locking button. If they are electric they will fold,seat
what did you change it to??,seat
I’ve got a newer model Leon now. 2.0 litre DSG petrol. It’s nice but I prefer the old one.,seat
You manually set it in the menu. Press the car button > press battery on side menu > press the surrounding area for hybrid and e-mode > press the cog next to hybrid and slide it further across to recoup.,seat
"The axial which holds the wiper is worn, and the wiper got out of alignment. You can try to adjust it, but at the end it's usually a replacement at the end",seat
"That’s down to your financial situation I guess; only you can really make that decision, however, you’ll always feel like the car isn’t as good as it could be & that feeling will nag at the back of your mind during the time you own the car - could make that argument for any added extra though.

2k extra is a lot; the larger screen sounds better though, all comes down to how much 2k means to you",seat
"The beats upgrade is not 2k but just a couple hundreds.
Upgrading the infotainment is another 1300 or so. I would definitely get the upgraded infotainment tho. Looks way better and I heard that the standard system doesn't really display Android Auto full screen.

Personally I think that the beats upgrade still is a bit too expensive for just a better amp and subwoofer but at the other hand it's not that bad. The AMP will make the standard speakers sound better and have more power.",seat
"I like everything bar the digital dash, prefer the analog dials",seat
ngl i have the 1.0 tfsi from 2018 - its one of the most fun and crazy sounding cars i ever had. just pure love,seat
Is there still a way to access the vehicle settings after installing a unit like that?,seat
From what I see it's not unreliable. There is a fella on YouTube that has over 200 K miles on his and he uses it as a driving instructor car. There is also another channel which tears down old engine's and they seem to think it's decent. But of course there are going to be cases when someone gets a bad one.,seat
"Even if you could get a hold of the software on USB, youd still need a scantool with acess to the Seat factory servers to update your different modules (radio, OCU, infotainment) to tell Them that youve given Them New software. Take your car to your local dealer and ask Them to update to 1969 if you cant via the infotainment.",seat
"My Ibiza has 304,000km on it. Still running, I wouldn’t say perfectly, but it goes pretty well. Previous owner treated it like shit, so there are some minor damages to it (cigarette stains on the interior and damage to the engine bay, the headlight cover is broken on both sides) but as far as reliability and running it’s very smooth and very efficient on fuel.",seat
altea 1.6 mpi here . 238k km. 2006 model.,seat
"You need to check your oil at operating temperature. Heat up the car to operating temperature, let it sit on a flat surface for 2 minutes and then check. As long as its between min and max its perfectly fine. If its at 4/5 between min and max youre about 0.2l short. Your engine takes 4.3L, so nothing to worry about at all. But again, your measurement is wrong.

If it was correct, and you have driven 8000km since your last oil change then you wouldnt be anywhere near min before your next oil change. The 1.5 is not known as an engine that burns oil, so No need to worry. You also have an oil level sensor in your car, so if you get low on oil, youll get notified.",seat
"The last 3 cars I’ve had I’ve had remapped. It makes an unbelievable difference to the car each time. Admittedly none of them are from the Vag umbrella, but most vag engines remap quite well. Also they’ve all been 1.9-2.5 litre turbo diesel’s where the most benefits are typically had. 

With modern traffic/speed limits and enforcements, all these cars would have been plenty without, but it wasn’t the peak power I’ve chased in any of them. It was always low down grunt, overtaking grunt and driveability. A lot of this being throttle response that’s been greatly improved. Aside from the current one, fuel economy got improved each time as well. 

So I wouldn’t hesitate next time around either.",seat
Exactly. Atleast engine wise,seat
"Hey,  
  
Thanks for your reply! I'll give these steps a try, but there's a bit of a hiccup. My SD Card is 16GB, and when I attempted to access the second URL you provided (https://seatmapdownloads.akamaized.net/EUAS/EU\_AS\_STD\_1520.zip), it returned an ""Invalid URL"" error. I did spot this URL, and I believe it's from the official SEAT site, but still no luck with the download!  
  
I'm a bit skeptical about whether the first URL will work even if I purchase a new SD Card. As far as I know, it needs to be an official SEAT Card, right?  
  
Thanks again for your help!",seat
"If you don't have the symbol on the drivers door, where you can change the mirrors position, then you don't have it. Had the same question two weeks ago",seat
"The starting price for both on the base models are in the £19,000 range",seat
"Sounds like you have a diesel with a DPF ? This is unfortunately something that happens within DPFs. I suspect you are probably not doing enough daily mileage and this is making life difficult for the DPF to do passive regenerations. I can get really deep into this topic but sadly I think you are stuck with this.
The reason you’re oil level increases is because every time a passive regeneration gets aborted, a quantity of diesel fuel gets past the piston rings and into the sump, diesel fuel mixes well with engine oil but it once it happens it does thin down the oil. Reducing the oil level isn’t the right fix. It should have an oil and filter change",seat
"Have you tried to disconnect BT and reconnect it before plugin the cable ?
On Suzuki for example it dis not work if BT was disconnect before plugin ans on Toyota Yaris, i had to plug before starting thé engine (so BT IS disconnect before plug the cable)",seat
"I very much doubt that as the market has been cooling off recently. I know because I sold my 2018 Leon St FR (all options except the virtual cockpit) for 16k € at 72k km. I tried to sell it for more over a 2 months period, but all the best offers I got were around 16k €. Don't know where you are located though.",seat
Curious as to why the 1.4tsi engine is considered unreliable? I keep seeing people say this. I've got a 1.4tsi Leon and now I'm worried!,seat
You checked because your car told you to check oil?,seat
"yeah, it's not beneath the radio nor near the shift stick... under the radio there's only the hazard button and the passenger airbag indicator",seat
Are you looking to sell it? 🤣drop some pics in of it mate interested,seat
"Yes.

I have a 70 plate 1.5 seat Leon FR car, and have the all in one package.

The warranty is actually pretty good, there were issues with the front sensor which have taken 3 attempts to fix with nothing coming out of my pocket.",seat
"That’s not an oil pressure light, that’s an engine fucked light. If that comes on, and you shut the engine off immediately, you might - just might - avoid a catastrophic engine failure. 

But you didn’t do that, you continued driving, and now you’ve done some unspeakably bad damage. Expect a bill in the thousands.",seat
For comparison I bought a 2019 Leon Cupra 290 (just shy of 50K) on the clock for £15800 about 3 weeks ago.,seat
"Only issue we have had was rear subframe rusting but a good wire brush and some hammerite it came up pretty good. yellow mk2 at least here in uk are pretty rare. other rare colours are purple and copper. most of the workings of the car are mk2/mk3 golf gti so parts are pretty easy to come by. body panels are harder to find. engine makes most of its power higher in rev range similar to honda k series. we just do preventative maintenance on car the usual worn out or old parts leads, coil, rotor arm, HT leads, fuel filter, oil change . next job is new thermostat and water pump maybe modernise the lighting. no real issues to report, had it 3years. Now they are starting to get scarce in UK.",seat
"I have this car, it’s coming up 3 years old and seems to be great. My only slight reservation though, is a “time will tell.” Car came up with an EML and it wasn’t running quite as smooth as before. Husband is a master tech so he plugged it in to see if it was safe to drive but couldn’t make any changes because it’s still under manufacturers warranty. They fault code indicated the timing chain had moved ever so slightly out of its parameter readings- so Seat roadside were called and they said yeah, it’s common, got a software update- which they did. That effectively told the cars ECU to allow bigger margins for the timing chain readings. That item should last the lifetime of the car.. so if it doesn’t, I will be very interested to see if Seat UK will pay for a replacement engine should that happen!",seat
"i’ll be honest i’ve never done anything like this to my car, do you think it would be easy? or am i better off saving up and buying a facelift bumper for twice the price and saving myself the trouble ? i think the central grille is also different on the p-fl compared to the fl so i’m not sure if that would cause issues too",seat
A sub will 100% not make your car accelerate slower except from the extra weight. Do you have the battery light flickering when bass hits? If not you are making enough with your current alternator.,seat
"Try looking at the Leon Cupra callipers, it’s possible they might be bolt on. Other than that, I can’t really help, sorry.",seat
"These have quite high consumption but that seems excessive, I’ve had to put a litre in mine in 10k miles.",seat
Matt black alloys?,seat
"Nah, I do plenty of motorway driving (about 200km a week in fact). It's just close to its service date. Just going to get it serviced now as I didn't particularly like the fix. Thanks 👍🏼",seat
"Take off the back trim of the boot, there will be a guide online somewhere",seat
"Haven't seen too many issues over the last few years... I could probably count on one hand the number of times I've seen an actual engine problem with them and not some nonsense software issue.

As long you keep up with the service (skip long life, 8-10k miles or a year) and drive it often (these car HATE to sit around), you'll be fine...

That being said, it's still a direct injection engine, so if you planning for some serious high mileage usage you might run into carbon build up issues

Also I'm a dealer tech... not many people bring their cars to us if it's out of warranty, so keep that in mind",seat
"Yeah, sounds like a ""Sporty"" thing to add.",seat
Thanks for info. ,seat
"Ah I've got an audi 8V for sale if you were in the UK. 2013 3 door 1.4 TFSI. Not to worry.

Definitely go with the Leon. Much better than the 8p.",seat
"Ah, I'm in the UK, so maybe different here regarding the specs and infotainment system configuration. Also I think all non-""Sport"" Ibiza FRs here have analog dials, you only get the digital cockpit in the FR Sport and some of the Excellence models. My regular FR has the analog dials, and 17"" alloys, rather than 18"", and fabric seats rather than alcantara. It's exactly the same mechanically as the FR Sport, though. I have a 6 speed manual 110PS /81Kw FR model (they seem to have increased the engine power a little in the 2024 model).

A few pics of my 2021 Desire Red FR:

Infotainment screen: https://i.imgur.com/LjXbzlR.jpg

Front/Side of car and alloys: https://i.imgur.com/LOE7SKK.jpg

https://i.imgur.com/LmoWdrE.jpg

https://i.imgur.com/1mTZ8Rk.jpg

Rear: https://i.imgur.com/h86kf9o.jpg",seat
Thanks for the answers guys!,seat
Heat resistant paint is needed.  I think,seat
"Sold my 2007. Leon mk2, 1,9 TDI with 200kkm…",seat
"Hmm, do you have the adaptive suspension?",seat
Yours is the older model. They don’t do 1.2 in the 6F,seat
And did you find Seat MIB3 updates on mibsolution?,seat
Did you do the whole sit in the car with both keys and press the unlock button on each key?,seat
"Only problem is when you have a damage on it, but if you got the money for a new car, you probably pay insurance on it so it can fix it for you! I got a bump on my leon, i could have it fixed and not pay a single cent for the repair.

Škoda has bright orange and the lime green. I saw 1 car wirh lime green, not a single orange one. It is fucking crazy that people dont even want vibrant colors on their cars anymore. And my experience with the blue color in the saloon and people wanting to buy is a clear sign of people wanting vibrant colors. The only problem is that people dont know they want it until they see it.

I am legit sad that I wont be able to get a Leon or Formentor in a color I want. If there was an option to get royal purple or neon green and similar colorsI would go for it in an instant.",seat
"I have now Feedback from a second Seat Dealer. He said that it is not possible for him to order the fullink code for this HW. Only while ordering the car this can be done.

For me this is mindblowingly stupid. I will see if i can either use a 3rd party system or swap another Seat Radio into it.",seat
buy an android radio with carplay and android auto - should be around 100 bucks on aliexpress etc,seat
"Is not invasive but still a pain in the ass…I just hate how Europe treats us like children…

Anyway, how tedious is the procedure of deactivation?",seat
Sometimes I wash it...,seat
"I'm sorry, but 🤮",seat
"I can’t charge it at home also, that’s why I’m a bit worried with the fuel consumption. So 30 mpg it’s the average in hybrid mode?",seat
"With my driving style in a sportstourer yes. My colleague has a hatchback and does less city driving, he gets on avg like 40 ish",seat
I loved my Leon fr in that shape best car ever,seat
"Even two cars is a bit silly... you'll very likely ruin the interior, and what happens if the worst happens and you crash on the way back? Those slabs will not stay where you put them...

Hire a van or have them delivered!",seat
Its a shit button. When you press it you shit. Its not very useful but extremely funny as long as youre not next to the person pressing it.,seat
"I don't think the MK3 ST 300 had a factory option for towbar and it wasn't type approved for towing weights, that's not to say you can't get after market ones without type approval.

Check these threads which is probably where I read this:

* [https://www.seatcupra.net/forums/threads/towbar-on-a-cupra-280-st.428968/](https://www.seatcupra.net/forums/threads/towbar-on-a-cupra-280-st.428968/)
* [https://www.seatcupra.net/forums/threads/leon-cupra-st-towbar.459089/page-3](https://www.seatcupra.net/forums/threads/leon-cupra-st-towbar.459089/page-3)

EDIT: I have a ST 300 2019 if you want me to check what the plates say.",seat
"Youre limited to 1 phase charging at a maximum of 3.7kw/h. So No matter how good of a charger you have, its still going to be arround 3.5-4 hours",seat
It produces slightly more noise than mpi engines since it has common rail fuel system. But not nearly as loud as diesel ones. And as it was mentioned here it gets more quiet after warmup.,seat
"I bought my car from Cinch, and had multiple warranty repairs done with them in the 3 month warranty window - I could have continued their warranty for £35 a month, or I could get the All-In plan from Seat directly, I decided to go with the latter and have began to regret it 

They don’t seem as keen to rectify issues, they noticed my rear shocks were leaking oil, and because it’s only ‘misting’ - they won’t replace them under warranty & expect me to pay £700 to repair them?
Baffles me how shock absorbers would be leaking oil on a car with 25k miles & that not be a manufacturer issue. 

Cars going in for a major service & MOT next month so I’ll update this then - hopefully they decide to do the jobs I need doing under warranty 

Also, if you think something is wrong with your car, and they can’t find the issue, they charge you £100 for simply looking at it, something to be aware of",seat
They do NOT have the same part number. But this doesnt mean that it doesnt fit. Did you ask the seller or maybe Seat?,seat
"Those are the FS III brakes and for a steering knuckle swap on these you will need knuckle from mk5/mk6 but those use 55mm diameter shocks and bolted wheel hub/bearing. It's going to be expensive... Have you tried using braided brake lines, better pads, rotors and fluid?",seat
"Check when the dsg service was done or what the interval is.

I wouldn't worry about the dsg as a whole the 6 speed is one of the stronger and more reliable one.",seat
"Yah, I'd check the manual for that one.",seat
"You'd need a plug in or reprogram to change the data cluster. Have a look at dash reprogramming online, you'll probably find something. VAG have a big aftermarket customisation market so you'll probably find something.",seat
"It's pretty stiff and I think it can't be changed easily without changing the springs. If you have dcc it helps a tiny bit, but tires made the biggest difference. I always noticed when I went from my 18"" summer wheels to my 15"" winter wheels.",seat
"You can buy a box that piggybacks to the existing unit behind the glovebox. 

It's costs £250. It adds Google and Android Auto to the existing system. No need to change the screen or unit.

https://www.makcoding.co.uk/product/seat-mib1-carplay-box/",seat
Guess it will be software fix then,seat
Just for the pano roof alone I'd take the golf...,seat
"Was yours an automatic? If so, if you got the DSG tuned that could have added to the cost (mine's a 6 speed manual 1.0 TSI 110).",seat
"Cold, 24h",seat
"So it's 10k/12months on standard service or up to 18k/24months on longlife.  

It's literally two hard coded parameters in the ecu to choose from. There is no 6500miles unless you happen to do 6500 miles over a 12 month period.",seat
"I have a 2007 1.4 16v ibiza with 200k on the clock,everything 👍


We had minor issues ..like pcv valve seal,one coil had to be replaced once.
Nothing expensive.
Car still runs great.",seat
Thanks! Do you want to share some pictures?,seat
The 1.8t and the 1.9tdi fit inside.,seat
That's what I wanted to hear. Thank you,seat
"For me audio quality is very important, but IDK a 2K cost increase is worth",seat
"I've had the exact same model (in red) between January 2020 and October 2023, and gave it back to the dealer (it was a lease) when it had about 57k km. I've had no issues whatsoever with it. I gave it back per contractual clauses, and a friend of mine bought it from the dealer based on my recommendations. I'm sure you will enjoy it! Congratulations! BTW, I remained in the Leon family, using now a Cupra Leon 1.5 eTSI 150 hp, which seems very familiar :-)",seat
Use additional fuel lol.,seat
Leon MK2 1.4 TSI 2011 with 263 000 km runs realy good.,seat
"Good point - maybe I should leave it to someone that knows what they’re doing! 

Thank you!",seat
E-tsi? Havent had that many issues with it. Tho its definately not as sporty as the 1.4 and the 1.5 non e-tsi.,seat
I just bought a 2020 leon st fr all extras except digital dash for £13500 from seat used cars so get the 2 year warranty etc. With 38k miles.,seat
"Its quite normal. And yeah, its diesel in your oil. Usually not because an injector is leaking, but because more diesel is injected during regeneration of your dpf. Youre about due for an oil change Arent you?",seat
You could be more constructive to what's clearly a young person trying to have joy in their moment.,seat
"[https://imgur.com/a/18GKHpE](https://imgur.com/a/18GKHpE)

pulled it up from the Seat Connect app",seat
Does it have an after market radio? My dad's old car did this when you first started the car and turned it off as well,seat
"I'm in the same boat, have just acquired a late 2021 Ibiza FR (110), but it came with two years warranty (I bought it from a SEAT main dealer), however I fully intend to get a stage 1 ECU remap once the warranty is over.",seat
"Thanks. When you say MK5 do you mean VW Polo? So I understand if I use those I have to swap my shocks too? :( I've got KW coilovers in there, would be a pity to have to change them

The first step I was going to do before trying bigger discs is to get Tarox Soltted rotors and semi metallic pads and a higher temp fluid. I've also already added some VCDS codings to give me the option to turn off ESC completely and I lowered the XDS intensity to low. I'm hopeful all these changes will help, but I still have my doubts, the heat generated will be the same and I wonder how the rest of the brake assembly (for example the hose running to the caliper) will handle the heat.",seat
