Comments,Make
"That's exactly why I was so surprised as well. I've never heard of a failure on these things, especially with such low milieage.",skoda
You mean stopping engine in traffic lights while you wait and turn it on when you press gas?,skoda
"TSI 95 HP, is it correct in english? I hope 😆",skoda
It will not show the name of the person who calls in the virtual cockpit display.,skoda
I have the Scala Se with the 1.5 Tsi engine (Manual) and it's great on the motorway. Makes the car feel really composed. It's more than enough power and very economical. If you are planning longish trips with family and luggage it's a good option.,skoda
That's pressure because of fuel consumption. For your comfort and durability of suspension. Inflate front and rear to 2.3. Noticeable better ride quality,skoda
"Pulling towards always increases by 1, pressing end button should decrease by 1 (once speed is set, as you correctly said), but it sometimes decreases by completely random amounts (5, 15, 30, anything really). Not sure what you mean by speed delta and tolerance",skoda
The car was wearing a plastic film livery.,skoda
"You can also get Octavia RS with 4x4, no need for Scout version unless you want more ground clearance which might be useful for gravel since RS is quite low.",skoda
Mileage?,skoda
"ooooh, so if im sleeping in the car for example its best to turn it on, man if only i knew it b4, is there a button like that in the yeti?",skoda
"Nice, buy the thin red and green stripes for the grille fins...looks really good...at least I think so",skoda
"Thank you, will do today, good point..",skoda
"ah i see, would the buttons on the wheel then work with that?",skoda
"Those are an option but the police here (Austria) is pretty strict I one got fined using those cam over belts     https://www.obi.at/reise-transport/lux-spanngurt-mit-klemmverschluss-2-stueck/p/1826312 on my roof rack they only approved those ratchet things. I want to invest once and be done with it. For a small package those rubber things are good but a washing machine?
My father's superb has rails in the back with locking cars each car has a big loop to secure a strap",skoda
"Do your have anyone that has VCDS or OBDeleven, asun running code scan should gives more info. Maybe ask local VAG-group on facebook if anyone is willing to read codes for you, if you don't hae access to one yourself",skoda
Thanks but I don't think that's it.  I'm fairly good at keeping keys dry and not dropping.  I was driving the car and couldn't lock it remotely with the fob when I noticed it first.  My trust is rapidly dwindling in this motor but maybe all new cars are problematic though.,skoda
Maybe it would be better to find a non-neglected 1.9 TDI? They're nearly bulletproof and economical.,skoda
I'd give you €2 and I don't even have a VRS. I've a superb,skoda
"Are both cars new or how many km have they been driven already? Usually if its same package superb vs same package superb, they superb wins",skoda
Look in your manual. Either the book that came with the car or the download able pdf version.,skoda
"Don’t worry about bugging. You don’t have access to that kind of info but a Google search with keywords from your description will show you relevant info. Like the one below. I don’t follow briskoda but I know it’s a very respectable source of info.

https://www.briskoda.net/forums/topic/494487-knocking-noise-from-engine-10-tsi/",skoda
"Ah damn I’ll start with the simple things first, chrome symbols etc",skoda
"But we agreed that the car has a tune, so i am not sure why this is still going.",skoda
What year is this?,skoda
"Yeah - fair enough, I guess in my head I am comparing to my OG 2016 Mk3 which was around 230ish (with a rated 220!)

I stand by my Electronic Diff and DSG comments though!",skoda
"If fuel efficiency was a consideration you could have gone for a greenline or 1.6tdi, around 560miles (900km) to a tank. Mine averages over 55mpg and on long motorway commutes can hit over 90mpg (38kmpl).

Maybe when you get a bit older 😄",skoda
So in summary a DSG is alot more comfortable and responsive :D niiiiiceeee,skoda
"Michelin Energy Saver are quiet and efficient, last very long. Not exceptionally grippy of course, you can't have both.",skoda
"They also sell a lot to fleets, and on a typical 3 year replacement cycle for a fleet operator, they'll only need to service it once, which makes their numbers look good.

Sometimes with looking at what the same manufacturer with the same engine in the same model recommend in other markets. 

E.g. USA market often recommends more frequent service intervals, and if anything the driving style there should be kinder on oil (longer distances, fewer short runs etc )",skoda
3800 kms. I have seen it from Day 1 as that sound comes only once when I move vehicle from overnight idle condition,skoda
1.0 is a good engine with good power output for that car. The 1.5 tsi will be a blessing for a car that small. It will be fast and it should get good mileage.,skoda
"Might be the flip issue. Have you tried to download your contacts to your phone itself? I'm not a phone tech, but enjoy fixing things and looking up solutions 😁 
Hope you get it sorted. I'm taking delivery of my new Kamiq in May. I will be using the Amundson entertainment in the car for my phone too. 😲",skoda
">The higher view and driving position is the main thing that's making me seriously think about the Karoq and Ateca.

Funny, that's exactly the reason why I'd chose an octavia.",skoda
And its pronouns are Das/Auto,skoda
Lol. Nope.,skoda
"Awesome, thank you! Did you use the inlay for newborns? I can see base pearl is from 3 months. Just to check, you have a Fabia Mk3 and this setup didn’t cause them to be too upright? This is super helpful, so thanks again!",skoda
"They’ve rebadged it, you fool.",skoda
"I drive 2021 Octavia 2.0 TDI with matrix lights. Matrix lights are absolutely awesome and I would choose them any time in any car.

However for such short daily trips that you're mentioning, I don't think the diesel would make sense. Especially in the winter it takes 10+ kilometers for the engine to get to the working temperature. 
If I were you I'd go for the benzin version despite no matrix.",skoda
Do you think car paint is invincible object? For now you wait and respray it later or use colour marker for now. But in future you need to wrap your front to prevent damage on your car paint,skoda
"There's also a minimum speed limit, which allows you to creep as long as you want, and to crush tall grass when parking.",skoda
"That’s the thing, the price is not very good, nearly 5000€. However this is Ireland and everything is expensive here. But even if I could drive it to 200miles and sell for 80% of what I paid I wouldn’t mind",skoda
Example part for Octavia II: https://www.ebay.co.uk/itm/255241115780?mkcid=16&mkevt=1&mkrid=711-127632-2357-0&ssspo=KjHjI6ASRi-&sssrc=4429486&ssuid=d6eqyokotzq&var=&widget_ver=artemis&media=COPY,skoda
I unscrew mine to top up the indicator fluid.,skoda
So basically lower it to the point you can't do speed bumps any more and stick fancy alloys on it?,skoda
"What phone, what app you use to play songs?",skoda
Superb estate is the king for space in my opinion!,skoda
Probably pretty sensible 👍,skoda
"It makes a difference. But only if you have long journeys and use it all the time, and drive conservatively.

I drive around 40 miles to work, and most of it is dual carriageway and motorways. I kick it into eco when I leave the house, and as soon as I hit a long stretch of road, I put my Adaptive Cruise Control on and I barely touch the pedal again for 40 minutes unless I really have to. Otherwise, I let the car brake and accelerate, etc.

I have a 1.5 tsi also. A full to the brim tank will hold 70 litres, give or take. And normally, I'll get around 530 miles out of it from normal driving as long as I'm not booting it everywhere. With the Eco and ACC on, I'm able to stretch that out to around 630/640. So, another 100 miles is great in fuel/moneys terms.",skoda
"Without coding a new battery, the system will not work correctly or with errors. 
But first you need diagnostics and only after that repair or replacement of damaged parts. 
Contact your nearest Skoda auto service center.",skoda
"Have you tried phoning round and visiting scrap yards?
Good way to grab one for much cheaper if they're still in the vehicle.
Most of them are quite cool about letting you take whatever at a fair price.",skoda
"Got Octavia 4 for about a year now. Never got the need for a phone holder. It has a dedicated place for a phone, but everything is on the infotainment.",skoda
"I got a Carlinkit adapter, it’s a device you put into your USB and it connects to the infotainment via CarPlay. 

Your phone pairs wirelessly to the Carlinkit box and you have wireless CarPlay, works 90% of the time.

I have a 2019 MK3 VRS and it’s a great option.",skoda
Change the water pump right away,skoda
Where do you set this?,skoda
Smaller wheels will make a big difference,skoda
Ok good to hear problem is gone. Many month ago it restarted like 4 times upon starting the engine. I have an octavia IV love it so much. I wish you a pleasant car owning :) i was sooo happy for months when received my new car,skoda
"Direkt, nein, aber ich weiß, dass man das Ganze auch durch maßgeschneiderte Lösungen mit Androidgeräten nachhaltig, und DEUTLICH günstiger lösen können soll. Aber da bin ich dann inhaltlich (en detail) wirklich überfragt, aber: im Skoda-Forum wird Dir sicherlich jemand weiterhelfen können. 

www.skodacommunity.de",skoda
You need a battery to start a battery? Electric cars suck so much...,skoda
"Correct! I bought this with 45.000 kms on it and remaining factory warranty until november for 450.000 nok, which is just insane, but its just the cost for cars in Norway. At least with a bit of an engine and awd.",skoda
Dark blue I think is the best color for Octavia.,skoda
I have a mk2 2012 Fabia with a 1.2 TSI (84 bhp I think?) and I'm at 70k+ miles and it still gets me around. I believe the engine post-dates the problematic ones that VAG had. Handled the steep Lake District hills last year with me and the wife and a boot full of gear with no problems. Funnily enough I did a 180 mile round trip yesterday in it.,skoda
"I’m still happy with my choice of tdi I guess it depends on your requirements and budget. The 4x4 tdi come up at a brilliant price and well looked after example which persuaded me.

I bought it in 2021 as 2015 for 11k with 60k miles, 1 owner and full service history with all works done, cambelt, haldex servicing etc.

I think the petrol model is chain driven?

Maybe drive both and see if any stand out to you more, in terms of your driving style etc.",skoda
"13 years and 213000km on my Superb, and it’s never happened to me.

I did have my back window smashed when a lorry carrying an unsecured load of scrap metal passed my car when parked, just as I was about to drive off, and a piece of metal fell through the window!",skoda
Will give it a go and report back,skoda
Discharges any energy in the key. Then it’ll treat the new battery actually as a new one,skoda
"Costs depend on what headunit you get, cheap Chinese knockoffs probably not worth it at all. Look at units by known manufacturer like Sony, Pioneer or JVC.

Price will vary depending on variety of things like parking cameras, conversion kit etc.

Check local supply & fit places, they usually quote their prices based that way.

That’s how it works in UK at least!",skoda
Unusual. Most places I see only say 230ish with a stage 2,skoda
Hard tyre pressure is bad for suspension?,skoda
Would the garage be able to do something about it? Or is it normal?  I suppose not .  Powerfull car = more thirsty,skoda
"Kann es sein, dass wir uns auch deutsch unterhalten können 😄
Ich hatte auch überlegt den Diesel zu nehmen, aber die 1.5 TSI Motoren sind ja sparsam, wenn man will.",skoda
Can you use mirrorlink without cable at Ambition package ? Car was paid 25.000€ and no apple car function without cable is radiculs,skoda
Similar price due to difference in milage. Trim wise as well. ,skoda
"Wiper linkage is moving freely if you take out the motor? Cause it usually gets stuck at the pins running through the support, the ones that you mount wiper arms in.",skoda
"Or wrap. Straight simple part, good practice for wrapping too.",skoda
Beautiful cars.,skoda
I also just bought 1.0. any recommendations??,skoda
Can you post a link to videos you’ve watched?,skoda
I used Duracell it only lasted a few months,skoda
They all have different models tho,skoda
"Ive got the 2023 octavia diesel wagon with 150ps and it drives amazing with good fuel economy

No isses so far for 1000km",skoda
"did you noticed for the first time ? how many km on dash \`? For me its not that annoying, but its the first car i really hear something just keep doing constantly, no change in time, like if its should go worse or not :D, I have side project car for race etc diesel, it just tractor everything vibrates i know its normal, for 2018+y , pretty fresh so i really dont know if it normal or not.",skoda
"Mine has free original windscreen no need to add anything, but I do have to add a bit for original mechanical parts",skoda
"Thanks, issue with the air vent is that is located very low on the dashboard 😀 only option would ve the one that fits to the shield I guess",skoda
Turbo petrol is not supposed to be as economic as diesel.,skoda
cameras so that the government can spy on u,skoda
Dunno much about your choice of car but if the dealership isn't great   I'd be looking at something with better support.,skoda
It’s a sweet car.. It behaves well at high rev as well..,skoda
is this still valid?,skoda
If it’s not the module I suspect either the wiper motor has given up or something in between idk not sure,skoda
"It really is underrated tech. I really love 14 or sth levels on the Enyaq. It is even better than on previous gen Octavia. That car was way lighter though, and with 4x4 a hoot in the curves.",skoda
It is just a drain that got clogged up. It is easily cleaned up with some pressure in there like air or water,skoda
"I have the Octavia 3 rs tdi wagon also and it's equipped with 17inch alloys. The ride is amazing, been to the island of Thassos from Romania through Bulgaria 2 times and didn't have any issues with it.",skoda
"Yeah, he should run a diagnostic test of the center module itself individually, maybe try a different mechanic who is more specialized in VAG electrical repairs",skoda
Definite Waze problem then! I've opened a ticket with them. I'll report back what they say. You should do the same!,skoda
No downside but the cost,skoda
It is the most reliable engine you can get in the 2nd gen Octavia,skoda
"There are Headunits available on Ali which have compatible canbus adapters which will show most of the vehicle functions but also give you Android Auto and Carplay.

Care needs to be taken however, in how its fitted (by whom). On my Yeti, the wiring was a bit off where the display would stay on even with the key out of the vehicle but after some extra bit of work, was sorted. That unit also gave me 360 camera setup which the stock unit (Bolero) was not capable of.",skoda
It's the fuel tank,skoda
"Ok, I have traffication, it was there when I got the car. I’ll remove it if possible. Never used, at least not on purpose :-).",skoda
"It's a tow hook, yes.

They usually aren't very durable or reinforced. Theese are really *only* suitable to hook onto when you have four rolling wheels and steering. Also, pull this hook with the slightest of an angle combined with a little force, and you're going to pull threads or bend it.

Source: I'm a tow truck driver.",skoda
"🤣 yeah, in my job sometimes sensors could be named that. Or jerks. Especially that ones that are difficult to catch in the act of reporting false values. This is one of the cases. Everybody jumps to the conclusion that the power struts are the culprits here or even worse, the tailgate controller and miss the fact that a condition for the power struts to work is the known status of the tailgate lock and powerlatch. Well, good luck explaining to the customer that you replaced both struts and the tailgate still doesn’t work 😁",skoda
Skoda and all stealerships will say whatever gets them more billable hours. The battery I replaced in a 2015 Fabia never generated errors or caused issues. And after a couple of years it's been to Škoda for maintenance in the meantime. Zero issues.,skoda
Is 110HP version a better choice in comparison to Dacia Jogger Extreme (fully speced) for someone who makes 8k kilometers per year? The price difference is quite different.,skoda
"6ft is short in my world, that's the shortest person in my family. You might be able to get by with a karoq then.

Ever considered a superb?",skoda
"Something similar happened to my Brother with his Mini. Make sure all your contacts are stored on your SIM card. For him the ones that were on his phone itself wouldn't sync. After moving all to SIM card, they synced to car no problem. Wasn't a pixel 8 though, but could be same issue.",skoda
"So the 2010 Skoda fabia 1.6tdi was my first four wheeled vehicle. It's at 288k km, I got it at 160. In the UK, find I get 35-45 indicated mpg in town, 55+ on the motorway, have seen 85mpg on a ten mile 50mph dead flat route. Prev owner put a new clutch before selling, I've only had to change the steering wheel clock ring, turbo actuator, front discs, timing belt, tensioners and water pump - generous estimate of 1k GBP on parts/fluids, do all my own work. If I only do town routes below 40mph then the DPF does start to clog and the light comes on to tell me to take it for a longer and faster journey, occurs every two-three months if it is only being used to pop to the shops and back. One thing I love about it is the fairly straightforward servicing, for a couple of years it only needed oil changes and filters.

It will do what you are looking for but if parts are not easily available I'd stay away. I've been in the situation of waiting nearly 14 months for parts for some of my other vehicles and it's rubbish. It's a vag car so most parts are compatible with other vehicles from the same chassis but it makes things a bit trickier.",skoda
"Sorry í just got this car today, how do i do that?",skoda
best engine in this octavia,skoda
"I don't know about any common leaking issues. SCR system sometimes leaks AdBlue and can be a several hundred EUR fix, depending on the type of leak. But it's not Superb specific, rather VAG generic. But I haven't heard personally about any Superbs having this issue. Not at this mileage definitely.",skoda
"Do-able, but a pain to change, by the looks of it. [https://www.briskoda.net/forums/topic/452960-resolution-to-b-pillar-foil-trim-issue/?do=findComment&comment=5306384](https://www.briskoda.net/forums/topic/452960-resolution-to-b-pillar-foil-trim-issue/?do=findComment&comment=5306384)",skoda
"I didn't know this! I do a fair bit of city driving, a lot of longer trips during the summer but not many during the winder - So I do wonder about the diesel issues with the short trips. But that's a great shout, thanks for the suggestions.  


Again, the gravel that I travel on really isn't that bad, just every now and then i'll get a few potholes and good chunky rocks - don't want to rock up on the gig with the front falling off lol.",skoda
"Could always get a simple stage 1 remap on it. Small increase of 40bhp or so, little fine-tuned boost in performance.
So long as it's done at a reputable garage that specialises in it and it's not done by wee Joe round the corner.",skoda
Luckily it’s still under warranty 😅,skoda
"idk where are you from, but its not really hot weather as far as i know. So what do you expect? 68km? I hope you didnt belive that in first place...",skoda
"You are hilarious. I am happy with the extra power. Just the seller invented a story about how the car has more power because it's tuned like the gold 7 cup.
Why would I cry. I am sharing an experience.",skoda
"I have an Octavia, and most of the wind noise seems to be coming from the wing mirrors",skoda
I would only consider Paintless Dent Repair for that. Not filler and paint.,skoda
"And you are upset? Virtually no changes, you only make it better. Be happy you got a bonus tune.",skoda
Vehicle settings then lights then the menu where you can set it to switch early - medium or late. I have it on early,skoda
"How are you finding it? I just bought a 2021 fabia estate, 1.0 SE, I've only had it for a week, anything noteworthy about these models I should know about?",skoda
Agreed. I am changing oil on my tiny 1.0 tsi every 7.5K. Though Skoda says it should be chcanged every year or 15K kms but with my kind of driving in bumper to bumper traffic and high idling times the oil itself degrades in just 8K kms. The NVH levels itself starts to change post 7K.,skoda
"Thanks. It drives just like normal so far, no problem with power!",skoda
"Nope. 

Direct Shift Gearbox is actually made up of two gear boxes (one holds off numbers and the other even numbered gears).

The car predicts if U want the next gear up or next gear down and has it ready selected in the other gearbox. This allows it to switch gears quite quickly and it feels like a manual shifting more than a traditional auto.

Once you get used to using the paddles it can be operated so that you choose when to change gears and has the same feel of control as a manual.",skoda
"Fake engine noise, really? ",skoda
"And also, you know, car go more fast vroom.
Men don't grow up, their toys just get bigger 😁",skoda
"The tip is also a set button, setting the current speed. Probably you press the brake, which disengages the ACC, after the button works as a set again, setting the current speed when pressed.",skoda
Please forget the long life intervalls if you want your engine to survive. Do a oil change after 1 year/ 15.000km max to insure that everything is ok.,skoda
"DIY job, hot glue sticks.",skoda
Yes but you have to pay excess. First £115 of the replacement cost,skoda
Chrome delete? You can purchase a Chrome Delete kit,skoda
Damn not a fan. Older model is much more attractive from behind.,skoda
"I just pushed it under A pillar without removing it, will post a photo tomorrow",skoda
Tbh that’s not that much. I know sales reps at our company that do 300 miles a day sometimes driving up and down the country making deals. Those company cars get run in every 3-4 years tops after its pushed over 100k miles,skoda
"No, you’re thinking of the headlight washers. Replace the fluid with acid and angle outwards.",skoda
Even after refuel it is showing 0,skoda
https://preview.redd.it/qpzkm7dh8lmc1.jpeg?width=1440&format=pjpg&auto=webp&s=4a3a38af7f997d9e18dcac36b2b916d2f8b67aee,skoda
Also spotted one,skoda
"The vehicle should be properly serviced by a dealer, have a complete inspection history and, depending on the mileage, the timing belt should have been changed and the gearbox serviced. 

What tends to break down, in my case once so far, is the auxiliary heater, which then happily stews away and has to be replaced, but the costs are not particularly high, and amount to around $ 600.",skoda
RTFM,skoda
"See if you can get a software upgrade for your infotainment system, I know for the mk4 Octavia the most recent version has stabilised a lot of the freezing issues you experience. You can either do it through a dealer/specialist or yourself. If you search for east yorkshire retrofits, they sell the upgrade",skoda
No problems with engine. Its just slow,skoda
"Scala's ground clearance is 149mm compared to 188mm for the Kamiq, so just shy of 4cm difference.",skoda
Not yet I believe. But probably at least +3k from the old model.,skoda
How low to the ground is it? Ive been in estates before and I feel like I'm sitting on the floor,skoda
Built in flesh light for on the go,skoda
Pretty sure that's a quick easy fix for those PDR guys.,skoda
030 103 175 B is the part number,skoda
"It has no steering oil, it is electric.",skoda
Trust me bro,skoda
It is an Kodiaq NS ACCUAAX1 from 2019,skoda
"> out one of the plugs to see what it is

Thank you, But There is nothing in my Handbook. I will try to get them from the Motor parts shop. cheers",skoda
It's worth checking if it also needs new handbrake cables and flex hoses for the rear brakes.,skoda
"Please note I know basicly nothing about cars, I'm very new to it all, but honestly what I would first check is oil level, after that, I'd be stumped",skoda
Good to hear that!,skoda
6.2-6.5 is the average if I’m not wrong,skoda
"It wasn't particularly annoying - the cup holders in the Rapids are in front of the gear stick, and there's a storage area behind them. I should have got round to sticking it to the top of the storage area with some velcro.",skoda
If your thermostat was stuck open or stuck closed do you think the check engine light would be on ?,skoda
"I'd say the Kodiak 1.5 has a better record, The newest generation of Octavia's are riddled with software issues and only time will tell with hardware.


I luckily pulled out my order for the original MK4 RS after I heard the nightmares and bought a used Superb 3 that has overall had little to no issues other than needing a new battery.


I know people that have went through with a MK4 order and would happily swap it for a MK3 Octavia in a heartbeat if they weren't tied into a PCP or HP contract.",skoda
