Comments,Make
"Same price for each car ? Or one is cheaper than the other ?

I'd go for the TDI if it has the same trim level and similar price, and presumably a decent maintenance history.",skoda
"Front and rear tyres, everyday use and fully loaded car",skoda
"You read it correct, it's front and back pressures depending on the load, HOWEVER

this is really strange, usually it goes up with rim size, not the other way around.

My superb has 2.4 for 17 inch, 2.5 for 18 and 2.6 for 19 for low loads.

This is so bizzare.",skoda
"Your car drove 3000 km already, is this the first you've noticed this? I would start with disconnecting battery terminals to reset the car, if visiting a dealer is not convenient at the moment.",skoda
"Ok, cool, thanx. I’ll disable it or remove it if it can be removed.",skoda
Where we’re going we don’t need wheels.,skoda
"1.0 wins in the city and small trips. If you start revving it past 3k RPM it loses any fuel efficiency benefits, like any other small engine.",skoda
Thanks it done around 5k ish miles per service which was yearly,skoda
Couldn’t find anything above the 2019-2021 model,skoda
"Actually there are 4 versions: an 86, 90, 105 and 110 hp. 

I have the 110hp version and I think it’s a very impressive engine for its size. Good fuel economy and plenty of power.",skoda
You know whats even safer than that? Not taking a picture while driving,skoda
"1. Either broken wiring or a broken lock. Maybe a blown fuse.
2. Not sure, sorry.
3. Broken wiring or blown fuse.",skoda
Very,skoda
"I have a 2015 vRS TDI with 6 speed DQ250, just had the gearbox serviced the other day, oil and filter. Intervals are 60,000 km between services.",skoda
Croatia?,skoda
"Yeah, I understood what you meant, I am asking in general because I was informed that my thermostat on my 07 Octavia was opening slightly earlier than it is supposed to and I was wondering if when it goes out and stops working will the check engine light light on the dash",skoda
Will you retain the mod or revert it to OEM? Your insurance provider may refuse indemnity in an unfortunate circumstance.,skoda
"Deary me, this car needs to be lowered. It looks like an apartment building on wheels. A nice apartment building, but still.",skoda
"Make sure there's nothing wrong with the brakes (the protective plate shouldn't be slightly bent) and it touches you when you turn, also check the planetary gears (both)",skoda
Same here. Had service 2 weeks ago and then this popped up.,skoda
"The microphone is located on the same unit, under a grille between the motion sensors and the dome lights.",skoda
Thanks. Get a diffusor on a fabia is possible but you need to change the whole rear end for that and not just the plastic part between the exhaust as in the octavia.,skoda
Also I can’t black out anything here it’s illegal ( in terms of windows),skoda
"what do you think I've been doing the last 2hrs, he just won't crack",skoda
Enjoy it! I got my very first skoda two weeks ago and I love it ❤️,skoda
A DQ 381 failing with 130kkm with only 400NM going through it when we were on a skiing trip tells me a different story...,skoda
"I love it.

Mine is 1.2 TSI.

No issues (so far, at least). So I don't have anything significant to share, tbh.

Especially if we consider the fact that mine one is the older version. Mine (2012) is 2nd generation, yours (2021) is 4th generation. I imagine yours must include some ""new tech"" that is not in mine. No idea.

My only complaint is how small those cupholers are xD So difficult to find a proper mug for them.",skoda
Google is your bestfriend in this case I believe.,skoda
Are you happy with your unit tho?,skoda
What are we seeing?,skoda
It isn’t,skoda
Co to říkáš? / Come again?,skoda
Octavia 3 = best octy,skoda
Left hand drive or right hand drive country? Roads are designed to have a small angle towards the curb so it can flush the water from rain to the curb. I sometimes feel that on newly built roads instead of older ones. I drive a right hand drive car,skoda
Yes because the main fuses (and locks etc) of the big battery a used operated by the 12V system which ya need a battery for when you don't have the big one in operation.,skoda
Looks clean but maybe you can find a newer model like 2020 or 2021 for 17k.,skoda
"I ve been accustomed to sedans, my previous one is corolla. Tbh i dont feel low on my superb, because you can adjust the seat height on mine. I only stand at 5 ft 6in. And the space feels like i am in SUV. (Even better space than fortuner)",skoda
They’re the interior sensors for the alarm system. If I remember correctly they’re even identified as such in the manual.,skoda
"By saying I have a manual (switchblade) car key I meant I have an ignition that I put the key in to start the car. I don’t have a button. I’ll check which name m/ no name batteries I bought. Where I keep my keys doesn’t really make sense seeing as… not able to connect to the car

Thanks",skoda
I follow him on instagram i love that car. If swapping would be easier here in germany i would also do it on my octavia as the parts themselves are basically plug and play,skoda
Wtf is wrong with skoda. People always get confused looking at my octavia and think of it as a Slavia 🤢,skoda
Yes i cant wait !!,skoda
"Been seeing a lot more crashes this year. Used to be one prr year, now it's monthly. 2019 Octavia",skoda
"True that! I did not bother about that.  But it's true, I did not think about fuel consumption when buying.  
I only saw a nice car -> ""It's a family car... But fast! -> would Clarkson say"" ;)  
So what if it is more expensive.... It's not a problem for our budget ... I think.",skoda
Where can I find news on the changes on the facelift model. Thanks,skoda
"Doesn’t seem to want reset, I wonder if when it’s switching off and on it’s counting me holding the button as 2 different presses",skoda
"My missus has a 18plate Tucson, and I prefer driving that. Just feels better put together",skoda
"I always got great performance and comfort from the Goodyear Eagle F1 Async series - think they are on to version 6 now...

If they do them in the size you need, they are a good buy IMHO.

I",skoda
"Verstehe, danke erst mal. Wie ich gelesen habe, besitzt das MIB 2 diese Funktion der BT Car Play Connection nicht. Die 2.5 jedoch schon. Ich müsste also das komplette Infotainment aufrüsten. Hast du dazu eine Meinung, Erfahrung?",skoda
But why? You could use Android Auto no?,skoda
"I personally drive 17 inch alloy wheels with a vRS suspension set in an Octavia 2.0 TDI, like a rollercoaster 🎢 at high speeds but gentle enough on rough streets.",skoda
and I'm looking at a 22k euro superb 280cp from 2015 😅,skoda
"Sounds that you've made a good deal, prices went through the roof since 2021 -_- 


The TDI Im looking at had pump and belt done as well, haldex and box about 20k ago. 


Petrols are chain driven but that kind of chain that you need to replace too 


Both cars are ages away hah, I'll have a think :) I'm leaning towards diesel because of mpg, reliability and longevity. I wasn't really after 4x4 but I guess other than haldex and slightly lower economy it goes into pros rather than cons ",skoda
"In my *Fabia Combi* I use something [like this](https://www.transvidia.hu/webaruhaz/muhelyfelszereles/spaniferek-gurtnik/10295/gumipok-10mm-100cm-05212832). I don't know the English name for it. Hungarians call it ""gumi-pók"" (""rubber spider""). What I have is similar to the picture; my Grandpa bought it in Czechoslovakia /you can guess the age of it by that/. 2 hooks can easily fit into one eyelet in the trunk's four corners, forming an ""X"", so one can pack bags securely under that.",skoda
Really disliking the Modern Solid design.,skoda
I knew it!,skoda
Could you check from infotainment what [level of sensitivity](https://imgur.com/a/piXXJh6) is set to yours? Early maybe?,skoda
"every skoda dealership should be able to order this part, but it will be pricey for all 4 of them",skoda
2 years ago I bought a 75k km Superb 2018 L&K with the same engine in Czechia at the exact same price. Is it a bad deal? No. Is it a good deal? Also no. It's a deal at a market price imho. Depends on the overall state of the car and how it's been looked after.,skoda
"Start stop might be off, bc the batterie is to low. Maybe the previous owner only drove short distances. Just drive a bit longer, let the batterie get loaded and it will work. At least that is what happened to me. I bought an Octi RS 3 with same mileage. To be honest, after driving it for 2 years, i programmed it out. Its useless and you fuck your engine and your gearbox, bc 1. the motor has to shut down and start over and over again and 2. if you dont want it to be shut down, you cant get in neutral while holding on a redline e.g. this is fucking your gearbox.",skoda
Archive.org and you go back to 2014 skoda's website.,skoda
Stage 1 usually requires just more regular plug changes and nothing else.,skoda
"The question is why you have a hybrid when you only charge 1 time per week, at a public charging station, with probably a high price per kW. Then drive around 6 days with a big xxx kg battery. You should go petrol (with your mileage) until you get availability to charge every day.",skoda
"I know exactly what you mean about availability and costs. 

I don’t know if a 4x4 version of the RS was released in Australia. It’s a car with a lot of configurations and variations. If they do exist in Australia, I have never seen one. 

I also know about the redriven video you speak of as that one of the videos I watched as well! I’m also based in Australia but not TAS. 

My used RS had 89k kms on it when purchased. 
My only piece of advice is do you research. I probably went a bit OTT with the research, and the redriven video didn’t help lol but they like to list EVERYTHING that could or might go wrong with any car they review. 
Yes there are reports of parts failing (water pump, thermostat housing, wheel bearing) but there are also just as many happy customers that have had their vehicle for over 150k kms with nothing to go wrong. 

yes it’s a good idea to set some money aside just in case, I did the same but not 10k worth. 
I’ve purchased new front tyres because the ones that came on the car were cheap and had a lot of road noise. 
I also had a slow leak in the upper timing case fixed ( cost a bit under $1500). 
And I had a rattle in the door fixed by an independent Skoda specialist. 
All of those were known issues when purchasing and also helped my case when it came time to discuss the final purchase price with the seller. 

I also purchased a OBD11 which will cost you about $100 or so, maybe a bit more. That will allow you to diagnose things yourself without having a mechanic charge you crazy amounts of money just to scan your car. 
I also have some money set aside just in case something catastrophic goes wrong, and aim to keep costs down by doing some work myself. 

From what I found, if you’re willing to do your research on the kind of car you’re purchasing you’re going to save yourself a lot headaches and heartaches. 
There is also a wealth of information on YouTube and the Briskoda owners forum which has helped me diagnose and fix the sunroof draining issue already (known issue when purchasing). 
Doing your research about these known issues will help your future headaches. 

I checked out 3 or 4 RS’s in person and I was serious about all of them. Once I checked it out in person I arranged a pre purchase inspection. Some of them came back rather questionable, which was also news to the owner! 
Sometimes owners can be oblivious to issues that are under the bonnet of the car - sometimes major sometimes minor. 

If you’re buying new, you won’t have to worry too much about the above comment as it’s under warranty - and Skoda Aus have a deal for 7 year warranty at the moment I think - unless that’s just my local Skoda dealer. 
If purchasing used, it’s cost effective to purchase a used car service pack, which won’t cover you for warranty claims if parts fail but it spreads out your servicing costs for your major and minor services. 

Owning a car like this requires a different mindset to the one we have culturally here is AUS. Aussies have been born and raised on fords, holdens, Toyotas, Hondas and Mazdas. 
Assies think a car should just go without thinking about care and maintenance. No fuss, no hassles, no bullshit. 
Car ownership is no longer like that (I believe, anyway). 
Things can go wrong at any moment with any brand of car. 

Owning a VAG product requires you to ‘enter into a relationship’ with a car like a Skoda (as my pre purchase inspection mechanic put it). 
Cars take time, attention and care. 
If you look after it, it will look after you. 


There’s lots I could say but don’t want to ramble on too much. 
I’m also on mobile so my responses aren’t  that great at the moment. 

If, after all this research and thought, you’re still keen on owning an Octavia RS then I highly encourage you to join the club. It’s a fantastic car to drive.",skoda
"850km sounds normal, so the fuel gauge is off by software. Look into how to reset this.",skoda
"Have you tried different music app? If you don’t have subscription, just try Podcasts. Download several music podcasts and switch between them, see what happens. Also, 2021 Octavia had a shitty multimedia software. Current version is 1941 and is quite good. I’d say go to a skoda service and have the multimedia updated. Also online communication unit, otherwise you won’t get online updates for multimedia after 1941.",skoda
The clicking noise is made by the solenoid as it is not getting enough power. It’s normal.,skoda
"Știu, nu mă sperii, sunt doar indignat de minciună și de povestea inventată de vânzător să justifice accelerația brutală.
Eu mă bucur de mașină și am zis să împărtășesc experiența cu comunitatea.",skoda
"The car should be fine, enjoy it. If you change the oil, make sure you do all of it and don't just top up with a different oil. It's up to you whether you inform your insurance of the modification.",skoda
This is not a Skoda function. Do you use Google Maps or Waze?,skoda
You guys should check your infotainment SW version. I assume Bolero/Columbus device in Style trim? They've fixed a lot of issues with SW ver. 1941.,skoda
"I think you can use one of those services which repair shops use to get repair data. I belive some have a small fee which allows for unlimited use for a day. 

But I don't think you would need them. In theory the only affected segments of wire are those in the picture because they flex every time the door is opened or closed. The rest should still be good because those don't see much movement.",skoda
"yes its the diesel

could it be normal for diesel cars to have it this low? Im used to a different car thats petrol which had its limit at around 6k rpm",skoda
Mersi mult.,skoda
Best bet is a junkyard. You'll easily find clean examples,skoda
Scala?,skoda
Press and hold the power button for 10-15 seconds to do a full reboot.,skoda
"DOP Motorsport is one of the best stage 1 options you could get in Romania fellow romanian !

If in doubt regarding oil/maintenance, just hit them up with a dm/call/mail whatever, explain the situation and I’m sure you’ll get the best advices. 

Have fun with the car, looks awesome !",skoda
"Check breakers and scrap yards around your way. It'll take 20 minutes to call them all up.
""How you doing mate, looking to see if you have any Mk3 octavias in? You do? Sweet. Is there a parcel shelf in any of them? How much?"" 

It might just need a bit of a clean.
Equally, the B7 passat probably has the same parcel shelf, but I can't say with any certainty that it does, but the photo you posted looks very similar to my B6 Passat parcel shelf, so, I'd hedge my bets",skoda
It's from a private owner. I enjoy driving and don't abuse my cars. My previous car was a octavia 3 rs tdi and didn't have any issues with it.,skoda
"it is possible to do this through the battery management screen on the infotainment no problem - however keep in mind that overnight (depending on weather conditions) the battery will 'leak' charge so it won't last the full 60km if you only intend to charge it once a week.

Having said that, on longer drives, even without charging the efficiency is pretty good. On a long drive I average 5 - 5.5 l/100km (motorway driving) with around  8 l/100km in city driving. But yes, if you charge the battery while driving - there's no point, as it almost doubles fuel consumption.

I bought mine second hand and given the relatively minimal price difference bewtween the solely petrol version and the PHEV version it was absolutely worth it in my opinion.",skoda
"Thanks. 

They all seem to be £160 or so and hoping to see if I can pick one up a bit cheaper. Thanks.",skoda
"Thanks. Got a rough price idea on timing belt change, if it's loads I'd need to look for one that's had it done as they'll likely all be over 6yrs for me?

Do they have heated windscreens or parking sensors? I'm getting mixed results looking online so guessing they may be optional extras.",skoda
Diesel and gasoline cars nowadays have nearly the same consumption. 90% of the time I would choose gasoline since diesels have gotten quite complex with emissions equipment. Some countries (like Finland where I'm from) diesel is about the same price as gasoline and annual roadtax is much higher.,skoda
"Thanks for everyone’s valuable input, I decided on the Superb, just paid the deposit, pumped to join the club! Took a 2023 model for additional discount.

https://preview.redd.it/1itehxj7j5oc1.jpeg?width=4032&format=pjpg&auto=webp&s=d4141dc29d7fcdc0c03f0df3e74cc7c0c9ab72b8",skoda
RSes are fine with 95 thankfully! :),skoda
"It usually autobrakes when parking in reverse a bit too quickly in tight spaces. Considering parking spaces around me usually barely fit my Superb, it happens a couple times a month. :)

If you don't suck at parking, it would almost never happen with a Scala-sized car",skoda
"I had same issue with octavia 1,6mpi.. check if you are not losing cooling water. I had it from bad quality of oil, after i changed oil it disapear. But i had completly different engine..",skoda
A defective key makes you think the car is not reliable?,skoda
Be sure to keep it parked on driveway or garage to prevent vandalism or keyers. Happened to me with the same car and I am also from Belgium. Lotta jealous fucks out there.,skoda
We don’t have a main Skoda /vw here there’s a company that has “official importing” and they import all vag cars . So when you go to Skoda you just choose from their pre-made lineups 😭 but sounds amazing hope you enjoy it,skoda
I'd tick that on the option list,skoda
"I have a pre facelift Octavia 2 with 1.6 MPI and from what I’ve heard the reliability is really good, mine has only 87 (almost88 000) km so I hope it will last (body is 100% rust free rn)",skoda
Bit confused it says E10 then 95RON minimum?,skoda
"Thanks, just means I know to look for them rather than expecting them to be included.

Six years will definitely happen first, do probably 80k in that time max. Just thinking if it's that time period and I'm looking at ones around 6-7 years old it'll need doing now if it hasn't been done already.",skoda
"I wouldn't use the ""rubber spider"" 😊 securing a load onto the roof-rails either. When my Dad was alive and we moved OSB boards [/2,5m x 1,25m/](https://www.obi.at/osb-platten-verlegeplatten/osb-3-verlegeplatte-stumpf-12-mm-x-250-cm-x-125-cm/p/5181128), a fridge and then a disassembled bed, we used strengthened ropes thick as your index finger, on the items (those were towing ropes, without the metal ends). The Hungarian Police didn't give two bits about us. - But then again, one can't compare the *""Rendőrség""* to *die Polizei* in Germany or Austria.

Oh, and I learn a few new German words every day: the ""rubber spider"" is [*die Gepäckspinne*](https://www.obi.at/reise-transport/gepaeckspinne-mit-metallhaken-8-armig-je-8-mm-x-80-cm/p/3180254) 😁",skoda
"Octavia Scout is also an option, very happy with it",skoda
Special entry point for autophiles.,skoda
That's why I like Skoda. The engines they used on their cars were already fitted on VW or Audi models. So when it came the time to pick engines for a specific car they chose the simple and reliable ones which had the least issues from VW/Audi chassis.,skoda
"What's your current mileage ?

Break pads needs to be worn in, depending on the mileage could also be unaligned properly.

Try another garage for advise if you're worried.",skoda
"Of course you could do that but I figured it might get expensive. I mean a power strut is around 400€ and a power latch/lock around 200. Parts replacement for testing is an accepted way of diagnosing problems but that should come as a last resort, when nothing else works. One of the reasons i said the problem could be tricky is because both components are known to fail. Power struts fail at the wiring (you don’t know which one and if you do repairing by soldering is just temporary because wiring is flexing each time you open the tailgate), also inside power strut is a simple but and screw mechanism that could fail due to mechanical wear. The powerlatch is also known to fail at the switches I was talking about earlier.",skoda
Great colour. I have the same on my fabia😆,skoda
"oil needs to be changed at least 1x year or 15000km max, whichever comes first",skoda
"You guys are forgetting that consumption is affected by driving conditions and driving style.  
I have karoq 2.0tdi 4x4 and the consumption is spot on. 
I can easily do 5 - 5.5 l/100km by driving sensibly. And those are official figures from the website. 
Even when driving more agressively its stays at around 6.  With that said, it can also easily drink 8 - 9 l/100km with heavy foot.

Its not always about ""driving slow"". Do you accelerate swiftly ? Do you coast whenever suitable? Do you overtake other cars often? How far and what terrain do  you take? Are your tires properly inflated? Do you drive alone?  You get different consumption when driving in town all day compared to mixed roads or highways...",skoda
"They did...Reddit, to find meaning...",skoda
"I believe whatever you pick as long from this brands, they are premium, aren't they?",skoda
"I did consider it, but only briefly. It's too big for me. 

And to be honest I fell in love with the vRS. 😄",skoda
Wow. So from the multitude of moving parts which could go wrong inside an engine you narrowed it down to the cam bolts from a simple noise complaint? May I ask what is your source?,skoda
Yes I can feel that. Are there counter-indications to using Eco all the time?,skoda
"I've checked the injector wiring yesterday and it looks perfectly fine, I've tried moving it around to see if the symptoms appear, but they didn't.",skoda
"I currently have Continental Sports Contact 5 on my Superb from factory and they have been good too.

I hated the Pirelli Zero my vRS came with - noisy and poor in the wet.",skoda
"Yeah very odd, I’m going to still let the Skoda garage have a look over it since its warranty. I’ll let you know what they say. Luckily I recorded the noise",skoda
In Czech Republic i have paid about £200 for complete change for an original one. But all from my pocket - I have no insurance of the windows.,skoda
Haha when it comes to cars it’s all personal preference but it’s nice to get some ideas into your head,skoda
"Brake disks and pads or drum brakes? Either way you can confirm it’s the rear by gently applying handbrake (careful where and when you do that, have the handbrake button pressed at all times so you can disengage it immediately; maybe an empty parking lot is a good place to do it). Anyway I suggest having the brakes inspected/serviced by a professional.",skoda
"Yes. Did mine change exactly like you 3 weeks ago, and last week I had the steering wheel replaced under warranty.",skoda
"Yeah have checked that, not it, haha. Funny you mentioned it, messed around with 3 of my friends during summer on my vRs wondering why front wipers aren't working for about 40 minutes, checked every fuse possible just to realize ""Dude, it's probably just the bonnet. Close it"" and yup, it was just the bonnet :D.",skoda
"Yes, it is complately normal.

Diesel cars act complately different in rev chart.

For example if your petrol car is able to go with 130km/h in 5th gear 4000revs, diesel do it in 2400revs 5th gear. 

So 4500revs is okay, and you shouldnt drive your car as petrol. Gear changes should happen in lower rpm-s under 2500rpm max.",skoda
Make chromes black. Either by changing the parts or wrapping over them.,skoda
"We used a Maxi Cosi 360 Pearl. Plenty of space and you can reuse the base when the kid grows out of the seat.
It is a bit pricy though.

Also, as mentioned, they have to sit backwards the first 18 months or so.",skoda
"Thanks. Out of interest when you say planetary gears, where abouts are these located? 😅 I’ve only heard of planetary gears in a gearbox.",skoda
"It's probably a loose connection on something if it's only on small loads. The smaller the load the smaller the current which is triggering the injectors. If one of those connections is loose it could fail to receive a signal when to the load is too small.

Check for loose connectors, corrosion in connectors or rodent damage.",skoda
"My friend, you got this fantastic thing called the internet where you can just type in stuff and have access to so much knowledge at your fingertips.   
Apparently this thing called youtube is fantastic.",skoda
