Comments,Make
"Could **also** be from the closing latch. There are 2 sensors there that reports the tailgate is either open or closed. One of them could be an a$$hole and not confirm the above. If that’s the case the tailgate will stop moving. Also the struts could be faulty, the wiring could fail and one of the struts travel sensors could report a faulty value. Also this will stop the tailgate. 
You need a tester to verify the faults in the address 6D (tailgate electronics). If you find faults regarding power struts position sensors, well, you know what to do. If you don’t find such a fault, you have to see tailgate lock measured values in the same address. If the values don’t match, the closing latch/lock is at fault.",skoda
"Do you have short drives? Then it's normal, but I'd recommend yearly oil changes.",skoda
"Do you mind telling me if you leave in a mounty area or not? I would mainly use it to move around in central europe and south europe, so i’d be crossing alps too",skoda
"Wasnt that annoying, having this thing laying around in your car? I was thinking of getting some device like that but i think it would be annoying..",skoda
"cheers, i was more curious as to why it's not working",skoda
"I am thinking about swapping the wheels with 17 inches or 18 inches. Even if the 18-inch wheels look better, the 17-inch ones provide more comfort and paired with the stiff suspension would look nice.

The ex owner had multiple sport cars, the last one was a Golf 6r with over 300hp, and he said that the Škoda is very good for him.

Thanks.",skoda
"Got the same spec but have only owned it for a few years. ~160k miles on the clock and still going strong. Engine is solid, no issues with gearbox. Minor issues with brakes",skoda
Thanks again!,skoda
"Cons: an old car with lots of miles that could have been driven hard.

Pros: if it was driven hard it could have more worn but a cleaner engine. Being an enthusiast trim it could be well maintained.

Italian tune-ups FTW!",skoda
Using ac shouldnt make much of a difference in modern cars if at all as far as I know,skoda
"With 14km daily a Diesel is a bad idea. I had one (VW Polo, different engine) and it didn't end well because of the EGR. Cost me a few thousand €.

Personally, I recently went for a 2021 PHEV Octavia Combi with a very similar daily commute (17 km). But it's not available for the facelift, at least not now.

Matrix lights work great for me.",skoda
"Where does it go, though? Isn't that still quite a chunky bit of kit that needs plugged in?
Do you have to unplug it when the cars sit for a time in case it drains the battery?
Pros/cons?",skoda
"Where in the world they do that?
For my Karoq it says I have a fuel consumption of 4.4-4.6 and I haven’t been able to go below 5.5 even if I drive slowly.",skoda
"My manual disappeared a long time ago, and I'm too lazy to search for a PDF one (if there is a one)",skoda
 Cheers! I will tale a look. I’ve not heard of this brand so thanks for expanding my search!,skoda
Got one today too after ±10000km,skoda
"Yeah, I completely understand. Almost removed the MK4 from my list if it weren’t for the reports of them getting better due to software and some hardware changes right before the facelift. Hoping that 5 years in, things have gotten a bit better.",skoda
It's a gem indeed 🙂,skoda
You shoud have save yourself instead saying your passenger took it :),skoda
Thank you! Great suggestion.,skoda
"The mk4 octavia really isn't that low man.


It'll be a bit shit on the pot holes though. ",skoda
"Wanting to replace your car due to ploblems with just the wear items feels kinda... Unconventional.

So basically you feel a stretch with your budget, so its better for you to sell your current car, buy a cheaper one, and keep ""the margin"" for maintenance, right?",skoda
Thanks mate ✌️,skoda
Came here to say this 😅,skoda
"Pretty much, yes. I’m a student so money is a bit tight always. My car has had problems nearly the whole time since purchase and as the mileage climbs to 250,000, I don’t see it improving. I want to try something new, even if it means going back 10 years haga",skoda
Well… get used to it.,skoda
Correct this is in Desaru :),skoda
Ah thank you!!!!,skoda
"It'll only improve your MPG if you keep driving in the same manner as before chipping the engine.
If you're planning on driving more aggressively than before, your MPG will go down.",skoda
"€ 0,50",skoda
"800k-900k km ?

Damn.",skoda
Is too expensive for the kilometers,skoda
"Because there is no traffic, lane assist and taking photo takes 1 second, since you activate camera with double click... that action is actually safer than changing main screen view, that require taking eyes of the road and click 5 times at least 3 times to display accurately",skoda
Qual é o motor? 1.5 tsi com motor eléctrico? Quantos CV? Adere ao r/SkodaPortugal :),skoda
But the car identifies as a vw😀,skoda
"Cool, we got it. It's tuned. Do you want to keep going or do you think you have expressed your feelings enough?",skoda
"I had this exact noise on my Fabia after driving through lots of deep water, also when turning right

I parked up and jerked the steering wheel left and right, full lock right, full lock left, another wiggle. Sorted! Noise hasn't come back since and it's been months

Not sure what was wrong but I assume I picked up some dirt or stones or something",skoda
"Completely forgot to mention that there’s no 98oct where I’m going, so that doesn’t help.",skoda
MK4,skoda
"It's not that, I just found that even though I replaced the battery in the main key, the message persisted. Only when I changed the battery in the spare did the warning stop. Also, try the CR2032  instead of the CR 2025.",skoda
My 1.5 tsi mhev was last changed oil with 5w30 Mobil 1. They don't use 0w20 here. Main dealer said that VW sent a bulletin for these engines to use thicker oil. I don't see any changes to the start stop system or mileage or anything,skoda
"Whatever you get,  make sure to transfer the tpm""s to each wheel or you'll get a warning light...oh yea, and wolfrace is my goto choice",skoda
What equipment do you need in the car for the sign recognition? Is it the same as for active cruise control?,skoda
Go for an OEM one for the best result (if your mechanic can order one),skoda
"I have 2 small kids and we pack a lot of stuff. The boot is big(>500 liters) but the Octavia has 600+ and it’s longer than higher. In the Karoq the boot is taller and imo it’s worse than the Octavia. If you pack a lot of stuff, the Octavia has practically an infinite boot 😂",skoda
"I literally didn't know the word ""Pillar"" even in my native language",skoda
"bought the car second hand in mid 2020, and haven't changed the battery since. I charge the battery regularly because my daily commute is only around 5 mins each way. I'll keep a multimeter in the car and keep track of its voltage.",skoda
"https://www.donedeal.ie/cars-for-sale/skoda-octavia-vrs-mk1/36455814. That’s the car on DoneDeal. Seller description is a bit odd and for all I know could be sold. I’m fed up of my MK7 golf had to get clutch replace and it still doesn’t feel good, needs new tires, brake pads, service in coming months and I’d rather move it on and try something different for a while",skoda
Is it my idea or does it look similar to an opel mokka?,skoda
"If it gets stuck open the car will have a hard time getting to operating temp, if it's stuck closed it will overheat",skoda
Kopacek brotha…. Don’t buy these cheap ones from AliExpress 😎,skoda
"Yep.

Locally, I cannot buy things from Ali. RCD330 was on my list but the import and shipping were not making any sense.

What was available locally (Chinese made) works well enough.

[https://hiwoodman.com/product/woodman-xtreme-4-0-360-view-system-qled-4g-slot-octa-core-4gb-32gb/](https://hiwoodman.com/product/woodman-xtreme-4-0-360-view-system-qled-4g-slot-octa-core-4gb-32gb/)

Not the exact model but close enough. They sent a unit with 360 cameras, plus a replacement facia for the new headunit.

It runs on Android but I just tap the Carplay app and not use any of the Android OS features. Android Auto also works if you have an Android phone.",skoda
"Also look at specifications too, mines a se-L which has a lot of the things I look for xenon’s, heated seats, acc, 8 in touch display with car play. Laurin and Klement is top spec but these normally hold a premium.",skoda
This was also the first thing in my head with the camshaft screws,skoda
No mark boy ! You spunk stain,skoda
You should scan it with obd scanner or have a mechanic do it. To me it sounds like it’s either the wiper motor that has given up or the worst possible scenario would be if your center module (I think that’s the name in English) has malfunctioned. Idk how you’ve checked the lever if it was faulty or not but if nothing comes up on the diagnostic tests it would be the lever that needs replacing (that’s best case scenario),skoda
Do you by any chance know if the Octavia i bought creeps forward when lifting foot off the break?,skoda
"I'm not familiar with the diagnostics tools on the VAG group, VCDS is mandatory right? (and expensive 😅)",skoda
If there are no broken copper strands then just put electrical tape over it. If there are cut strands you can cut the affected piece of wire and solder a new one in place. The new piece should be atleast as thick as the factory one. A wire too thin can start a fire.,skoda
"Celsius, but miles 🤔
Also, is that temp sensor ok? Seems like it could be shorting to ground.",skoda
I’ll try it! Thanks,skoda
"I use mine for work carrying collapsible ladders and various tools.
Probably not to the weight of your gear.

But it drives like it's empty, and I absolutely love it.

Try and get a couple of years warranty too as I've had a fair bit of work done under warranty including replacing the Medtronic. 

I have the 2l diesel version.


Oh I do long journeys and often get 55+mpg too",skoda
"congrats!

PErsonally if I lived there.. I'd have gone for a more obvious colour.  But tastes differ",skoda
"Scala already has DCC (basic version), it’s simpler than Octavia/Superb/Kodiaq. Just some valves that are on/off basically making the shocks stiffer or softer. When stiffer, booooy that’s nice 😁😁😁",skoda
A lot of dead bugs by the look of it.,skoda
Yeah it's water in the oil probably from condensation. 2 years is too long especially for the turbo and chain.,skoda
"Its fun actually and very satisfying. Ive done it on klima control, bolero stereo. Next is mirror controls and the buttons for heated seats.",skoda
"Taking it to a garage on Friday, the place that fitted the battery said they will pay for whatever it needs doing, so I’m hoping it’ll all be sorted soon!",skoda
"Yes, I guess, I understood 😂",skoda
If it predicts that you’re not reacting it will intervene. It does work with the manual transmission,skoda
and this is coming from a Skoda fan.,skoda
How do I check the battery?,skoda
"Try to ask in a specialised shop. Ideally, bring your car to them and try the options. The shop I consulted was adamant that no car is too small.",skoda
"IDK my B&W AliExpress emblems are still attached after cold winter and muuultiple washes, so IDK why not.",skoda
That trick with a wheel can heal a lot of problems in Skoda,skoda
"For the MK3 FL Octavia hatch, none.

I've got a 2020 MK3 FL hatch. It came without a spare wheel. There was a massive moulded foam tray under the boot floor, which sits in the spare wheel well. It contains the tyre sealant equipment and towing eye.

I managed to get a spare wheel and the toolkit from another Octavia  and it takes up exactly the same amount of space under the boot floor. The difference is that where the moulded tray sat there is now a spare wheel and toolset.",skoda
😂 yeah it's a very rare model,skoda
Yes. I mainly use the car for a 40km trip 3-4 times a week. Got no start stop,skoda
"Superb has better soundproofing and better/more comfortable suspension setup. Octavia is a comfortable cruiser but it can't quite measure up to Superb standards. If the price is similar i wouldn't hesitate, superb all the way.

PS i hate leather seats but only because i live in Greece and leather seats get so heated under the sun. I don't know if its a problem in your country tho.",skoda
RS require 98 or is 95 good enough?,skoda
"Probably a mod done through VCDS or OBD11, possibly Carista/carly although no experience with those two.",skoda
"Thanks, I will try to find one. With that, you can see what the Infotainment is doing?",skoda
One stupid little thing to check is if the bonnet is either properly closed or if the sensor works. The wipers will not work if the car thinks it's open.,skoda
А почему номера красные?,skoda
"I didn’t know that the seals come with the calipers, thanks for the tip!",skoda
Kumoh ectsa ps71,skoda
"I've been digging online for info, but couldn't find anything on how to reset the gauges. Mind you, my Scala doesn't have virtual cockpit.

So nothing needs to get replaced? What should I do now?",skoda
"Nice, thanks for the reassurance.",skoda
Are you serious?,skoda
"It's a small service which includes oil and filter.
Inspection of fluid levels, brakes, paint, windscreen, wheels etc...
They will also update software on engine, gearbox and infotainment if available.

They want you to drop by their workshop and leave some cash.
If not, warranty will be void most likely.

You could give them a call and ask what's included and price.",skoda
1.5 TSI DSG Scala \~ 5.5 on highway,skoda
it's also a known issue on Octavia and Superb,skoda
The 17 inch wheels would be cheaper and would provide a comfier ride. Thanks.,skoda
"2.0 TDI 🫵🏻🔥

In a country with hard speed controls, and harsh limitations, it’s completely idiotic to pay for things, you can’t actively use.",skoda
"I have never had a modern car, this is my first tech car. But yes, the infotainment system is impeccable I would say. Pretty fast, everything I need, wireless Car Play/Android Auto (I expected to use the cable). Everything is perfect.",skoda
"fair enough, it'll just work until it doesn't. 
I installed a new head unit yesterday and it struggled to start this morning, gave it a charge and now it starts as normal. 
Iets push it till it gives up😆",skoda
https://preview.redd.it/q45sp5rib5qc1.jpeg?width=2400&format=pjpg&auto=webp&s=596fc5c0c740bdf374a1df330f0c9a749369d6d5,skoda
"1.6 MPI with 145.000 km. 

No engine issues until now. Had some sensors replaced in (almost) 14 years and regular oil changes.",skoda
"I have the 2l turbo diesel octavia, in regular drive mode it automatically activates eco for coasting so i cant speak on manually activating it

But i feel like theres more difference in using the speed limiter 

Without it i use about 6l diesel for 100kms but with speed limiter mostly on its more in the range of 4.4 or almost 4.0 on the Autobahn

With Sport mode active and a bit of fast sporty driving i get around 6-7L",skoda
"Get a magnetic one, simple and effective.
You can even buy ypur own magnets, stick some 3m on them and put them wherever you want.

As for the phone, metal back plate will do the trick.
You can find these items in a set, or separate.

Set ones tent to have shit magnets, I have [this](https://www.emag.ro/suport-auto-pentru-telefon-yesido-mini-silver-magnetic-bvr-5/pd/DWDPNYMBM/?utm_campaign=share_product&utm_source=mobile_dynamic_share&utm_medium=android)

Its strong enaugh for my phone to not jump from potholes or when agresively flooring it.

I have a Moto edge 40, which is not small by any metric, before I had the Moto edge 20 which is ridiculously larger than the 40, and it was still holding nicely.",skoda
Sometimes start/stop errors on MQB cars appear out of nowhere and dissappear the next day. I've had these multiple times on Octavia A7. The battery was stock and functioned perfectly fine.,skoda
"nah thats the normal noise, it happened once when i was with a friend, and what a good day to hit legs LOL",skoda
"Not after Cupra due to the reasons listed the first time you asked. 

I’m not arguing for the SUV, I’m specifying the reason as to why I’m even considering one, per my comment above. 

I’m not enjoying asking questions, I’m looking for feedback from people who actually have experience with either models, ideally in similar circumstances - you know, hence why I asked in this subreddit.",skoda
Beautiful car! Efficient? 5l 100km?,skoda
DSG service is every 60K Kms and timing belt at 1.2Lakh KMs.,skoda
No coconut trees in Croatia. This is somewhere tropical. Desaru is in Malaysia :),skoda
"Do you know the reason for this??
Why has it happened",skoda
"What specs is your Golf, by the way?",skoda
"My neighbor's passat b6 has double the kilometers and 1% of the chips, so there must be some difference in paint thickness or hardness",skoda
A car,skoda
I have $3,skoda
"Well. 2 hours of engine on just to drive 14km will give a big fuel consumption, like 15L/100km.

If the tank has fuel but the car says it's empty then probably the fuel level sensor in the tank is faulty.

I say that the service you took your car to test drove it till the emptied the tank. The wrong data shown in the fuel consumption tabs is a result of disconnecting the car's battery (a common procedure during repair). Disconnection of the battery wipes the memory on the distance travel, fuel consumption tabs etc.

Go refuel and see if the fuel level changes.",skoda
"Unfiltered air may pass the filter without the lid.

The engine would be sucking hot air from the engine bay instead of cool air from outside and slightly reduce horsepower.

Other than that, the induction noises are sweet.",skoda
Why ? Too flimsy ?,skoda
It couldn’t have gone out of line by hitting potholes or kerbs. Had to be something done incorrectly.,skoda
Where are prices for RS already known?,skoda
A Skoda,skoda
The A with the crossed out circle means start stop is on but not in effect. When it stops the engine the circle goes away.,skoda
Mhm I like both,skoda
"**P0171**:

Mass air flow sensor (G70) defective

Intake system leaking

Possible solutions

Check mass air flow sensor (G70)

Check fuel pressure control

Check fuel pump

Check injection valves

Check intake tract for leaks

Check exhaust system for leaks

Check secondary air system for leaks

Check vacuum hoses for leaks

The OBD error code **P1292** on VW, Audi, Seat and Skoda models means that there is a problem with the engine coolant thermostat, more specifically an open circuit. This indicates a fault in the electrical connection or a defective thermostat.

The OBD error code **P1290** indicates that the engine coolant temperature sensor (ECT) in VW, Audi, Seat or Skoda vehicles is sending an unusually high input value to the engine control unit (ECM). This may indicate a problem with the sensor, the wiring or an overheated cooling system.

Possible causes of OBD error **P1290** in VW, Audi, Seat & Skoda

* Defective engine coolant temperature sensor (ECT)
* Short circuit or interruption in the wiring of the ECT sensor
* Incorrect connection of the ECT sensor to the engine control unit (ECM)
* Defective engine control unit (ECM)
* Coolant level too low or cooling system leaking
* Malfunction of the thermostat
* Blockage in the cooling system
* Electrical fault or interference in the OBD system

If you have a fault in the electrical system, for example dilapidated cables or oxidised connections, then replacing components is of little or no use.",skoda
"Cheers, unfortunately Skoda don’t offer diesel models here. I’m based in the UAE",skoda
Holy inflatables batman! those are some high pressures ,skoda
"stock system is designed the way it is, you should leave it like that. i.e stock cars should stay like that, until you want to gain some power then you do modifications.",skoda
"410cm long but room for 5 and 410 litres luggage? 

I find that really unlikely!",skoda
"Hol' Dir wieder einen VW-Bus.

Ganz ehrlich.",skoda
I have 2012 superb and having same issues.... Will chevk that a pillar,skoda
That some vandal/thug scratches I mean. Don't polish it too hard. It attracts vandals. Speaking from experience.,skoda
"I'm also getting bad sound quality. To me it sounds like bass is coming through the tweeters instead of or as well as subwoofer which isn't really working but I don't really know anything.

It's pretty sad as it's almost unbearable on some songs and sometimes I don't notice at all.

For me I'm listening through Spotify from carplay.",skoda
That’s brilliant,skoda
I've got [Wolfrace](https://www.wolfrace.com/) on my Octavia RS. Had them on for about a year and they've been no issue at all.,skoda
Thanks for the advice. I agree with all of it :) It is very annoying to connect the phone via cable each time to use navigation via apple car. That’s why I need a phone holder.,skoda
"You can find the manual here: https://digital-manual.skoda-auto.com/w/en_GB/show/db9d0dfaf39abe43ac1445257d17f499_1_en_GB?ct=db9d0dfaf39abe43ac1445257d17f499_1_en_GB
  
I take it your phone won't connect to it at all? ",skoda
It should be green because it's a Škoda.,skoda
Nah i didnt think it would be worth much but my dad was adamant that it was rare or some shit,skoda
"Sportline doesn't have almost any extras that matter, mostly visuals.
Vision, vision+ is where its at.",skoda
"I strongly suggest you do not start the car again. Some bolts in the camshaft adjuster detached and are rubbing against the timing belt cover. This situation must be confirmed by taking out the cover. Take the car on a platform to a dealership, the adjuster must be replaced entirely.",skoda
"Had the same issue with my octavia. The knocking was coming from the dsg gear box, and probably it's a 50k worth replacement at the dealership",skoda
no buy the 1.5 tsi even if youi have to put little less extras on it. on the octavia it is fast enough with full suitcases and 4 people. imagine a much less heavy car with this engine,skoda
"Nice man, love that colour too",skoda
That’s too expensive for 100k kms. And it’s also 2019. You can find the same with 60-80k from 2020 at least.,skoda
The perfect car for a family! 👨🏻‍👩🏻‍👧🏻‍👦🏻 + 🐕 = 💚,skoda
It’s for hiding your last Rolo,skoda
"A ked aj mas, tak spoluucast, nie? 😅",skoda
Congrats. Looks great,skoda
DQ381 oil change at 120k. At least that's what Skoda service told me.,skoda
Maybe they forgot to reconnect a sensor or something.,skoda
I have the same problem with Waze on my new Karoq. Same with the last Karoq too. Annoys the hell out of me! Gone back to google maps.,skoda
"Often it’s just a faulty crankshaft position sensor. It doesn’t detect the flywheel turning. 

After that the fuel system.",skoda
"I ordered this on Genuary 22th, there already was this model ahah  
I went to the Skoda center nearby and the man built the car together with me and we ordered it once it was how I wanted",skoda
It's a drain hole. Stops spilt fuel and water running down your side panel.  That little centre piece can be taken out and cleaned,skoda
Unless you're absolutely terrible at parking you can do without the 360 cam,skoda
"In einem anderen Post wurde AAWireless empfohlen. Geht aber über WLAN, nicht BT: https://stadt-bremerhaven.de/aawireless-2023-im-test-kleiner-helfer-fuer-kabelloses-android-auto/


Ich hab da auch schon ein Auge drauf geworfen und warte jetzt drauf, dass mich das Anstöpseln zu sehr nervt :-D",skoda
"I am familiar with chip tuning, had stage on a previous car and didn't have any engine problems. I think with 100 octane gasoline it should do 310HP. For now I am happy with it and will enjoy the driving experience.

I just wanted to take some precautions.",skoda
"For those who dont have these cars in their country (I dont either):

Slavia on the left (scala's sedan variant but on a polo platform instead of golf)  
Kushaq on the right which is essentially a VW T-Cross+(Fabia but as an suv). It would sell pretty good in EU as kamiq's more affordable lil bro just like what t-cross is alongside t-roc if. But they dont sell it in the EU.

Slavia is sold in some other countries other than India but Kushaq is and India-only model.",skoda
"Naah, just order it without AC - it saves a few kilograms of weight, less friction from the bell and the bearings and less electronics that uses electricity and loads the alternator. And all that makes for better fuel efficiency!

I sometimes even ask my wife to get out of the car and push it just to save fuel. It also keeps her in good shape! Downside is that she is getting stronger and now she is slowly becoming ""the men"" in the house.",skoda
"I got mine here: https://www.kopacek.com/skoda/octavia-iii/octavia-iii-original-skoda-emblem-int-version

They have a lot og good fitting parts.",skoda
"Despite some negative reviews, there are also positive reviews. Still you will be the judge. Just visit them and book a test drive. It is free anyway and gather info as much. Ive visited them just to ask qoute for parts. So far so good.",skoda
"Yeah. I already drove the car with front wheels lifted up but there was no extra noises from the gearbox. Just engine noise. I have booked an appointment but it will be in two weeks so I have to wait till then.

I just wonder why so POV videos with the 1.6 TDI Octavia seem have the same whine. For example this at 2.45. It's the exact same whine and at the exact same revs/speed. I'm just thinking it's the characteristics of this 5-speed gearbox:

[https://www.youtube.com/watch?v=eOz8RngUF6E&t=156s](https://www.youtube.com/watch?v=eOz8RngUF6E&t=156s)",skoda
