Comments,Make
"Don't confuse hybrid with plug in hybrid. 

A lot of the hybrid tech is mild, and doesn't need you to charge the car.",seat
"If you're lucky and it cranks it *might* be salvageable. If not, that's good night Irene, engine's kaput. Red oil light, especially on a diesel is bad news, either low pressure or running dry. Worst case scenario, new engine and turbo. Best case scenario, rebuild engine and recondition turbo.

Sticky throttle is unrelated, probably something wrong at the pedal

For future reference, check oil level, orange dipstick under the bonnet, every so often when the car is cold.",seat
I got mine delivered couple days ago and it got ISA. Very annoying but well what can we do about it... need to turn it off again for every new ride. Riding the speed limit is the new way i guess.,seat
"I found a very useful article at the 4th Duckduckgo page: https://www.waveform.com/pages/cell-phone-signal-booster-guide#guide-how-boosters-work This device seem to operate from out to in, so I assume the automotive version also does the amplification from whatever cell tower is nearby and not mirroring any phone signal to the outside as I had previously assumed

Edit 1: Most of the bullshit I found was of this nature: https://www.weboost.com/boosters/vehicle Many many pages of just commercial product ads",seat
"Equalizer settings are subjective to the listener, just put some music on & play around with it",seat
"You can buy a plug and play box that connects to the back of the existing MIB1 unit. 

https://www.makcoding.co.uk/product/seat-mib1-carplay-box/",seat
I’ll be in hybrid mode att in this case. If it consumes more or less 45 mpg like the 1.6 tdi I’ve got rn that’s fine for me.,seat
"Thermostat should not fail closed, but everything is possible. Get it checked by reputable shop that knows VWs. It's 16 years old car so things can and for sure will fail at some point. Your car luckily does not have silica bag in the reservoir to cause harm.

Do not continue driving if the cooling system is not able to hold pressure. That will cause the engine to overheat and it can make the engine go kaput",seat
ok... then i dont know what could be the prob... I would check the basic stuff like update spotify/carplay/android auto an your phone or use another cable 😅,seat
It’s sister to you 😉,seat
How did you put the mics in the intake?,seat
Petrol,seat
"Damn £15k? 
I paid £9k for my 2017 model (in early 2022). Mine is the 1.2tsi and I’m assuming this is a 1.0. They’re good cars, mine has been cheap to operate",seat
I mean it’s a Golf but although VW developed a wonderfully engineered car. The Seat Leon is much better looking IMHO,seat
"If you have 2 SD slots its possible to activate... there are plenty of guides on the web on how to activate..

Badically you need to install the mib2 toolbox and apply a patch... then you have to code the unit and maybe you have to change the port (if you are lucky, you dont have to)",seat
"You should have an opf or dpf, depending if it’s gasoline or diesel, try going to some repair shop with a good tester, and ask them to tell you wether it is clogged, that could increase fuel consumption
Also try changing your air filter if that’s old, cause that might also help raising fuel consumption",seat
"In what ways specifically?

About 7 to 8 thousand euros (plus a bit additional left for potential fixes,etc.), but prices are wildly different from country to country, so for that money here in the Balkans I can get the Leon 3, 8P or the Golf 6 from the VAG hatch segment and that's about it. Golf 7 starts at 9k in the worst trims and states or 11+ for a decent one in the same trim/state that a Leon goes for 7-8.

There are other brands like Peugeot and Ford which are cheaper than VW and maybe even Seat, but honestly I don't like them despite that maybe being a more rational choice, I have an old Seat Arosa now which never gave me any trouble, so I'd like to stay with Seat or at least within the group.",seat
Go to any professional auto paint shop and have it colour matched in a can. It’ll be about £20 for a single can matched on the spot.,seat
"Have a look at the build sticker on your car, it should show the build date. That should give you a clue as to which one to download",seat
"If it's the same as the Cupra Formentor PHEV then depends the speed, over 90 km/h the ICE will turn on automatically",seat
If anybody needs pics for anymore information to get your own fixed at the dealer let me know. I can send pics of all information about the interface :),seat
Update the MIB to the latest version doesn’t help.,seat
">according to the manual - there's a ""driving mode"" button near the shift stick that allows to change the mode.

>alas - I don't have that in my car whatsoever.

I take that your car has an automatic transmission, right?

With a standard gearbox you are responsible of the ""driving modes"" and the computer only tells you the consumption results of your driving, some cars also give you suggestions on when to make the gear changes to keep the fuel usage in check.

Maybe I'm miss understanding you.",seat
"Is it when you are going over somewhat rough ground or speed-bumps?
I had this issue a while ago, and it was because the suspension top mount hadn't been properly secured",seat
That’s too long to charge up to 60km.,seat
"No they're ok for 100-200k with maintenance. I'm at 100k still on original clutch. Replaced the camera belt and water pump at 90k. I might need to replace the tensioner belt soonish. I'll probably sell mine soon, I'm looking at moving to Spain. Cara there are like 20-30 percent more.",seat
thanks,seat
"When ON, it Activates Auto Hold.

When OFF, it Activates Creep Mode.

I prefer to be Creepy.",seat
"Depends where you live, body panels might look good on both cars, but how rusty is the underside and are rocker panels rust damaged? How are the brake lines on it, are they just about to blow up? How about suspension parts, powertrain?",seat
"10k is fine with fully synthetic oil. It can go to 18k on longlife.  

7500k is far too early for modern oils.",seat
"Look at [this post](https://www.reddit.com/r/seat/comments/18smbdx/bbk_kit_for_seat_ibiza_2019/), if your front brakes look exactly the same as the ones in the photo, then my explanation in the comments applies to your car aswell",seat
"Mpi and Tsi are just systems of different types. Mpi stands for multi point injection and was mostly used on older VW cars. Tsi engines use direct injection which requires higher fuel pressure. Therefore this type of engine uses a common rail system, which has a high pressure fuel pump, which creates that diesel-like noise.",seat
"Ouch, £800 is a steep price",seat
Id recommend getting those lights polished so they arent as yellow and he'll look even more amazing,seat
"Thanks for explaining! Sucks, but you live and you learn I guess. It was my first car :').",seat
"Lots of conflicting info here... [here's the official info from SEAT](https://imgur.com/a/dHjkzEF) for all service items... this is based on a CUNA diesel engine which is more common, if you get me a VIN I can give you the specific list for the car...",seat
1000%,seat
"Aw darn :(. Thanks for the help man, I really appreciate it. So basically all these companies selling big brake kits (Racingline Forge etc) for 6F Ibizas are full of s**t and never actually tested fitting them? They claim they are direct bolt on kits 

Still wondering if there is a solution for the overheating. Would higher temp rated pads and cross drilled or grooved rotors help at all? The total disc volume would be close to the same so I assume it wouldn't help a whole lot?

I'm also thinking the main culprit is the XDS, because the side that caught fire was the right side, on a clockwise track, and I was trail braking quite a lot. I'm thinking it was activating the front inner wheel brake a lot both when braking and powering out of the corner. Any idea how to turn off XDS? Couldn't figure it out with VCDS as the brake/abs module was locked and it wanted me to input an access code. The car is a 2022 FR 1.5. I realize it's not exactly a track car but I like to hoon it every now and then",seat
"Having owned 2 Cupra's I'd go Cupra but beware the Cupra is only front wheel driver and can suffer from some horrendous wheel hop.

The golf R is the slightly better car only because it is more refined and a quieter drive. The Cupra has some horrific road noise. But it costs more to buy and run, plus it's hard finding one with all the toys.",seat
So what is chance for us to update? Maybe you found other method?,seat
The leon estates i see start at 22k,seat
"Really?

I've got a 2023 1.0 and can't see the fuel consumption is that bad. Doing an hour's driving a day on mixed roads and it's performing pretty much as advertised. This is paired with the DSG though.",seat
"Have a look at some RTMG products, they make blow off valves etc and they can also tune your car.",seat
Yes it does hahaha,seat
"If set to 50% (you can set any value), it will mamage the battery ±5% around that value, depending on the driving situation.",seat
I'll factor it into the price then and get it done,seat
"Thats the plan for me, was going to look around for someone who does custom fitting of sound systems or maybe order a subwoofer and install that under the seat",seat
Ajector seat,seat
If you're looking for Brembo's you can look up all compatible break discs & pads for your specific car / engine. Here's for 1.9 TDI (77 kW / 105 CV): [Bremboparts LEON 1P](https://www.bremboparts.com/europe/en/catalogue/seat-leon-1p1-1-9-tdi/000018769-1),seat
"Will take a look, thank you!",seat
"Update phone
Deinstall spotify
Restart phone
Install spotify

Test",seat
"After you start, the lights turn off, so totally good.",seat
It's just a pointless exercise.,seat
The price was out of my budget,seat
"My 2021 6 speed manual Ibiza FR has Economy, Normal, Sport and Custom driving modes, there's a button next to the gear stick for changing these.",seat
"hopefully they dont try lie to me, if they do im going to demand they give me it in writing that its fine, so that if it does fail i can throw it back at them and say you lied and now its completely failed. no flywheel should be broken at 40k miles, i have only done 3-4k of those miles and mostly motorway miles driving steady.",seat
"I mean, what temperature is it right now? In the winter I can go around 20-25km full electric while in the summer it's not unusual to get above 40km range",seat
"Completely normal. Did you check on a hot or cold engine, and how long did you let it sit before checking?",seat
"Audi tech here (we have the same driveline in our A3, plus i work on seat, cupra, vw and skoda aswell, and own a leon sportstourer hybrid.)

The tech in your car is much better at calculating whats best for fuel consumption than you Are. Unless you know that youll be driving in the city for an extended amount of time, put it in hybrid and let it do its thing. No point in having the ICE work overtime to charge your HV battery to 50%+ while driving. Charge as much as you can while stationary, use EV mode if you can get to where youre going within its range, otherwise use hybrid",seat
Btw how long does it take to fully charge the battery on a type2 charger (22kw)?,seat
A for Atom bomb,seat
I think it’s 204hp combined. Not the 245hp from the cupra version.,seat
I checked today and no software update was available in infotainment settings yet,seat
"Soest hhiiiinndddaaaabuuuuiilldiiiinngg!

Nice FR, enjoy the rides",seat
"The kit mentions a 6m cable... so it is not prewired and you have to wire it in.

I read many different blogs and forums for retrofitting.

here is one of them (german though): https://www.hering-projects.de/nachruestung-einer-rueckfahrkamera-seat-leon-5f/

you can use any cam. mine was a smaller one for 20€ from ali.",seat
"If you're just looking to replace the engine, whatever yours has, this way it'll be easier to just switch. If larger, lots of options however bear in mind that you'll need to replace a ton of other components.",seat
Yeah well it doesn't really make sense to compare prices then,seat
Maybe mines not a TSI then. It’s a 1 litre fr sport and is defo chain driven,seat
"There is also a ""critical fault"" mode where glow plug light flashes. Also it can be combination where EML is on, glow plug light is flashing. The all time classic is 1.6 TDI where it throws EML, cruise control / start&stop error and on top of that glowing spicy noodle.",seat
Well you have your answer directly from the source... Yes they're long life timing belts (which is 15 years or 180k miles)...,seat
I'd be more concerned that the battery looks way smaller than the space they have allowed for it also if you search Seat Ibiza 2010 engine bay it will show that those wires are normal but I think your battery is too small,seat
??,seat
"The colour is called 27A cup cobber. You can buy touch up paint and spray paint om ebay, or sometimes in your local hobby shop",seat
"“You’ve switched off your targeting computer, what’s wrong?”",seat
"Faro trasero derecho exterior para IBIZA/CORDOBA 6L 02/02- https://amzn.eu/d/f5hD2nS

I found this on Amazon and it says they fit on a Ibiza and a cordoba, so maybe they are the same but I’m not 100% sure",seat
Mine does this all the time too and I didn’t know you could do this.,seat
What marking are you looking for exactly?,seat
"I have VCDS, own 2 VW Group cars and look after a 3rd. I know what the service schedule is. 

Literally did my Golf 7 (same as Leon) 2 weeks ago and reset the service indicator. Shows as something like 9600 miles and 365 days (owing to the fact the ecu measures in km).",seat
It isnt my video but my car behaves the same. Maybe it is just how it works?,seat
Sorry auto correct. Yes KL. Doesn't it have to be a genuine VW part in order for it to work?,seat
I have an MIB3,seat
It’s the A hole button. Because some asshole that gets in your car I gonna want to push it.,seat
"It’s not the rubber seal around the door? Has just come loose?

I noticed I get wind noise if I have the back seats down or the AC on full blast but that’s it?",seat
Is this the 2015-2017 6p body shape?,seat
On mine I can take the little panel out and push out the blank buttons. I'm not sure why you shouldn't be able to unless thr panel on yours model is different.,seat
Will try that the next time! Will do,seat
"I have a 2018 1.2 TSI and was told that they are long life belts and that you need to get them checked around 240,000KM and that came from two seat garages I rang",seat
Dpf sorts itself,seat
"No, dealer only. Or possible to solder components to the unit but I wouldn't recommend it. Unfortunately cheaper to get a third party double din radio unit. 

I was quoted 340€ for activation in Ireland. May be 200 and something elsewhere.",seat
A for anguish,seat
So theres No power at the bulb? Or No ground? Probably a good idea to figure out which one youre missing. Going for the relay wont help you,seat
"I have carried ~375kg bagged gravel with only myself ~80kg. Put 3 bags, ~75kg in passenger foot well to even out. Was fine but took it easy just in case.",seat
"Lol what??????
So diesel from vag is gaining ""oil"" so you need to remove it and TSI is drinking oil. Balanced like it should be😂",seat
Hey hey mines only a standard 2016 seat Ibiza. I would have loved a fr edition but it’s my first car after all. I love the red mirrors. Did it come like that from factory?,seat
Isn't that the esc button?,seat
"Yep, does it disconnect randomly? Every so often not frequently but annoying enough haha.",seat
It is a bomb button,seat
Is there any setting to remove those black bars ? It's like stock and you are stuck with them ? Thx,seat
"Interesting, do you know where could I find a bit more info? I like this technical stuff",seat
"EPC Eletronic Powercontroll. its what controlls your Throttle input to your Engine. before it was a simple pull wire to a carb, now its a wire and controll module for crusecontroll and stability programs and so on.",seat
Yeah the reviews on the 130bhp say it’s sluggish which is probs right when in a bigger car,seat
"Its night and day, well worth the money",seat
I recently did mine. Definitely worth the money. But it depends on who's remapping your car. Make sure that the dealer is experienced. Mine was double the cost of your quote..,seat
PS. Go gold,seat
I’d go to seat directly. It’s weird that you’ve had no errors.,seat
"Wow

Way to ruin a car",seat
"Added bonus if you own a cupra you have less biases from people then if you own a golf R.

So unless you drive like the stereotypical fast golf driver, go for the cupra.",seat
Refurb them.,seat
"I love my 2019 SEAT one, not sure about the newer pure cupra ones",seat
"Ah wasn’t aware, even on the 2018 model? How do you code it?",seat
"Done a bit of research on forums, the ones on the boot lid, seem to be identical, however, the ones on the rear quarter pannels seem different on the sides by a bit. I have an ibiza 6l myself, i'll check it against a cordoba if i ever get the chance",seat
"Maybe is part of the FR package then?

I have a manual gearbox 2020 Ibiza Xcellence and has no driving modes I can remember.",seat
Some seat specialists around the UK (if you are UK based) offer various upgrades and unlocks. Search for your nearest. Never had it done but prices if I remember were relatively cheap,seat
"Driving 30 seconds with no oil pressure HAS killed your engine. No two ways about it, the engine is done for.",seat
"Why does it sound suspect to you?? Cars these days are just computers on wheels...

Mechanical failures are few and far between...",seat
"Not a problem. I would say if you can afford a lux go for it. The heated bucket seats are really nice, adaptive cruise control is great, keyless entry is good and the wireless phone charging is awesome.

You can turn the wired android auto to wireless with a £20 dongle from alibaba. Works really well",seat
My husband is getting fired lol I would never have bought the bloody thing if I knew that!,seat
Dankje 😎,seat
"Since I have a technisat Unit, I used another one. :)

but here is a vid for that https://youtu.be/hAou90S_R-Y

Also check the description of the vid... and also from the other vid... :)",seat
"You don’t say which model this is for, can you provide more info?",seat
Auto hold.,seat
"Well thats what you get. Also, 60km is on a good, Sunny, but not too hot day. Expect less range",seat
Had the same problem and switched to wireless Android auto with the adapter from Motorola. Works great!,seat
"I take it everything worked ok prior to these issues? If you know a mate that’s got a diagnostic scanner that would be my 1st thing I’d try, just to see if there are any codes present.",seat
"It’s just sending an electric signal to start the engine, doesn’t make a difference",seat
"My bad i think with start/stop system it does not jump back to the settings i mean only when you turn the car off completely like when you are home and start it up again when going to work in the morning.

But indeed this is all extra work that was unnecessary if they didn't decided to implement all this crap.. 

Have a nice day and hopefully you still enjoy the car!

If you have anymore questions let me know.",seat
"Here is a good video about high mileage seat Leon MK3
https://youtu.be/xciHvUxulqQ?si=1aA_7YYNxET5_Svd",seat
The boot area is the least sound insulated area but you can get the golf spare wheel liner to cut down on road noise. Door cards are nowhere near as good as Audi's though.,seat
"How is your battery sounding? I had these lights pop up when the battery was dying, weirdly the DPF sensor was one of the first to throw a fit. Been fine since a new battery 

AGM batteries dying on modern cars seems to cause a lot of electrical gremlins",seat
"They are really charging the customers 2K for the same speakers and an additional subwoofer?

Pretty disappointing honestly, i was sure the standard 6 speakers would have been replaced with superior ones",seat
This,seat
"Yep, it seems to be some cable touching the plastic and just bouncing on it, mines the same.",seat
"No, I mean not the copra trim, but maybe I'm wrong",seat
Welcome,seat
Cable tie it mate or get the proper fixings for it.,seat
I have exactly that configuration in my 2020 sportstourer. I’ve had the car for 2 years now and it has 45k km and the gear has been without fault so far. I like how seemless the mild hybrid system works with the auto gearbox. Really smooth. My only slight minus point would be how the car engine brakes going from 3rd to 2nd gear. Under light braking it can sometimes make things feel a bit jerky as the gearbox is setup to engine brake slightly more aggressively in 2nd gear. Not a huge deal though in the grand scheme of things. The 7speed dsg has been on the market for a long time now so I would assume all teething issues are been resolved. It’s also not a very high torque drivetrain so the overall load on the gearbox isn’t out of the ordinary.,seat
"Exactly what I think, I dont even want wireless - just the basic cablebound AndroidAuto functionality. On the first drive it even asked me if I want to use Android Auto or Apple CarPlay - but then the paywall hit and since then the notification is gone.",seat
"Nope, car is all black and grey so I want to keep this 2 tone vibe",seat
So that would replace my unit in the glovebox?,seat
"Petrol 194 variant. Awesome just churned fuel. 

Think the diesel is better here in the 184 variants.",seat
"Okay, I'm in Sweden and had mine for about 1,5 years. Overall happy with it but for longer trips during winter I just use hybrid from the start. You will notice a big difference in range when summer hits",seat
"I understand now. My main concern at the moment is that the current SD Card I have is only 16GB, and unfortunately, the URL provided isn't working for me (though I'm not certain if it's just my end). It seems like I've hit a bit of a roadblock for now.",seat
"3 cylinder I'd look for something with a bigger engine, maybe the 1.4 or the 1.5",seat
She still looks like [this](https://ibb.co/qCZqNF2) in the summer 😛,seat
"Thank you.   It holds pressure well.  Possibly to well, still pressurised after being stood 4 days.",seat
"It's a manual so no dsg issues but good to know about the cooling! 

Was yours diesel or petrol? 

How did you find it?",seat
"I've got a 150bhp 1.5 tsi 2019 Leon, the engine is sound and fairly fast for what the car is. A stage one remap shouldn't really effect your engines lifespan if you ask me, it will just open up what the engine is actually capable of stock. The car should do you well really, as its all vw parts at the end of the day. Only issue I know is formidable with these cars is the infotainment system repeatedly disconnecting from apple carplay/android auto.",seat
RTFM,seat
I mean I’d say if it was in the 12-13k price range that would be a superb deal considering it is on par spec with better spec Golfs 2020+ plates but yeah I’m still happy with paying a decent amount on contract for this every month as I’ll be handing back the car after 2/3 years so hopefully as long as the market don’t crash too bad I shouldn’t be in negative equity when I get the settlement figure.,seat
Full link on the 2019 uses Android Auto or Apple Carplay and works with all modern android versions I've tried above 9 to latest.,seat
Got the wrong badge in the centre of your wheels.,seat
"What is a Leon LL? 🤔

Edit: Ah you mean KL...

idk about the KL but in the 5F i just paid like 20€ since i just bought a cam from Ali and fitted and coded it myself. 😅 There are a lot of guides online for it. I can imagine that there are also a guide for the KL.",seat
That car looks amazing bro ! 💯🔥 and yes indeed i ordered the 110ps / 81kw car but recieved the 115ps / 85kw one lol. Was a pleasant suprise :),seat
"Just read up about 1.5 TSI engine issues before taking the plunge, I don’t want to be alarmist but there was a known fault on these with regard to hesitation on pulling off, believe me I know as I have a Ibiza 1.5 EVO and mine has this issue.

Still love the car though",seat
Mines in the settings menu on the infotainment system,seat
"My wife's Arona (72plate) is booked in for a recall next week. According to the dealer, its a software update",seat
"Good point, but in 4 years it has never gone below 760Km even in the cold months. So I just wondered if it could be something mechanic",seat
"DSG you're meant to service after 5 years. Even if it's not been done, it only costs like 300 quid from a main dealer. All seat prices are available online. 

It won't fall over because it's a year ovedue on low mileage. But that kind of mileage at that age could indicate lots of short runs. I'd be more concerned about DPF etc.",seat
Not true. I have manual. There is a button under the screen to the left hand side.,seat
Weird. Mines a 2018 Leon FR and I can physically toggle it on and off but mine is manual.,seat
There probably isn't any I have a 2016 ibiza and it had none,seat
"Auto hold. So say you’re on a hill and press your break pedal, you’ll get a green ‘A’ on your dash. You can then let go of the break pedal and the car will continue to hold it for you.

Hope that makes sense.",seat
I'd need to save up to have a charger installed!,seat
